experiments/sk3rx8_transposes/yaml_outputs/hgemm_nn_2024-06-05_12_37_15/aquavanjaram942_Cijk_Ailk_Bljk_HHS_BH.yaml
- {MinimumRequiredVersion: 4.41.0}
- aquavanjaram942
- gfx942
- [Device 0049, Device 0050]
    SolutionIndex: 0
    SolutionNameMin: Cijk_Ailk_Bljk_HHS_BH_MT32x32x16_MI16x16x16x1_SN_1LDSB0_AMAS0_ELFLR0_GLVWA2_GLVWB2_NLCB1_PLR1_SVW1_SKFT0_SKXCCM1_TT1_16_VW1_VWB1_WGM0
    SolutionIndex: 1
    SolutionNameMin: Cijk_Ailk_Bljk_HHS_BH_MT32x32x16_MI16x16x16x1_SN_1LDSB0_AMAS0_ELFLR0_GLVWA2_GLVWB2_NLCB1_PLR1_SVW1_SKFT1_SKXCCM1_TT1_16_VW1_VWB1_WGM0
    SolutionIndex: 2
    SolutionNameMin: Cijk_Ailk_Bljk_HHS_BH_MT32x32x16_MI16x16x16x1_SN_1LDSB0_AMAS0_ELFLR12_GLVWA2_GLVWB2_NLCB1_PLR1_SVW1_SKFT1_SKXCCM1_TT1_16_VW1_VWB1_WGM0
    SolutionIndex: 3
    SolutionNameMin: Cijk_Ailk_Bljk_HHS_BH_MT32x32x32_MI16x16x16x1_SN_1LDSB0_AMAS0_ELFLR0_GLVWA4_GLVWB4_NLCB1_PLR3_SVW1_SKFT0_SKXCCM1_TT1_16_VW1_VWB1_WGM0
    SolutionIndex: 4
    SolutionNameMin: Cijk_Ailk_Bljk_HHS_BH_MT32x32x32_MI16x16x16x1_SN_1LDSB0_AMAS0_ELFLR12_GLVWA4_GLVWB4_NLCB1_PLR3_SVW1_SKFT0_SKXCCM1_TT1_16_VW1_VWB1_WGM0
    SolutionIndex: 5
    SolutionNameMin: Cijk_Ailk_Bljk_HHS_BH_MT32x32x32_MI16x16x16x1_SN_1LDSB0_AMAS0_ELFLR0_GLVWA4_GLVWB4_NLCB1_PLR3_SVW1_SKFT1_SKXCCM0_TT1_16_VW1_VWB1_WGM0
    SolutionIndex: 6
    SolutionNameMin: Cijk_Ailk_Bljk_HHS_BH_MT32x32x32_MI16x16x16x1_SN_1LDSB0_AMAS0_ELFLR0_GLVWA4_GLVWB4_NLCB1_PLR3_SVW1_SKFT1_SKXCCM1_TT1_16_VW1_VWB1_WGM0
    SolutionIndex: 7
    SolutionNameMin: Cijk_Ailk_Bljk_HHS_BH_MT32x32x32_MI16x16x16x1_SN_1LDSB0_AMAS0_ELFLR12_GLVWA4_GLVWB4_NLCB1_PLR3_SVW1_SKFT1_SKXCCM1_TT1_16_VW1_VWB1_WGM0
    SolutionIndex: 8
    SolutionNameMin: Cijk_Ailk_Bljk_HHS_BH_MT128x32x32_MI16x16x16x1_SN_1LDSB0_AMAS3_ELFLR0_GLVWA8_GLVWB4_NLCB1_PLR3_SVW2_SKFT1_SKXCCM0_TT4_16_VW2_VWB1_WGM8
    SolutionIndex: 9
    SolutionNameMin: Cijk_Ailk_Bljk_HHS_BH_MT64x64x32_MI16x16x16x1_SN_1LDSB0_AMAS3_ELFLR12_GLVWA8_GLVWB8_NLCB1_PLR3_SVW2_SKFT0_SKXCCM0_TT2_32_VW2_VWB2_WGM0
    SolutionIndex: 10
    SolutionNameMin: Cijk_Ailk_Bljk_HHS_BH_MT64x64x32_MI16x16x16x1_SN_1LDSB0_AMAS3_ELFLR0_GLVWA8_GLVWB8_NLCB1_PLR3_SVW2_SKFT0_SKXCCM1_TT2_32_VW2_VWB2_WGM0
    SolutionIndex: 11
    SolutionNameMin: Cijk_Ailk_Bljk_HHS_BH_MT64x64x32_MI16x16x16x1_SN_1LDSB0_AMAS3_ELFLR12_GLVWA8_GLVWB8_NLCB1_PLR3_SVW2_SKFT0_SKXCCM1_TT2_32_VW2_VWB2_WGM0
    SolutionIndex: 12
    SolutionNameMin: Cijk_Ailk_Bljk_HHS_BH_MT64x64x32_MI16x16x16x1_SN_1LDSB0_AMAS3_ELFLR0_GLVWA8_GLVWB8_NLCB1_PLR3_SVW2_SKFT1_SKXCCM0_TT2_32_VW2_VWB2_WGM0
    SolutionIndex: 13
    SolutionNameMin: Cijk_Ailk_Bljk_HHS_BH_MT64x64x32_MI16x16x16x1_SN_1LDSB0_AMAS3_ELFLR12_GLVWA8_GLVWB8_NLCB1_PLR3_SVW2_SKFT1_SKXCCM0_TT2_32_VW2_VWB2_WGM0
    SolutionIndex: 14
    SolutionNameMin: Cijk_Ailk_Bljk_HHS_BH_MT256x128x32_MI16x16x16x1_SN_1LDSB0_AMAS3_ELFLR0_GLVWA8_GLVWB8_NLCB2_PLR3_SVW4_SKFT0_SKXCCM1_TT8_64_VW4_VWB4_WGM0
    SolutionIndex: 15
    SolutionNameMin: Cijk_Ailk_Bljk_HHS_BH_MT256x128x32_MI16x16x16x1_SN_1LDSB0_AMAS3_ELFLR0_GLVWA8_GLVWB8_NLCB2_PLR3_SVW4_SKFT1_SKXCCM1_TT8_64_VW4_VWB4_WGM0
    SolutionIndex: 16
    SolutionNameMin: Cijk_Ailk_Bljk_HHS_BH_MT256x128x32_MI16x16x16x1_SN_1LDSB0_AMAS3_ELFLR12_GLVWA8_GLVWB8_NLCB2_PLR3_SVW4_SKFT1_SKXCCM1_TT8_64_VW4_VWB4_WGM0
    SolutionIndex: 17
    SolutionNameMin: Cijk_Ailk_Bljk_HHS_BH_MT256x128x32_MI16x16x16x1_SN_1LDSB0_AMAS3_ELFLR12_GLVWA8_GLVWB8_NLCB1_PLR3_SVW4_SKFT1_SKXCCM1_TT8_64_VW4_VWB4_WGM8
    SolutionIndex: 18
    SolutionNameMin: Cijk_Ailk_Bljk_HHS_BH_MT256x128x32_MI16x16x16x1_SN_1LDSB0_AMAS3_ELFLR0_GLVWA8_GLVWB8_NLCB2_PLR3_SVW4_SKFT1_SKXCCM1_TT8_64_VW4_VWB4_WGM8
    SolutionIndex: 19
    SolutionNameMin: Cijk_Ailk_Bljk_HHS_BH_MT256x128x32_MI16x16x16x1_SN_1LDSB0_AMAS3_ELFLR12_GLVWA8_GLVWB8_NLCB2_PLR3_SVW4_SKFT1_SKXCCM1_TT8_64_VW4_VWB4_WGM8
    SolutionIndex: 20
    SolutionNameMin: Cijk_Ailk_Bljk_HHS_BH_MT128x128x32_MI16x16x16x1_SN_1LDSB0_AMAS3_ELFLR0_GLVWA8_GLVWB8_NLCB1_PLR3_SVW4_SKFT0_SKXCCM1_TT4_64_VW4_VWB4_WGM0
    SolutionIndex: 21
    SolutionNameMin: Cijk_Ailk_Bljk_HHS_BH_MT128x128x32_MI16x16x16x1_SN_1LDSB0_AMAS3_ELFLR0_GLVWA8_GLVWB8_NLCB1_PLR3_SVW4_SKFT1_SKXCCM1_TT4_64_VW4_VWB4_WGM0
    SolutionIndex: 22
    SolutionNameMin: Cijk_Ailk_Bljk_HHS_BH_MT128x128x32_MI16x16x16x1_SN_1LDSB0_AMAS3_ELFLR0_GLVWA8_GLVWB8_NLCB2_PLR3_SVW4_SKFT0_SKXCCM1_TT4_64_VW4_VWB4_WGM0
    SolutionIndex: 23
    SolutionNameMin: Cijk_Ailk_Bljk_HHS_BH_MT128x128x32_MI16x16x16x1_SN_1LDSB0_AMAS3_ELFLR0_GLVWA8_GLVWB8_NLCB2_PLR3_SVW4_SKFT1_SKXCCM1_TT4_64_VW4_VWB4_WGM0
    SolutionIndex: 24
    SolutionNameMin: Cijk_Ailk_Bljk_HHS_BH_MT128x128x32_MI16x16x16x1_SN_1LDSB0_AMAS3_ELFLR12_GLVWA8_GLVWB8_NLCB1_PLR3_SVW4_SKFT1_SKXCCM0_TT4_64_VW4_VWB4_WGM8
    SolutionIndex: 25
    SolutionNameMin: Cijk_Ailk_Bljk_HHS_BH_MT128x64x32_MI16x16x16x1_SN_1LDSB0_AMAS3_ELFLR12_GLVWA8_GLVWB8_NLCB1_PLR3_SVW4_SKFT0_SKXCCM0_TT4_32_VW4_VWB1_WGM0
    SolutionIndex: 26
    SolutionNameMin: Cijk_Ailk_Bljk_HHS_BH_MT128x64x32_MI16x16x16x1_SN_1LDSB0_AMAS3_ELFLR0_GLVWA8_GLVWB8_NLCB1_PLR3_SVW4_SKFT1_SKXCCM0_TT4_32_VW4_VWB1_WGM0
    SolutionIndex: 27
    SolutionNameMin: Cijk_Ailk_Bljk_HHS_BH_MT128x64x32_MI16x16x16x1_SN_1LDSB0_AMAS3_ELFLR12_GLVWA8_GLVWB8_NLCB1_PLR3_SVW4_SKFT1_SKXCCM0_TT4_32_VW4_VWB1_WGM0
    SolutionIndex: 28
    SolutionNameMin: Cijk_Ailk_Bljk_HHS_BH_MT128x64x32_MI16x16x16x1_SN_1LDSB0_AMAS3_ELFLR0_GLVWA8_GLVWB8_NLCB1_PLR3_SVW4_SKFT1_SKXCCM1_TT4_32_VW4_VWB1_WGM0
    SolutionIndex: 29
    SolutionNameMin: Cijk_Ailk_Bljk_HHS_BH_MT128x64x32_MI16x16x16x1_SN_1LDSB0_AMAS3_ELFLR12_GLVWA8_GLVWB8_NLCB1_PLR3_SVW4_SKFT1_SKXCCM1_TT4_32_VW4_VWB1_WGM0
    SolutionIndex: 30
    SolutionNameMin: Cijk_Ailk_Bljk_HHS_BH_MT128x64x32_MI16x16x16x1_SN_1LDSB0_AMAS3_ELFLR0_GLVWA8_GLVWB8_NLCB1_PLR3_SVW4_SKFT0_SKXCCM1_TT4_32_VW4_VWB1_WGM8
    SolutionIndex: 31
    SolutionNameMin: Cijk_Ailk_Bljk_HHS_BH_MT128x64x32_MI16x16x16x1_SN_1LDSB0_AMAS3_ELFLR12_GLVWA8_GLVWB8_NLCB1_PLR3_SVW4_SKFT0_SKXCCM1_TT4_32_VW4_VWB1_WGM8
    SolutionIndex: 32
    SolutionNameMin: Cijk_Ailk_Bljk_HHS_BH_MT128x64x32_MI16x16x16x1_SN_1LDSB0_AMAS3_ELFLR0_GLVWA8_GLVWB8_NLCB1_PLR3_SVW4_SKFT1_SKXCCM1_TT4_32_VW4_VWB1_WGM8
    SolutionIndex: 33
    SolutionNameMin: Cijk_Ailk_Bljk_HHS_BH_MT128x64x32_MI16x16x16x1_SN_1LDSB0_AMAS3_ELFLR12_GLVWA8_GLVWB8_NLCB1_PLR3_SVW4_SKFT1_SKXCCM1_TT4_32_VW4_VWB1_WGM8
    SolutionIndex: 34
    SolutionNameMin: Cijk_Ailk_Bljk_HHS_BH_MT128x32x32_MI16x16x16x1_SN_1LDSB0_AMAS3_ELFLR0_GLVWA8_GLVWB4_NLCB1_PLR3_SVW4_SKFT0_SKXCCM0_TT4_16_VW4_VWB1_WGM0
    SolutionIndex: 35
    SolutionNameMin: Cijk_Ailk_Bljk_HHS_BH_MT128x32x32_MI16x16x16x1_SN_1LDSB0_AMAS3_ELFLR12_GLVWA8_GLVWB4_NLCB1_PLR3_SVW4_SKFT0_SKXCCM0_TT4_16_VW4_VWB1_WGM0
    SolutionIndex: 36
    SolutionNameMin: Cijk_Ailk_Bljk_HHS_BH_MT128x32x32_MI16x16x16x1_SN_1LDSB0_AMAS3_ELFLR0_GLVWA8_GLVWB4_NLCB1_PLR3_SVW4_SKFT1_SKXCCM0_TT4_16_VW4_VWB1_WGM0
    SolutionIndex: 37
    SolutionNameMin: Cijk_Ailk_Bljk_HHS_BH_MT128x32x32_MI16x16x16x1_SN_1LDSB0_AMAS3_ELFLR12_GLVWA8_GLVWB4_NLCB1_PLR3_SVW4_SKFT1_SKXCCM0_TT4_16_VW4_VWB1_WGM0
    SolutionIndex: 38
    SolutionNameMin: Cijk_Ailk_Bljk_HHS_BH_MT128x32x32_MI16x16x16x1_SN_1LDSB0_AMAS3_ELFLR0_GLVWA8_GLVWB4_NLCB1_PLR3_SVW4_SKFT0_SKXCCM1_TT4_16_VW4_VWB1_WGM8
    SolutionIndex: 39
    SolutionNameMin: Cijk_Ailk_Bljk_HHS_BH_MT128x32x32_MI16x16x16x1_SN_1LDSB0_AMAS3_ELFLR12_GLVWA8_GLVWB4_NLCB1_PLR3_SVW4_SKFT1_SKXCCM0_TT4_16_VW4_VWB1_WGM8
    SolutionIndex: 40
    SolutionNameMin: Cijk_Ailk_Bljk_HHS_BH_MT256x256x32_MI16x16x16x1_SN_1LDSB1_AMAS3_ELFLR0_GLVWA8_GLVWB8_NLCB1_PLR3_SVW4_SKFT0_SKXCCM1_TT8_128_VW4_VWB4_WGM0
    SolutionIndex: 41
    SolutionNameMin: Cijk_Ailk_Bljk_HHS_BH_MT256x128x32_MI16x16x16x1_SN_1LDSB1_AMAS3_ELFLR12_GLVWA8_GLVWB8_NLCB1_PLR3_SVW4_SKFT0_SKXCCM0_TT8_64_VW4_VWB4_WGM0
    SolutionIndex: 42
    SolutionNameMin: Cijk_Ailk_Bljk_HHS_BH_MT256x128x32_MI16x16x16x1_SN_1LDSB1_AMAS3_ELFLR12_GLVWA8_GLVWB8_NLCB2_PLR3_SVW4_SKFT0_SKXCCM0_TT8_64_VW4_VWB4_WGM0
    SolutionIndex: 43
    SolutionNameMin: Cijk_Ailk_Bljk_HHS_BH_MT256x128x32_MI16x16x16x1_SN_1LDSB1_AMAS3_ELFLR12_GLVWA8_GLVWB8_NLCB2_PLR3_SVW4_SKFT0_SKXCCM1_TT8_64_VW4_VWB4_WGM0
    SolutionIndex: 44
    SolutionNameMin: Cijk_Ailk_Bljk_HHS_BH_MT256x128x32_MI16x16x16x1_SN_1LDSB1_AMAS3_ELFLR12_GLVWA8_GLVWB8_NLCB2_PLR3_SVW4_SKFT1_SKXCCM1_TT8_64_VW4_VWB4_WGM0
    SolutionIndex: 45
    SolutionNameMin: Cijk_Ailk_Bljk_HHS_BH_MT256x128x32_MI16x16x16x1_SN_1LDSB1_AMAS3_ELFLR12_GLVWA8_GLVWB8_NLCB2_PLR3_SVW4_SKFT0_SKXCCM0_TT8_64_VW4_VWB4_WGM8
    SolutionIndex: 46
    SolutionNameMin: Cijk_Ailk_Bljk_HHS_BH_MT256x128x32_MI16x16x16x1_SN_1LDSB1_AMAS3_ELFLR0_GLVWA8_GLVWB8_NLCB2_PLR3_SVW4_SKFT0_SKXCCM1_TT8_64_VW4_VWB4_WGM8
    SolutionIndex: 47
    SolutionNameMin: Cijk_Ailk_Bljk_HHS_BH_MT256x128x32_MI16x16x16x1_SN_1LDSB1_AMAS3_ELFLR12_GLVWA8_GLVWB8_NLCB2_PLR3_SVW4_SKFT1_SKXCCM1_TT8_64_VW4_VWB4_WGM8
    SolutionIndex: 48
    SolutionNameMin: Cijk_Ailk_Bljk_HHS_BH_MT32x32x64_MI16x16x16x1_SN_1LDSB0_AMAS0_ELFLR0_GLVWA8_GLVWB8_NLCB1_PLR5_SVW1_SKFT0_SKXCCM0_TT1_16_VW1_VWB1_WGM0
    SolutionIndex: 49
    SolutionNameMin: Cijk_Ailk_Bljk_HHS_BH_MT32x32x64_MI16x16x16x1_SN_1LDSB0_AMAS0_ELFLR12_GLVWA8_GLVWB8_NLCB1_PLR5_SVW1_SKFT0_SKXCCM0_TT1_16_VW1_VWB1_WGM0
    SolutionIndex: 50
    SolutionNameMin: Cijk_Ailk_Bljk_HHS_BH_MT32x32x64_MI16x16x16x1_SN_1LDSB0_AMAS0_ELFLR0_GLVWA8_GLVWB8_NLCB1_PLR5_SVW1_SKFT0_SKXCCM1_TT1_16_VW1_VWB1_WGM0
    SolutionIndex: 51
    SolutionNameMin: Cijk_Ailk_Bljk_HHS_BH_MT32x32x64_MI16x16x16x1_SN_1LDSB0_AMAS0_ELFLR12_GLVWA8_GLVWB8_NLCB1_PLR5_SVW1_SKFT0_SKXCCM1_TT1_16_VW1_VWB1_WGM0
    SolutionIndex: 52
    SolutionNameMin: Cijk_Ailk_Bljk_HHS_BH_MT32x32x64_MI16x16x16x1_SN_1LDSB0_AMAS0_ELFLR0_GLVWA8_GLVWB8_NLCB1_PLR5_SVW1_SKFT1_SKXCCM0_TT1_16_VW1_VWB1_WGM0
    SolutionIndex: 53
    SolutionNameMin: Cijk_Ailk_Bljk_HHS_BH_MT32x32x64_MI16x16x16x1_SN_1LDSB0_AMAS0_ELFLR12_GLVWA8_GLVWB8_NLCB1_PLR5_SVW1_SKFT1_SKXCCM0_TT1_16_VW1_VWB1_WGM0
    SolutionIndex: 54
    SolutionNameMin: Cijk_Ailk_Bljk_HHS_BH_MT32x32x64_MI16x16x16x1_SN_1LDSB0_AMAS0_ELFLR0_GLVWA8_GLVWB8_NLCB1_PLR5_SVW1_SKFT1_SKXCCM1_TT1_16_VW1_VWB1_WGM0
    SolutionIndex: 55
    SolutionNameMin: Cijk_Ailk_Bljk_HHS_BH_MT32x32x64_MI16x16x16x1_SN_1LDSB0_AMAS0_ELFLR12_GLVWA8_GLVWB8_NLCB1_PLR5_SVW1_SKFT1_SKXCCM1_TT1_16_VW1_VWB1_WGM0
    SolutionIndex: 56
    SolutionNameMin: Cijk_Ailk_Bljk_HHS_BH_MT32x32x64_MI16x16x16x1_SN_1LDSB0_AMAS0_ELFLR12_GLVWA8_GLVWB8_NLCB1_PLR5_SVW1_SKFT0_SKXCCM1_TT1_16_VW1_VWB1_WGM8
    SolutionIndex: 57
    SolutionNameMin: Cijk_Ailk_Bljk_HHS_BH_MT32x32x64_MI16x16x16x1_SN_1LDSB0_AMAS0_ELFLR0_GLVWA8_GLVWB8_NLCB1_PLR5_SVW1_SKFT1_SKXCCM0_TT1_16_VW1_VWB1_WGM8
    SolutionIndex: 58
    SolutionNameMin: Cijk_Ailk_Bljk_HHS_BH_MT32x32x64_MI16x16x16x1_SN_1LDSB0_AMAS0_ELFLR0_GLVWA8_GLVWB8_NLCB1_PLR5_SVW1_SKFT1_SKXCCM1_TT1_16_VW1_VWB1_WGM8
    SolutionIndex: 59
    SolutionNameMin: Cijk_Ailk_Bljk_HHS_BH_MT32x32x64_MI16x16x16x1_SN_1LDSB0_AMAS0_ELFLR12_GLVWA8_GLVWB8_NLCB1_PLR5_SVW1_SKFT1_SKXCCM1_TT1_16_VW1_VWB1_WGM8
    SolutionIndex: 60
    SolutionNameMin: Cijk_Ailk_Bljk_HHS_BH_MT64x64x64_MI16x16x16x1_SN_1LDSB0_AMAS3_ELFLR0_GLVWA8_GLVWB8_NLCB2_PLR5_SVW2_SKFT0_SKXCCM0_TT2_32_VW2_VWB2_WGM0
    SolutionIndex: 61
    SolutionNameMin: Cijk_Ailk_Bljk_HHS_BH_MT64x64x64_MI16x16x16x1_SN_1LDSB0_AMAS3_ELFLR12_GLVWA8_GLVWB8_NLCB2_PLR5_SVW2_SKFT0_SKXCCM1_TT2_32_VW2_VWB2_WGM0
    SolutionIndex: 62
    SolutionNameMin: Cijk_Ailk_Bljk_HHS_BH_MT64x64x64_MI16x16x16x1_SN_1LDSB0_AMAS3_ELFLR0_GLVWA8_GLVWB8_NLCB2_PLR5_SVW2_SKFT1_SKXCCM1_TT2_32_VW2_VWB2_WGM0
    SolutionIndex: 63
    SolutionNameMin: Cijk_Ailk_Bljk_HHS_BH_MT64x64x64_MI16x16x16x1_SN_1LDSB0_AMAS3_ELFLR12_GLVWA8_GLVWB8_NLCB2_PLR5_SVW2_SKFT1_SKXCCM1_TT2_32_VW2_VWB2_WGM0
    SolutionIndex: 64
    SolutionNameMin: Cijk_Ailk_Bljk_HHS_BH_MT64x64x64_MI16x16x16x1_SN_1LDSB0_AMAS3_ELFLR0_GLVWA8_GLVWB8_NLCB2_PLR5_SVW2_SKFT0_SKXCCM1_TT2_32_VW2_VWB2_WGM8
    SolutionIndex: 65
    SolutionNameMin: Cijk_Ailk_Bljk_HHS_BH_MT64x64x64_MI16x16x16x1_SN_1LDSB0_AMAS3_ELFLR12_GLVWA8_GLVWB8_NLCB2_PLR5_SVW2_SKFT0_SKXCCM1_TT2_32_VW2_VWB2_WGM8
    SolutionIndex: 66
    SolutionNameMin: Cijk_Ailk_Bljk_HHS_BH_MT64x64x64_MI16x16x16x1_SN_1LDSB0_AMAS3_ELFLR0_GLVWA8_GLVWB8_NLCB2_PLR5_SVW2_SKFT1_SKXCCM1_TT2_32_VW2_VWB2_WGM8
    SolutionIndex: 67
    SolutionNameMin: Cijk_Ailk_Bljk_HHS_BH_MT64x64x64_MI16x16x16x1_SN_1LDSB0_AMAS3_ELFLR12_GLVWA8_GLVWB8_NLCB2_PLR5_SVW2_SKFT1_SKXCCM1_TT2_32_VW2_VWB2_WGM8
    SolutionIndex: 68
    SolutionNameMin: Cijk_Ailk_Bljk_HHS_BH_MT64x32x64_MI16x16x16x1_SN_1LDSB0_AMAS3_ELFLR0_GLVWA8_GLVWB8_NLCB1_PLR5_SVW2_SKFT0_SKXCCM0_TT2_16_VW2_VWB1_WGM0
    SolutionIndex: 69
    SolutionNameMin: Cijk_Ailk_Bljk_HHS_BH_MT64x32x64_MI16x16x16x1_SN_1LDSB0_AMAS3_ELFLR12_GLVWA8_GLVWB8_NLCB1_PLR5_SVW2_SKFT0_SKXCCM0_TT2_16_VW2_VWB1_WGM0
    SolutionIndex: 70
    SolutionNameMin: Cijk_Ailk_Bljk_HHS_BH_MT64x32x64_MI16x16x16x1_SN_1LDSB0_AMAS3_ELFLR0_GLVWA8_GLVWB8_NLCB1_PLR5_SVW2_SKFT0_SKXCCM1_TT2_16_VW2_VWB1_WGM0
    SolutionIndex: 71
    SolutionNameMin: Cijk_Ailk_Bljk_HHS_BH_MT64x32x64_MI16x16x16x1_SN_1LDSB0_AMAS3_ELFLR12_GLVWA8_GLVWB8_NLCB1_PLR5_SVW2_SKFT0_SKXCCM1_TT2_16_VW2_VWB1_WGM0
    SolutionIndex: 72
    SolutionNameMin: Cijk_Ailk_Bljk_HHS_BH_MT64x32x64_MI16x16x16x1_SN_1LDSB0_AMAS3_ELFLR0_GLVWA8_GLVWB8_NLCB1_PLR5_SVW2_SKFT1_SKXCCM0_TT2_16_VW2_VWB1_WGM0
    SolutionIndex: 73
    SolutionNameMin: Cijk_Ailk_Bljk_HHS_BH_MT64x32x64_MI16x16x16x1_SN_1LDSB0_AMAS3_ELFLR12_GLVWA8_GLVWB8_NLCB1_PLR5_SVW2_SKFT1_SKXCCM0_TT2_16_VW2_VWB1_WGM0
    SolutionIndex: 74
    SolutionNameMin: Cijk_Ailk_Bljk_HHS_BH_MT64x32x64_MI16x16x16x1_SN_1LDSB0_AMAS3_ELFLR0_GLVWA8_GLVWB8_NLCB1_PLR5_SVW2_SKFT1_SKXCCM1_TT2_16_VW2_VWB1_WGM0
    SolutionIndex: 75
    SolutionNameMin: Cijk_Ailk_Bljk_HHS_BH_MT64x32x64_MI16x16x16x1_SN_1LDSB0_AMAS3_ELFLR12_GLVWA8_GLVWB8_NLCB1_PLR5_SVW2_SKFT1_SKXCCM1_TT2_16_VW2_VWB1_WGM0
    SolutionIndex: 76
    SolutionNameMin: Cijk_Ailk_Bljk_HHS_BH_MT64x32x64_MI16x16x16x1_SN_1LDSB0_AMAS3_ELFLR12_GLVWA8_GLVWB8_NLCB1_PLR5_SVW2_SKFT0_SKXCCM0_TT2_16_VW2_VWB1_WGM8
    SolutionIndex: 77
    SolutionNameMin: Cijk_Ailk_Bljk_HHS_BH_MT64x32x64_MI16x16x16x1_SN_1LDSB0_AMAS3_ELFLR12_GLVWA8_GLVWB8_NLCB1_PLR5_SVW2_SKFT0_SKXCCM1_TT2_16_VW2_VWB1_WGM8
    SolutionIndex: 78
    SolutionNameMin: Cijk_Ailk_Bljk_HHS_BH_MT128x128x64_MI16x16x16x1_SN_1LDSB0_AMAS3_ELFLR0_GLVWA8_GLVWB8_NLCB2_PLR5_SVW4_SKFT0_SKXCCM1_TT4_64_VW4_VWB4_WGM0
    SolutionIndex: 79
    SolutionNameMin: Cijk_Ailk_Bljk_HHS_BH_MT128x128x64_MI16x16x16x1_SN_1LDSB0_AMAS3_ELFLR12_GLVWA8_GLVWB8_NLCB2_PLR5_SVW4_SKFT0_SKXCCM1_TT4_64_VW4_VWB4_WGM0
    SolutionIndex: 80
    SolutionNameMin: Cijk_Ailk_Bljk_HHS_BH_MT128x128x64_MI16x16x16x1_SN_1LDSB0_AMAS3_ELFLR0_GLVWA8_GLVWB8_NLCB2_PLR5_SVW4_SKFT1_SKXCCM0_TT4_64_VW4_VWB4_WGM0
    SolutionIndex: 81
    SolutionNameMin: Cijk_Ailk_Bljk_HHS_BH_MT128x128x64_MI16x16x16x1_SN_1LDSB0_AMAS3_ELFLR12_GLVWA8_GLVWB8_NLCB2_PLR5_SVW4_SKFT1_SKXCCM0_TT4_64_VW4_VWB4_WGM0
    SolutionIndex: 82
    SolutionNameMin: Cijk_Ailk_Bljk_HHS_BH_MT128x128x64_MI16x16x16x1_SN_1LDSB0_AMAS3_ELFLR0_GLVWA8_GLVWB8_NLCB2_PLR5_SVW4_SKFT1_SKXCCM1_TT4_64_VW4_VWB4_WGM0
    SolutionIndex: 83
    SolutionNameMin: Cijk_Ailk_Bljk_HHS_BH_MT128x128x64_MI16x16x16x1_SN_1LDSB0_AMAS3_ELFLR12_GLVWA8_GLVWB8_NLCB2_PLR5_SVW4_SKFT1_SKXCCM1_TT4_64_VW4_VWB4_WGM0
    SolutionIndex: 84
    SolutionNameMin: Cijk_Ailk_Bljk_HHS_BH_MT128x128x64_MI16x16x16x1_SN_1LDSB0_AMAS3_ELFLR12_GLVWA8_GLVWB8_NLCB2_PLR5_SVW4_SKFT0_SKXCCM0_TT4_64_VW4_VWB4_WGM8
    SolutionIndex: 85
    SolutionNameMin: Cijk_Ailk_Bljk_HHS_BH_MT128x128x64_MI16x16x16x1_SN_1LDSB0_AMAS3_ELFLR0_GLVWA8_GLVWB8_NLCB2_PLR5_SVW4_SKFT0_SKXCCM1_TT4_64_VW4_VWB4_WGM8
    SolutionIndex: 86
    SolutionNameMin: Cijk_Ailk_Bljk_HHS_BH_MT128x128x64_MI16x16x16x1_SN_1LDSB0_AMAS3_ELFLR0_GLVWA8_GLVWB8_NLCB2_PLR5_SVW4_SKFT1_SKXCCM0_TT4_64_VW4_VWB4_WGM8
    SolutionIndex: 87
    SolutionNameMin: Cijk_Ailk_Bljk_HHS_BH_MT128x128x64_MI16x16x16x1_SN_1LDSB0_AMAS3_ELFLR12_GLVWA8_GLVWB8_NLCB2_PLR5_SVW4_SKFT1_SKXCCM0_TT4_64_VW4_VWB4_WGM8
    SolutionIndex: 88
    SolutionNameMin: Cijk_Ailk_Bljk_HHS_BH_MT128x128x64_MI16x16x16x1_SN_1LDSB0_AMAS3_ELFLR0_GLVWA8_GLVWB8_NLCB2_PLR5_SVW4_SKFT1_SKXCCM1_TT4_64_VW4_VWB4_WGM8
    SolutionIndex: 89
    SolutionNameMin: Cijk_Ailk_Bljk_HHS_BH_MT128x128x64_MI16x16x16x1_SN_1LDSB0_AMAS3_ELFLR12_GLVWA8_GLVWB8_NLCB2_PLR5_SVW4_SKFT1_SKXCCM1_TT4_64_VW4_VWB4_WGM8
    SolutionIndex: 90
    SolutionNameMin: Cijk_Ailk_Bljk_HHS_BH_MT128x64x64_MI16x16x16x1_SN_1LDSB0_AMAS3_ELFLR0_GLVWA8_GLVWB8_NLCB1_PLR5_SVW4_SKFT0_SKXCCM1_TT4_32_VW4_VWB1_WGM0
    SolutionIndex: 91
    SolutionNameMin: Cijk_Ailk_Bljk_HHS_BH_MT128x64x64_MI16x16x16x1_SN_1LDSB0_AMAS3_ELFLR12_GLVWA8_GLVWB8_NLCB1_PLR5_SVW4_SKFT0_SKXCCM1_TT4_32_VW4_VWB1_WGM0
    SolutionIndex: 92
    SolutionNameMin: Cijk_Ailk_Bljk_HHS_BH_MT128x64x64_MI16x16x16x1_SN_1LDSB0_AMAS3_ELFLR0_GLVWA8_GLVWB8_NLCB1_PLR5_SVW4_SKFT1_SKXCCM1_TT4_32_VW4_VWB1_WGM0
    SolutionIndex: 93
    SolutionNameMin: Cijk_Ailk_Bljk_HHS_BH_MT128x64x64_MI16x16x16x1_SN_1LDSB0_AMAS3_ELFLR12_GLVWA8_GLVWB8_NLCB1_PLR5_SVW4_SKFT1_SKXCCM1_TT4_32_VW4_VWB1_WGM0
    SolutionIndex: 94
    SolutionNameMin: Cijk_Ailk_Bljk_HHS_BH_MT128x64x64_MI16x16x16x1_SN_1LDSB0_AMAS3_ELFLR0_GLVWA8_GLVWB8_NLCB2_PLR5_SVW4_SKFT0_SKXCCM0_TT4_32_VW4_VWB1_WGM0
    SolutionIndex: 95
    SolutionNameMin: Cijk_Ailk_Bljk_HHS_BH_MT128x64x64_MI16x16x16x1_SN_1LDSB0_AMAS3_ELFLR0_GLVWA8_GLVWB8_NLCB2_PLR5_SVW4_SKFT0_SKXCCM1_TT4_32_VW4_VWB1_WGM0
    SolutionIndex: 96
    SolutionNameMin: Cijk_Ailk_Bljk_HHS_BH_MT128x64x64_MI16x16x16x1_SN_1LDSB0_AMAS3_ELFLR12_GLVWA8_GLVWB8_NLCB2_PLR5_SVW4_SKFT0_SKXCCM1_TT4_32_VW4_VWB1_WGM0
    SolutionIndex: 97
    SolutionNameMin: Cijk_Ailk_Bljk_HHS_BH_MT128x64x64_MI16x16x16x1_SN_1LDSB0_AMAS3_ELFLR0_GLVWA8_GLVWB8_NLCB2_PLR5_SVW4_SKFT1_SKXCCM1_TT4_32_VW4_VWB1_WGM0
    SolutionIndex: 98
    SolutionNameMin: Cijk_Ailk_Bljk_HHS_BH_MT128x64x64_MI16x16x16x1_SN_1LDSB0_AMAS3_ELFLR12_GLVWA8_GLVWB8_NLCB2_PLR5_SVW4_SKFT1_SKXCCM1_TT4_32_VW4_VWB1_WGM0
    SolutionIndex: 99
    SolutionNameMin: Cijk_Ailk_Bljk_HHS_BH_MT128x64x64_MI16x16x16x1_SN_1LDSB0_AMAS3_ELFLR0_GLVWA8_GLVWB8_NLCB1_PLR5_SVW4_SKFT0_SKXCCM1_TT4_32_VW4_VWB1_WGM8
    SolutionIndex: 100
    SolutionNameMin: Cijk_Ailk_Bljk_HHS_BH_MT128x64x64_MI16x16x16x1_SN_1LDSB0_AMAS3_ELFLR12_GLVWA8_GLVWB8_NLCB1_PLR5_SVW4_SKFT0_SKXCCM1_TT4_32_VW4_VWB1_WGM8
    SolutionIndex: 101
    SolutionNameMin: Cijk_Ailk_Bljk_HHS_BH_MT128x64x64_MI16x16x16x1_SN_1LDSB0_AMAS3_ELFLR12_GLVWA8_GLVWB8_NLCB1_PLR5_SVW4_SKFT1_SKXCCM1_TT4_32_VW4_VWB1_WGM8
    SolutionIndex: 102
    SolutionNameMin: Cijk_Ailk_Bljk_HHS_BH_MT128x64x64_MI16x16x16x1_SN_1LDSB0_AMAS3_ELFLR0_GLVWA8_GLVWB8_NLCB2_PLR5_SVW4_SKFT0_SKXCCM0_TT4_32_VW4_VWB1_WGM8
    SolutionIndex: 103
    SolutionNameMin: Cijk_Ailk_Bljk_HHS_BH_MT128x64x64_MI16x16x16x1_SN_1LDSB0_AMAS3_ELFLR12_GLVWA8_GLVWB8_NLCB2_PLR5_SVW4_SKFT0_SKXCCM0_TT4_32_VW4_VWB1_WGM8
    SolutionIndex: 104
    SolutionNameMin: Cijk_Ailk_Bljk_HHS_BH_MT128x64x64_MI16x16x16x1_SN_1LDSB0_AMAS3_ELFLR0_GLVWA8_GLVWB8_NLCB2_PLR5_SVW4_SKFT0_SKXCCM1_TT4_32_VW4_VWB1_WGM8
    SolutionIndex: 105
    SolutionNameMin: Cijk_Ailk_Bljk_HHS_BH_MT128x64x64_MI16x16x16x1_SN_1LDSB0_AMAS3_ELFLR12_GLVWA8_GLVWB8_NLCB2_PLR5_SVW4_SKFT0_SKXCCM1_TT4_32_VW4_VWB1_WGM8
    SolutionIndex: 106
    SolutionNameMin: Cijk_Ailk_Bljk_HHS_BH_MT128x64x64_MI16x16x16x1_SN_1LDSB0_AMAS3_ELFLR0_GLVWA8_GLVWB8_NLCB2_PLR5_SVW4_SKFT1_SKXCCM0_TT4_32_VW4_VWB1_WGM8
    SolutionIndex: 107
    SolutionNameMin: Cijk_Ailk_Bljk_HHS_BH_MT128x64x64_MI16x16x16x1_SN_1LDSB0_AMAS3_ELFLR12_GLVWA8_GLVWB8_NLCB2_PLR5_SVW4_SKFT1_SKXCCM0_TT4_32_VW4_VWB1_WGM8
    SolutionIndex: 108
    SolutionNameMin: Cijk_Ailk_Bljk_HHS_BH_MT128x64x64_MI16x16x16x1_SN_1LDSB0_AMAS3_ELFLR0_GLVWA8_GLVWB8_NLCB2_PLR5_SVW4_SKFT1_SKXCCM1_TT4_32_VW4_VWB1_WGM8
    SolutionIndex: 109
    SolutionNameMin: Cijk_Ailk_Bljk_HHS_BH_MT128x64x64_MI16x16x16x1_SN_1LDSB0_AMAS3_ELFLR12_GLVWA8_GLVWB8_NLCB2_PLR5_SVW4_SKFT1_SKXCCM1_TT4_32_VW4_VWB1_WGM8
    SolutionIndex: 110
    SolutionNameMin: Cijk_Ailk_Bljk_HHS_BH_MT128x32x64_MI16x16x16x1_SN_1LDSB0_AMAS3_ELFLR0_GLVWA8_GLVWB8_NLCB1_PLR5_SVW4_SKFT0_SKXCCM0_TT4_16_VW4_VWB1_WGM0
    SolutionIndex: 111
    SolutionNameMin: Cijk_Ailk_Bljk_HHS_BH_MT128x32x64_MI16x16x16x1_SN_1LDSB0_AMAS3_ELFLR12_GLVWA8_GLVWB8_NLCB1_PLR5_SVW4_SKFT0_SKXCCM0_TT4_16_VW4_VWB1_WGM0
    SolutionIndex: 112
    SolutionNameMin: Cijk_Ailk_Bljk_HHS_BH_MT128x32x64_MI16x16x16x1_SN_1LDSB0_AMAS3_ELFLR0_GLVWA8_GLVWB8_NLCB1_PLR5_SVW4_SKFT0_SKXCCM1_TT4_16_VW4_VWB1_WGM0
    SolutionIndex: 113
    SolutionNameMin: Cijk_Ailk_Bljk_HHS_BH_MT128x32x64_MI16x16x16x1_SN_1LDSB0_AMAS3_ELFLR12_GLVWA8_GLVWB8_NLCB1_PLR5_SVW4_SKFT0_SKXCCM1_TT4_16_VW4_VWB1_WGM0
    SolutionIndex: 114
    SolutionNameMin: Cijk_Ailk_Bljk_HHS_BH_MT128x32x64_MI16x16x16x1_SN_1LDSB0_AMAS3_ELFLR0_GLVWA8_GLVWB8_NLCB1_PLR5_SVW4_SKFT1_SKXCCM0_TT4_16_VW4_VWB1_WGM0
    SolutionIndex: 115
    SolutionNameMin: Cijk_Ailk_Bljk_HHS_BH_MT128x32x64_MI16x16x16x1_SN_1LDSB0_AMAS3_ELFLR12_GLVWA8_GLVWB8_NLCB1_PLR5_SVW4_SKFT1_SKXCCM0_TT4_16_VW4_VWB1_WGM0
    SolutionIndex: 116
    SolutionNameMin: Cijk_Ailk_Bljk_HHS_BH_MT128x32x64_MI16x16x16x1_SN_1LDSB0_AMAS3_ELFLR0_GLVWA8_GLVWB8_NLCB1_PLR5_SVW4_SKFT1_SKXCCM1_TT4_16_VW4_VWB1_WGM0
    SolutionIndex: 117
    SolutionNameMin: Cijk_Ailk_Bljk_HHS_BH_MT128x32x64_MI16x16x16x1_SN_1LDSB0_AMAS3_ELFLR12_GLVWA8_GLVWB8_NLCB1_PLR5_SVW4_SKFT1_SKXCCM1_TT4_16_VW4_VWB1_WGM0
    SolutionIndex: 118
    SolutionNameMin: Cijk_Ailk_Bljk_HHS_BH_MT128x32x64_MI16x16x16x1_SN_1LDSB0_AMAS3_ELFLR0_GLVWA8_GLVWB8_NLCB1_PLR5_SVW4_SKFT0_SKXCCM0_TT4_16_VW4_VWB1_WGM8
    SolutionIndex: 119
    SolutionNameMin: Cijk_Ailk_Bljk_HHS_BH_MT128x32x64_MI16x16x16x1_SN_1LDSB0_AMAS3_ELFLR12_GLVWA8_GLVWB8_NLCB1_PLR5_SVW4_SKFT0_SKXCCM1_TT4_16_VW4_VWB1_WGM8
    SolutionIndex: 120
    SolutionNameMin: Cijk_Ailk_Bljk_HHS_BH_MT128x32x64_MI16x16x16x1_SN_1LDSB0_AMAS3_ELFLR0_GLVWA8_GLVWB8_NLCB1_PLR5_SVW4_SKFT1_SKXCCM1_TT4_16_VW4_VWB1_WGM8
    SolutionIndex: 121
    SolutionNameMin: Cijk_Ailk_Bljk_HHS_BH_MT128x32x64_MI16x16x16x1_SN_1LDSB0_AMAS3_ELFLR12_GLVWA8_GLVWB8_NLCB1_PLR5_SVW4_SKFT1_SKXCCM1_TT4_16_VW4_VWB1_WGM8
    SolutionIndex: 122
    SolutionNameMin: Cijk_Ailk_Bljk_HHS_BH_MT256x256x64_MI16x16x16x1_SN_1LDSB1_AMAS3_ELFLR0_GLVWA8_GLVWB8_NLCB2_PLR5_SVW4_SKFT0_SKXCCM0_TT8_128_VW4_VWB4_WGM0
    SolutionIndex: 123
    SolutionNameMin: Cijk_Ailk_Bljk_HHS_BH_MT256x256x64_MI16x16x16x1_SN_1LDSB1_AMAS3_ELFLR12_GLVWA8_GLVWB8_NLCB2_PLR5_SVW4_SKFT0_SKXCCM0_TT8_128_VW4_VWB4_WGM0
    SolutionIndex: 124
    SolutionNameMin: Cijk_Ailk_Bljk_HHS_BH_MT256x256x64_MI16x16x16x1_SN_1LDSB1_AMAS3_ELFLR12_GLVWA8_GLVWB8_NLCB2_PLR5_SVW4_SKFT0_SKXCCM1_TT8_128_VW4_VWB4_WGM0
    SolutionIndex: 125
    SolutionNameMin: Cijk_Ailk_Bljk_HHS_BH_MT256x256x64_MI16x16x16x1_SN_1LDSB1_AMAS3_ELFLR0_GLVWA8_GLVWB8_NLCB2_PLR5_SVW4_SKFT1_SKXCCM0_TT8_128_VW4_VWB4_WGM0
    SolutionIndex: 126
    SolutionNameMin: Cijk_Ailk_Bljk_HHS_BH_MT256x256x64_MI16x16x16x1_SN_1LDSB1_AMAS3_ELFLR0_GLVWA8_GLVWB8_NLCB2_PLR5_SVW4_SKFT1_SKXCCM1_TT8_128_VW4_VWB4_WGM0
    SolutionIndex: 127
    SolutionNameMin: Cijk_Ailk_Bljk_HHS_BH_MT256x256x64_MI16x16x16x1_SN_1LDSB1_AMAS3_ELFLR12_GLVWA8_GLVWB8_NLCB2_PLR5_SVW4_SKFT1_SKXCCM1_TT8_128_VW4_VWB4_WGM0
    SolutionIndex: 128
    SolutionNameMin: Cijk_Ailk_Bljk_HHS_BH_MT256x256x64_MI16x16x16x1_SN_1LDSB1_AMAS3_ELFLR12_GLVWA8_GLVWB8_NLCB2_PLR5_SVW4_SKFT0_SKXCCM0_TT8_128_VW4_VWB4_WGM8
    SolutionIndex: 129
    SolutionNameMin: Cijk_Ailk_Bljk_HHS_BH_MT256x256x64_MI16x16x16x1_SN_1LDSB1_AMAS3_ELFLR0_GLVWA8_GLVWB8_NLCB2_PLR5_SVW4_SKFT0_SKXCCM1_TT8_128_VW4_VWB4_WGM8
    SolutionIndex: 130
    SolutionNameMin: Cijk_Ailk_Bljk_HHS_BH_MT256x256x64_MI16x16x16x1_SN_1LDSB1_AMAS3_ELFLR12_GLVWA8_GLVWB8_NLCB2_PLR5_SVW4_SKFT0_SKXCCM1_TT8_128_VW4_VWB4_WGM8
    SolutionIndex: 131
    SolutionNameMin: Cijk_Ailk_Bljk_HHS_BH_MT256x256x64_MI16x16x16x1_SN_1LDSB1_AMAS3_ELFLR0_GLVWA8_GLVWB8_NLCB2_PLR5_SVW4_SKFT1_SKXCCM0_TT8_128_VW4_VWB4_WGM8
    SolutionIndex: 132
    SolutionNameMin: Cijk_Ailk_Bljk_HHS_BH_MT256x256x64_MI16x16x16x1_SN_1LDSB1_AMAS3_ELFLR12_GLVWA8_GLVWB8_NLCB2_PLR5_SVW4_SKFT1_SKXCCM0_TT8_128_VW4_VWB4_WGM8
    SolutionIndex: 133
    SolutionNameMin: Cijk_Ailk_Bljk_HHS_BH_MT256x256x64_MI16x16x16x1_SN_1LDSB1_AMAS3_ELFLR0_GLVWA8_GLVWB8_NLCB2_PLR5_SVW4_SKFT1_SKXCCM1_TT8_128_VW4_VWB4_WGM8
    SolutionIndex: 134
    SolutionNameMin: Cijk_Ailk_Bljk_HHS_BH_MT128x256x64_MI16x16x16x1_SN_1LDSB1_AMAS3_ELFLR12_GLVWA8_GLVWB8_NLCB2_PLR5_SVW4_SKFT1_SKXCCM0_TT4_128_VW4_VWB4_WGM8
    SolutionIndex: 135
    SolutionNameMin: Cijk_Ailk_Bljk_HHS_BH_MT256x128x64_MI16x16x16x1_SN_1LDSB1_AMAS3_ELFLR0_GLVWA8_GLVWB8_NLCB2_PLR5_SVW4_SKFT0_SKXCCM0_TT8_64_VW4_VWB4_WGM0
    SolutionIndex: 136
    SolutionNameMin: Cijk_Ailk_Bljk_HHS_BH_MT256x128x64_MI16x16x16x1_SN_1LDSB1_AMAS3_ELFLR0_GLVWA8_GLVWB8_NLCB2_PLR5_SVW4_SKFT0_SKXCCM1_TT8_64_VW4_VWB4_WGM0
    SolutionIndex: 137
    SolutionNameMin: Cijk_Ailk_Bljk_HHS_BH_MT256x128x64_MI16x16x16x1_SN_1LDSB1_AMAS3_ELFLR0_GLVWA8_GLVWB8_NLCB2_PLR5_SVW4_SKFT1_SKXCCM0_TT8_64_VW4_VWB4_WGM0
    SolutionIndex: 138
    SolutionNameMin: Cijk_Ailk_Bljk_HHS_BH_MT256x128x64_MI16x16x16x1_SN_1LDSB1_AMAS3_ELFLR12_GLVWA8_GLVWB8_NLCB2_PLR5_SVW4_SKFT1_SKXCCM0_TT8_64_VW4_VWB4_WGM0
    SolutionIndex: 139
    SolutionNameMin: Cijk_Ailk_Bljk_HHS_BH_MT256x128x64_MI16x16x16x1_SN_1LDSB1_AMAS3_ELFLR0_GLVWA8_GLVWB8_NLCB2_PLR5_SVW4_SKFT1_SKXCCM1_TT8_64_VW4_VWB4_WGM0
    SolutionIndex: 140
    SolutionNameMin: Cijk_Ailk_Bljk_HHS_BH_MT256x128x64_MI16x16x16x1_SN_1LDSB1_AMAS3_ELFLR12_GLVWA8_GLVWB8_NLCB2_PLR5_SVW4_SKFT1_SKXCCM1_TT8_64_VW4_VWB4_WGM0
    SolutionIndex: 141
    SolutionNameMin: Cijk_Ailk_Bljk_HHS_BH_MT256x128x64_MI16x16x16x1_SN_1LDSB1_AMAS3_ELFLR0_GLVWA8_GLVWB8_NLCB2_PLR5_SVW4_SKFT0_SKXCCM0_TT8_64_VW4_VWB4_WGM8
    SolutionIndex: 142
    SolutionNameMin: Cijk_Ailk_Bljk_HHS_BH_MT256x128x64_MI16x16x16x1_SN_1LDSB1_AMAS3_ELFLR12_GLVWA8_GLVWB8_NLCB2_PLR5_SVW4_SKFT0_SKXCCM0_TT8_64_VW4_VWB4_WGM8
    SolutionIndex: 143
    SolutionNameMin: Cijk_Ailk_Bljk_HHS_BH_MT256x128x64_MI16x16x16x1_SN_1LDSB1_AMAS3_ELFLR0_GLVWA8_GLVWB8_NLCB2_PLR5_SVW4_SKFT0_SKXCCM1_TT8_64_VW4_VWB4_WGM8
    SolutionIndex: 144
    SolutionNameMin: Cijk_Ailk_Bljk_HHS_BH_MT256x128x64_MI16x16x16x1_SN_1LDSB1_AMAS3_ELFLR12_GLVWA8_GLVWB8_NLCB2_PLR5_SVW4_SKFT0_SKXCCM1_TT8_64_VW4_VWB4_WGM8
    SolutionIndex: 145
    SolutionNameMin: Cijk_Ailk_Bljk_HHS_BH_MT256x128x64_MI16x16x16x1_SN_1LDSB1_AMAS3_ELFLR12_GLVWA8_GLVWB8_NLCB2_PLR5_SVW4_SKFT1_SKXCCM0_TT8_64_VW4_VWB4_WGM8
    SolutionIndex: 146
    SolutionNameMin: Cijk_Ailk_Bljk_HHS_BH_MT256x128x64_MI16x16x16x1_SN_1LDSB1_AMAS3_ELFLR0_GLVWA8_GLVWB8_NLCB2_PLR5_SVW4_SKFT1_SKXCCM1_TT8_64_VW4_VWB4_WGM8
    SolutionIndex: 147
    SolutionNameMin: Cijk_Ailk_Bljk_HHS_BH_MT256x128x64_MI16x16x16x1_SN_1LDSB1_AMAS3_ELFLR12_GLVWA8_GLVWB8_NLCB2_PLR5_SVW4_SKFT1_SKXCCM1_TT8_64_VW4_VWB4_WGM8
    SolutionIndex: 148
    SolutionNameMin: Cijk_Ailk_Bljk_HHS_BH_MT128x128x64_MI16x16x16x1_SN_1LDSB1_AMAS3_ELFLR12_GLVWA8_GLVWB8_NLCB2_PLR5_SVW4_SKFT0_SKXCCM0_TT4_64_VW4_VWB4_WGM0
    SolutionIndex: 149
    SolutionNameMin: Cijk_Ailk_Bljk_HHS_BH_MT128x128x64_MI16x16x16x1_SN_1LDSB1_AMAS3_ELFLR12_GLVWA8_GLVWB8_NLCB2_PLR5_SVW4_SKFT0_SKXCCM1_TT4_64_VW4_VWB4_WGM0
    SolutionIndex: 150
    SolutionNameMin: Cijk_Ailk_Bljk_HHS_BH_MT128x128x64_MI16x16x16x1_SN_1LDSB1_AMAS3_ELFLR0_GLVWA8_GLVWB8_NLCB2_PLR5_SVW4_SKFT1_SKXCCM0_TT4_64_VW4_VWB4_WGM0
    SolutionIndex: 151
    SolutionNameMin: Cijk_Ailk_Bljk_HHS_BH_MT128x128x64_MI16x16x16x1_SN_1LDSB1_AMAS3_ELFLR0_GLVWA8_GLVWB8_NLCB2_PLR5_SVW4_SKFT1_SKXCCM1_TT4_64_VW4_VWB4_WGM0
    SolutionIndex: 152
    SolutionNameMin: Cijk_Ailk_Bljk_HHS_BH_MT128x128x64_MI16x16x16x1_SN_1LDSB1_AMAS3_ELFLR12_GLVWA8_GLVWB8_NLCB2_PLR5_SVW4_SKFT1_SKXCCM1_TT4_64_VW4_VWB4_WGM0
    SolutionIndex: 153
    SolutionNameMin: Cijk_Ailk_Bljk_HHS_BH_MT128x128x64_MI16x16x16x1_SN_1LDSB1_AMAS3_ELFLR0_GLVWA8_GLVWB8_NLCB2_PLR5_SVW4_SKFT0_SKXCCM1_TT4_64_VW4_VWB4_WGM8
    SolutionIndex: 154
    SolutionNameMin: Cijk_Ailk_Bljk_HHS_BH_MT128x128x64_MI16x16x16x1_SN_1LDSB1_AMAS3_ELFLR12_GLVWA8_GLVWB8_NLCB2_PLR5_SVW4_SKFT0_SKXCCM1_TT4_64_VW4_VWB4_WGM8
    SolutionIndex: 155
    SolutionNameMin: Cijk_Ailk_Bljk_HHS_BH_MT128x128x64_MI16x16x16x1_SN_1LDSB1_AMAS3_ELFLR12_GLVWA8_GLVWB8_NLCB2_PLR5_SVW4_SKFT1_SKXCCM0_TT4_64_VW4_VWB4_WGM8
    SolutionIndex: 156
    SolutionNameMin: Cijk_Ailk_Bljk_HHS_BH_MT128x128x64_MI16x16x16x1_SN_1LDSB1_AMAS3_ELFLR0_GLVWA8_GLVWB8_NLCB2_PLR5_SVW4_SKFT1_SKXCCM1_TT4_64_VW4_VWB4_WGM8
    SolutionIndex: 157
    SolutionNameMin: Cijk_Ailk_Bljk_HHS_BH_MT128x128x64_MI16x16x16x1_SN_1LDSB1_AMAS3_ELFLR12_GLVWA8_GLVWB8_NLCB2_PLR5_SVW4_SKFT1_SKXCCM1_TT4_64_VW4_VWB4_WGM8
- - - [128, 128, 1, 128, 128, 128, 128, 128]
    - [115, 555.503]
  - - [128, 128, 1, 256, 128, 128, 128, 256]
    - [51, 887.355]
  - - [128, 128, 1, 512, 128, 128, 128, 512]
    - [49, 1380.89]
  - - [128, 128, 1, 1024, 128, 128, 128, 1024]
    - [50, 1830.54]
  - - [128, 128, 1, 2048, 128, 128, 128, 2048]
    - [0, 3084.94]
  - - [128, 128, 1, 4096, 128, 128, 128, 4096]
    - [4, 5934.75]
  - - [128, 128, 1, 8192, 128, 128, 128, 8192]
    - [58, 10942.7]
  - - [128, 256, 1, 128, 128, 128, 128, 128]
    - [57, 1012.56]
  - - [128, 256, 1, 256, 128, 128, 128, 256]
    - [54, 1762.02]
  - - [128, 256, 1, 512, 128, 128, 128, 512]
    - [51, 2697.48]
  - - [128, 256, 1, 1024, 128, 128, 128, 1024]
    - [1, 4545.18]
  - - [128, 256, 1, 2048, 128, 128, 128, 2048]
    - [4, 8589.98]
  - - [128, 256, 1, 4096, 128, 128, 128, 4096]
    - [53, 15389.4]
  - - [128, 256, 1, 8192, 128, 128, 128, 8192]
    - [55, 25006.3]
  - - [128, 512, 1, 128, 128, 128, 128, 128]
    - [50, 2009.09]
  - - [128, 512, 1, 256, 128, 128, 128, 256]
    - [58, 3440.79]
  - - [128, 512, 1, 512, 128, 128, 128, 512]
    - [4, 6026.4]
  - - [128, 512, 1, 1024, 128, 128, 128, 1024]
    - [56, 11118.8]
  - - [128, 512, 1, 2048, 128, 128, 128, 2048]
    - [53, 18899.9]
  - - [128, 512, 1, 4096, 128, 128, 128, 4096]
    - [49, 29701.4]
  - - [128, 512, 1, 8192, 128, 128, 128, 8192]
    - [73, 46503.5]
  - - [128, 1024, 1, 128, 128, 128, 128, 128]
    - [59, 3896.76]
  - - [128, 1024, 1, 256, 128, 128, 128, 256]
    - [55, 6963.39]
  - - [128, 1024, 1, 512, 128, 128, 128, 512]
    - [55, 12599.9]
  - - [128, 1024, 1, 1024, 128, 128, 128, 1024]
    - [5, 21162.4]
  - - [128, 1024, 1, 2048, 128, 128, 128, 2048]
    - [74, 34442.0]
  - - [128, 1024, 1, 4096, 128, 128, 128, 4096]
    - [73, 54066.5]
  - - [128, 1024, 1, 8192, 128, 128, 128, 8192]
    - [39, 80263.7]
  - - [128, 2048, 1, 128, 128, 128, 128, 128]
    - [53, 8093.03]
  - - [128, 2048, 1, 256, 128, 128, 128, 256]
    - [48, 14331.6]
  - - [128, 2048, 1, 512, 128, 128, 128, 512]
    - [74, 23577.2]
  - - [128, 2048, 1, 1024, 128, 128, 128, 1024]
    - [75, 39415.7]
  - - [128, 2048, 1, 2048, 128, 128, 128, 2048]
    - [75, 59119.9]
  - - [128, 2048, 1, 4096, 128, 128, 128, 4096]
    - [37, 93135.5]
  - - [128, 2048, 1, 8192, 128, 128, 128, 8192]
    - [38, 125638.0]
  - - [128, 4096, 1, 128, 128, 128, 128, 128]
    - [76, 15322.6]
  - - [128, 4096, 1, 256, 128, 128, 128, 256]
    - [71, 27281.4]
  - - [128, 4096, 1, 512, 128, 128, 128, 512]
    - [75, 42246.8]
  - - [128, 4096, 1, 1024, 128, 128, 128, 1024]
    - [121, 65571.9]
  - - [128, 4096, 1, 2048, 128, 128, 128, 2048]
    - [63, 101369.0]
  - - [128, 4096, 1, 4096, 128, 128, 128, 4096]
    - [108, 136235.0]
  - - [128, 4096, 1, 8192, 128, 128, 128, 8192]
    - [108, 184975.0]
  - - [128, 8192, 1, 128, 128, 128, 128, 128]
    - [111, 28959.2]
  - - [128, 8192, 1, 256, 128, 128, 128, 256]
    - [61, 50023.2]
  - - [128, 8192, 1, 512, 128, 128, 128, 512]
    - [61, 74670.9]
  - - [128, 8192, 1, 1024, 128, 128, 128, 1024]
    - [63, 111709.0]
  - - [128, 8192, 1, 2048, 128, 128, 128, 2048]
    - [109, 142600.0]
  - - [128, 8192, 1, 4096, 128, 128, 128, 4096]
    - [102, 196682.0]
  - - [128, 8192, 1, 8192, 128, 128, 128, 8192]
    - [80, 261288.0]
  - - [256, 128, 1, 128, 256, 256, 256, 128]
    - [68, 1004.01]
  - - [256, 128, 1, 256, 256, 256, 256, 256]
    - [50, 1758.72]
  - - [256, 128, 1, 512, 256, 256, 256, 512]
    - [51, 2688.82]
  - - [256, 128, 1, 1024, 256, 256, 256, 1024]
    - [2, 4510.67]
  - - [256, 128, 1, 2048, 256, 256, 256, 2048]
    - [3, 8534.06]
  - - [256, 128, 1, 4096, 256, 256, 256, 4096]
    - [52, 15222.1]
  - - [256, 128, 1, 8192, 256, 256, 256, 8192]
    - [49, 24757.8]
  - - [256, 256, 1, 128, 256, 256, 256, 128]
    - [54, 2007.16]
  - - [256, 256, 1, 256, 256, 256, 256, 256]
    - [59, 3434.23]
  - - [256, 256, 1, 512, 256, 256, 256, 512]
    - [7, 6026.18]
  - - [256, 256, 1, 1024, 256, 256, 256, 1024]
    - [51, 11122.0]
  - - [256, 256, 1, 2048, 256, 256, 256, 2048]
    - [49, 18799.7]
  - - [256, 256, 1, 4096, 256, 256, 256, 4096]
    - [51, 29452.1]
  - - [256, 256, 1, 8192, 256, 256, 256, 8192]
    - [75, 46049.3]
  - - [256, 512, 1, 128, 256, 256, 256, 128]
    - [51, 3898.93]
  - - [256, 512, 1, 256, 256, 256, 256, 256]
    - [55, 6931.4]
  - - [256, 512, 1, 512, 256, 256, 256, 512]
    - [51, 12509.3]
  - - [256, 512, 1, 1024, 256, 256, 256, 1024]
    - [49, 20943.2]
  - - [256, 512, 1, 2048, 256, 256, 256, 2048]
    - [76, 34188.5]
  - - [256, 512, 1, 4096, 256, 256, 256, 4096]
    - [72, 54019.6]
  - - [256, 512, 1, 8192, 256, 256, 256, 8192]
    - [76, 75021.4]
  - - [256, 1024, 1, 128, 256, 256, 256, 128]
    - [52, 8055.49]
  - - [256, 1024, 1, 256, 256, 256, 256, 256]
    - [53, 14251.1]
  - - [256, 1024, 1, 512, 256, 256, 256, 512]
    - [75, 23474.8]
  - - [256, 1024, 1, 1024, 256, 256, 256, 1024]
    - [71, 39002.2]
  - - [256, 1024, 1, 2048, 256, 256, 256, 2048]
    - [9, 59517.0]
  - - [256, 1024, 1, 4096, 256, 256, 256, 4096]
    - [36, 94583.3]
  - - [256, 1024, 1, 8192, 256, 256, 256, 8192]
    - [11, 124537.0]
  - - [256, 2048, 1, 128, 256, 256, 256, 128]
    - [76, 15367.9]
  - - [256, 2048, 1, 256, 256, 256, 256, 256]
    - [71, 27146.6]
  - - [256, 2048, 1, 512, 256, 256, 256, 512]
    - [70, 42163.7]
  - - [256, 2048, 1, 1024, 256, 256, 256, 1024]
    - [113, 65899.9]
  - - [256, 2048, 1, 2048, 256, 256, 256, 2048]
    - [110, 104681.0]
  - - [256, 2048, 1, 4096, 256, 256, 256, 4096]
    - [119, 138395.0]
  - - [256, 2048, 1, 8192, 256, 256, 256, 8192]
    - [105, 178212.0]
  - - [256, 4096, 1, 128, 256, 256, 256, 128]
    - [111, 28416.4]
  - - [256, 4096, 1, 256, 256, 256, 256, 256]
    - [116, 49685.8]
  - - [256, 4096, 1, 512, 256, 256, 256, 512]
    - [117, 75015.6]
  - - [256, 4096, 1, 1024, 256, 256, 256, 1024]
    - [63, 110604.0]
  - - [256, 4096, 1, 2048, 256, 256, 256, 2048]
    - [90, 147504.0]
  - - [256, 4096, 1, 4096, 256, 256, 256, 4096]
    - [108, 195765.0]
  - - [256, 4096, 1, 8192, 256, 256, 256, 8192]
    - [85, 249208.0]
  - - [256, 8192, 1, 128, 256, 256, 256, 128]
    - [121, 49500.4]
  - - [256, 8192, 1, 256, 256, 256, 256, 256]
    - [94, 68309.1]
  - - [256, 8192, 1, 512, 256, 256, 256, 512]
    - [92, 112424.0]
  - - [256, 8192, 1, 1024, 256, 256, 256, 1024]
    - [96, 150303.0]
  - - [256, 8192, 1, 2048, 256, 256, 256, 2048]
    - [97, 202375.0]
  - - [256, 8192, 1, 4096, 256, 256, 256, 4096]
    - [153, 264737.0]
  - - [256, 8192, 1, 8192, 256, 256, 256, 8192]
    - [142, 328307.0]
  - - [512, 128, 1, 128, 512, 512, 512, 128]
    - [48, 1980.16]
  - - [512, 128, 1, 256, 512, 512, 512, 256]
    - [55, 3421.96]
  - - [512, 128, 1, 512, 512, 512, 512, 512]
    - [6, 5996.74]
  - - [512, 128, 1, 1024, 512, 512, 512, 1024]
    - [51, 11110.4]
  - - [512, 128, 1, 2048, 512, 512, 512, 2048]
    - [53, 18878.1]
  - - [512, 128, 1, 4096, 512, 512, 512, 4096]
    - [49, 29166.2]
  - - [512, 128, 1, 8192, 512, 512, 512, 8192]
    - [73, 45514.4]
  - - [512, 256, 1, 128, 512, 512, 512, 128]
    - [55, 3825.22]
  - - [512, 256, 1, 256, 512, 512, 512, 256]
    - [50, 6891.77]
  - - [512, 256, 1, 512, 512, 512, 512, 512]
    - [51, 12478.1]
  - - [512, 256, 1, 1024, 512, 512, 512, 1024]
    - [49, 20892.2]
  - - [512, 256, 1, 2048, 512, 512, 512, 2048]
    - [74, 34108.5]
  - - [512, 256, 1, 4096, 512, 512, 512, 4096]
    - [70, 53435.9]
  - - [512, 256, 1, 8192, 512, 512, 512, 8192]
    - [77, 74176.4]
  - - [512, 512, 1, 128, 512, 512, 512, 128]
    - [49, 8043.29]
  - - [512, 512, 1, 256, 512, 512, 512, 256]
    - [51, 14184.4]
  - - [512, 512, 1, 512, 512, 512, 512, 512]
    - [70, 23298.5]
  - - [512, 512, 1, 1024, 512, 512, 512, 1024]
    - [76, 38793.9]
  - - [512, 512, 1, 2048, 512, 512, 512, 2048]
    - [37, 60375.0]
  - - [512, 512, 1, 4096, 512, 512, 512, 4096]
    - [8, 86291.7]
  - - [512, 512, 1, 8192, 512, 512, 512, 8192]
    - [61, 119690.0]
  - - [512, 1024, 1, 128, 512, 512, 512, 128]
    - [73, 15608.1]
  - - [512, 1024, 1, 256, 512, 512, 512, 256]
    - [71, 27084.1]
  - - [512, 1024, 1, 512, 512, 512, 512, 512]
    - [71, 42004.5]
  - - [512, 1024, 1, 1024, 512, 512, 512, 1024]
    - [13, 67844.0]
  - - [512, 1024, 1, 2048, 512, 512, 512, 2048]
    - [37, 101731.0]
  - - [512, 1024, 1, 4096, 512, 512, 512, 4096]
    - [10, 132473.0]
  - - [512, 1024, 1, 8192, 512, 512, 512, 8192]
    - [29, 177340.0]
  - - [512, 2048, 1, 128, 512, 512, 512, 128]
    - [118, 28502.2]
  - - [512, 2048, 1, 256, 512, 512, 512, 256]
    - [116, 49434.7]
  - - [512, 2048, 1, 512, 512, 512, 512, 512]
    - [112, 76423.0]
  - - [512, 2048, 1, 1024, 512, 512, 512, 1024]
    - [64, 111077.0]
  - - [512, 2048, 1, 2048, 512, 512, 512, 2048]
    - [92, 147878.0]
  - - [512, 2048, 1, 4096, 512, 512, 512, 4096]
    - [20, 186486.0]
  - - [512, 2048, 1, 8192, 512, 512, 512, 8192]
    - [78, 252209.0]
  - - [512, 4096, 1, 128, 512, 512, 512, 128]
    - [117, 49456.6]
  - - [512, 4096, 1, 256, 512, 512, 512, 256]
    - [116, 69614.9]
  - - [512, 4096, 1, 512, 512, 512, 512, 512]
    - [93, 114431.0]
  - - [512, 4096, 1, 1024, 512, 512, 512, 1024]
    - [91, 151898.0]
  - - [512, 4096, 1, 2048, 512, 512, 512, 2048]
    - [97, 199328.0]
  - - [512, 4096, 1, 4096, 512, 512, 512, 4096]
    - [89, 256860.0]
  - - [512, 4096, 1, 8192, 512, 512, 512, 8192]
    - [14, 325394.0]
  - - [512, 8192, 1, 128, 512, 512, 512, 128]
    - [84, 71838.0]
  - - [512, 8192, 1, 256, 512, 512, 512, 256]
    - [84, 103438.0]
  - - [512, 8192, 1, 512, 512, 512, 512, 512]
    - [95, 148531.0]
  - - [512, 8192, 1, 1024, 512, 512, 512, 1024]
    - [78, 203556.0]
  - - [512, 8192, 1, 2048, 512, 512, 512, 2048]
    - [88, 261307.0]
  - - [512, 8192, 1, 4096, 512, 512, 512, 4096]
    - [41, 333357.0]
  - - [512, 8192, 1, 8192, 512, 512, 512, 8192]
    - [145, 371616.0]
  - - [1024, 128, 1, 128, 1024, 1024, 1024, 128]
    - [51, 3853.91]
  - - [1024, 128, 1, 256, 1024, 1024, 1024, 256]
    - [48, 6885.39]
  - - [1024, 128, 1, 512, 1024, 1024, 1024, 512]
    - [55, 12503.7]
  - - [1024, 128, 1, 1024, 1024, 1024, 1024, 1024]
    - [52, 21108.7]
  - - [1024, 128, 1, 2048, 1024, 1024, 1024, 2048]
    - [71, 34793.4]
  - - [1024, 128, 1, 4096, 1024, 1024, 1024, 4096]
    - [73, 53332.9]
  - - [1024, 128, 1, 8192, 1024, 1024, 1024, 8192]
    - [13, 76987.1]
  - - [1024, 256, 1, 128, 1024, 1024, 1024, 128]
    - [49, 8115.38]
  - - [1024, 256, 1, 256, 1024, 1024, 1024, 256]
    - [51, 14152.7]
  - - [1024, 256, 1, 512, 1024, 1024, 1024, 512]
    - [77, 23385.0]
  - - [1024, 256, 1, 1024, 1024, 1024, 1024, 1024]
    - [75, 38887.9]
  - - [1024, 256, 1, 2048, 1024, 1024, 1024, 2048]
    - [35, 62324.2]
  - - [1024, 256, 1, 4096, 1024, 1024, 1024, 4096]
    - [9, 87788.8]
  - - [1024, 256, 1, 8192, 1024, 1024, 1024, 8192]
    - [67, 117350.0]
  - - [1024, 512, 1, 128, 1024, 1024, 1024, 128]
    - [69, 15325.0]
  - - [1024, 512, 1, 256, 1024, 1024, 1024, 256]
    - [71, 27200.6]
  - - [1024, 512, 1, 512, 1024, 1024, 1024, 512]
    - [75, 42008.4]
  - - [1024, 512, 1, 1024, 1024, 1024, 1024, 1024]
    - [37, 69421.0]
  - - [1024, 512, 1, 2048, 1024, 1024, 1024, 2048]
    - [67, 101587.0]
  - - [1024, 512, 1, 4096, 1024, 1024, 1024, 4096]
    - [33, 129770.0]
  - - [1024, 512, 1, 8192, 1024, 1024, 1024, 8192]
    - [29, 167809.0]
  - - [1024, 1024, 1, 128, 1024, 1024, 1024, 128]
    - [111, 29062.2]
  - - [1024, 1024, 1, 256, 1024, 1024, 1024, 256]
    - [117, 49635.1]
  - - [1024, 1024, 1, 512, 1024, 1024, 1024, 512]
    - [113, 75434.7]
  - - [1024, 1024, 1, 1024, 1024, 1024, 1024, 1024]
    - [60, 112681.0]
  - - [1024, 1024, 1, 2048, 1024, 1024, 1024, 2048]
    - [96, 140601.0]
  - - [1024, 1024, 1, 4096, 1024, 1024, 1024, 4096]
    - [21, 187395.0]
  - - [1024, 1024, 1, 8192, 1024, 1024, 1024, 8192]
    - [78, 251065.0]
  - - [1024, 2048, 1, 128, 1024, 1024, 1024, 128]
    - [117, 49581.9]
  - - [1024, 2048, 1, 256, 1024, 1024, 1024, 256]
    - [102, 72787.0]
  - - [1024, 2048, 1, 512, 1024, 1024, 1024, 512]
    - [92, 115238.0]
  - - [1024, 2048, 1, 1024, 1024, 1024, 1024, 1024]
    - [101, 152816.0]
  - - [1024, 2048, 1, 2048, 1024, 1024, 1024, 2048]
    - [23, 196152.0]
  - - [1024, 2048, 1, 4096, 1024, 1024, 1024, 4096]
    - [78, 271825.0]
  - - [1024, 2048, 1, 8192, 1024, 1024, 1024, 8192]
    - [136, 318671.0]
  - - [1024, 4096, 1, 128, 1024, 1024, 1024, 128]
    - [86, 71344.7]
  - - [1024, 4096, 1, 256, 1024, 1024, 1024, 256]
    - [148, 106133.0]
  - - [1024, 4096, 1, 512, 1024, 1024, 1024, 512]
    - [96, 149435.0]
  - - [1024, 4096, 1, 1024, 1024, 1024, 1024, 1024]
    - [98, 203121.0]
  - - [1024, 4096, 1, 2048, 1024, 1024, 1024, 2048]
    - [78, 269469.0]
  - - [1024, 4096, 1, 4096, 1024, 1024, 1024, 4096]
    - [45, 324875.0]
  - - [1024, 4096, 1, 8192, 1024, 1024, 1024, 8192]
    - [139, 362825.0]
  - - [1024, 8192, 1, 128, 1024, 1024, 1024, 128]
    - [138, 96479.6]
  - - [1024, 8192, 1, 256, 1024, 1024, 1024, 256]
    - [109, 134962.0]
  - - [1024, 8192, 1, 512, 1024, 1024, 1024, 512]
    - [83, 193739.0]
  - - [1024, 8192, 1, 1024, 1024, 1024, 1024, 1024]
    - [151, 263653.0]
  - - [1024, 8192, 1, 2048, 1024, 1024, 1024, 2048]
    - [42, 332123.0]
  - - [1024, 8192, 1, 4096, 1024, 1024, 1024, 4096]
    - [141, 364426.0]
  - - [1024, 8192, 1, 8192, 1024, 1024, 1024, 8192]
    - [128, 433632.0]
  - - [2048, 128, 1, 128, 2048, 2048, 2048, 128]
    - [48, 8060.7]
  - - [2048, 128, 1, 256, 2048, 2048, 2048, 256]
    - [51, 14143.7]
  - - [2048, 128, 1, 512, 2048, 2048, 2048, 512]
    - [71, 23345.5]
  - - [2048, 128, 1, 1024, 2048, 2048, 2048, 1024]
    - [74, 39010.1]
  - - [2048, 128, 1, 2048, 2048, 2048, 2048, 2048]
    - [34, 61017.5]
  - - [2048, 128, 1, 4096, 2048, 2048, 2048, 4096]
    - [9, 93684.0]
  - - [2048, 128, 1, 8192, 2048, 2048, 2048, 8192]
    - [63, 118342.0]
  - - [2048, 256, 1, 128, 2048, 2048, 2048, 128]
    - [73, 15455.4]
  - - [2048, 256, 1, 256, 2048, 2048, 2048, 256]
    - [71, 27126.9]
  - - [2048, 256, 1, 512, 2048, 2048, 2048, 512]
    - [75, 41738.9]
  - - [2048, 256, 1, 1024, 2048, 2048, 2048, 1024]
    - [114, 69892.6]
  - - [2048, 256, 1, 2048, 2048, 2048, 2048, 2048]
    - [9, 101130.0]
  - - [2048, 256, 1, 4096, 2048, 2048, 2048, 4096]
    - [26, 128331.0]
  - - [2048, 256, 1, 8192, 2048, 2048, 2048, 8192]
    - [31, 167442.0]
  - - [2048, 512, 1, 128, 2048, 2048, 2048, 128]
    - [111, 28589.1]
  - - [2048, 512, 1, 256, 2048, 2048, 2048, 256]
    - [113, 49384.6]
  - - [2048, 512, 1, 512, 2048, 2048, 2048, 512]
    - [63, 75446.5]
  - - [2048, 512, 1, 1024, 2048, 2048, 2048, 1024]
    - [67, 110311.0]
  - - [2048, 512, 1, 2048, 2048, 2048, 2048, 2048]
    - [31, 136625.0]
  - - [2048, 512, 1, 4096, 2048, 2048, 2048, 4096]
    - [20, 184858.0]
  - - [2048, 512, 1, 8192, 2048, 2048, 2048, 8192]
    - [79, 248594.0]
  - - [2048, 1024, 1, 128, 2048, 2048, 2048, 128]
    - [120, 49114.9]
  - - [2048, 1024, 1, 256, 2048, 2048, 2048, 256]
    - [103, 74367.3]
  - - [2048, 1024, 1, 512, 2048, 2048, 2048, 512]
    - [93, 114964.0]
  - - [2048, 1024, 1, 1024, 2048, 2048, 2048, 1024]
    - [30, 148092.0]
  - - [2048, 1024, 1, 2048, 2048, 2048, 2048, 2048]
    - [152, 193896.0]
  - - [2048, 1024, 1, 4096, 2048, 2048, 2048, 4096]
    - [78, 262072.0]
  - - [2048, 1024, 1, 8192, 2048, 2048, 2048, 8192]
    - [140, 305809.0]
  - - [2048, 2048, 1, 128, 2048, 2048, 2048, 128]
    - [81, 69706.4]
  - - [2048, 2048, 1, 256, 2048, 2048, 2048, 256]
    - [102, 103358.0]
  - - [2048, 2048, 1, 512, 2048, 2048, 2048, 512]
    - [96, 149684.0]
  - - [2048, 2048, 1, 1024, 2048, 2048, 2048, 1024]
    - [149, 198622.0]
  - - [2048, 2048, 1, 2048, 2048, 2048, 2048, 2048]
    - [82, 269565.0]
  - - [2048, 2048, 1, 4096, 2048, 2048, 2048, 4096]
    - [144, 336119.0]
  - - [2048, 2048, 1, 8192, 2048, 2048, 2048, 8192]
    - [139, 360908.0]
  - - [2048, 4096, 1, 128, 2048, 2048, 2048, 128]
    - [137, 97194.2]
  - - [2048, 4096, 1, 256, 2048, 2048, 2048, 256]
    - [79, 136990.0]
  - - [2048, 4096, 1, 512, 2048, 2048, 2048, 512]
    - [83, 194923.0]
  - - [2048, 4096, 1, 1024, 2048, 2048, 2048, 1024]
    - [89, 260626.0]
  - - [2048, 4096, 1, 2048, 2048, 2048, 2048, 2048]
    - [16, 323638.0]
  - - [2048, 4096, 1, 4096, 2048, 2048, 2048, 4096]
    - [129, 362744.0]
  - - [2048, 4096, 1, 8192, 2048, 2048, 2048, 8192]
    - [124, 431809.0]
  - - [2048, 8192, 1, 128, 2048, 2048, 2048, 128]
    - [145, 120273.0]
  - - [2048, 8192, 1, 256, 2048, 2048, 2048, 256]
    - [151, 173866.0]
  - - [2048, 8192, 1, 512, 2048, 2048, 2048, 512]
    - [147, 245843.0]
  - - [2048, 8192, 1, 1024, 2048, 2048, 2048, 1024]
    - [143, 309640.0]
  - - [2048, 8192, 1, 2048, 2048, 2048, 2048, 2048]
    - [141, 374213.0]
  - - [2048, 8192, 1, 4096, 2048, 2048, 2048, 4096]
    - [133, 424101.0]
  - - [2048, 8192, 1, 8192, 2048, 2048, 2048, 8192]
    - [131, 472725.0]
  - - [4096, 128, 1, 128, 4096, 4096, 4096, 128]
    - [69, 15589.9]
  - - [4096, 128, 1, 256, 4096, 4096, 4096, 256]
    - [75, 27153.8]
  - - [4096, 128, 1, 512, 4096, 4096, 4096, 512]
    - [74, 42073.7]
  - - [4096, 128, 1, 1024, 4096, 4096, 4096, 1024]
    - [37, 67783.1]
  - - [4096, 128, 1, 2048, 4096, 4096, 4096, 2048]
    - [12, 102293.0]
  - - [4096, 128, 1, 4096, 4096, 4096, 4096, 4096]
    - [27, 133884.0]
  - - [4096, 128, 1, 8192, 4096, 4096, 4096, 8192]
    - [28, 169974.0]
  - - [4096, 256, 1, 128, 4096, 4096, 4096, 128]
    - [111, 28660.7]
  - - [4096, 256, 1, 256, 4096, 4096, 4096, 256]
    - [66, 49584.7]
  - - [4096, 256, 1, 512, 4096, 4096, 4096, 512]
    - [62, 75371.1]
  - - [4096, 256, 1, 1024, 4096, 4096, 4096, 1024]
    - [65, 110958.0]
  - - [4096, 256, 1, 2048, 4096, 4096, 4096, 2048]
    - [25, 138830.0]
  - - [4096, 256, 1, 4096, 4096, 4096, 4096, 4096]
    - [83, 185331.0]
  - - [4096, 256, 1, 8192, 4096, 4096, 4096, 8192]
    - [20, 249221.0]
  - - [4096, 512, 1, 128, 4096, 4096, 4096, 128]
    - [121, 49707.9]
  - - [4096, 512, 1, 256, 4096, 4096, 4096, 256]
    - [103, 77114.6]
  - - [4096, 512, 1, 512, 4096, 4096, 4096, 512]
    - [99, 109999.0]
  - - [4096, 512, 1, 1024, 4096, 4096, 4096, 1024]
    - [100, 149848.0]
  - - [4096, 512, 1, 2048, 4096, 4096, 4096, 2048]
    - [82, 192316.0]
  - - [4096, 512, 1, 4096, 4096, 4096, 4096, 4096]
    - [82, 264913.0]
  - - [4096, 512, 1, 8192, 4096, 4096, 4096, 8192]
    - [136, 305654.0]
  - - [4096, 1024, 1, 128, 4096, 4096, 4096, 128]
    - [106, 68690.8]
  - - [4096, 1024, 1, 256, 4096, 4096, 4096, 256]
    - [103, 106041.0]
  - - [4096, 1024, 1, 512, 4096, 4096, 4096, 512]
    - [108, 142919.0]
  - - [4096, 1024, 1, 1024, 4096, 4096, 4096, 1024]
    - [153, 205856.0]
  - - [4096, 1024, 1, 2048, 4096, 4096, 4096, 2048]
    - [22, 265928.0]
  - - [4096, 1024, 1, 4096, 4096, 4096, 4096, 4096]
    - [136, 315921.0]
  - - [4096, 1024, 1, 8192, 4096, 4096, 4096, 8192]
    - [46, 353831.0]
  - - [4096, 2048, 1, 128, 4096, 4096, 4096, 128]
    - [135, 96498.8]
  - - [4096, 2048, 1, 256, 4096, 4096, 4096, 256]
    - [107, 137886.0]
  - - [4096, 2048, 1, 512, 4096, 4096, 4096, 512]
    - [82, 192940.0]
  - - [4096, 2048, 1, 1024, 4096, 4096, 4096, 1024]
    - [82, 261390.0]
  - - [4096, 2048, 1, 2048, 4096, 4096, 4096, 2048]
    - [146, 330510.0]
  - - [4096, 2048, 1, 4096, 4096, 4096, 4096, 4096]
    - [140, 365617.0]
  - - [4096, 2048, 1, 8192, 4096, 4096, 4096, 8192]
    - [130, 429603.0]
  - - [4096, 4096, 1, 128, 4096, 4096, 4096, 128]
    - [134, 117626.0]
  - - [4096, 4096, 1, 256, 4096, 4096, 4096, 256]
    - [83, 174248.0]
  - - [4096, 4096, 1, 512, 4096, 4096, 4096, 512]
    - [146, 239213.0]
  - - [4096, 4096, 1, 1024, 4096, 4096, 4096, 1024]
    - [44, 311938.0]
  - - [4096, 4096, 1, 2048, 4096, 4096, 4096, 2048]
    - [126, 366911.0]
  - - [4096, 4096, 1, 4096, 4096, 4096, 4096, 4096]
    - [127, 423027.0]
  - - [4096, 4096, 1, 8192, 4096, 4096, 4096, 8192]
    - [132, 466641.0]
  - - [4096, 8192, 1, 128, 4096, 4096, 4096, 128]
    - [87, 139781.0]
  - - [4096, 8192, 1, 256, 4096, 4096, 4096, 256]
    - [140, 203275.0]
  - - [4096, 8192, 1, 512, 4096, 4096, 4096, 512]
    - [19, 273359.0]
  - - [4096, 8192, 1, 1024, 4096, 4096, 4096, 1024]
    - [127, 347784.0]
  - - [4096, 8192, 1, 2048, 4096, 4096, 4096, 2048]
    - [40, 423943.0]
  - - [4096, 8192, 1, 4096, 4096, 4096, 4096, 4096]
    - [124, 492504.0]
  - - [4096, 8192, 1, 8192, 4096, 4096, 4096, 8192]
    - [124, 513945.0]
  - - [8192, 128, 1, 128, 8192, 8192, 8192, 128]
    - [110, 28683.4]
  - - [8192, 128, 1, 256, 8192, 8192, 8192, 256]
    - [117, 49317.3]
  - - [8192, 128, 1, 512, 8192, 8192, 8192, 512]
    - [66, 74992.5]
  - - [8192, 128, 1, 1024, 8192, 8192, 8192, 1024]
    - [66, 110670.0]
  - - [8192, 128, 1, 2048, 8192, 8192, 8192, 2048]
    - [32, 138853.0]
  - - [8192, 128, 1, 4096, 8192, 8192, 8192, 4096]
    - [23, 183632.0]
  - - [8192, 128, 1, 8192, 8192, 8192, 8192, 8192]
    - [150, 251462.0]
  - - [8192, 256, 1, 128, 8192, 8192, 8192, 128]
    - [121, 49752.1]
  - - [8192, 256, 1, 256, 8192, 8192, 8192, 256]
    - [94, 75533.6]
  - - [8192, 256, 1, 512, 8192, 8192, 8192, 512]
    - [66, 106681.0]
  - - [8192, 256, 1, 1024, 8192, 8192, 8192, 1024]
    - [104, 147905.0]
  - - [8192, 256, 1, 2048, 8192, 8192, 8192, 2048]
    - [24, 194925.0]
  - - [8192, 256, 1, 4096, 8192, 8192, 8192, 4096]
    - [83, 260451.0]
  - - [8192, 256, 1, 8192, 8192, 8192, 8192, 8192]
    - [136, 305682.0]
  - - [8192, 512, 1, 128, 8192, 8192, 8192, 128]
    - [86, 71700.6]
  - - [8192, 512, 1, 256, 8192, 8192, 8192, 256]
    - [148, 102467.0]
  - - [8192, 512, 1, 512, 8192, 8192, 8192, 512]
    - [99, 143367.0]
  - - [8192, 512, 1, 1024, 8192, 8192, 8192, 1024]
    - [157, 201950.0]
  - - [8192, 512, 1, 2048, 8192, 8192, 8192, 2048]
    - [78, 261142.0]
  - - [8192, 512, 1, 4096, 8192, 8192, 8192, 4096]
    - [43, 320838.0]
  - - [8192, 512, 1, 8192, 8192, 8192, 8192, 8192]
    - [128, 353235.0]
  - - [8192, 1024, 1, 128, 8192, 8192, 8192, 128]
    - [145, 96279.4]
  - - [8192, 1024, 1, 256, 8192, 8192, 8192, 256]
    - [154, 133836.0]
  - - [8192, 1024, 1, 512, 8192, 8192, 8192, 512]
    - [156, 192402.0]
  - - [8192, 1024, 1, 1024, 8192, 8192, 8192, 1024]
    - [156, 264946.0]
  - - [8192, 1024, 1, 2048, 8192, 8192, 8192, 2048]
    - [144, 319495.0]
  - - [8192, 1024, 1, 4096, 8192, 8192, 8192, 4096]
    - [127, 361232.0]
  - - [8192, 1024, 1, 8192, 8192, 8192, 8192, 8192]
    - [124, 424748.0]
  - - [8192, 2048, 1, 128, 8192, 8192, 8192, 128]
    - [155, 119142.0]
  - - [8192, 2048, 1, 256, 8192, 8192, 8192, 256]
    - [88, 171865.0]
  - - [8192, 2048, 1, 512, 8192, 8192, 8192, 512]
    - [47, 245901.0]
  - - [8192, 2048, 1, 1024, 8192, 8192, 8192, 1024]
    - [139, 322134.0]
  - - [8192, 2048, 1, 2048, 8192, 8192, 8192, 2048]
    - [15, 362318.0]
  - - [8192, 2048, 1, 4096, 8192, 8192, 8192, 4096]
    - [127, 433908.0]
  - - [8192, 2048, 1, 8192, 8192, 8192, 8192, 8192]
    - [126, 468594.0]
  - - [8192, 4096, 1, 128, 8192, 8192, 8192, 128]
    - [86, 137941.0]
  - - [8192, 4096, 1, 256, 8192, 8192, 8192, 256]
    - [146, 200670.0]
  - - [8192, 4096, 1, 512, 8192, 8192, 8192, 512]
    - [18, 279286.0]
  - - [8192, 4096, 1, 1024, 8192, 8192, 8192, 1024]
    - [127, 350655.0]
  - - [8192, 4096, 1, 2048, 8192, 8192, 8192, 2048]
    - [127, 429933.0]
  - - [8192, 4096, 1, 4096, 8192, 8192, 8192, 4096]
    - [122, 490446.0]
  - - [8192, 4096, 1, 8192, 8192, 8192, 8192, 8192]
    - [123, 520510.0]
  - - [8192, 8192, 1, 128, 8192, 8192, 8192, 128]
    - [139, 154125.0]
  - - [8192, 8192, 1, 256, 8192, 8192, 8192, 256]
    - [19, 224743.0]
  - - [8192, 8192, 1, 512, 8192, 8192, 8192, 512]
    - [17, 305054.0]
  - - [8192, 8192, 1, 1024, 8192, 8192, 8192, 1024]
    - [125, 390866.0]
  - - [8192, 8192, 1, 2048, 8192, 8192, 8192, 2048]
    - [122, 471640.0]
  - - [8192, 8192, 1, 4096, 8192, 8192, 8192, 4096]
    - [123, 527817.0]
  - - [8192, 8192, 1, 8192, 8192, 8192, 8192, 8192]
    - [123, 555613.0]
- null
- null
- DeviceEfficiency
