experiments/sk3rx8_transposes/yaml_outputs/hgemm_nt_2024-06-05_12_37_15/aquavanjaram942_Cijk_Ailk_Bjlk_HHS_BH.yaml
- {MinimumRequiredVersion: 4.41.0}
- aquavanjaram942
- gfx942
- [Device 0049, Device 0050]
    SolutionIndex: 0
    SolutionNameMin: Cijk_Ailk_Bjlk_HHS_BH_MT32x32x16_MI16x16x16x1_SN_1LDSB0_AMAS0_ELFLR12_GLVWA2_GLVWB2_NLCB1_PLR1_SVW1_SKFT0_SKXCCM1_TT1_16_VW1_VWB1_WGM0
    SolutionIndex: 1
    SolutionNameMin: Cijk_Ailk_Bjlk_HHS_BH_MT32x32x16_MI16x16x16x1_SN_1LDSB0_AMAS0_ELFLR0_GLVWA2_GLVWB2_NLCB1_PLR1_SVW1_SKFT1_SKXCCM1_TT1_16_VW1_VWB1_WGM0
    SolutionIndex: 2
    SolutionNameMin: Cijk_Ailk_Bjlk_HHS_BH_MT32x32x16_MI16x16x16x1_SN_1LDSB0_AMAS0_ELFLR12_GLVWA2_GLVWB2_NLCB1_PLR1_SVW1_SKFT1_SKXCCM1_TT1_16_VW1_VWB1_WGM0
    SolutionIndex: 3
    SolutionNameMin: Cijk_Ailk_Bjlk_HHS_BH_MT64x64x32_MI16x16x16x1_SN_1LDSB0_AMAS0_ELFLR0_GLVWA8_GLVWB8_NLCB1_PLR3_SVW1_SKFT1_SKXCCM0_TT2_32_VW1_VWB1_WGM0
    SolutionIndex: 4
    SolutionNameMin: Cijk_Ailk_Bjlk_HHS_BH_MT32x32x32_MI16x16x16x1_SN_1LDSB0_AMAS0_ELFLR12_GLVWA4_GLVWB4_NLCB1_PLR3_SVW1_SKFT0_SKXCCM0_TT1_16_VW1_VWB1_WGM0
    SolutionIndex: 5
    SolutionNameMin: Cijk_Ailk_Bjlk_HHS_BH_MT32x32x32_MI16x16x16x1_SN_1LDSB0_AMAS0_ELFLR0_GLVWA4_GLVWB4_NLCB1_PLR3_SVW1_SKFT0_SKXCCM1_TT1_16_VW1_VWB1_WGM0
    SolutionIndex: 6
    SolutionNameMin: Cijk_Ailk_Bjlk_HHS_BH_MT32x32x32_MI16x16x16x1_SN_1LDSB0_AMAS0_ELFLR12_GLVWA4_GLVWB4_NLCB1_PLR3_SVW1_SKFT0_SKXCCM1_TT1_16_VW1_VWB1_WGM0
    SolutionIndex: 7
    SolutionNameMin: Cijk_Ailk_Bjlk_HHS_BH_MT32x32x32_MI16x16x16x1_SN_1LDSB0_AMAS0_ELFLR12_GLVWA4_GLVWB4_NLCB1_PLR3_SVW1_SKFT1_SKXCCM0_TT1_16_VW1_VWB1_WGM0
    SolutionIndex: 8
    SolutionNameMin: Cijk_Ailk_Bjlk_HHS_BH_MT32x32x32_MI16x16x16x1_SN_1LDSB0_AMAS0_ELFLR12_GLVWA4_GLVWB4_NLCB1_PLR3_SVW1_SKFT1_SKXCCM1_TT1_16_VW1_VWB1_WGM0
    SolutionIndex: 9
    SolutionNameMin: Cijk_Ailk_Bjlk_HHS_BH_MT32x32x32_MI16x16x16x1_SN_1LDSB0_AMAS0_ELFLR0_GLVWA4_GLVWB4_NLCB1_PLR3_SVW1_SKFT1_SKXCCM1_TT1_16_VW1_VWB1_WGM8
    SolutionIndex: 10
    SolutionNameMin: Cijk_Ailk_Bjlk_HHS_BH_MT32x32x32_MI16x16x16x1_SN_1LDSB0_AMAS0_ELFLR12_GLVWA4_GLVWB4_NLCB1_PLR3_SVW1_SKFT1_SKXCCM1_TT1_16_VW1_VWB1_WGM8
    SolutionIndex: 11
    SolutionNameMin: Cijk_Ailk_Bjlk_HHS_BH_MT64x128x32_MI16x16x16x1_SN_1LDSB0_AMAS3_ELFLR0_GLVWA8_GLVWB8_NLCB2_PLR3_SVW2_SKFT1_SKXCCM1_TT2_64_VW2_VWB2_WGM0
    SolutionIndex: 12
    SolutionNameMin: Cijk_Ailk_Bjlk_HHS_BH_MT128x64x32_MI16x16x16x1_SN_1LDSB0_AMAS3_ELFLR12_GLVWA8_GLVWB8_NLCB1_PLR3_SVW2_SKFT1_SKXCCM1_TT4_32_VW2_VWB2_WGM8
    SolutionIndex: 13
    SolutionNameMin: Cijk_Ailk_Bjlk_HHS_BH_MT64x64x32_MI16x16x16x1_SN_1LDSB0_AMAS3_ELFLR12_GLVWA8_GLVWB8_NLCB1_PLR3_SVW2_SKFT0_SKXCCM1_TT2_32_VW2_VWB2_WGM0
    SolutionIndex: 14
    SolutionNameMin: Cijk_Ailk_Bjlk_HHS_BH_MT64x64x32_MI16x16x16x1_SN_1LDSB0_AMAS3_ELFLR0_GLVWA8_GLVWB8_NLCB1_PLR3_SVW2_SKFT1_SKXCCM1_TT2_32_VW2_VWB2_WGM0
    SolutionIndex: 15
    SolutionNameMin: Cijk_Ailk_Bjlk_HHS_BH_MT64x64x32_MI16x16x16x1_SN_1LDSB0_AMAS3_ELFLR12_GLVWA8_GLVWB8_NLCB1_PLR3_SVW2_SKFT1_SKXCCM1_TT2_32_VW2_VWB2_WGM0
    SolutionIndex: 16
    SolutionNameMin: Cijk_Ailk_Bjlk_HHS_BH_MT64x64x32_MI16x16x16x1_SN_1LDSB0_AMAS3_ELFLR0_GLVWA8_GLVWB8_NLCB1_PLR3_SVW2_SKFT0_SKXCCM1_TT2_32_VW2_VWB2_WGM8
    SolutionIndex: 17
    SolutionNameMin: Cijk_Ailk_Bjlk_HHS_BH_MT64x64x32_MI16x16x16x1_SN_1LDSB0_AMAS3_ELFLR12_GLVWA8_GLVWB8_NLCB1_PLR3_SVW2_SKFT0_SKXCCM1_TT2_32_VW2_VWB2_WGM8
    SolutionIndex: 18
    SolutionNameMin: Cijk_Ailk_Bjlk_HHS_BH_MT64x64x32_MI16x16x16x1_SN_1LDSB0_AMAS3_ELFLR0_GLVWA8_GLVWB8_NLCB1_PLR3_SVW2_SKFT1_SKXCCM1_TT2_32_VW2_VWB2_WGM8
    SolutionIndex: 19
    SolutionNameMin: Cijk_Ailk_Bjlk_HHS_BH_MT64x64x32_MI16x16x16x1_SN_1LDSB0_AMAS3_ELFLR12_GLVWA8_GLVWB8_NLCB1_PLR3_SVW2_SKFT1_SKXCCM1_TT2_32_VW2_VWB2_WGM8
    SolutionIndex: 20
    SolutionNameMin: Cijk_Ailk_Bjlk_HHS_BH_MT64x32x32_MI16x16x16x1_SN_1LDSB0_AMAS3_ELFLR12_GLVWA8_GLVWB4_NLCB1_PLR3_SVW2_SKFT0_SKXCCM1_TT2_16_VW2_VWB1_WGM0
    SolutionIndex: 21
    SolutionNameMin: Cijk_Ailk_Bjlk_HHS_BH_MT256x256x32_MI16x16x16x1_SN_1LDSB0_AMAS3_ELFLR0_GLVWA8_GLVWB8_NLCB2_PLR3_SVW4_SKFT0_SKXCCM1_TT8_128_VW4_VWB4_WGM0
    SolutionIndex: 22
    SolutionNameMin: Cijk_Ailk_Bjlk_HHS_BH_MT256x256x32_MI16x16x16x1_SN_1LDSB0_AMAS3_ELFLR0_GLVWA8_GLVWB8_NLCB1_PLR3_SVW4_SKFT1_SKXCCM1_TT8_128_VW4_VWB4_WGM8
    SolutionIndex: 23
    SolutionNameMin: Cijk_Ailk_Bjlk_HHS_BH_MT256x256x32_MI16x16x16x1_SN_1LDSB0_AMAS3_ELFLR0_GLVWA8_GLVWB8_NLCB2_PLR3_SVW4_SKFT0_SKXCCM1_TT8_128_VW4_VWB4_WGM8
    SolutionIndex: 24
    SolutionNameMin: Cijk_Ailk_Bjlk_HHS_BH_MT128x256x32_MI16x16x16x1_SN_1LDSB0_AMAS3_ELFLR12_GLVWA8_GLVWB8_NLCB1_PLR3_SVW4_SKFT0_SKXCCM1_TT4_128_VW4_VWB4_WGM0
    SolutionIndex: 25
    SolutionNameMin: Cijk_Ailk_Bjlk_HHS_BH_MT128x256x32_MI16x16x16x1_SN_1LDSB0_AMAS3_ELFLR0_GLVWA8_GLVWB8_NLCB1_PLR3_SVW4_SKFT0_SKXCCM1_TT4_128_VW4_VWB4_WGM8
    SolutionIndex: 26
    SolutionNameMin: Cijk_Ailk_Bjlk_HHS_BH_MT128x256x32_MI16x16x16x1_SN_1LDSB0_AMAS3_ELFLR0_GLVWA8_GLVWB8_NLCB1_PLR3_SVW4_SKFT1_SKXCCM1_TT4_128_VW4_VWB4_WGM8
    SolutionIndex: 27
    SolutionNameMin: Cijk_Ailk_Bjlk_HHS_BH_MT128x256x32_MI16x16x16x1_SN_1LDSB0_AMAS3_ELFLR0_GLVWA8_GLVWB8_NLCB2_PLR3_SVW4_SKFT1_SKXCCM1_TT4_128_VW4_VWB4_WGM8
    SolutionIndex: 28
    SolutionNameMin: Cijk_Ailk_Bjlk_HHS_BH_MT256x128x32_MI16x16x16x1_SN_1LDSB0_AMAS3_ELFLR12_GLVWA8_GLVWB8_NLCB2_PLR3_SVW4_SKFT0_SKXCCM1_TT8_64_VW4_VWB4_WGM0
    SolutionIndex: 29
    SolutionNameMin: Cijk_Ailk_Bjlk_HHS_BH_MT256x128x32_MI16x16x16x1_SN_1LDSB0_AMAS3_ELFLR12_GLVWA8_GLVWB8_NLCB2_PLR3_SVW4_SKFT0_SKXCCM1_TT8_64_VW4_VWB4_WGM8
    SolutionIndex: 30
    SolutionNameMin: Cijk_Ailk_Bjlk_HHS_BH_MT256x128x32_MI16x16x16x1_SN_1LDSB0_AMAS3_ELFLR12_GLVWA8_GLVWB8_NLCB2_PLR3_SVW4_SKFT1_SKXCCM1_TT8_64_VW4_VWB4_WGM8
    SolutionIndex: 31
    SolutionNameMin: Cijk_Ailk_Bjlk_HHS_BH_MT128x128x32_MI16x16x16x1_SN_1LDSB0_AMAS3_ELFLR0_GLVWA8_GLVWB8_NLCB1_PLR3_SVW4_SKFT0_SKXCCM0_TT4_64_VW4_VWB4_WGM0
    SolutionIndex: 32
    SolutionNameMin: Cijk_Ailk_Bjlk_HHS_BH_MT128x128x32_MI16x16x16x1_SN_1LDSB0_AMAS3_ELFLR0_GLVWA8_GLVWB8_NLCB1_PLR3_SVW4_SKFT0_SKXCCM1_TT4_64_VW4_VWB4_WGM0
    SolutionIndex: 33
    SolutionNameMin: Cijk_Ailk_Bjlk_HHS_BH_MT128x128x32_MI16x16x16x1_SN_1LDSB0_AMAS3_ELFLR12_GLVWA8_GLVWB8_NLCB1_PLR3_SVW4_SKFT0_SKXCCM1_TT4_64_VW4_VWB4_WGM0
    SolutionIndex: 34
    SolutionNameMin: Cijk_Ailk_Bjlk_HHS_BH_MT128x128x32_MI16x16x16x1_SN_1LDSB0_AMAS3_ELFLR0_GLVWA8_GLVWB8_NLCB1_PLR3_SVW4_SKFT1_SKXCCM1_TT4_64_VW4_VWB4_WGM0
    SolutionIndex: 35
    SolutionNameMin: Cijk_Ailk_Bjlk_HHS_BH_MT128x128x32_MI16x16x16x1_SN_1LDSB0_AMAS3_ELFLR12_GLVWA8_GLVWB8_NLCB2_PLR3_SVW4_SKFT0_SKXCCM0_TT4_64_VW4_VWB4_WGM0
    SolutionIndex: 36
    SolutionNameMin: Cijk_Ailk_Bjlk_HHS_BH_MT128x128x32_MI16x16x16x1_SN_1LDSB0_AMAS3_ELFLR12_GLVWA8_GLVWB8_NLCB2_PLR3_SVW4_SKFT0_SKXCCM1_TT4_64_VW4_VWB4_WGM0
    SolutionIndex: 37
    SolutionNameMin: Cijk_Ailk_Bjlk_HHS_BH_MT128x128x32_MI16x16x16x1_SN_1LDSB0_AMAS3_ELFLR12_GLVWA8_GLVWB8_NLCB2_PLR3_SVW4_SKFT1_SKXCCM1_TT4_64_VW4_VWB4_WGM0
    SolutionIndex: 38
    SolutionNameMin: Cijk_Ailk_Bjlk_HHS_BH_MT128x128x32_MI16x16x16x1_SN_1LDSB0_AMAS3_ELFLR0_GLVWA8_GLVWB8_NLCB1_PLR3_SVW4_SKFT0_SKXCCM1_TT4_64_VW4_VWB4_WGM8
    SolutionIndex: 39
    SolutionNameMin: Cijk_Ailk_Bjlk_HHS_BH_MT128x128x32_MI16x16x16x1_SN_1LDSB0_AMAS3_ELFLR0_GLVWA8_GLVWB8_NLCB2_PLR3_SVW4_SKFT0_SKXCCM1_TT4_64_VW4_VWB4_WGM8
    SolutionIndex: 40
    SolutionNameMin: Cijk_Ailk_Bjlk_HHS_BH_MT128x128x32_MI16x16x16x1_SN_1LDSB0_AMAS3_ELFLR0_GLVWA8_GLVWB8_NLCB2_PLR3_SVW4_SKFT1_SKXCCM1_TT4_64_VW4_VWB4_WGM8
    SolutionIndex: 41
    SolutionNameMin: Cijk_Ailk_Bjlk_HHS_BH_MT128x128x32_MI16x16x16x1_SN_1LDSB0_AMAS3_ELFLR12_GLVWA8_GLVWB8_NLCB2_PLR3_SVW4_SKFT1_SKXCCM1_TT4_64_VW4_VWB4_WGM8
    SolutionIndex: 42
    SolutionNameMin: Cijk_Ailk_Bjlk_HHS_BH_MT128x64x32_MI16x16x16x1_SN_1LDSB0_AMAS3_ELFLR0_GLVWA8_GLVWB8_NLCB1_PLR3_SVW4_SKFT0_SKXCCM1_TT4_32_VW4_VWB1_WGM0
    SolutionIndex: 43
    SolutionNameMin: Cijk_Ailk_Bjlk_HHS_BH_MT128x64x32_MI16x16x16x1_SN_1LDSB0_AMAS3_ELFLR12_GLVWA8_GLVWB8_NLCB1_PLR3_SVW4_SKFT1_SKXCCM0_TT4_32_VW4_VWB1_WGM0
    SolutionIndex: 44
    SolutionNameMin: Cijk_Ailk_Bjlk_HHS_BH_MT128x64x32_MI16x16x16x1_SN_1LDSB0_AMAS3_ELFLR0_GLVWA8_GLVWB8_NLCB1_PLR3_SVW4_SKFT1_SKXCCM1_TT4_32_VW4_VWB1_WGM0
    SolutionIndex: 45
    SolutionNameMin: Cijk_Ailk_Bjlk_HHS_BH_MT128x64x32_MI16x16x16x1_SN_1LDSB0_AMAS3_ELFLR12_GLVWA8_GLVWB8_NLCB1_PLR3_SVW4_SKFT1_SKXCCM1_TT4_32_VW4_VWB1_WGM0
    SolutionIndex: 46
    SolutionNameMin: Cijk_Ailk_Bjlk_HHS_BH_MT128x64x32_MI16x16x16x1_SN_1LDSB0_AMAS3_ELFLR0_GLVWA8_GLVWB8_NLCB1_PLR3_SVW4_SKFT0_SKXCCM1_TT4_32_VW4_VWB1_WGM8
    SolutionIndex: 47
    SolutionNameMin: Cijk_Ailk_Bjlk_HHS_BH_MT128x64x32_MI16x16x16x1_SN_1LDSB0_AMAS3_ELFLR12_GLVWA8_GLVWB8_NLCB1_PLR3_SVW4_SKFT0_SKXCCM1_TT4_32_VW4_VWB1_WGM8
    SolutionIndex: 48
    SolutionNameMin: Cijk_Ailk_Bjlk_HHS_BH_MT128x64x32_MI16x16x16x1_SN_1LDSB0_AMAS3_ELFLR0_GLVWA8_GLVWB8_NLCB1_PLR3_SVW4_SKFT1_SKXCCM0_TT4_32_VW4_VWB1_WGM8
    SolutionIndex: 49
    SolutionNameMin: Cijk_Ailk_Bjlk_HHS_BH_MT128x64x32_MI16x16x16x1_SN_1LDSB0_AMAS3_ELFLR0_GLVWA8_GLVWB8_NLCB1_PLR3_SVW4_SKFT1_SKXCCM1_TT4_32_VW4_VWB1_WGM8
    SolutionIndex: 50
    SolutionNameMin: Cijk_Ailk_Bjlk_HHS_BH_MT128x64x32_MI16x16x16x1_SN_1LDSB0_AMAS3_ELFLR12_GLVWA8_GLVWB8_NLCB1_PLR3_SVW4_SKFT1_SKXCCM1_TT4_32_VW4_VWB1_WGM8
    SolutionIndex: 51
    SolutionNameMin: Cijk_Ailk_Bjlk_HHS_BH_MT128x32x32_MI16x16x16x1_SN_1LDSB0_AMAS3_ELFLR12_GLVWA8_GLVWB4_NLCB1_PLR3_SVW4_SKFT0_SKXCCM0_TT4_16_VW4_VWB1_WGM0
    SolutionIndex: 52
    SolutionNameMin: Cijk_Ailk_Bjlk_HHS_BH_MT128x32x32_MI16x16x16x1_SN_1LDSB0_AMAS3_ELFLR12_GLVWA8_GLVWB4_NLCB1_PLR3_SVW4_SKFT1_SKXCCM0_TT4_16_VW4_VWB1_WGM0
    SolutionIndex: 53
    SolutionNameMin: Cijk_Ailk_Bjlk_HHS_BH_MT128x32x32_MI16x16x16x1_SN_1LDSB0_AMAS3_ELFLR0_GLVWA8_GLVWB4_NLCB1_PLR3_SVW4_SKFT1_SKXCCM1_TT4_16_VW4_VWB1_WGM0
    SolutionIndex: 54
    SolutionNameMin: Cijk_Ailk_Bjlk_HHS_BH_MT128x32x32_MI16x16x16x1_SN_1LDSB0_AMAS3_ELFLR12_GLVWA8_GLVWB4_NLCB1_PLR3_SVW4_SKFT1_SKXCCM1_TT4_16_VW4_VWB1_WGM0
    SolutionIndex: 55
    SolutionNameMin: Cijk_Ailk_Bjlk_HHS_BH_MT256x256x32_MI16x16x16x1_SN_1LDSB1_AMAS3_ELFLR12_GLVWA8_GLVWB8_NLCB2_PLR3_SVW4_SKFT0_SKXCCM1_TT8_128_VW4_VWB4_WGM0
    SolutionIndex: 56
    SolutionNameMin: Cijk_Ailk_Bjlk_HHS_BH_MT256x256x32_MI16x16x16x1_SN_1LDSB1_AMAS3_ELFLR12_GLVWA8_GLVWB8_NLCB2_PLR3_SVW4_SKFT1_SKXCCM1_TT8_128_VW4_VWB4_WGM0
    SolutionIndex: 57
    SolutionNameMin: Cijk_Ailk_Bjlk_HHS_BH_MT256x256x32_MI16x16x16x1_SN_1LDSB1_AMAS3_ELFLR12_GLVWA8_GLVWB8_NLCB1_PLR3_SVW4_SKFT0_SKXCCM1_TT8_128_VW4_VWB4_WGM8
    SolutionIndex: 58
    SolutionNameMin: Cijk_Ailk_Bjlk_HHS_BH_MT256x256x32_MI16x16x16x1_SN_1LDSB1_AMAS3_ELFLR12_GLVWA8_GLVWB8_NLCB1_PLR3_SVW4_SKFT1_SKXCCM1_TT8_128_VW4_VWB4_WGM8
    SolutionIndex: 59
    SolutionNameMin: Cijk_Ailk_Bjlk_HHS_BH_MT256x256x32_MI16x16x16x1_SN_1LDSB1_AMAS3_ELFLR12_GLVWA8_GLVWB8_NLCB2_PLR3_SVW4_SKFT0_SKXCCM0_TT8_128_VW4_VWB4_WGM8
    SolutionIndex: 60
    SolutionNameMin: Cijk_Ailk_Bjlk_HHS_BH_MT128x256x32_MI16x16x16x1_SN_1LDSB1_AMAS3_ELFLR12_GLVWA8_GLVWB8_NLCB2_PLR3_SVW4_SKFT0_SKXCCM0_TT4_128_VW4_VWB4_WGM0
    SolutionIndex: 61
    SolutionNameMin: Cijk_Ailk_Bjlk_HHS_BH_MT128x256x32_MI16x16x16x1_SN_1LDSB1_AMAS3_ELFLR0_GLVWA8_GLVWB8_NLCB2_PLR3_SVW4_SKFT1_SKXCCM1_TT4_128_VW4_VWB4_WGM8
    SolutionIndex: 62
    SolutionNameMin: Cijk_Ailk_Bjlk_HHS_BH_MT128x128x32_MI16x16x16x1_SN_1LDSB1_AMAS3_ELFLR0_GLVWA8_GLVWB8_NLCB1_PLR3_SVW4_SKFT1_SKXCCM1_TT4_64_VW4_VWB4_WGM0
    SolutionIndex: 63
    SolutionNameMin: Cijk_Ailk_Bjlk_HHS_BH_MT128x128x32_MI16x16x16x1_SN_1LDSB1_AMAS3_ELFLR0_GLVWA8_GLVWB8_NLCB2_PLR3_SVW4_SKFT1_SKXCCM1_TT4_64_VW4_VWB4_WGM0
    SolutionIndex: 64
    SolutionNameMin: Cijk_Ailk_Bjlk_HHS_BH_MT128x128x32_MI16x16x16x1_SN_1LDSB1_AMAS3_ELFLR0_GLVWA8_GLVWB8_NLCB2_PLR3_SVW4_SKFT1_SKXCCM1_TT4_64_VW4_VWB4_WGM8
    SolutionIndex: 65
    SolutionNameMin: Cijk_Ailk_Bjlk_HHS_BH_MT64x64x64_MI16x16x16x1_SN_1LDSB0_AMAS0_ELFLR12_GLVWA8_GLVWB8_NLCB1_PLR5_SVW1_SKFT0_SKXCCM1_TT2_32_VW1_VWB1_WGM0
    SolutionIndex: 66
    SolutionNameMin: Cijk_Ailk_Bjlk_HHS_BH_MT64x64x64_MI16x16x16x1_SN_1LDSB0_AMAS0_ELFLR12_GLVWA8_GLVWB8_NLCB1_PLR5_SVW1_SKFT1_SKXCCM1_TT2_32_VW1_VWB1_WGM0
    SolutionIndex: 67
    SolutionNameMin: Cijk_Ailk_Bjlk_HHS_BH_MT64x64x64_MI16x16x16x1_SN_1LDSB0_AMAS0_ELFLR12_GLVWA8_GLVWB8_NLCB2_PLR5_SVW1_SKFT1_SKXCCM1_TT2_32_VW1_VWB1_WGM8
    SolutionIndex: 68
    SolutionNameMin: Cijk_Ailk_Bjlk_HHS_BH_MT32x32x64_MI16x16x16x1_SN_1LDSB0_AMAS0_ELFLR0_GLVWA8_GLVWB8_NLCB1_PLR5_SVW1_SKFT0_SKXCCM0_TT1_16_VW1_VWB1_WGM0
    SolutionIndex: 69
    SolutionNameMin: Cijk_Ailk_Bjlk_HHS_BH_MT32x32x64_MI16x16x16x1_SN_1LDSB0_AMAS0_ELFLR12_GLVWA8_GLVWB8_NLCB1_PLR5_SVW1_SKFT0_SKXCCM0_TT1_16_VW1_VWB1_WGM0
    SolutionIndex: 70
    SolutionNameMin: Cijk_Ailk_Bjlk_HHS_BH_MT32x32x64_MI16x16x16x1_SN_1LDSB0_AMAS0_ELFLR0_GLVWA8_GLVWB8_NLCB1_PLR5_SVW1_SKFT0_SKXCCM1_TT1_16_VW1_VWB1_WGM0
    SolutionIndex: 71
    SolutionNameMin: Cijk_Ailk_Bjlk_HHS_BH_MT32x32x64_MI16x16x16x1_SN_1LDSB0_AMAS0_ELFLR12_GLVWA8_GLVWB8_NLCB1_PLR5_SVW1_SKFT0_SKXCCM1_TT1_16_VW1_VWB1_WGM0
    SolutionIndex: 72
    SolutionNameMin: Cijk_Ailk_Bjlk_HHS_BH_MT32x32x64_MI16x16x16x1_SN_1LDSB0_AMAS0_ELFLR0_GLVWA8_GLVWB8_NLCB1_PLR5_SVW1_SKFT1_SKXCCM0_TT1_16_VW1_VWB1_WGM0
    SolutionIndex: 73
    SolutionNameMin: Cijk_Ailk_Bjlk_HHS_BH_MT32x32x64_MI16x16x16x1_SN_1LDSB0_AMAS0_ELFLR12_GLVWA8_GLVWB8_NLCB1_PLR5_SVW1_SKFT1_SKXCCM0_TT1_16_VW1_VWB1_WGM0
    SolutionIndex: 74
    SolutionNameMin: Cijk_Ailk_Bjlk_HHS_BH_MT32x32x64_MI16x16x16x1_SN_1LDSB0_AMAS0_ELFLR0_GLVWA8_GLVWB8_NLCB1_PLR5_SVW1_SKFT1_SKXCCM1_TT1_16_VW1_VWB1_WGM0
    SolutionIndex: 75
    SolutionNameMin: Cijk_Ailk_Bjlk_HHS_BH_MT32x32x64_MI16x16x16x1_SN_1LDSB0_AMAS0_ELFLR12_GLVWA8_GLVWB8_NLCB1_PLR5_SVW1_SKFT1_SKXCCM1_TT1_16_VW1_VWB1_WGM0
    SolutionIndex: 76
    SolutionNameMin: Cijk_Ailk_Bjlk_HHS_BH_MT32x32x64_MI16x16x16x1_SN_1LDSB0_AMAS0_ELFLR0_GLVWA8_GLVWB8_NLCB1_PLR5_SVW1_SKFT0_SKXCCM0_TT1_16_VW1_VWB1_WGM8
    SolutionIndex: 77
    SolutionNameMin: Cijk_Ailk_Bjlk_HHS_BH_MT32x32x64_MI16x16x16x1_SN_1LDSB0_AMAS0_ELFLR12_GLVWA8_GLVWB8_NLCB1_PLR5_SVW1_SKFT1_SKXCCM1_TT1_16_VW1_VWB1_WGM8
    SolutionIndex: 78
    SolutionNameMin: Cijk_Ailk_Bjlk_HHS_BH_MT128x128x64_MI16x16x16x1_SN_1LDSB0_AMAS3_ELFLR12_GLVWA8_GLVWB8_NLCB2_PLR5_SVW2_SKFT1_SKXCCM0_TT4_64_VW2_VWB2_WGM8
    SolutionIndex: 79
    SolutionNameMin: Cijk_Ailk_Bjlk_HHS_BH_MT64x128x64_MI16x16x16x1_SN_1LDSB0_AMAS3_ELFLR12_GLVWA8_GLVWB8_NLCB1_PLR5_SVW2_SKFT1_SKXCCM1_TT2_64_VW2_VWB2_WGM8
    SolutionIndex: 80
    SolutionNameMin: Cijk_Ailk_Bjlk_HHS_BH_MT64x128x64_MI16x16x16x1_SN_1LDSB0_AMAS3_ELFLR0_GLVWA8_GLVWB8_NLCB2_PLR5_SVW2_SKFT0_SKXCCM1_TT2_64_VW2_VWB2_WGM8
    SolutionIndex: 81
    SolutionNameMin: Cijk_Ailk_Bjlk_HHS_BH_MT64x64x64_MI16x16x16x1_SN_1LDSB0_AMAS3_ELFLR0_GLVWA8_GLVWB8_NLCB1_PLR5_SVW2_SKFT0_SKXCCM1_TT2_32_VW2_VWB2_WGM0
    SolutionIndex: 82
    SolutionNameMin: Cijk_Ailk_Bjlk_HHS_BH_MT64x64x64_MI16x16x16x1_SN_1LDSB0_AMAS3_ELFLR12_GLVWA8_GLVWB8_NLCB1_PLR5_SVW2_SKFT0_SKXCCM1_TT2_32_VW2_VWB2_WGM0
    SolutionIndex: 83
    SolutionNameMin: Cijk_Ailk_Bjlk_HHS_BH_MT64x64x64_MI16x16x16x1_SN_1LDSB0_AMAS3_ELFLR0_GLVWA8_GLVWB8_NLCB1_PLR5_SVW2_SKFT1_SKXCCM0_TT2_32_VW2_VWB2_WGM0
    SolutionIndex: 84
    SolutionNameMin: Cijk_Ailk_Bjlk_HHS_BH_MT64x64x64_MI16x16x16x1_SN_1LDSB0_AMAS3_ELFLR12_GLVWA8_GLVWB8_NLCB1_PLR5_SVW2_SKFT1_SKXCCM0_TT2_32_VW2_VWB2_WGM0
    SolutionIndex: 85
    SolutionNameMin: Cijk_Ailk_Bjlk_HHS_BH_MT64x64x64_MI16x16x16x1_SN_1LDSB0_AMAS3_ELFLR12_GLVWA8_GLVWB8_NLCB1_PLR5_SVW2_SKFT1_SKXCCM1_TT2_32_VW2_VWB2_WGM0
    SolutionIndex: 86
    SolutionNameMin: Cijk_Ailk_Bjlk_HHS_BH_MT64x64x64_MI16x16x16x1_SN_1LDSB0_AMAS3_ELFLR0_GLVWA8_GLVWB8_NLCB2_PLR5_SVW2_SKFT0_SKXCCM1_TT2_32_VW2_VWB2_WGM0
    SolutionIndex: 87
    SolutionNameMin: Cijk_Ailk_Bjlk_HHS_BH_MT64x64x64_MI16x16x16x1_SN_1LDSB0_AMAS3_ELFLR0_GLVWA8_GLVWB8_NLCB2_PLR5_SVW2_SKFT1_SKXCCM1_TT2_32_VW2_VWB2_WGM0
    SolutionIndex: 88
    SolutionNameMin: Cijk_Ailk_Bjlk_HHS_BH_MT64x64x64_MI16x16x16x1_SN_1LDSB0_AMAS3_ELFLR0_GLVWA8_GLVWB8_NLCB1_PLR5_SVW2_SKFT0_SKXCCM1_TT2_32_VW2_VWB2_WGM8
    SolutionIndex: 89
    SolutionNameMin: Cijk_Ailk_Bjlk_HHS_BH_MT64x64x64_MI16x16x16x1_SN_1LDSB0_AMAS3_ELFLR12_GLVWA8_GLVWB8_NLCB1_PLR5_SVW2_SKFT0_SKXCCM1_TT2_32_VW2_VWB2_WGM8
    SolutionIndex: 90
    SolutionNameMin: Cijk_Ailk_Bjlk_HHS_BH_MT64x64x64_MI16x16x16x1_SN_1LDSB0_AMAS3_ELFLR0_GLVWA8_GLVWB8_NLCB1_PLR5_SVW2_SKFT1_SKXCCM1_TT2_32_VW2_VWB2_WGM8
    SolutionIndex: 91
    SolutionNameMin: Cijk_Ailk_Bjlk_HHS_BH_MT64x64x64_MI16x16x16x1_SN_1LDSB0_AMAS3_ELFLR12_GLVWA8_GLVWB8_NLCB1_PLR5_SVW2_SKFT1_SKXCCM1_TT2_32_VW2_VWB2_WGM8
    SolutionIndex: 92
    SolutionNameMin: Cijk_Ailk_Bjlk_HHS_BH_MT64x32x64_MI16x16x16x1_SN_1LDSB0_AMAS3_ELFLR0_GLVWA8_GLVWB8_NLCB1_PLR5_SVW2_SKFT0_SKXCCM1_TT2_16_VW2_VWB1_WGM0
    SolutionIndex: 93
    SolutionNameMin: Cijk_Ailk_Bjlk_HHS_BH_MT64x32x64_MI16x16x16x1_SN_1LDSB0_AMAS3_ELFLR12_GLVWA8_GLVWB8_NLCB1_PLR5_SVW2_SKFT0_SKXCCM1_TT2_16_VW2_VWB1_WGM0
    SolutionIndex: 94
    SolutionNameMin: Cijk_Ailk_Bjlk_HHS_BH_MT64x32x64_MI16x16x16x1_SN_1LDSB0_AMAS3_ELFLR0_GLVWA8_GLVWB8_NLCB1_PLR5_SVW2_SKFT1_SKXCCM0_TT2_16_VW2_VWB1_WGM0
    SolutionIndex: 95
    SolutionNameMin: Cijk_Ailk_Bjlk_HHS_BH_MT64x32x64_MI16x16x16x1_SN_1LDSB0_AMAS3_ELFLR12_GLVWA8_GLVWB8_NLCB1_PLR5_SVW2_SKFT1_SKXCCM0_TT2_16_VW2_VWB1_WGM0
    SolutionIndex: 96
    SolutionNameMin: Cijk_Ailk_Bjlk_HHS_BH_MT64x32x64_MI16x16x16x1_SN_1LDSB0_AMAS3_ELFLR0_GLVWA8_GLVWB8_NLCB1_PLR5_SVW2_SKFT1_SKXCCM1_TT2_16_VW2_VWB1_WGM0
    SolutionIndex: 97
    SolutionNameMin: Cijk_Ailk_Bjlk_HHS_BH_MT64x32x64_MI16x16x16x1_SN_1LDSB0_AMAS3_ELFLR12_GLVWA8_GLVWB8_NLCB1_PLR5_SVW2_SKFT1_SKXCCM1_TT2_16_VW2_VWB1_WGM0
    SolutionIndex: 98
    SolutionNameMin: Cijk_Ailk_Bjlk_HHS_BH_MT64x32x64_MI16x16x16x1_SN_1LDSB0_AMAS3_ELFLR0_GLVWA8_GLVWB8_NLCB1_PLR5_SVW2_SKFT0_SKXCCM0_TT2_16_VW2_VWB1_WGM8
    SolutionIndex: 99
    SolutionNameMin: Cijk_Ailk_Bjlk_HHS_BH_MT64x32x64_MI16x16x16x1_SN_1LDSB0_AMAS3_ELFLR12_GLVWA8_GLVWB8_NLCB1_PLR5_SVW2_SKFT0_SKXCCM0_TT2_16_VW2_VWB1_WGM8
    SolutionIndex: 100
    SolutionNameMin: Cijk_Ailk_Bjlk_HHS_BH_MT64x32x64_MI16x16x16x1_SN_1LDSB0_AMAS3_ELFLR0_GLVWA8_GLVWB8_NLCB1_PLR5_SVW2_SKFT0_SKXCCM1_TT2_16_VW2_VWB1_WGM8
    SolutionIndex: 101
    SolutionNameMin: Cijk_Ailk_Bjlk_HHS_BH_MT64x32x64_MI16x16x16x1_SN_1LDSB0_AMAS3_ELFLR12_GLVWA8_GLVWB8_NLCB1_PLR5_SVW2_SKFT0_SKXCCM1_TT2_16_VW2_VWB1_WGM8
    SolutionIndex: 102
    SolutionNameMin: Cijk_Ailk_Bjlk_HHS_BH_MT64x32x64_MI16x16x16x1_SN_1LDSB0_AMAS3_ELFLR0_GLVWA8_GLVWB8_NLCB1_PLR5_SVW2_SKFT1_SKXCCM0_TT2_16_VW2_VWB1_WGM8
    SolutionIndex: 103
    SolutionNameMin: Cijk_Ailk_Bjlk_HHS_BH_MT64x32x64_MI16x16x16x1_SN_1LDSB0_AMAS3_ELFLR12_GLVWA8_GLVWB8_NLCB1_PLR5_SVW2_SKFT1_SKXCCM0_TT2_16_VW2_VWB1_WGM8
    SolutionIndex: 104
    SolutionNameMin: Cijk_Ailk_Bjlk_HHS_BH_MT64x32x64_MI16x16x16x1_SN_1LDSB0_AMAS3_ELFLR12_GLVWA8_GLVWB8_NLCB1_PLR5_SVW2_SKFT1_SKXCCM1_TT2_16_VW2_VWB1_WGM8
    SolutionIndex: 105
    SolutionNameMin: Cijk_Ailk_Bjlk_HHS_BH_MT128x128x64_MI16x16x16x1_SN_1LDSB0_AMAS3_ELFLR12_GLVWA8_GLVWB8_NLCB1_PLR5_SVW4_SKFT0_SKXCCM1_TT4_64_VW4_VWB4_WGM0
    SolutionIndex: 106
    SolutionNameMin: Cijk_Ailk_Bjlk_HHS_BH_MT128x128x64_MI16x16x16x1_SN_1LDSB0_AMAS3_ELFLR0_GLVWA8_GLVWB8_NLCB1_PLR5_SVW4_SKFT1_SKXCCM0_TT4_64_VW4_VWB4_WGM0
    SolutionIndex: 107
    SolutionNameMin: Cijk_Ailk_Bjlk_HHS_BH_MT128x128x64_MI16x16x16x1_SN_1LDSB0_AMAS3_ELFLR0_GLVWA8_GLVWB8_NLCB1_PLR5_SVW4_SKFT1_SKXCCM1_TT4_64_VW4_VWB4_WGM0
    SolutionIndex: 108
    SolutionNameMin: Cijk_Ailk_Bjlk_HHS_BH_MT128x128x64_MI16x16x16x1_SN_1LDSB0_AMAS3_ELFLR12_GLVWA8_GLVWB8_NLCB1_PLR5_SVW4_SKFT1_SKXCCM1_TT4_64_VW4_VWB4_WGM0
    SolutionIndex: 109
    SolutionNameMin: Cijk_Ailk_Bjlk_HHS_BH_MT128x128x64_MI16x16x16x1_SN_1LDSB0_AMAS3_ELFLR0_GLVWA8_GLVWB8_NLCB2_PLR5_SVW4_SKFT0_SKXCCM1_TT4_64_VW4_VWB4_WGM0
    SolutionIndex: 110
    SolutionNameMin: Cijk_Ailk_Bjlk_HHS_BH_MT128x128x64_MI16x16x16x1_SN_1LDSB0_AMAS3_ELFLR12_GLVWA8_GLVWB8_NLCB2_PLR5_SVW4_SKFT0_SKXCCM1_TT4_64_VW4_VWB4_WGM0
    SolutionIndex: 111
    SolutionNameMin: Cijk_Ailk_Bjlk_HHS_BH_MT128x128x64_MI16x16x16x1_SN_1LDSB0_AMAS3_ELFLR0_GLVWA8_GLVWB8_NLCB2_PLR5_SVW4_SKFT1_SKXCCM0_TT4_64_VW4_VWB4_WGM0
    SolutionIndex: 112
    SolutionNameMin: Cijk_Ailk_Bjlk_HHS_BH_MT128x128x64_MI16x16x16x1_SN_1LDSB0_AMAS3_ELFLR12_GLVWA8_GLVWB8_NLCB2_PLR5_SVW4_SKFT1_SKXCCM0_TT4_64_VW4_VWB4_WGM0
    SolutionIndex: 113
    SolutionNameMin: Cijk_Ailk_Bjlk_HHS_BH_MT128x128x64_MI16x16x16x1_SN_1LDSB0_AMAS3_ELFLR0_GLVWA8_GLVWB8_NLCB2_PLR5_SVW4_SKFT1_SKXCCM1_TT4_64_VW4_VWB4_WGM0
    SolutionIndex: 114
    SolutionNameMin: Cijk_Ailk_Bjlk_HHS_BH_MT128x128x64_MI16x16x16x1_SN_1LDSB0_AMAS3_ELFLR12_GLVWA8_GLVWB8_NLCB2_PLR5_SVW4_SKFT1_SKXCCM1_TT4_64_VW4_VWB4_WGM0
    SolutionIndex: 115
    SolutionNameMin: Cijk_Ailk_Bjlk_HHS_BH_MT128x128x64_MI16x16x16x1_SN_1LDSB0_AMAS3_ELFLR12_GLVWA8_GLVWB8_NLCB1_PLR5_SVW4_SKFT0_SKXCCM0_TT4_64_VW4_VWB4_WGM8
    SolutionIndex: 116
    SolutionNameMin: Cijk_Ailk_Bjlk_HHS_BH_MT128x128x64_MI16x16x16x1_SN_1LDSB0_AMAS3_ELFLR0_GLVWA8_GLVWB8_NLCB1_PLR5_SVW4_SKFT0_SKXCCM1_TT4_64_VW4_VWB4_WGM8
    SolutionIndex: 117
    SolutionNameMin: Cijk_Ailk_Bjlk_HHS_BH_MT128x128x64_MI16x16x16x1_SN_1LDSB0_AMAS3_ELFLR12_GLVWA8_GLVWB8_NLCB1_PLR5_SVW4_SKFT0_SKXCCM1_TT4_64_VW4_VWB4_WGM8
    SolutionIndex: 118
    SolutionNameMin: Cijk_Ailk_Bjlk_HHS_BH_MT128x128x64_MI16x16x16x1_SN_1LDSB0_AMAS3_ELFLR0_GLVWA8_GLVWB8_NLCB1_PLR5_SVW4_SKFT1_SKXCCM0_TT4_64_VW4_VWB4_WGM8
    SolutionIndex: 119
    SolutionNameMin: Cijk_Ailk_Bjlk_HHS_BH_MT128x128x64_MI16x16x16x1_SN_1LDSB0_AMAS3_ELFLR12_GLVWA8_GLVWB8_NLCB1_PLR5_SVW4_SKFT1_SKXCCM0_TT4_64_VW4_VWB4_WGM8
    SolutionIndex: 120
    SolutionNameMin: Cijk_Ailk_Bjlk_HHS_BH_MT128x128x64_MI16x16x16x1_SN_1LDSB0_AMAS3_ELFLR0_GLVWA8_GLVWB8_NLCB1_PLR5_SVW4_SKFT1_SKXCCM1_TT4_64_VW4_VWB4_WGM8
    SolutionIndex: 121
    SolutionNameMin: Cijk_Ailk_Bjlk_HHS_BH_MT128x128x64_MI16x16x16x1_SN_1LDSB0_AMAS3_ELFLR0_GLVWA8_GLVWB8_NLCB2_PLR5_SVW4_SKFT0_SKXCCM1_TT4_64_VW4_VWB4_WGM8
    SolutionIndex: 122
    SolutionNameMin: Cijk_Ailk_Bjlk_HHS_BH_MT128x128x64_MI16x16x16x1_SN_1LDSB0_AMAS3_ELFLR12_GLVWA8_GLVWB8_NLCB2_PLR5_SVW4_SKFT0_SKXCCM1_TT4_64_VW4_VWB4_WGM8
    SolutionIndex: 123
    SolutionNameMin: Cijk_Ailk_Bjlk_HHS_BH_MT128x128x64_MI16x16x16x1_SN_1LDSB0_AMAS3_ELFLR12_GLVWA8_GLVWB8_NLCB2_PLR5_SVW4_SKFT1_SKXCCM1_TT4_64_VW4_VWB4_WGM8
    SolutionIndex: 124
    SolutionNameMin: Cijk_Ailk_Bjlk_HHS_BH_MT128x64x64_MI16x16x16x1_SN_1LDSB0_AMAS3_ELFLR12_GLVWA8_GLVWB8_NLCB1_PLR5_SVW4_SKFT0_SKXCCM1_TT4_32_VW4_VWB1_WGM0
    SolutionIndex: 125
    SolutionNameMin: Cijk_Ailk_Bjlk_HHS_BH_MT128x64x64_MI16x16x16x1_SN_1LDSB0_AMAS3_ELFLR0_GLVWA8_GLVWB8_NLCB1_PLR5_SVW4_SKFT1_SKXCCM0_TT4_32_VW4_VWB1_WGM0
    SolutionIndex: 126
    SolutionNameMin: Cijk_Ailk_Bjlk_HHS_BH_MT128x64x64_MI16x16x16x1_SN_1LDSB0_AMAS3_ELFLR0_GLVWA8_GLVWB8_NLCB1_PLR5_SVW4_SKFT1_SKXCCM1_TT4_32_VW4_VWB1_WGM0
    SolutionIndex: 127
    SolutionNameMin: Cijk_Ailk_Bjlk_HHS_BH_MT128x64x64_MI16x16x16x1_SN_1LDSB0_AMAS3_ELFLR12_GLVWA8_GLVWB8_NLCB1_PLR5_SVW4_SKFT1_SKXCCM1_TT4_32_VW4_VWB1_WGM0
    SolutionIndex: 128
    SolutionNameMin: Cijk_Ailk_Bjlk_HHS_BH_MT128x64x64_MI16x16x16x1_SN_1LDSB0_AMAS3_ELFLR12_GLVWA8_GLVWB8_NLCB2_PLR5_SVW4_SKFT1_SKXCCM1_TT4_32_VW4_VWB1_WGM0
    SolutionIndex: 129
    SolutionNameMin: Cijk_Ailk_Bjlk_HHS_BH_MT128x64x64_MI16x16x16x1_SN_1LDSB0_AMAS3_ELFLR12_GLVWA8_GLVWB8_NLCB1_PLR5_SVW4_SKFT0_SKXCCM1_TT4_32_VW4_VWB1_WGM8
    SolutionIndex: 130
    SolutionNameMin: Cijk_Ailk_Bjlk_HHS_BH_MT128x64x64_MI16x16x16x1_SN_1LDSB0_AMAS3_ELFLR12_GLVWA8_GLVWB8_NLCB1_PLR5_SVW4_SKFT1_SKXCCM0_TT4_32_VW4_VWB1_WGM8
    SolutionIndex: 131
    SolutionNameMin: Cijk_Ailk_Bjlk_HHS_BH_MT128x64x64_MI16x16x16x1_SN_1LDSB0_AMAS3_ELFLR0_GLVWA8_GLVWB8_NLCB1_PLR5_SVW4_SKFT1_SKXCCM1_TT4_32_VW4_VWB1_WGM8
    SolutionIndex: 132
    SolutionNameMin: Cijk_Ailk_Bjlk_HHS_BH_MT128x64x64_MI16x16x16x1_SN_1LDSB0_AMAS3_ELFLR12_GLVWA8_GLVWB8_NLCB1_PLR5_SVW4_SKFT1_SKXCCM1_TT4_32_VW4_VWB1_WGM8
    SolutionIndex: 133
    SolutionNameMin: Cijk_Ailk_Bjlk_HHS_BH_MT128x64x64_MI16x16x16x1_SN_1LDSB0_AMAS3_ELFLR12_GLVWA8_GLVWB8_NLCB2_PLR5_SVW4_SKFT0_SKXCCM0_TT4_32_VW4_VWB1_WGM8
    SolutionIndex: 134
    SolutionNameMin: Cijk_Ailk_Bjlk_HHS_BH_MT128x64x64_MI16x16x16x1_SN_1LDSB0_AMAS3_ELFLR12_GLVWA8_GLVWB8_NLCB2_PLR5_SVW4_SKFT0_SKXCCM1_TT4_32_VW4_VWB1_WGM8
    SolutionIndex: 135
    SolutionNameMin: Cijk_Ailk_Bjlk_HHS_BH_MT128x64x64_MI16x16x16x1_SN_1LDSB0_AMAS3_ELFLR0_GLVWA8_GLVWB8_NLCB2_PLR5_SVW4_SKFT1_SKXCCM0_TT4_32_VW4_VWB1_WGM8
    SolutionIndex: 136
    SolutionNameMin: Cijk_Ailk_Bjlk_HHS_BH_MT128x64x64_MI16x16x16x1_SN_1LDSB0_AMAS3_ELFLR12_GLVWA8_GLVWB8_NLCB2_PLR5_SVW4_SKFT1_SKXCCM1_TT4_32_VW4_VWB1_WGM8
    SolutionIndex: 137
    SolutionNameMin: Cijk_Ailk_Bjlk_HHS_BH_MT128x32x64_MI16x16x16x1_SN_1LDSB0_AMAS3_ELFLR12_GLVWA8_GLVWB8_NLCB1_PLR5_SVW4_SKFT0_SKXCCM0_TT4_16_VW4_VWB1_WGM0
    SolutionIndex: 138
    SolutionNameMin: Cijk_Ailk_Bjlk_HHS_BH_MT128x32x64_MI16x16x16x1_SN_1LDSB0_AMAS3_ELFLR12_GLVWA8_GLVWB8_NLCB1_PLR5_SVW4_SKFT1_SKXCCM0_TT4_16_VW4_VWB1_WGM0
    SolutionIndex: 139
    SolutionNameMin: Cijk_Ailk_Bjlk_HHS_BH_MT128x32x64_MI16x16x16x1_SN_1LDSB0_AMAS3_ELFLR12_GLVWA8_GLVWB8_NLCB1_PLR5_SVW4_SKFT1_SKXCCM1_TT4_16_VW4_VWB1_WGM0
    SolutionIndex: 140
    SolutionNameMin: Cijk_Ailk_Bjlk_HHS_BH_MT128x32x64_MI16x16x16x1_SN_1LDSB0_AMAS3_ELFLR0_GLVWA8_GLVWB8_NLCB1_PLR5_SVW4_SKFT0_SKXCCM1_TT4_16_VW4_VWB1_WGM8
    SolutionIndex: 141
    SolutionNameMin: Cijk_Ailk_Bjlk_HHS_BH_MT128x32x64_MI16x16x16x1_SN_1LDSB0_AMAS3_ELFLR12_GLVWA8_GLVWB8_NLCB1_PLR5_SVW4_SKFT1_SKXCCM1_TT4_16_VW4_VWB1_WGM8
    SolutionIndex: 142
    SolutionNameMin: Cijk_Ailk_Bjlk_HHS_BH_MT256x256x64_MI16x16x16x1_SN_1LDSB1_AMAS3_ELFLR0_GLVWA8_GLVWB8_NLCB1_PLR5_SVW4_SKFT0_SKXCCM0_TT8_128_VW4_VWB4_WGM0
    SolutionIndex: 143
    SolutionNameMin: Cijk_Ailk_Bjlk_HHS_BH_MT256x256x64_MI16x16x16x1_SN_1LDSB1_AMAS3_ELFLR0_GLVWA8_GLVWB8_NLCB1_PLR5_SVW4_SKFT0_SKXCCM1_TT8_128_VW4_VWB4_WGM0
    SolutionIndex: 144
    SolutionNameMin: Cijk_Ailk_Bjlk_HHS_BH_MT256x256x64_MI16x16x16x1_SN_1LDSB1_AMAS3_ELFLR0_GLVWA8_GLVWB8_NLCB1_PLR5_SVW4_SKFT1_SKXCCM1_TT8_128_VW4_VWB4_WGM0
    SolutionIndex: 145
    SolutionNameMin: Cijk_Ailk_Bjlk_HHS_BH_MT256x256x64_MI16x16x16x1_SN_1LDSB1_AMAS3_ELFLR0_GLVWA8_GLVWB8_NLCB2_PLR5_SVW4_SKFT0_SKXCCM0_TT8_128_VW4_VWB4_WGM0
    SolutionIndex: 146
    SolutionNameMin: Cijk_Ailk_Bjlk_HHS_BH_MT256x256x64_MI16x16x16x1_SN_1LDSB1_AMAS3_ELFLR0_GLVWA8_GLVWB8_NLCB2_PLR5_SVW4_SKFT0_SKXCCM1_TT8_128_VW4_VWB4_WGM0
    SolutionIndex: 147
    SolutionNameMin: Cijk_Ailk_Bjlk_HHS_BH_MT256x256x64_MI16x16x16x1_SN_1LDSB1_AMAS3_ELFLR12_GLVWA8_GLVWB8_NLCB2_PLR5_SVW4_SKFT0_SKXCCM1_TT8_128_VW4_VWB4_WGM0
    SolutionIndex: 148
    SolutionNameMin: Cijk_Ailk_Bjlk_HHS_BH_MT256x256x64_MI16x16x16x1_SN_1LDSB1_AMAS3_ELFLR0_GLVWA8_GLVWB8_NLCB1_PLR5_SVW4_SKFT1_SKXCCM1_TT8_128_VW4_VWB4_WGM8
    SolutionIndex: 149
    SolutionNameMin: Cijk_Ailk_Bjlk_HHS_BH_MT256x256x64_MI16x16x16x1_SN_1LDSB1_AMAS3_ELFLR0_GLVWA8_GLVWB8_NLCB2_PLR5_SVW4_SKFT1_SKXCCM1_TT8_128_VW4_VWB4_WGM8
    SolutionIndex: 150
    SolutionNameMin: Cijk_Ailk_Bjlk_HHS_BH_MT128x256x64_MI16x16x16x1_SN_1LDSB1_AMAS3_ELFLR12_GLVWA8_GLVWB8_NLCB1_PLR5_SVW4_SKFT0_SKXCCM0_TT4_128_VW4_VWB4_WGM0
    SolutionIndex: 151
    SolutionNameMin: Cijk_Ailk_Bjlk_HHS_BH_MT128x256x64_MI16x16x16x1_SN_1LDSB1_AMAS3_ELFLR0_GLVWA8_GLVWB8_NLCB1_PLR5_SVW4_SKFT1_SKXCCM0_TT4_128_VW4_VWB4_WGM0
    SolutionIndex: 152
    SolutionNameMin: Cijk_Ailk_Bjlk_HHS_BH_MT128x256x64_MI16x16x16x1_SN_1LDSB1_AMAS3_ELFLR0_GLVWA8_GLVWB8_NLCB1_PLR5_SVW4_SKFT1_SKXCCM1_TT4_128_VW4_VWB4_WGM0
    SolutionIndex: 153
    SolutionNameMin: Cijk_Ailk_Bjlk_HHS_BH_MT128x256x64_MI16x16x16x1_SN_1LDSB1_AMAS3_ELFLR12_GLVWA8_GLVWB8_NLCB2_PLR5_SVW4_SKFT0_SKXCCM0_TT4_128_VW4_VWB4_WGM0
    SolutionIndex: 154
    SolutionNameMin: Cijk_Ailk_Bjlk_HHS_BH_MT128x256x64_MI16x16x16x1_SN_1LDSB1_AMAS3_ELFLR0_GLVWA8_GLVWB8_NLCB2_PLR5_SVW4_SKFT1_SKXCCM1_TT4_128_VW4_VWB4_WGM0
    SolutionIndex: 155
    SolutionNameMin: Cijk_Ailk_Bjlk_HHS_BH_MT128x256x64_MI16x16x16x1_SN_1LDSB1_AMAS3_ELFLR12_GLVWA8_GLVWB8_NLCB2_PLR5_SVW4_SKFT1_SKXCCM1_TT4_128_VW4_VWB4_WGM0
    SolutionIndex: 156
    SolutionNameMin: Cijk_Ailk_Bjlk_HHS_BH_MT256x128x64_MI16x16x16x1_SN_1LDSB1_AMAS3_ELFLR0_GLVWA8_GLVWB8_NLCB1_PLR5_SVW4_SKFT0_SKXCCM0_TT8_64_VW4_VWB4_WGM0
    SolutionIndex: 157
    SolutionNameMin: Cijk_Ailk_Bjlk_HHS_BH_MT256x128x64_MI16x16x16x1_SN_1LDSB1_AMAS3_ELFLR0_GLVWA8_GLVWB8_NLCB1_PLR5_SVW4_SKFT0_SKXCCM1_TT8_64_VW4_VWB4_WGM0
    SolutionIndex: 158
    SolutionNameMin: Cijk_Ailk_Bjlk_HHS_BH_MT256x128x64_MI16x16x16x1_SN_1LDSB1_AMAS3_ELFLR0_GLVWA8_GLVWB8_NLCB1_PLR5_SVW4_SKFT0_SKXCCM1_TT8_64_VW4_VWB4_WGM8
    SolutionIndex: 159
    SolutionNameMin: Cijk_Ailk_Bjlk_HHS_BH_MT256x128x64_MI16x16x16x1_SN_1LDSB1_AMAS3_ELFLR12_GLVWA8_GLVWB8_NLCB1_PLR5_SVW4_SKFT1_SKXCCM0_TT8_64_VW4_VWB4_WGM8
    SolutionIndex: 160
    SolutionNameMin: Cijk_Ailk_Bjlk_HHS_BH_MT256x128x64_MI16x16x16x1_SN_1LDSB1_AMAS3_ELFLR0_GLVWA8_GLVWB8_NLCB2_PLR5_SVW4_SKFT0_SKXCCM0_TT8_64_VW4_VWB4_WGM8
    SolutionIndex: 161
    SolutionNameMin: Cijk_Ailk_Bjlk_HHS_BH_MT256x128x64_MI16x16x16x1_SN_1LDSB1_AMAS3_ELFLR0_GLVWA8_GLVWB8_NLCB2_PLR5_SVW4_SKFT0_SKXCCM1_TT8_64_VW4_VWB4_WGM8
    SolutionIndex: 162
    SolutionNameMin: Cijk_Ailk_Bjlk_HHS_BH_MT128x128x64_MI16x16x16x1_SN_1LDSB1_AMAS3_ELFLR0_GLVWA8_GLVWB8_NLCB1_PLR5_SVW4_SKFT0_SKXCCM1_TT4_64_VW4_VWB4_WGM0
    SolutionIndex: 163
    SolutionNameMin: Cijk_Ailk_Bjlk_HHS_BH_MT128x128x64_MI16x16x16x1_SN_1LDSB1_AMAS3_ELFLR12_GLVWA8_GLVWB8_NLCB1_PLR5_SVW4_SKFT1_SKXCCM0_TT4_64_VW4_VWB4_WGM0
    SolutionIndex: 164
    SolutionNameMin: Cijk_Ailk_Bjlk_HHS_BH_MT128x128x64_MI16x16x16x1_SN_1LDSB1_AMAS3_ELFLR0_GLVWA8_GLVWB8_NLCB1_PLR5_SVW4_SKFT1_SKXCCM1_TT4_64_VW4_VWB4_WGM0
    SolutionIndex: 165
    SolutionNameMin: Cijk_Ailk_Bjlk_HHS_BH_MT128x128x64_MI16x16x16x1_SN_1LDSB1_AMAS3_ELFLR12_GLVWA8_GLVWB8_NLCB2_PLR5_SVW4_SKFT0_SKXCCM0_TT4_64_VW4_VWB4_WGM0
    SolutionIndex: 166
    SolutionNameMin: Cijk_Ailk_Bjlk_HHS_BH_MT128x128x64_MI16x16x16x1_SN_1LDSB1_AMAS3_ELFLR0_GLVWA8_GLVWB8_NLCB2_PLR5_SVW4_SKFT1_SKXCCM0_TT4_64_VW4_VWB4_WGM0
    SolutionIndex: 167
    SolutionNameMin: Cijk_Ailk_Bjlk_HHS_BH_MT128x128x64_MI16x16x16x1_SN_1LDSB1_AMAS3_ELFLR12_GLVWA8_GLVWB8_NLCB2_PLR5_SVW4_SKFT1_SKXCCM0_TT4_64_VW4_VWB4_WGM0
    SolutionIndex: 168
    SolutionNameMin: Cijk_Ailk_Bjlk_HHS_BH_MT128x128x64_MI16x16x16x1_SN_1LDSB1_AMAS3_ELFLR0_GLVWA8_GLVWB8_NLCB2_PLR5_SVW4_SKFT1_SKXCCM1_TT4_64_VW4_VWB4_WGM0
    SolutionIndex: 169
    SolutionNameMin: Cijk_Ailk_Bjlk_HHS_BH_MT128x128x64_MI16x16x16x1_SN_1LDSB1_AMAS3_ELFLR12_GLVWA8_GLVWB8_NLCB2_PLR5_SVW4_SKFT1_SKXCCM1_TT4_64_VW4_VWB4_WGM0
    SolutionIndex: 170
    SolutionNameMin: Cijk_Ailk_Bjlk_HHS_BH_MT128x128x64_MI16x16x16x1_SN_1LDSB1_AMAS3_ELFLR0_GLVWA8_GLVWB8_NLCB1_PLR5_SVW4_SKFT0_SKXCCM1_TT4_64_VW4_VWB4_WGM8
    SolutionIndex: 171
    SolutionNameMin: Cijk_Ailk_Bjlk_HHS_BH_MT128x128x64_MI16x16x16x1_SN_1LDSB1_AMAS3_ELFLR12_GLVWA8_GLVWB8_NLCB1_PLR5_SVW4_SKFT1_SKXCCM0_TT4_64_VW4_VWB4_WGM8
    SolutionIndex: 172
    SolutionNameMin: Cijk_Ailk_Bjlk_HHS_BH_MT128x128x64_MI16x16x16x1_SN_1LDSB1_AMAS3_ELFLR0_GLVWA8_GLVWB8_NLCB1_PLR5_SVW4_SKFT1_SKXCCM1_TT4_64_VW4_VWB4_WGM8
    SolutionIndex: 173
    SolutionNameMin: Cijk_Ailk_Bjlk_HHS_BH_MT128x128x64_MI16x16x16x1_SN_1LDSB1_AMAS3_ELFLR12_GLVWA8_GLVWB8_NLCB1_PLR5_SVW4_SKFT1_SKXCCM1_TT4_64_VW4_VWB4_WGM8
    SolutionIndex: 174
    SolutionNameMin: Cijk_Ailk_Bjlk_HHS_BH_MT128x128x64_MI16x16x16x1_SN_1LDSB1_AMAS3_ELFLR12_GLVWA8_GLVWB8_NLCB2_PLR5_SVW4_SKFT0_SKXCCM0_TT4_64_VW4_VWB4_WGM8
    SolutionIndex: 175
    SolutionNameMin: Cijk_Ailk_Bjlk_HHS_BH_MT128x128x64_MI16x16x16x1_SN_1LDSB1_AMAS3_ELFLR0_GLVWA8_GLVWB8_NLCB2_PLR5_SVW4_SKFT0_SKXCCM1_TT4_64_VW4_VWB4_WGM8
    SolutionIndex: 176
    SolutionNameMin: Cijk_Ailk_Bjlk_HHS_BH_MT128x128x64_MI16x16x16x1_SN_1LDSB1_AMAS3_ELFLR0_GLVWA8_GLVWB8_NLCB2_PLR5_SVW4_SKFT1_SKXCCM1_TT4_64_VW4_VWB4_WGM8
    SolutionIndex: 177
    SolutionNameMin: Cijk_Ailk_Bjlk_HHS_BH_MT128x128x64_MI16x16x16x1_SN_1LDSB1_AMAS3_ELFLR12_GLVWA8_GLVWB8_NLCB2_PLR5_SVW4_SKFT1_SKXCCM1_TT4_64_VW4_VWB4_WGM8
- - - [128, 128, 1, 128, 128, 128, 128, 128]
    - [137, 548.46]
  - - [128, 128, 1, 256, 128, 128, 128, 128]
    - [73, 905.719]
  - - [128, 128, 1, 512, 128, 128, 128, 128]
    - [68, 1385.69]
  - - [128, 128, 1, 1024, 128, 128, 128, 128]
    - [75, 1872.48]
  - - [128, 128, 1, 2048, 128, 128, 128, 128]
    - [2, 3122.37]
  - - [128, 128, 1, 4096, 128, 128, 128, 128]
    - [6, 6141.28]
  - - [128, 128, 1, 8192, 128, 128, 128, 128]
    - [8, 11706.7]
  - - [128, 256, 1, 128, 128, 128, 128, 256]
    - [73, 1032.07]
  - - [128, 256, 1, 256, 128, 128, 128, 256]
    - [70, 1763.87]
  - - [128, 256, 1, 512, 128, 128, 128, 256]
    - [75, 2716.11]
  - - [128, 256, 1, 1024, 128, 128, 128, 256]
    - [0, 4609.9]
  - - [128, 256, 1, 2048, 128, 128, 128, 256]
    - [8, 8962.81]
  - - [128, 256, 1, 4096, 128, 128, 128, 256]
    - [8, 16656.4]
  - - [128, 256, 1, 8192, 128, 128, 128, 256]
    - [76, 27655.0]
  - - [128, 512, 1, 128, 128, 128, 128, 512]
    - [68, 2019.26]
  - - [128, 512, 1, 256, 128, 128, 128, 512]
    - [75, 3432.33]
  - - [128, 512, 1, 512, 128, 128, 128, 512]
    - [10, 6121.08]
  - - [128, 512, 1, 1024, 128, 128, 128, 512]
    - [71, 11600.6]
  - - [128, 512, 1, 2048, 128, 128, 128, 512]
    - [6, 20809.5]
  - - [128, 512, 1, 4096, 128, 128, 128, 512]
    - [8, 34334.4]
  - - [128, 512, 1, 8192, 128, 128, 128, 512]
    - [93, 49420.5]
  - - [128, 1024, 1, 128, 128, 128, 128, 1024]
    - [71, 3875.4]
  - - [128, 1024, 1, 256, 128, 128, 128, 1024]
    - [75, 7053.25]
  - - [128, 1024, 1, 512, 128, 128, 128, 1024]
    - [71, 12987.2]
  - - [128, 1024, 1, 1024, 128, 128, 128, 1024]
    - [6, 23059.9]
  - - [128, 1024, 1, 2048, 128, 128, 128, 1024]
    - [76, 37310.5]
  - - [128, 1024, 1, 4096, 128, 128, 128, 1024]
    - [98, 59404.9]
  - - [128, 1024, 1, 8192, 128, 128, 128, 1024]
    - [20, 76011.3]
  - - [128, 2048, 1, 128, 128, 128, 128, 2048]
    - [69, 8059.54]
  - - [128, 2048, 1, 256, 128, 128, 128, 2048]
    - [75, 14459.9]
  - - [128, 2048, 1, 512, 128, 128, 128, 2048]
    - [69, 24870.1]
  - - [128, 2048, 1, 1024, 128, 128, 128, 2048]
    - [93, 41584.8]
  - - [128, 2048, 1, 2048, 128, 128, 128, 2048]
    - [100, 65960.7]
  - - [128, 2048, 1, 4096, 128, 128, 128, 2048]
    - [84, 87714.9]
  - - [128, 2048, 1, 8192, 128, 128, 128, 2048]
    - [88, 128775.0]
  - - [128, 4096, 1, 128, 128, 128, 128, 4096]
    - [95, 15506.2]
  - - [128, 4096, 1, 256, 128, 128, 128, 4096]
    - [97, 27728.5]
  - - [128, 4096, 1, 512, 128, 128, 128, 4096]
    - [104, 44707.5]
  - - [128, 4096, 1, 1024, 128, 128, 128, 4096]
    - [102, 70775.7]
  - - [128, 4096, 1, 2048, 128, 128, 128, 4096]
    - [65, 101220.0]
  - - [128, 4096, 1, 4096, 128, 128, 128, 4096]
    - [127, 141088.0]
  - - [128, 4096, 1, 8192, 128, 128, 128, 4096]
    - [48, 191660.0]
  - - [128, 8192, 1, 128, 128, 128, 128, 8192]
    - [94, 29059.1]
  - - [128, 8192, 1, 256, 128, 128, 128, 8192]
    - [139, 49712.5]
  - - [128, 8192, 1, 512, 128, 128, 128, 8192]
    - [82, 79899.5]
  - - [128, 8192, 1, 1024, 128, 128, 128, 8192]
    - [66, 107901.0]
  - - [128, 8192, 1, 2048, 128, 128, 128, 8192]
    - [128, 151114.0]
  - - [128, 8192, 1, 4096, 128, 128, 128, 8192]
    - [134, 206454.0]
  - - [128, 8192, 1, 8192, 128, 128, 128, 8192]
    - [37, 271141.0]
  - - [256, 128, 1, 128, 256, 256, 256, 128]
    - [73, 1041.02]
  - - [256, 128, 1, 256, 256, 256, 256, 128]
    - [69, 1753.35]
  - - [256, 128, 1, 512, 256, 256, 256, 128]
    - [71, 2700.96]
  - - [256, 128, 1, 1024, 256, 256, 256, 128]
    - [1, 4554.89]
  - - [256, 128, 1, 2048, 256, 256, 256, 128]
    - [5, 8853.75]
  - - [256, 128, 1, 4096, 256, 256, 256, 128]
    - [7, 16566.2]
  - - [256, 128, 1, 8192, 256, 256, 256, 128]
    - [72, 27658.1]
  - - [256, 256, 1, 128, 256, 256, 256, 256]
    - [68, 2031.11]
  - - [256, 256, 1, 256, 256, 256, 256, 256]
    - [74, 3438.74]
  - - [256, 256, 1, 512, 256, 256, 256, 256]
    - [8, 6123.54]
  - - [256, 256, 1, 1024, 256, 256, 256, 256]
    - [71, 11511.5]
  - - [256, 256, 1, 2048, 256, 256, 256, 256]
    - [8, 20831.2]
  - - [256, 256, 1, 4096, 256, 256, 256, 256]
    - [71, 34316.3]
  - - [256, 256, 1, 8192, 256, 256, 256, 256]
    - [101, 49276.5]
  - - [256, 512, 1, 128, 256, 256, 256, 512]
    - [69, 3876.02]
  - - [256, 512, 1, 256, 256, 256, 256, 512]
    - [77, 6997.29]
  - - [256, 512, 1, 512, 256, 256, 256, 512]
    - [71, 13010.6]
  - - [256, 512, 1, 1024, 256, 256, 256, 512]
    - [8, 23145.2]
  - - [256, 512, 1, 2048, 256, 256, 256, 512]
    - [69, 38827.6]
  - - [256, 512, 1, 4096, 256, 256, 256, 512]
    - [92, 61125.4]
  - - [256, 512, 1, 8192, 256, 256, 256, 512]
    - [92, 78014.6]
  - - [256, 1024, 1, 128, 256, 256, 256, 1024]
    - [69, 8101.65]
  - - [256, 1024, 1, 256, 256, 256, 256, 1024]
    - [71, 14356.7]
  - - [256, 1024, 1, 512, 256, 256, 256, 1024]
    - [69, 24757.1]
  - - [256, 1024, 1, 1024, 256, 256, 256, 1024]
    - [93, 42633.8]
  - - [256, 1024, 1, 2048, 256, 256, 256, 1024]
    - [99, 67133.7]
  - - [256, 1024, 1, 4096, 256, 256, 256, 1024]
    - [81, 89105.8]
  - - [256, 1024, 1, 8192, 256, 256, 256, 1024]
    - [17, 122123.0]
  - - [256, 2048, 1, 128, 256, 256, 256, 2048]
    - [95, 15394.4]
  - - [256, 2048, 1, 256, 256, 256, 256, 2048]
    - [93, 27577.9]
  - - [256, 2048, 1, 512, 256, 256, 256, 2048]
    - [97, 45442.7]
  - - [256, 2048, 1, 1024, 256, 256, 256, 2048]
    - [97, 71142.9]
  - - [256, 2048, 1, 2048, 256, 256, 256, 2048]
    - [85, 97344.1]
  - - [256, 2048, 1, 4096, 256, 256, 256, 2048]
    - [125, 139005.0]
  - - [256, 2048, 1, 8192, 256, 256, 256, 2048]
    - [129, 186674.0]
  - - [256, 4096, 1, 128, 256, 256, 256, 4096]
    - [97, 29011.8]
  - - [256, 4096, 1, 256, 256, 256, 256, 4096]
    - [140, 49932.8]
  - - [256, 4096, 1, 512, 256, 256, 256, 4096]
    - [139, 80033.0]
  - - [256, 4096, 1, 1024, 256, 256, 256, 4096]
    - [13, 112782.0]
  - - [256, 4096, 1, 2048, 256, 256, 256, 4096]
    - [50, 153234.0]
  - - [256, 4096, 1, 4096, 256, 256, 256, 4096]
    - [49, 209078.0]
  - - [256, 4096, 1, 8192, 256, 256, 256, 4096]
    - [32, 270021.0]
  - - [256, 8192, 1, 128, 256, 256, 256, 8192]
    - [139, 49817.8]
  - - [256, 8192, 1, 256, 256, 256, 256, 8192]
    - [53, 72044.6]
  - - [256, 8192, 1, 512, 256, 256, 256, 8192]
    - [14, 112062.0]
  - - [256, 8192, 1, 1024, 256, 256, 256, 8192]
    - [126, 155720.0]
  - - [256, 8192, 1, 2048, 256, 256, 256, 8192]
    - [44, 212604.0]
  - - [256, 8192, 1, 4096, 256, 256, 256, 8192]
    - [123, 298037.0]
  - - [256, 8192, 1, 8192, 256, 256, 256, 8192]
    - [160, 339902.0]
  - - [512, 128, 1, 128, 512, 512, 512, 128]
    - [73, 1987.96]
  - - [512, 128, 1, 256, 512, 512, 512, 128]
    - [71, 3442.77]
  - - [512, 128, 1, 512, 512, 512, 512, 128]
    - [6, 6121.31]
  - - [512, 128, 1, 1024, 512, 512, 512, 128]
    - [71, 11528.4]
  - - [512, 128, 1, 2048, 512, 512, 512, 128]
    - [4, 20743.2]
  - - [512, 128, 1, 4096, 512, 512, 512, 128]
    - [9, 34142.4]
  - - [512, 128, 1, 8192, 512, 512, 512, 128]
    - [104, 49218.2]
  - - [512, 256, 1, 128, 512, 512, 512, 256]
    - [75, 3863.06]
  - - [512, 256, 1, 256, 512, 512, 512, 256]
    - [75, 7019.86]
  - - [512, 256, 1, 512, 512, 512, 512, 256]
    - [6, 12772.6]
  - - [512, 256, 1, 1024, 512, 512, 512, 256]
    - [6, 23072.2]
  - - [512, 256, 1, 2048, 512, 512, 512, 256]
    - [69, 38262.3]
  - - [512, 256, 1, 4096, 512, 512, 512, 256]
    - [100, 59925.5]
  - - [512, 256, 1, 8192, 512, 512, 512, 256]
    - [104, 75951.5]
  - - [512, 512, 1, 128, 512, 512, 512, 512]
    - [73, 8122.65]
  - - [512, 512, 1, 256, 512, 512, 512, 512]
    - [75, 14309.5]
  - - [512, 512, 1, 512, 512, 512, 512, 512]
    - [68, 24880.7]
  - - [512, 512, 1, 1024, 512, 512, 512, 512]
    - [97, 42446.2]
  - - [512, 512, 1, 2048, 512, 512, 512, 512]
    - [92, 68311.7]
  - - [512, 512, 1, 4096, 512, 512, 512, 512]
    - [91, 87615.3]
  - - [512, 512, 1, 8192, 512, 512, 512, 512]
    - [15, 119502.0]
  - - [512, 1024, 1, 128, 512, 512, 512, 1024]
    - [95, 15314.9]
  - - [512, 1024, 1, 256, 512, 512, 512, 1024]
    - [97, 27501.5]
  - - [512, 1024, 1, 512, 512, 512, 512, 1024]
    - [97, 45435.8]
  - - [512, 1024, 1, 1024, 512, 512, 512, 1024]
    - [51, 73388.9]
  - - [512, 1024, 1, 2048, 512, 512, 512, 1024]
    - [14, 105257.0]
  - - [512, 1024, 1, 4096, 512, 512, 512, 1024]
    - [42, 133417.0]
  - - [512, 1024, 1, 8192, 512, 512, 512, 1024]
    - [47, 181337.0]
  - - [512, 2048, 1, 128, 512, 512, 512, 2048]
    - [103, 28610.5]
  - - [512, 2048, 1, 256, 512, 512, 512, 2048]
    - [139, 49363.6]
  - - [512, 2048, 1, 512, 512, 512, 512, 2048]
    - [139, 80279.9]
  - - [512, 2048, 1, 1024, 512, 512, 512, 2048]
    - [17, 113866.0]
  - - [512, 2048, 1, 2048, 512, 512, 512, 2048]
    - [50, 150382.0]
  - - [512, 2048, 1, 4096, 512, 512, 512, 2048]
    - [136, 194743.0]
  - - [512, 2048, 1, 8192, 512, 512, 512, 2048]
    - [38, 263102.0]
  - - [512, 4096, 1, 128, 512, 512, 512, 4096]
    - [139, 49804.8]
  - - [512, 4096, 1, 256, 512, 512, 512, 4096]
    - [53, 73041.0]
  - - [512, 4096, 1, 512, 512, 512, 512, 4096]
    - [14, 113534.0]
  - - [512, 4096, 1, 1024, 512, 512, 512, 4096]
    - [124, 155868.0]
  - - [512, 4096, 1, 2048, 512, 512, 512, 4096]
    - [40, 207916.0]
  - - [512, 4096, 1, 4096, 512, 512, 512, 4096]
    - [176, 279798.0]
  - - [512, 4096, 1, 8192, 512, 512, 512, 4096]
    - [62, 337332.0]
  - - [512, 8192, 1, 128, 512, 512, 512, 8192]
    - [119, 75992.9]
  - - [512, 8192, 1, 256, 512, 512, 512, 8192]
    - [106, 103278.0]
  - - [512, 8192, 1, 512, 512, 512, 512, 8192]
    - [12, 149837.0]
  - - [512, 8192, 1, 1024, 512, 512, 512, 8192]
    - [114, 215939.0]
  - - [512, 8192, 1, 2048, 512, 512, 512, 8192]
    - [172, 297415.0]
  - - [512, 8192, 1, 4096, 512, 512, 512, 8192]
    - [120, 349328.0]
  - - [512, 8192, 1, 8192, 512, 512, 512, 8192]
    - [156, 400489.0]
  - - [1024, 128, 1, 128, 1024, 1024, 1024, 128]
    - [69, 3876.38]
  - - [1024, 128, 1, 256, 1024, 1024, 1024, 128]
    - [71, 6971.49]
  - - [1024, 128, 1, 512, 1024, 1024, 1024, 128]
    - [75, 12810.9]
  - - [1024, 128, 1, 1024, 1024, 1024, 1024, 128]
    - [8, 22911.7]
  - - [1024, 128, 1, 2048, 1024, 1024, 1024, 128]
    - [100, 37165.1]
  - - [1024, 128, 1, 4096, 1024, 1024, 1024, 128]
    - [101, 56786.4]
  - - [1024, 128, 1, 8192, 1024, 1024, 1024, 128]
    - [92, 75855.3]
  - - [1024, 256, 1, 128, 1024, 1024, 1024, 256]
    - [69, 8078.79]
  - - [1024, 256, 1, 256, 1024, 1024, 1024, 256]
    - [75, 14309.5]
  - - [1024, 256, 1, 512, 1024, 1024, 1024, 256]
    - [68, 24768.5]
  - - [1024, 256, 1, 1024, 1024, 1024, 1024, 256]
    - [93, 42585.8]
  - - [1024, 256, 1, 2048, 1024, 1024, 1024, 256]
    - [100, 65694.0]
  - - [1024, 256, 1, 4096, 1024, 1024, 1024, 256]
    - [89, 88859.1]
  - - [1024, 256, 1, 8192, 1024, 1024, 1024, 256]
    - [82, 124215.0]
  - - [1024, 512, 1, 128, 1024, 1024, 1024, 512]
    - [73, 15286.9]
  - - [1024, 512, 1, 256, 1024, 1024, 1024, 512]
    - [92, 27374.5]
  - - [1024, 512, 1, 512, 1024, 1024, 1024, 512]
    - [97, 45211.2]
  - - [1024, 512, 1, 1024, 1024, 1024, 1024, 512]
    - [52, 74552.5]
  - - [1024, 512, 1, 2048, 1024, 1024, 1024, 512]
    - [17, 105065.0]
  - - [1024, 512, 1, 4096, 1024, 1024, 1024, 512]
    - [49, 131598.0]
  - - [1024, 512, 1, 8192, 1024, 1024, 1024, 512]
    - [45, 174844.0]
  - - [1024, 1024, 1, 128, 1024, 1024, 1024, 1024]
    - [137, 29107.7]
  - - [1024, 1024, 1, 256, 1024, 1024, 1024, 1024]
    - [139, 49733.7]
  - - [1024, 1024, 1, 512, 1024, 1024, 1024, 1024]
    - [82, 80841.8]
  - - [1024, 1024, 1, 1024, 1024, 1024, 1024, 1024]
    - [16, 115198.0]
  - - [1024, 1024, 1, 2048, 1024, 1024, 1024, 1024]
    - [46, 144706.0]
  - - [1024, 1024, 1, 4096, 1024, 1024, 1024, 1024]
    - [41, 189253.0]
  - - [1024, 1024, 1, 8192, 1024, 1024, 1024, 1024]
    - [36, 252913.0]
  - - [1024, 2048, 1, 128, 1024, 1024, 1024, 2048]
    - [125, 49886.5]
  - - [1024, 2048, 1, 256, 1024, 1024, 1024, 2048]
    - [54, 72868.5]
  - - [1024, 2048, 1, 512, 1024, 1024, 1024, 2048]
    - [18, 113358.0]
  - - [1024, 2048, 1, 1024, 1024, 1024, 1024, 2048]
    - [127, 156739.0]
  - - [1024, 2048, 1, 2048, 1024, 1024, 1024, 2048]
    - [50, 204347.0]
  - - [1024, 2048, 1, 4096, 1024, 1024, 1024, 2048]
    - [33, 271385.0]
  - - [1024, 2048, 1, 8192, 1024, 1024, 1024, 2048]
    - [28, 331979.0]
  - - [1024, 4096, 1, 128, 1024, 1024, 1024, 4096]
    - [112, 77287.1]
  - - [1024, 4096, 1, 256, 1024, 1024, 1024, 4096]
    - [163, 104655.0]
  - - [1024, 4096, 1, 512, 1024, 1024, 1024, 4096]
    - [126, 148439.0]
  - - [1024, 4096, 1, 1024, 1024, 1024, 1024, 4096]
    - [105, 213533.0]
  - - [1024, 4096, 1, 2048, 1024, 1024, 1024, 4096]
    - [170, 290486.0]
  - - [1024, 4096, 1, 4096, 1024, 1024, 1024, 4096]
    - [25, 342973.0]
  - - [1024, 4096, 1, 8192, 1024, 1024, 1024, 4096]
    - [144, 374860.0]
  - - [1024, 8192, 1, 128, 1024, 1024, 1024, 8192]
    - [112, 99917.1]
  - - [1024, 8192, 1, 256, 1024, 1024, 1024, 8192]
    - [136, 137265.0]
  - - [1024, 8192, 1, 512, 1024, 1024, 1024, 8192]
    - [34, 205940.0]
  - - [1024, 8192, 1, 1024, 1024, 1024, 1024, 8192]
    - [107, 290833.0]
  - - [1024, 8192, 1, 2048, 1024, 1024, 1024, 8192]
    - [109, 351290.0]
  - - [1024, 8192, 1, 4096, 1024, 1024, 1024, 8192]
    - [159, 396820.0]
  - - [1024, 8192, 1, 8192, 1024, 1024, 1024, 8192]
    - [59, 453062.0]
  - - [2048, 128, 1, 128, 2048, 2048, 2048, 128]
    - [69, 8076.1]
  - - [2048, 128, 1, 256, 2048, 2048, 2048, 128]
    - [75, 14323.4]
  - - [2048, 128, 1, 512, 2048, 2048, 2048, 128]
    - [69, 24884.5]
  - - [2048, 128, 1, 1024, 2048, 2048, 2048, 128]
    - [93, 42012.6]
  - - [2048, 128, 1, 2048, 2048, 2048, 2048, 128]
    - [97, 65478.4]
  - - [2048, 128, 1, 4096, 2048, 2048, 2048, 128]
    - [3, 89513.2]
  - - [2048, 128, 1, 8192, 2048, 2048, 2048, 128]
    - [87, 124381.0]
  - - [2048, 256, 1, 128, 2048, 2048, 2048, 256]
    - [95, 15369.4]
  - - [2048, 256, 1, 256, 2048, 2048, 2048, 256]
    - [93, 27542.9]
  - - [2048, 256, 1, 512, 2048, 2048, 2048, 256]
    - [96, 45382.8]
  - - [2048, 256, 1, 1024, 2048, 2048, 2048, 256]
    - [137, 71170.7]
  - - [2048, 256, 1, 2048, 2048, 2048, 2048, 256]
    - [81, 97093.4]
  - - [2048, 256, 1, 4096, 2048, 2048, 2048, 256]
    - [86, 132546.0]
  - - [2048, 256, 1, 8192, 2048, 2048, 2048, 256]
    - [79, 179393.0]
  - - [2048, 512, 1, 128, 2048, 2048, 2048, 512]
    - [94, 28817.4]
  - - [2048, 512, 1, 256, 2048, 2048, 2048, 512]
    - [139, 49824.6]
  - - [2048, 512, 1, 512, 2048, 2048, 2048, 512]
    - [85, 80013.2]
  - - [2048, 512, 1, 1024, 2048, 2048, 2048, 512]
    - [16, 114604.0]
  - - [2048, 512, 1, 2048, 2048, 2048, 2048, 512]
    - [50, 144713.0]
  - - [2048, 512, 1, 4096, 2048, 2048, 2048, 512]
    - [80, 191761.0]
  - - [2048, 512, 1, 8192, 2048, 2048, 2048, 512]
    - [110, 263572.0]
  - - [2048, 1024, 1, 128, 2048, 2048, 2048, 1024]
    - [138, 50113.3]
  - - [2048, 1024, 1, 256, 2048, 2048, 2048, 1024]
    - [91, 72361.0]
  - - [2048, 1024, 1, 512, 2048, 2048, 2048, 1024]
    - [14, 113605.0]
  - - [2048, 1024, 1, 1024, 2048, 2048, 2048, 1024]
    - [136, 150486.0]
  - - [2048, 1024, 1, 2048, 2048, 2048, 2048, 1024]
    - [38, 200905.0]
  - - [2048, 1024, 1, 4096, 2048, 2048, 2048, 1024]
    - [122, 270815.0]
  - - [2048, 1024, 1, 8192, 2048, 2048, 2048, 1024]
    - [27, 332097.0]
  - - [2048, 2048, 1, 128, 2048, 2048, 2048, 2048]
    - [115, 76832.1]
  - - [2048, 2048, 1, 256, 2048, 2048, 2048, 2048]
    - [165, 102779.0]
  - - [2048, 2048, 1, 512, 2048, 2048, 2048, 2048]
    - [132, 148677.0]
  - - [2048, 2048, 1, 1024, 2048, 2048, 2048, 2048]
    - [172, 213167.0]
  - - [2048, 2048, 1, 2048, 2048, 2048, 2048, 2048]
    - [122, 292897.0]
  - - [2048, 2048, 1, 4096, 2048, 2048, 2048, 2048]
    - [61, 348206.0]
  - - [2048, 2048, 1, 8192, 2048, 2048, 2048, 2048]
    - [57, 368643.0]
  - - [2048, 4096, 1, 128, 2048, 2048, 2048, 4096]
    - [171, 100166.0]
  - - [2048, 4096, 1, 256, 2048, 2048, 2048, 4096]
    - [135, 139268.0]
  - - [2048, 4096, 1, 512, 2048, 2048, 2048, 4096]
    - [162, 206649.0]
  - - [2048, 4096, 1, 1024, 2048, 2048, 2048, 4096]
    - [63, 288504.0]
  - - [2048, 4096, 1, 2048, 2048, 2048, 2048, 4096]
    - [170, 349678.0]
  - - [2048, 4096, 1, 4096, 2048, 2048, 2048, 4096]
    - [23, 380371.0]
  - - [2048, 4096, 1, 8192, 2048, 2048, 2048, 4096]
    - [143, 453477.0]
  - - [2048, 8192, 1, 128, 2048, 2048, 2048, 8192]
    - [108, 119075.0]
  - - [2048, 8192, 1, 256, 2048, 2048, 2048, 8192]
    - [168, 185983.0]
  - - [2048, 8192, 1, 512, 2048, 2048, 2048, 8192]
    - [107, 263665.0]
  - - [2048, 8192, 1, 1024, 2048, 2048, 2048, 8192]
    - [152, 339816.0]
  - - [2048, 8192, 1, 2048, 2048, 2048, 2048, 8192]
    - [152, 392639.0]
  - - [2048, 8192, 1, 4096, 2048, 2048, 2048, 8192]
    - [22, 442393.0]
  - - [2048, 8192, 1, 8192, 2048, 2048, 2048, 8192]
    - [58, 475345.0]
  - - [4096, 128, 1, 128, 4096, 4096, 4096, 128]
    - [73, 15508.0]
  - - [4096, 128, 1, 256, 4096, 4096, 4096, 128]
    - [96, 27538.6]
  - - [4096, 128, 1, 512, 4096, 4096, 4096, 128]
    - [97, 45143.2]
  - - [4096, 128, 1, 1024, 4096, 4096, 4096, 128]
    - [54, 70833.4]
  - - [4096, 128, 1, 2048, 4096, 4096, 4096, 128]
    - [67, 99043.3]
  - - [4096, 128, 1, 4096, 4096, 4096, 4096, 128]
    - [43, 134677.0]
  - - [4096, 128, 1, 8192, 4096, 4096, 4096, 128]
    - [11, 181569.0]
  - - [4096, 256, 1, 128, 4096, 4096, 4096, 256]
    - [95, 28995.3]
  - - [4096, 256, 1, 256, 4096, 4096, 4096, 256]
    - [141, 49532.1]
  - - [4096, 256, 1, 512, 4096, 4096, 4096, 256]
    - [85, 79935.9]
  - - [4096, 256, 1, 1024, 4096, 4096, 4096, 256]
    - [17, 112371.0]
  - - [4096, 256, 1, 2048, 4096, 4096, 4096, 256]
    - [46, 145196.0]
  - - [4096, 256, 1, 4096, 4096, 4096, 4096, 256]
    - [32, 195466.0]
  - - [4096, 256, 1, 8192, 4096, 4096, 4096, 256]
    - [38, 268987.0]
  - - [4096, 512, 1, 128, 4096, 4096, 4096, 512]
    - [138, 49754.8]
  - - [4096, 512, 1, 256, 4096, 4096, 4096, 512]
    - [133, 76317.1]
  - - [4096, 512, 1, 512, 4096, 4096, 4096, 512]
    - [19, 113543.0]
  - - [4096, 512, 1, 1024, 4096, 4096, 4096, 512]
    - [129, 154028.0]
  - - [4096, 512, 1, 2048, 4096, 4096, 4096, 512]
    - [39, 205906.0]
  - - [4096, 512, 1, 4096, 4096, 4096, 4096, 512]
    - [170, 283217.0]
  - - [4096, 512, 1, 8192, 4096, 4096, 4096, 512]
    - [154, 331500.0]
  - - [4096, 1024, 1, 128, 4096, 4096, 4096, 1024]
    - [118, 76128.6]
  - - [4096, 1024, 1, 256, 4096, 4096, 4096, 1024]
    - [174, 103750.0]
  - - [4096, 1024, 1, 512, 4096, 4096, 4096, 1024]
    - [120, 146627.0]
  - - [4096, 1024, 1, 1024, 4096, 4096, 4096, 1024]
    - [122, 214277.0]
  - - [4096, 1024, 1, 2048, 4096, 4096, 4096, 1024]
    - [170, 296419.0]
  - - [4096, 1024, 1, 4096, 4096, 4096, 4096, 1024]
    - [120, 339332.0]
  - - [4096, 1024, 1, 8192, 4096, 4096, 4096, 1024]
    - [148, 378971.0]
  - - [4096, 2048, 1, 128, 4096, 4096, 4096, 2048]
    - [171, 100639.0]
  - - [4096, 2048, 1, 256, 4096, 4096, 4096, 2048]
    - [130, 137673.0]
  - - [4096, 2048, 1, 512, 4096, 4096, 4096, 2048]
    - [176, 204427.0]
  - - [4096, 2048, 1, 1024, 4096, 4096, 4096, 2048]
    - [164, 287630.0]
  - - [4096, 2048, 1, 2048, 4096, 4096, 4096, 2048]
    - [168, 351999.0]
  - - [4096, 2048, 1, 4096, 4096, 4096, 4096, 2048]
    - [157, 379537.0]
  - - [4096, 2048, 1, 8192, 4096, 4096, 4096, 2048]
    - [57, 447431.0]
  - - [4096, 4096, 1, 128, 4096, 4096, 4096, 4096]
    - [164, 118425.0]
  - - [4096, 4096, 1, 256, 4096, 4096, 4096, 4096]
    - [168, 184357.0]
  - - [4096, 4096, 1, 512, 4096, 4096, 4096, 4096]
    - [30, 253540.0]
  - - [4096, 4096, 1, 1024, 4096, 4096, 4096, 4096]
    - [155, 343792.0]
  - - [4096, 4096, 1, 2048, 4096, 4096, 4096, 4096]
    - [158, 393834.0]
  - - [4096, 4096, 1, 4096, 4096, 4096, 4096, 4096]
    - [21, 445299.0]
  - - [4096, 4096, 1, 8192, 4096, 4096, 4096, 4096]
    - [147, 487210.0]
  - - [4096, 8192, 1, 128, 4096, 4096, 4096, 8192]
    - [78, 144678.0]
  - - [4096, 8192, 1, 256, 4096, 4096, 4096, 8192]
    - [113, 214392.0]
  - - [4096, 8192, 1, 512, 4096, 4096, 4096, 8192]
    - [30, 294355.0]
  - - [4096, 8192, 1, 1024, 4096, 4096, 4096, 8192]
    - [56, 369256.0]
  - - [4096, 8192, 1, 2048, 4096, 4096, 4096, 8192]
    - [146, 454293.0]
  - - [4096, 8192, 1, 4096, 4096, 4096, 4096, 8192]
    - [146, 506856.0]
  - - [4096, 8192, 1, 8192, 4096, 4096, 4096, 8192]
    - [145, 530275.0]
  - - [8192, 128, 1, 128, 8192, 8192, 8192, 128]
    - [96, 29190.7]
  - - [8192, 128, 1, 256, 8192, 8192, 8192, 128]
    - [141, 49405.6]
  - - [8192, 128, 1, 512, 8192, 8192, 8192, 128]
    - [90, 78453.2]
  - - [8192, 128, 1, 1024, 8192, 8192, 8192, 128]
    - [89, 104559.0]
  - - [8192, 128, 1, 2048, 8192, 8192, 8192, 128]
    - [83, 143953.0]
  - - [8192, 128, 1, 4096, 8192, 8192, 8192, 128]
    - [11, 197077.0]
  - - [8192, 128, 1, 8192, 8192, 8192, 8192, 128]
    - [31, 272785.0]
  - - [8192, 256, 1, 128, 8192, 8192, 8192, 256]
    - [141, 49750.3]
  - - [8192, 256, 1, 256, 8192, 8192, 8192, 256]
    - [135, 74173.9]
  - - [8192, 256, 1, 512, 8192, 8192, 8192, 256]
    - [18, 112988.0]
  - - [8192, 256, 1, 1024, 8192, 8192, 8192, 256]
    - [129, 153636.0]
  - - [8192, 256, 1, 2048, 8192, 8192, 8192, 256]
    - [35, 204548.0]
  - - [8192, 256, 1, 4096, 8192, 8192, 8192, 256]
    - [162, 287150.0]
  - - [8192, 256, 1, 8192, 8192, 8192, 8192, 256]
    - [111, 339891.0]
  - - [8192, 512, 1, 128, 8192, 8192, 8192, 512]
    - [118, 77771.5]
  - - [8192, 512, 1, 256, 8192, 8192, 8192, 512]
    - [166, 101546.0]
  - - [8192, 512, 1, 512, 8192, 8192, 8192, 512]
    - [131, 147567.0]
  - - [8192, 512, 1, 1024, 8192, 8192, 8192, 512]
    - [117, 214946.0]
  - - [8192, 512, 1, 2048, 8192, 8192, 8192, 512]
    - [169, 287217.0]
  - - [8192, 512, 1, 4096, 8192, 8192, 8192, 512]
    - [24, 341816.0]
  - - [8192, 512, 1, 8192, 8192, 8192, 8192, 512]
    - [151, 401171.0]
  - - [8192, 1024, 1, 128, 8192, 8192, 8192, 1024]
    - [167, 97884.7]
  - - [8192, 1024, 1, 256, 8192, 8192, 8192, 1024]
    - [121, 136539.0]
  - - [8192, 1024, 1, 512, 8192, 8192, 8192, 1024]
    - [64, 203511.0]
  - - [8192, 1024, 1, 1024, 8192, 8192, 8192, 1024]
    - [177, 288245.0]
  - - [8192, 1024, 1, 2048, 8192, 8192, 8192, 1024]
    - [116, 349274.0]
  - - [8192, 1024, 1, 4096, 8192, 8192, 8192, 1024]
    - [60, 392404.0]
  - - [8192, 1024, 1, 8192, 8192, 8192, 8192, 1024]
    - [149, 450588.0]
  - - [8192, 2048, 1, 128, 8192, 8192, 8192, 2048]
    - [171, 118954.0]
  - - [8192, 2048, 1, 256, 8192, 8192, 8192, 2048]
    - [177, 180564.0]
  - - [8192, 2048, 1, 512, 8192, 8192, 8192, 2048]
    - [172, 257674.0]
  - - [8192, 2048, 1, 1024, 8192, 8192, 8192, 2048]
    - [26, 337769.0]
  - - [8192, 2048, 1, 2048, 8192, 8192, 8192, 2048]
    - [150, 397763.0]
  - - [8192, 2048, 1, 4096, 8192, 8192, 8192, 2048]
    - [153, 460870.0]
  - - [8192, 2048, 1, 8192, 8192, 8192, 8192, 2048]
    - [55, 493902.0]
  - - [8192, 4096, 1, 128, 8192, 8192, 8192, 4096]
    - [118, 146502.0]
  - - [8192, 4096, 1, 256, 8192, 8192, 8192, 4096]
    - [173, 213265.0]
  - - [8192, 4096, 1, 512, 8192, 8192, 8192, 4096]
    - [175, 292354.0]
  - - [8192, 4096, 1, 1024, 8192, 8192, 8192, 4096]
    - [158, 378259.0]
  - - [8192, 4096, 1, 2048, 8192, 8192, 8192, 4096]
    - [60, 447982.0]
  - - [8192, 4096, 1, 4096, 8192, 8192, 8192, 4096]
    - [145, 526094.0]
  - - [8192, 4096, 1, 8192, 8192, 8192, 8192, 4096]
    - [142, 552268.0]
  - - [8192, 8192, 1, 128, 8192, 8192, 8192, 8192]
    - [153, 162987.0]
  - - [8192, 8192, 1, 256, 8192, 8192, 8192, 8192]
    - [29, 241437.0]
  - - [8192, 8192, 1, 512, 8192, 8192, 8192, 8192]
    - [30, 330074.0]
  - - [8192, 8192, 1, 1024, 8192, 8192, 8192, 8192]
    - [161, 419136.0]
  - - [8192, 8192, 1, 2048, 8192, 8192, 8192, 8192]
    - [147, 497823.0]
  - - [8192, 8192, 1, 4096, 8192, 8192, 8192, 8192]
    - [142, 568628.0]
  - - [8192, 8192, 1, 8192, 8192, 8192, 8192, 8192]
    - [145, 594715.0]
- null
- null
- DeviceEfficiency
