experiments/sk3rx8_transposes/yaml_outputs/hgemm_tt_2024-06-05_12_37_15/aquavanjaram942_Cijk_Alik_Bjlk_HHS_BH.yaml
- {MinimumRequiredVersion: 4.41.0}
- aquavanjaram942
- gfx942
- [Device 0049, Device 0050]
    SolutionIndex: 0
    SolutionNameMin: Cijk_Alik_Bjlk_HHS_BH_MT32x32x16_MI16x16x16x1_SN_1LDSB0_AMAS0_ELFLR0_GLVWA2_GLVWB2_NLCB1_PLR1_SVW1_SKFT0_SKXCCM1_TT1_16_VW1_VWB1_WGM0
    SolutionIndex: 1
    SolutionNameMin: Cijk_Alik_Bjlk_HHS_BH_MT32x32x16_MI16x16x16x1_SN_1LDSB0_AMAS0_ELFLR12_GLVWA2_GLVWB2_NLCB1_PLR1_SVW1_SKFT0_SKXCCM1_TT1_16_VW1_VWB1_WGM0
    SolutionIndex: 2
    SolutionNameMin: Cijk_Alik_Bjlk_HHS_BH_MT32x32x16_MI16x16x16x1_SN_1LDSB0_AMAS0_ELFLR12_GLVWA2_GLVWB2_NLCB1_PLR1_SVW1_SKFT1_SKXCCM0_TT1_16_VW1_VWB1_WGM0
    SolutionIndex: 3
    SolutionNameMin: Cijk_Alik_Bjlk_HHS_BH_MT32x32x16_MI16x16x16x1_SN_1LDSB0_AMAS0_ELFLR12_GLVWA2_GLVWB2_NLCB1_PLR1_SVW1_SKFT1_SKXCCM1_TT1_16_VW1_VWB1_WGM0
    SolutionIndex: 4
    SolutionNameMin: Cijk_Alik_Bjlk_HHS_BH_MT32x32x16_MI16x16x16x1_SN_1LDSB0_AMAS0_ELFLR0_GLVWA2_GLVWB2_NLCB1_PLR1_SVW1_SKFT1_SKXCCM1_TT1_16_VW1_VWB1_WGM8
    SolutionIndex: 5
    SolutionNameMin: Cijk_Alik_Bjlk_HHS_BH_MT32x32x32_MI16x16x16x1_SN_1LDSB0_AMAS0_ELFLR12_GLVWA4_GLVWB4_NLCB1_PLR3_SVW1_SKFT0_SKXCCM0_TT1_16_VW1_VWB1_WGM0
    SolutionIndex: 6
    SolutionNameMin: Cijk_Alik_Bjlk_HHS_BH_MT32x32x32_MI16x16x16x1_SN_1LDSB0_AMAS0_ELFLR12_GLVWA4_GLVWB4_NLCB1_PLR3_SVW1_SKFT0_SKXCCM1_TT1_16_VW1_VWB1_WGM0
    SolutionIndex: 7
    SolutionNameMin: Cijk_Alik_Bjlk_HHS_BH_MT32x32x32_MI16x16x16x1_SN_1LDSB0_AMAS0_ELFLR0_GLVWA4_GLVWB4_NLCB1_PLR3_SVW1_SKFT1_SKXCCM1_TT1_16_VW1_VWB1_WGM0
    SolutionIndex: 8
    SolutionNameMin: Cijk_Alik_Bjlk_HHS_BH_MT32x32x32_MI16x16x16x1_SN_1LDSB0_AMAS0_ELFLR12_GLVWA4_GLVWB4_NLCB1_PLR3_SVW1_SKFT1_SKXCCM1_TT1_16_VW1_VWB1_WGM0
    SolutionIndex: 9
    SolutionNameMin: Cijk_Alik_Bjlk_HHS_BH_MT128x128x32_MI16x16x16x1_SN_1LDSB0_AMAS3_ELFLR0_GLVWA8_GLVWB8_NLCB2_PLR3_SVW2_SKFT0_SKXCCM0_TT4_64_VW2_VWB2_WGM0
    SolutionIndex: 10
    SolutionNameMin: Cijk_Alik_Bjlk_HHS_BH_MT64x128x32_MI16x16x16x1_SN_1LDSB0_AMAS3_ELFLR0_GLVWA8_GLVWB8_NLCB1_PLR3_SVW2_SKFT1_SKXCCM1_TT2_64_VW2_VWB2_WGM0
    SolutionIndex: 11
    SolutionNameMin: Cijk_Alik_Bjlk_HHS_BH_MT64x128x32_MI16x16x16x1_SN_1LDSB0_AMAS3_ELFLR0_GLVWA8_GLVWB8_NLCB2_PLR3_SVW2_SKFT1_SKXCCM1_TT2_64_VW2_VWB2_WGM0
    SolutionIndex: 12
    SolutionNameMin: Cijk_Alik_Bjlk_HHS_BH_MT64x128x32_MI16x16x16x1_SN_1LDSB0_AMAS3_ELFLR12_GLVWA8_GLVWB8_NLCB2_PLR3_SVW2_SKFT1_SKXCCM1_TT2_64_VW2_VWB2_WGM0
    SolutionIndex: 13
    SolutionNameMin: Cijk_Alik_Bjlk_HHS_BH_MT64x128x32_MI16x16x16x1_SN_1LDSB0_AMAS3_ELFLR12_GLVWA8_GLVWB8_NLCB1_PLR3_SVW2_SKFT0_SKXCCM1_TT2_64_VW2_VWB2_WGM8
    SolutionIndex: 14
    SolutionNameMin: Cijk_Alik_Bjlk_HHS_BH_MT64x128x32_MI16x16x16x1_SN_1LDSB0_AMAS3_ELFLR0_GLVWA8_GLVWB8_NLCB1_PLR3_SVW2_SKFT1_SKXCCM1_TT2_64_VW2_VWB2_WGM8
    SolutionIndex: 15
    SolutionNameMin: Cijk_Alik_Bjlk_HHS_BH_MT64x128x32_MI16x16x16x1_SN_1LDSB0_AMAS3_ELFLR0_GLVWA8_GLVWB8_NLCB2_PLR3_SVW2_SKFT0_SKXCCM1_TT2_64_VW2_VWB2_WGM8
    SolutionIndex: 16
    SolutionNameMin: Cijk_Alik_Bjlk_HHS_BH_MT64x128x32_MI16x16x16x1_SN_1LDSB0_AMAS3_ELFLR12_GLVWA8_GLVWB8_NLCB2_PLR3_SVW2_SKFT0_SKXCCM1_TT2_64_VW2_VWB2_WGM8
    SolutionIndex: 17
    SolutionNameMin: Cijk_Alik_Bjlk_HHS_BH_MT64x128x32_MI16x16x16x1_SN_1LDSB0_AMAS3_ELFLR0_GLVWA8_GLVWB8_NLCB2_PLR3_SVW2_SKFT1_SKXCCM0_TT2_64_VW2_VWB2_WGM8
    SolutionIndex: 18
    SolutionNameMin: Cijk_Alik_Bjlk_HHS_BH_MT64x128x32_MI16x16x16x1_SN_1LDSB0_AMAS3_ELFLR0_GLVWA8_GLVWB8_NLCB2_PLR3_SVW2_SKFT1_SKXCCM1_TT2_64_VW2_VWB2_WGM8
    SolutionIndex: 19
    SolutionNameMin: Cijk_Alik_Bjlk_HHS_BH_MT64x128x32_MI16x16x16x1_SN_1LDSB0_AMAS3_ELFLR12_GLVWA8_GLVWB8_NLCB2_PLR3_SVW2_SKFT1_SKXCCM1_TT2_64_VW2_VWB2_WGM8
    SolutionIndex: 20
    SolutionNameMin: Cijk_Alik_Bjlk_HHS_BH_MT64x64x32_MI16x16x16x1_SN_1LDSB0_AMAS3_ELFLR0_GLVWA8_GLVWB8_NLCB1_PLR3_SVW2_SKFT0_SKXCCM0_TT2_32_VW2_VWB2_WGM0
    SolutionIndex: 21
    SolutionNameMin: Cijk_Alik_Bjlk_HHS_BH_MT64x64x32_MI16x16x16x1_SN_1LDSB0_AMAS3_ELFLR12_GLVWA8_GLVWB8_NLCB1_PLR3_SVW2_SKFT0_SKXCCM0_TT2_32_VW2_VWB2_WGM0
    SolutionIndex: 22
    SolutionNameMin: Cijk_Alik_Bjlk_HHS_BH_MT64x64x32_MI16x16x16x1_SN_1LDSB0_AMAS3_ELFLR0_GLVWA8_GLVWB8_NLCB1_PLR3_SVW2_SKFT0_SKXCCM1_TT2_32_VW2_VWB2_WGM0
    SolutionIndex: 23
    SolutionNameMin: Cijk_Alik_Bjlk_HHS_BH_MT64x64x32_MI16x16x16x1_SN_1LDSB0_AMAS3_ELFLR12_GLVWA8_GLVWB8_NLCB1_PLR3_SVW2_SKFT0_SKXCCM1_TT2_32_VW2_VWB2_WGM0
    SolutionIndex: 24
    SolutionNameMin: Cijk_Alik_Bjlk_HHS_BH_MT64x64x32_MI16x16x16x1_SN_1LDSB0_AMAS3_ELFLR0_GLVWA8_GLVWB8_NLCB1_PLR3_SVW2_SKFT1_SKXCCM0_TT2_32_VW2_VWB2_WGM0
    SolutionIndex: 25
    SolutionNameMin: Cijk_Alik_Bjlk_HHS_BH_MT64x64x32_MI16x16x16x1_SN_1LDSB0_AMAS3_ELFLR12_GLVWA8_GLVWB8_NLCB1_PLR3_SVW2_SKFT1_SKXCCM0_TT2_32_VW2_VWB2_WGM0
    SolutionIndex: 26
    SolutionNameMin: Cijk_Alik_Bjlk_HHS_BH_MT64x64x32_MI16x16x16x1_SN_1LDSB0_AMAS3_ELFLR0_GLVWA8_GLVWB8_NLCB1_PLR3_SVW2_SKFT1_SKXCCM1_TT2_32_VW2_VWB2_WGM0
    SolutionIndex: 27
    SolutionNameMin: Cijk_Alik_Bjlk_HHS_BH_MT64x64x32_MI16x16x16x1_SN_1LDSB0_AMAS3_ELFLR12_GLVWA8_GLVWB8_NLCB1_PLR3_SVW2_SKFT1_SKXCCM1_TT2_32_VW2_VWB2_WGM0
    SolutionIndex: 28
    SolutionNameMin: Cijk_Alik_Bjlk_HHS_BH_MT64x64x32_MI16x16x16x1_SN_1LDSB0_AMAS3_ELFLR0_GLVWA8_GLVWB8_NLCB1_PLR3_SVW2_SKFT0_SKXCCM0_TT2_32_VW2_VWB2_WGM8
    SolutionIndex: 29
    SolutionNameMin: Cijk_Alik_Bjlk_HHS_BH_MT64x64x32_MI16x16x16x1_SN_1LDSB0_AMAS3_ELFLR0_GLVWA8_GLVWB8_NLCB1_PLR3_SVW2_SKFT0_SKXCCM1_TT2_32_VW2_VWB2_WGM8
    SolutionIndex: 30
    SolutionNameMin: Cijk_Alik_Bjlk_HHS_BH_MT64x64x32_MI16x16x16x1_SN_1LDSB0_AMAS3_ELFLR12_GLVWA8_GLVWB8_NLCB1_PLR3_SVW2_SKFT0_SKXCCM1_TT2_32_VW2_VWB2_WGM8
    SolutionIndex: 31
    SolutionNameMin: Cijk_Alik_Bjlk_HHS_BH_MT64x64x32_MI16x16x16x1_SN_1LDSB0_AMAS3_ELFLR0_GLVWA8_GLVWB8_NLCB1_PLR3_SVW2_SKFT1_SKXCCM0_TT2_32_VW2_VWB2_WGM8
    SolutionIndex: 32
    SolutionNameMin: Cijk_Alik_Bjlk_HHS_BH_MT64x64x32_MI16x16x16x1_SN_1LDSB0_AMAS3_ELFLR12_GLVWA8_GLVWB8_NLCB1_PLR3_SVW2_SKFT1_SKXCCM0_TT2_32_VW2_VWB2_WGM8
    SolutionIndex: 33
    SolutionNameMin: Cijk_Alik_Bjlk_HHS_BH_MT64x64x32_MI16x16x16x1_SN_1LDSB0_AMAS3_ELFLR0_GLVWA8_GLVWB8_NLCB1_PLR3_SVW2_SKFT1_SKXCCM1_TT2_32_VW2_VWB2_WGM8
    SolutionIndex: 34
    SolutionNameMin: Cijk_Alik_Bjlk_HHS_BH_MT64x64x32_MI16x16x16x1_SN_1LDSB0_AMAS3_ELFLR12_GLVWA8_GLVWB8_NLCB1_PLR3_SVW2_SKFT1_SKXCCM1_TT2_32_VW2_VWB2_WGM8
    SolutionIndex: 35
    SolutionNameMin: Cijk_Alik_Bjlk_HHS_BH_MT64x32x32_MI16x16x16x1_SN_1LDSB0_AMAS3_ELFLR12_GLVWA8_GLVWB4_NLCB1_PLR3_SVW2_SKFT0_SKXCCM0_TT2_16_VW2_VWB1_WGM0
    SolutionIndex: 36
    SolutionNameMin: Cijk_Alik_Bjlk_HHS_BH_MT64x32x32_MI16x16x16x1_SN_1LDSB0_AMAS3_ELFLR0_GLVWA8_GLVWB4_NLCB1_PLR3_SVW2_SKFT0_SKXCCM1_TT2_16_VW2_VWB1_WGM0
    SolutionIndex: 37
    SolutionNameMin: Cijk_Alik_Bjlk_HHS_BH_MT64x32x32_MI16x16x16x1_SN_1LDSB0_AMAS3_ELFLR12_GLVWA8_GLVWB4_NLCB1_PLR3_SVW2_SKFT0_SKXCCM1_TT2_16_VW2_VWB1_WGM0
    SolutionIndex: 38
    SolutionNameMin: Cijk_Alik_Bjlk_HHS_BH_MT64x32x32_MI16x16x16x1_SN_1LDSB0_AMAS3_ELFLR0_GLVWA8_GLVWB4_NLCB1_PLR3_SVW2_SKFT1_SKXCCM0_TT2_16_VW2_VWB1_WGM0
    SolutionIndex: 39
    SolutionNameMin: Cijk_Alik_Bjlk_HHS_BH_MT64x32x32_MI16x16x16x1_SN_1LDSB0_AMAS3_ELFLR12_GLVWA8_GLVWB4_NLCB1_PLR3_SVW2_SKFT1_SKXCCM0_TT2_16_VW2_VWB1_WGM0
    SolutionIndex: 40
    SolutionNameMin: Cijk_Alik_Bjlk_HHS_BH_MT64x32x32_MI16x16x16x1_SN_1LDSB0_AMAS3_ELFLR0_GLVWA8_GLVWB4_NLCB1_PLR3_SVW2_SKFT1_SKXCCM1_TT2_16_VW2_VWB1_WGM0
    SolutionIndex: 41
    SolutionNameMin: Cijk_Alik_Bjlk_HHS_BH_MT64x32x32_MI16x16x16x1_SN_1LDSB0_AMAS3_ELFLR12_GLVWA8_GLVWB4_NLCB1_PLR3_SVW2_SKFT1_SKXCCM1_TT2_16_VW2_VWB1_WGM0
    SolutionIndex: 42
    SolutionNameMin: Cijk_Alik_Bjlk_HHS_BH_MT64x32x32_MI16x16x16x1_SN_1LDSB0_AMAS3_ELFLR12_GLVWA8_GLVWB4_NLCB1_PLR3_SVW2_SKFT0_SKXCCM0_TT2_16_VW2_VWB1_WGM8
    SolutionIndex: 43
    SolutionNameMin: Cijk_Alik_Bjlk_HHS_BH_MT64x32x32_MI16x16x16x1_SN_1LDSB0_AMAS3_ELFLR0_GLVWA8_GLVWB4_NLCB1_PLR3_SVW2_SKFT0_SKXCCM1_TT2_16_VW2_VWB1_WGM8
    SolutionIndex: 44
    SolutionNameMin: Cijk_Alik_Bjlk_HHS_BH_MT64x32x32_MI16x16x16x1_SN_1LDSB0_AMAS3_ELFLR12_GLVWA8_GLVWB4_NLCB1_PLR3_SVW2_SKFT0_SKXCCM1_TT2_16_VW2_VWB1_WGM8
    SolutionIndex: 45
    SolutionNameMin: Cijk_Alik_Bjlk_HHS_BH_MT64x32x32_MI16x16x16x1_SN_1LDSB0_AMAS3_ELFLR0_GLVWA8_GLVWB4_NLCB1_PLR3_SVW2_SKFT1_SKXCCM0_TT2_16_VW2_VWB1_WGM8
    SolutionIndex: 46
    SolutionNameMin: Cijk_Alik_Bjlk_HHS_BH_MT64x32x32_MI16x16x16x1_SN_1LDSB0_AMAS3_ELFLR0_GLVWA8_GLVWB4_NLCB1_PLR3_SVW2_SKFT1_SKXCCM1_TT2_16_VW2_VWB1_WGM8
    SolutionIndex: 47
    SolutionNameMin: Cijk_Alik_Bjlk_HHS_BH_MT64x32x32_MI16x16x16x1_SN_1LDSB0_AMAS3_ELFLR12_GLVWA8_GLVWB4_NLCB1_PLR3_SVW2_SKFT1_SKXCCM1_TT2_16_VW2_VWB1_WGM8
    SolutionIndex: 48
    SolutionNameMin: Cijk_Alik_Bjlk_HHS_BH_MT256x256x32_MI16x16x16x1_SN_1LDSB0_AMAS3_ELFLR0_GLVWA8_GLVWB8_NLCB1_PLR3_SVW4_SKFT0_SKXCCM1_TT8_128_VW4_VWB4_WGM0
    SolutionIndex: 49
    SolutionNameMin: Cijk_Alik_Bjlk_HHS_BH_MT256x256x32_MI16x16x16x1_SN_1LDSB0_AMAS3_ELFLR0_GLVWA8_GLVWB8_NLCB2_PLR3_SVW4_SKFT0_SKXCCM0_TT8_128_VW4_VWB4_WGM0
    SolutionIndex: 50
    SolutionNameMin: Cijk_Alik_Bjlk_HHS_BH_MT256x256x32_MI16x16x16x1_SN_1LDSB0_AMAS3_ELFLR0_GLVWA8_GLVWB8_NLCB2_PLR3_SVW4_SKFT0_SKXCCM1_TT8_128_VW4_VWB4_WGM0
    SolutionIndex: 51
    SolutionNameMin: Cijk_Alik_Bjlk_HHS_BH_MT256x256x32_MI16x16x16x1_SN_1LDSB0_AMAS3_ELFLR0_GLVWA8_GLVWB8_NLCB1_PLR3_SVW4_SKFT0_SKXCCM1_TT8_128_VW4_VWB4_WGM8
    SolutionIndex: 52
    SolutionNameMin: Cijk_Alik_Bjlk_HHS_BH_MT256x256x32_MI16x16x16x1_SN_1LDSB0_AMAS3_ELFLR0_GLVWA8_GLVWB8_NLCB1_PLR3_SVW4_SKFT1_SKXCCM1_TT8_128_VW4_VWB4_WGM8
    SolutionIndex: 53
    SolutionNameMin: Cijk_Alik_Bjlk_HHS_BH_MT256x256x32_MI16x16x16x1_SN_1LDSB0_AMAS3_ELFLR0_GLVWA8_GLVWB8_NLCB2_PLR3_SVW4_SKFT0_SKXCCM1_TT8_128_VW4_VWB4_WGM8
    SolutionIndex: 54
    SolutionNameMin: Cijk_Alik_Bjlk_HHS_BH_MT128x256x32_MI16x16x16x1_SN_1LDSB0_AMAS3_ELFLR12_GLVWA8_GLVWB8_NLCB1_PLR3_SVW4_SKFT0_SKXCCM0_TT4_128_VW4_VWB4_WGM0
    SolutionIndex: 55
    SolutionNameMin: Cijk_Alik_Bjlk_HHS_BH_MT128x256x32_MI16x16x16x1_SN_1LDSB0_AMAS3_ELFLR0_GLVWA8_GLVWB8_NLCB1_PLR3_SVW4_SKFT0_SKXCCM1_TT4_128_VW4_VWB4_WGM0
    SolutionIndex: 56
    SolutionNameMin: Cijk_Alik_Bjlk_HHS_BH_MT128x256x32_MI16x16x16x1_SN_1LDSB0_AMAS3_ELFLR12_GLVWA8_GLVWB8_NLCB1_PLR3_SVW4_SKFT1_SKXCCM0_TT4_128_VW4_VWB4_WGM0
    SolutionIndex: 57
    SolutionNameMin: Cijk_Alik_Bjlk_HHS_BH_MT128x256x32_MI16x16x16x1_SN_1LDSB0_AMAS3_ELFLR0_GLVWA8_GLVWB8_NLCB1_PLR3_SVW4_SKFT1_SKXCCM1_TT4_128_VW4_VWB4_WGM0
    SolutionIndex: 58
    SolutionNameMin: Cijk_Alik_Bjlk_HHS_BH_MT128x256x32_MI16x16x16x1_SN_1LDSB0_AMAS3_ELFLR12_GLVWA8_GLVWB8_NLCB1_PLR3_SVW4_SKFT1_SKXCCM1_TT4_128_VW4_VWB4_WGM0
    SolutionIndex: 59
    SolutionNameMin: Cijk_Alik_Bjlk_HHS_BH_MT128x256x32_MI16x16x16x1_SN_1LDSB0_AMAS3_ELFLR0_GLVWA8_GLVWB8_NLCB2_PLR3_SVW4_SKFT0_SKXCCM0_TT4_128_VW4_VWB4_WGM0
    SolutionIndex: 60
    SolutionNameMin: Cijk_Alik_Bjlk_HHS_BH_MT128x256x32_MI16x16x16x1_SN_1LDSB0_AMAS3_ELFLR0_GLVWA8_GLVWB8_NLCB2_PLR3_SVW4_SKFT1_SKXCCM0_TT4_128_VW4_VWB4_WGM0
    SolutionIndex: 61
    SolutionNameMin: Cijk_Alik_Bjlk_HHS_BH_MT128x256x32_MI16x16x16x1_SN_1LDSB0_AMAS3_ELFLR0_GLVWA8_GLVWB8_NLCB2_PLR3_SVW4_SKFT1_SKXCCM1_TT4_128_VW4_VWB4_WGM0
    SolutionIndex: 62
    SolutionNameMin: Cijk_Alik_Bjlk_HHS_BH_MT128x256x32_MI16x16x16x1_SN_1LDSB0_AMAS3_ELFLR12_GLVWA8_GLVWB8_NLCB2_PLR3_SVW4_SKFT1_SKXCCM1_TT4_128_VW4_VWB4_WGM0
    SolutionIndex: 63
    SolutionNameMin: Cijk_Alik_Bjlk_HHS_BH_MT128x256x32_MI16x16x16x1_SN_1LDSB0_AMAS3_ELFLR0_GLVWA8_GLVWB8_NLCB1_PLR3_SVW4_SKFT0_SKXCCM1_TT4_128_VW4_VWB4_WGM8
    SolutionIndex: 64
    SolutionNameMin: Cijk_Alik_Bjlk_HHS_BH_MT128x256x32_MI16x16x16x1_SN_1LDSB0_AMAS3_ELFLR0_GLVWA8_GLVWB8_NLCB1_PLR3_SVW4_SKFT1_SKXCCM1_TT4_128_VW4_VWB4_WGM8
    SolutionIndex: 65
    SolutionNameMin: Cijk_Alik_Bjlk_HHS_BH_MT128x256x32_MI16x16x16x1_SN_1LDSB0_AMAS3_ELFLR12_GLVWA8_GLVWB8_NLCB1_PLR3_SVW4_SKFT1_SKXCCM1_TT4_128_VW4_VWB4_WGM8
    SolutionIndex: 66
    SolutionNameMin: Cijk_Alik_Bjlk_HHS_BH_MT128x256x32_MI16x16x16x1_SN_1LDSB0_AMAS3_ELFLR0_GLVWA8_GLVWB8_NLCB2_PLR3_SVW4_SKFT0_SKXCCM1_TT4_128_VW4_VWB4_WGM8
    SolutionIndex: 67
    SolutionNameMin: Cijk_Alik_Bjlk_HHS_BH_MT128x256x32_MI16x16x16x1_SN_1LDSB0_AMAS3_ELFLR12_GLVWA8_GLVWB8_NLCB2_PLR3_SVW4_SKFT0_SKXCCM1_TT4_128_VW4_VWB4_WGM8
    SolutionIndex: 68
    SolutionNameMin: Cijk_Alik_Bjlk_HHS_BH_MT128x256x32_MI16x16x16x1_SN_1LDSB0_AMAS3_ELFLR12_GLVWA8_GLVWB8_NLCB2_PLR3_SVW4_SKFT1_SKXCCM1_TT4_128_VW4_VWB4_WGM8
    SolutionIndex: 69
    SolutionNameMin: Cijk_Alik_Bjlk_HHS_BH_MT128x128x32_MI16x16x16x1_SN_1LDSB0_AMAS3_ELFLR0_GLVWA8_GLVWB8_NLCB1_PLR3_SVW4_SKFT0_SKXCCM1_TT4_64_VW4_VWB4_WGM0
    SolutionIndex: 70
    SolutionNameMin: Cijk_Alik_Bjlk_HHS_BH_MT128x128x32_MI16x16x16x1_SN_1LDSB0_AMAS3_ELFLR12_GLVWA8_GLVWB8_NLCB1_PLR3_SVW4_SKFT1_SKXCCM0_TT4_64_VW4_VWB4_WGM0
    SolutionIndex: 71
    SolutionNameMin: Cijk_Alik_Bjlk_HHS_BH_MT128x128x32_MI16x16x16x1_SN_1LDSB0_AMAS3_ELFLR12_GLVWA8_GLVWB8_NLCB1_PLR3_SVW4_SKFT1_SKXCCM1_TT4_64_VW4_VWB4_WGM0
    SolutionIndex: 72
    SolutionNameMin: Cijk_Alik_Bjlk_HHS_BH_MT128x128x32_MI16x16x16x1_SN_1LDSB0_AMAS3_ELFLR12_GLVWA8_GLVWB8_NLCB2_PLR3_SVW4_SKFT1_SKXCCM0_TT4_64_VW4_VWB4_WGM0
    SolutionIndex: 73
    SolutionNameMin: Cijk_Alik_Bjlk_HHS_BH_MT128x128x32_MI16x16x16x1_SN_1LDSB0_AMAS3_ELFLR0_GLVWA8_GLVWB8_NLCB2_PLR3_SVW4_SKFT1_SKXCCM1_TT4_64_VW4_VWB4_WGM0
    SolutionIndex: 74
    SolutionNameMin: Cijk_Alik_Bjlk_HHS_BH_MT128x128x32_MI16x16x16x1_SN_1LDSB0_AMAS3_ELFLR0_GLVWA8_GLVWB8_NLCB1_PLR3_SVW4_SKFT0_SKXCCM0_TT4_64_VW4_VWB4_WGM8
    SolutionIndex: 75
    SolutionNameMin: Cijk_Alik_Bjlk_HHS_BH_MT128x128x32_MI16x16x16x1_SN_1LDSB0_AMAS3_ELFLR0_GLVWA8_GLVWB8_NLCB1_PLR3_SVW4_SKFT0_SKXCCM1_TT4_64_VW4_VWB4_WGM8
    SolutionIndex: 76
    SolutionNameMin: Cijk_Alik_Bjlk_HHS_BH_MT128x128x32_MI16x16x16x1_SN_1LDSB0_AMAS3_ELFLR12_GLVWA8_GLVWB8_NLCB1_PLR3_SVW4_SKFT0_SKXCCM1_TT4_64_VW4_VWB4_WGM8
    SolutionIndex: 77
    SolutionNameMin: Cijk_Alik_Bjlk_HHS_BH_MT128x128x32_MI16x16x16x1_SN_1LDSB0_AMAS3_ELFLR0_GLVWA8_GLVWB8_NLCB1_PLR3_SVW4_SKFT1_SKXCCM1_TT4_64_VW4_VWB4_WGM8
    SolutionIndex: 78
    SolutionNameMin: Cijk_Alik_Bjlk_HHS_BH_MT128x128x32_MI16x16x16x1_SN_1LDSB0_AMAS3_ELFLR12_GLVWA8_GLVWB8_NLCB1_PLR3_SVW4_SKFT1_SKXCCM1_TT4_64_VW4_VWB4_WGM8
    SolutionIndex: 79
    SolutionNameMin: Cijk_Alik_Bjlk_HHS_BH_MT128x128x32_MI16x16x16x1_SN_1LDSB0_AMAS3_ELFLR0_GLVWA8_GLVWB8_NLCB2_PLR3_SVW4_SKFT0_SKXCCM1_TT4_64_VW4_VWB4_WGM8
    SolutionIndex: 80
    SolutionNameMin: Cijk_Alik_Bjlk_HHS_BH_MT128x128x32_MI16x16x16x1_SN_1LDSB0_AMAS3_ELFLR12_GLVWA8_GLVWB8_NLCB2_PLR3_SVW4_SKFT1_SKXCCM0_TT4_64_VW4_VWB4_WGM8
    SolutionIndex: 81
    SolutionNameMin: Cijk_Alik_Bjlk_HHS_BH_MT128x128x32_MI16x16x16x1_SN_1LDSB0_AMAS3_ELFLR0_GLVWA8_GLVWB8_NLCB2_PLR3_SVW4_SKFT1_SKXCCM1_TT4_64_VW4_VWB4_WGM8
    SolutionIndex: 82
    SolutionNameMin: Cijk_Alik_Bjlk_HHS_BH_MT128x64x32_MI16x16x16x1_SN_1LDSB0_AMAS3_ELFLR0_GLVWA8_GLVWB8_NLCB1_PLR3_SVW4_SKFT1_SKXCCM0_TT4_32_VW4_VWB1_WGM0
    SolutionIndex: 83
    SolutionNameMin: Cijk_Alik_Bjlk_HHS_BH_MT128x64x32_MI16x16x16x1_SN_1LDSB0_AMAS3_ELFLR0_GLVWA8_GLVWB8_NLCB1_PLR3_SVW4_SKFT0_SKXCCM1_TT4_32_VW4_VWB1_WGM8
    SolutionIndex: 84
    SolutionNameMin: Cijk_Alik_Bjlk_HHS_BH_MT128x64x32_MI16x16x16x1_SN_1LDSB0_AMAS3_ELFLR12_GLVWA8_GLVWB8_NLCB1_PLR3_SVW4_SKFT0_SKXCCM1_TT4_32_VW4_VWB1_WGM8
    SolutionIndex: 85
    SolutionNameMin: Cijk_Alik_Bjlk_HHS_BH_MT128x64x32_MI16x16x16x1_SN_1LDSB0_AMAS3_ELFLR0_GLVWA8_GLVWB8_NLCB1_PLR3_SVW4_SKFT1_SKXCCM0_TT4_32_VW4_VWB1_WGM8
    SolutionIndex: 86
    SolutionNameMin: Cijk_Alik_Bjlk_HHS_BH_MT128x64x32_MI16x16x16x1_SN_1LDSB0_AMAS3_ELFLR0_GLVWA8_GLVWB8_NLCB1_PLR3_SVW4_SKFT1_SKXCCM1_TT4_32_VW4_VWB1_WGM8
    SolutionIndex: 87
    SolutionNameMin: Cijk_Alik_Bjlk_HHS_BH_MT256x256x32_MI16x16x16x1_SN_1LDSB1_AMAS3_ELFLR0_GLVWA8_GLVWB8_NLCB1_PLR3_SVW4_SKFT0_SKXCCM1_TT8_128_VW4_VWB4_WGM0
    SolutionIndex: 88
    SolutionNameMin: Cijk_Alik_Bjlk_HHS_BH_MT256x256x32_MI16x16x16x1_SN_1LDSB1_AMAS3_ELFLR12_GLVWA8_GLVWB8_NLCB1_PLR3_SVW4_SKFT0_SKXCCM1_TT8_128_VW4_VWB4_WGM0
    SolutionIndex: 89
    SolutionNameMin: Cijk_Alik_Bjlk_HHS_BH_MT256x256x32_MI16x16x16x1_SN_1LDSB1_AMAS3_ELFLR0_GLVWA8_GLVWB8_NLCB1_PLR3_SVW4_SKFT1_SKXCCM1_TT8_128_VW4_VWB4_WGM0
    SolutionIndex: 90
    SolutionNameMin: Cijk_Alik_Bjlk_HHS_BH_MT256x256x32_MI16x16x16x1_SN_1LDSB1_AMAS3_ELFLR0_GLVWA8_GLVWB8_NLCB2_PLR3_SVW4_SKFT0_SKXCCM0_TT8_128_VW4_VWB4_WGM0
    SolutionIndex: 91
    SolutionNameMin: Cijk_Alik_Bjlk_HHS_BH_MT256x256x32_MI16x16x16x1_SN_1LDSB1_AMAS3_ELFLR0_GLVWA8_GLVWB8_NLCB2_PLR3_SVW4_SKFT1_SKXCCM1_TT8_128_VW4_VWB4_WGM0
    SolutionIndex: 92
    SolutionNameMin: Cijk_Alik_Bjlk_HHS_BH_MT256x256x32_MI16x16x16x1_SN_1LDSB1_AMAS3_ELFLR12_GLVWA8_GLVWB8_NLCB2_PLR3_SVW4_SKFT1_SKXCCM1_TT8_128_VW4_VWB4_WGM0
    SolutionIndex: 93
    SolutionNameMin: Cijk_Alik_Bjlk_HHS_BH_MT256x256x32_MI16x16x16x1_SN_1LDSB1_AMAS3_ELFLR0_GLVWA8_GLVWB8_NLCB1_PLR3_SVW4_SKFT0_SKXCCM1_TT8_128_VW4_VWB4_WGM8
    SolutionIndex: 94
    SolutionNameMin: Cijk_Alik_Bjlk_HHS_BH_MT256x256x32_MI16x16x16x1_SN_1LDSB1_AMAS3_ELFLR12_GLVWA8_GLVWB8_NLCB1_PLR3_SVW4_SKFT0_SKXCCM1_TT8_128_VW4_VWB4_WGM8
    SolutionIndex: 95
    SolutionNameMin: Cijk_Alik_Bjlk_HHS_BH_MT256x256x32_MI16x16x16x1_SN_1LDSB1_AMAS3_ELFLR0_GLVWA8_GLVWB8_NLCB1_PLR3_SVW4_SKFT1_SKXCCM1_TT8_128_VW4_VWB4_WGM8
    SolutionIndex: 96
    SolutionNameMin: Cijk_Alik_Bjlk_HHS_BH_MT256x256x32_MI16x16x16x1_SN_1LDSB1_AMAS3_ELFLR0_GLVWA8_GLVWB8_NLCB2_PLR3_SVW4_SKFT0_SKXCCM1_TT8_128_VW4_VWB4_WGM8
    SolutionIndex: 97
    SolutionNameMin: Cijk_Alik_Bjlk_HHS_BH_MT256x256x32_MI16x16x16x1_SN_1LDSB1_AMAS3_ELFLR0_GLVWA8_GLVWB8_NLCB2_PLR3_SVW4_SKFT1_SKXCCM0_TT8_128_VW4_VWB4_WGM8
    SolutionIndex: 98
    SolutionNameMin: Cijk_Alik_Bjlk_HHS_BH_MT256x256x32_MI16x16x16x1_SN_1LDSB1_AMAS3_ELFLR12_GLVWA8_GLVWB8_NLCB2_PLR3_SVW4_SKFT1_SKXCCM1_TT8_128_VW4_VWB4_WGM8
    SolutionIndex: 99
    SolutionNameMin: Cijk_Alik_Bjlk_HHS_BH_MT128x256x32_MI16x16x16x1_SN_1LDSB1_AMAS3_ELFLR0_GLVWA8_GLVWB8_NLCB1_PLR3_SVW4_SKFT0_SKXCCM1_TT4_128_VW4_VWB4_WGM0
    SolutionIndex: 100
    SolutionNameMin: Cijk_Alik_Bjlk_HHS_BH_MT128x256x32_MI16x16x16x1_SN_1LDSB1_AMAS3_ELFLR0_GLVWA8_GLVWB8_NLCB1_PLR3_SVW4_SKFT1_SKXCCM1_TT4_128_VW4_VWB4_WGM0
    SolutionIndex: 101
    SolutionNameMin: Cijk_Alik_Bjlk_HHS_BH_MT128x256x32_MI16x16x16x1_SN_1LDSB1_AMAS3_ELFLR0_GLVWA8_GLVWB8_NLCB2_PLR3_SVW4_SKFT0_SKXCCM0_TT4_128_VW4_VWB4_WGM0
    SolutionIndex: 102
    SolutionNameMin: Cijk_Alik_Bjlk_HHS_BH_MT128x256x32_MI16x16x16x1_SN_1LDSB1_AMAS3_ELFLR0_GLVWA8_GLVWB8_NLCB2_PLR3_SVW4_SKFT1_SKXCCM1_TT4_128_VW4_VWB4_WGM0
    SolutionIndex: 103
    SolutionNameMin: Cijk_Alik_Bjlk_HHS_BH_MT128x256x32_MI16x16x16x1_SN_1LDSB1_AMAS3_ELFLR12_GLVWA8_GLVWB8_NLCB2_PLR3_SVW4_SKFT1_SKXCCM1_TT4_128_VW4_VWB4_WGM0
    SolutionIndex: 104
    SolutionNameMin: Cijk_Alik_Bjlk_HHS_BH_MT128x256x32_MI16x16x16x1_SN_1LDSB1_AMAS3_ELFLR0_GLVWA8_GLVWB8_NLCB1_PLR3_SVW4_SKFT0_SKXCCM1_TT4_128_VW4_VWB4_WGM8
    SolutionIndex: 105
    SolutionNameMin: Cijk_Alik_Bjlk_HHS_BH_MT128x256x32_MI16x16x16x1_SN_1LDSB1_AMAS3_ELFLR12_GLVWA8_GLVWB8_NLCB1_PLR3_SVW4_SKFT0_SKXCCM1_TT4_128_VW4_VWB4_WGM8
    SolutionIndex: 106
    SolutionNameMin: Cijk_Alik_Bjlk_HHS_BH_MT128x256x32_MI16x16x16x1_SN_1LDSB1_AMAS3_ELFLR0_GLVWA8_GLVWB8_NLCB2_PLR3_SVW4_SKFT0_SKXCCM1_TT4_128_VW4_VWB4_WGM8
    SolutionIndex: 107
    SolutionNameMin: Cijk_Alik_Bjlk_HHS_BH_MT128x256x32_MI16x16x16x1_SN_1LDSB1_AMAS3_ELFLR12_GLVWA8_GLVWB8_NLCB2_PLR3_SVW4_SKFT0_SKXCCM1_TT4_128_VW4_VWB4_WGM8
    SolutionIndex: 108
    SolutionNameMin: Cijk_Alik_Bjlk_HHS_BH_MT128x256x32_MI16x16x16x1_SN_1LDSB1_AMAS3_ELFLR0_GLVWA8_GLVWB8_NLCB2_PLR3_SVW4_SKFT1_SKXCCM1_TT4_128_VW4_VWB4_WGM8
    SolutionIndex: 109
    SolutionNameMin: Cijk_Alik_Bjlk_HHS_BH_MT128x256x32_MI16x16x16x1_SN_1LDSB1_AMAS3_ELFLR12_GLVWA8_GLVWB8_NLCB2_PLR3_SVW4_SKFT1_SKXCCM1_TT4_128_VW4_VWB4_WGM8
    SolutionIndex: 110
    SolutionNameMin: Cijk_Alik_Bjlk_HHS_BH_MT128x128x32_MI16x16x16x1_SN_1LDSB1_AMAS3_ELFLR12_GLVWA8_GLVWB8_NLCB1_PLR3_SVW4_SKFT1_SKXCCM1_TT4_64_VW4_VWB4_WGM0
    SolutionIndex: 111
    SolutionNameMin: Cijk_Alik_Bjlk_HHS_BH_MT128x128x32_MI16x16x16x1_SN_1LDSB1_AMAS3_ELFLR0_GLVWA8_GLVWB8_NLCB2_PLR3_SVW4_SKFT0_SKXCCM1_TT4_64_VW4_VWB4_WGM0
    SolutionIndex: 112
    SolutionNameMin: Cijk_Alik_Bjlk_HHS_BH_MT128x128x32_MI16x16x16x1_SN_1LDSB1_AMAS3_ELFLR0_GLVWA8_GLVWB8_NLCB1_PLR3_SVW4_SKFT0_SKXCCM1_TT4_64_VW4_VWB4_WGM8
    SolutionIndex: 113
    SolutionNameMin: Cijk_Alik_Bjlk_HHS_BH_MT128x128x32_MI16x16x16x1_SN_1LDSB1_AMAS3_ELFLR0_GLVWA8_GLVWB8_NLCB1_PLR3_SVW4_SKFT1_SKXCCM1_TT4_64_VW4_VWB4_WGM8
    SolutionIndex: 114
    SolutionNameMin: Cijk_Alik_Bjlk_HHS_BH_MT128x128x32_MI16x16x16x1_SN_1LDSB1_AMAS3_ELFLR0_GLVWA8_GLVWB8_NLCB2_PLR3_SVW4_SKFT0_SKXCCM1_TT4_64_VW4_VWB4_WGM8
    SolutionIndex: 115
    SolutionNameMin: Cijk_Alik_Bjlk_HHS_BH_MT128x128x32_MI16x16x16x1_SN_1LDSB1_AMAS3_ELFLR12_GLVWA8_GLVWB8_NLCB2_PLR3_SVW4_SKFT0_SKXCCM1_TT4_64_VW4_VWB4_WGM8
    SolutionIndex: 116
    SolutionNameMin: Cijk_Alik_Bjlk_HHS_BH_MT128x128x32_MI16x16x16x1_SN_1LDSB1_AMAS3_ELFLR0_GLVWA8_GLVWB8_NLCB2_PLR3_SVW4_SKFT1_SKXCCM1_TT4_64_VW4_VWB4_WGM8
    SolutionIndex: 117
    SolutionNameMin: Cijk_Alik_Bjlk_HHS_BH_MT128x128x32_MI16x16x16x1_SN_1LDSB1_AMAS3_ELFLR12_GLVWA8_GLVWB8_NLCB2_PLR3_SVW4_SKFT1_SKXCCM1_TT4_64_VW4_VWB4_WGM8
    SolutionIndex: 118
    SolutionNameMin: Cijk_Alik_Bjlk_HHS_BH_MT32x64x64_MI16x16x16x1_SN_1LDSB0_AMAS0_ELFLR0_GLVWA8_GLVWB8_NLCB1_PLR5_SVW1_SKFT0_SKXCCM1_TT1_32_VW1_VWB1_WGM0
    SolutionIndex: 119
    SolutionNameMin: Cijk_Alik_Bjlk_HHS_BH_MT32x64x64_MI16x16x16x1_SN_1LDSB0_AMAS0_ELFLR12_GLVWA8_GLVWB8_NLCB1_PLR5_SVW1_SKFT0_SKXCCM1_TT1_32_VW1_VWB1_WGM0
    SolutionIndex: 120
    SolutionNameMin: Cijk_Alik_Bjlk_HHS_BH_MT32x64x64_MI16x16x16x1_SN_1LDSB0_AMAS0_ELFLR0_GLVWA8_GLVWB8_NLCB1_PLR5_SVW1_SKFT1_SKXCCM1_TT1_32_VW1_VWB1_WGM0
    SolutionIndex: 121
    SolutionNameMin: Cijk_Alik_Bjlk_HHS_BH_MT32x64x64_MI16x16x16x1_SN_1LDSB0_AMAS0_ELFLR12_GLVWA8_GLVWB8_NLCB1_PLR5_SVW1_SKFT1_SKXCCM1_TT1_32_VW1_VWB1_WGM0
    SolutionIndex: 122
    SolutionNameMin: Cijk_Alik_Bjlk_HHS_BH_MT32x64x64_MI16x16x16x1_SN_1LDSB0_AMAS0_ELFLR0_GLVWA8_GLVWB8_NLCB2_PLR5_SVW1_SKFT0_SKXCCM0_TT1_32_VW1_VWB1_WGM0
    SolutionIndex: 123
    SolutionNameMin: Cijk_Alik_Bjlk_HHS_BH_MT32x32x64_MI16x16x16x1_SN_1LDSB0_AMAS0_ELFLR0_GLVWA8_GLVWB8_NLCB1_PLR5_SVW1_SKFT0_SKXCCM0_TT1_16_VW1_VWB1_WGM0
    SolutionIndex: 124
    SolutionNameMin: Cijk_Alik_Bjlk_HHS_BH_MT32x32x64_MI16x16x16x1_SN_1LDSB0_AMAS0_ELFLR12_GLVWA8_GLVWB8_NLCB1_PLR5_SVW1_SKFT0_SKXCCM0_TT1_16_VW1_VWB1_WGM0
    SolutionIndex: 125
    SolutionNameMin: Cijk_Alik_Bjlk_HHS_BH_MT32x32x64_MI16x16x16x1_SN_1LDSB0_AMAS0_ELFLR0_GLVWA8_GLVWB8_NLCB1_PLR5_SVW1_SKFT0_SKXCCM1_TT1_16_VW1_VWB1_WGM0
    SolutionIndex: 126
    SolutionNameMin: Cijk_Alik_Bjlk_HHS_BH_MT32x32x64_MI16x16x16x1_SN_1LDSB0_AMAS0_ELFLR12_GLVWA8_GLVWB8_NLCB1_PLR5_SVW1_SKFT0_SKXCCM1_TT1_16_VW1_VWB1_WGM0
    SolutionIndex: 127
    SolutionNameMin: Cijk_Alik_Bjlk_HHS_BH_MT32x32x64_MI16x16x16x1_SN_1LDSB0_AMAS0_ELFLR0_GLVWA8_GLVWB8_NLCB1_PLR5_SVW1_SKFT1_SKXCCM0_TT1_16_VW1_VWB1_WGM0
    SolutionIndex: 128
    SolutionNameMin: Cijk_Alik_Bjlk_HHS_BH_MT32x32x64_MI16x16x16x1_SN_1LDSB0_AMAS0_ELFLR12_GLVWA8_GLVWB8_NLCB1_PLR5_SVW1_SKFT1_SKXCCM0_TT1_16_VW1_VWB1_WGM0
    SolutionIndex: 129
    SolutionNameMin: Cijk_Alik_Bjlk_HHS_BH_MT32x32x64_MI16x16x16x1_SN_1LDSB0_AMAS0_ELFLR0_GLVWA8_GLVWB8_NLCB1_PLR5_SVW1_SKFT1_SKXCCM1_TT1_16_VW1_VWB1_WGM0
    SolutionIndex: 130
    SolutionNameMin: Cijk_Alik_Bjlk_HHS_BH_MT32x32x64_MI16x16x16x1_SN_1LDSB0_AMAS0_ELFLR12_GLVWA8_GLVWB8_NLCB1_PLR5_SVW1_SKFT1_SKXCCM1_TT1_16_VW1_VWB1_WGM0
    SolutionIndex: 131
    SolutionNameMin: Cijk_Alik_Bjlk_HHS_BH_MT32x32x64_MI16x16x16x1_SN_1LDSB0_AMAS0_ELFLR12_GLVWA8_GLVWB8_NLCB1_PLR5_SVW1_SKFT0_SKXCCM0_TT1_16_VW1_VWB1_WGM8
    SolutionIndex: 132
    SolutionNameMin: Cijk_Alik_Bjlk_HHS_BH_MT32x32x64_MI16x16x16x1_SN_1LDSB0_AMAS0_ELFLR0_GLVWA8_GLVWB8_NLCB1_PLR5_SVW1_SKFT0_SKXCCM1_TT1_16_VW1_VWB1_WGM8
    SolutionIndex: 133
    SolutionNameMin: Cijk_Alik_Bjlk_HHS_BH_MT32x32x64_MI16x16x16x1_SN_1LDSB0_AMAS0_ELFLR12_GLVWA8_GLVWB8_NLCB1_PLR5_SVW1_SKFT0_SKXCCM1_TT1_16_VW1_VWB1_WGM8
    SolutionIndex: 134
    SolutionNameMin: Cijk_Alik_Bjlk_HHS_BH_MT32x32x64_MI16x16x16x1_SN_1LDSB0_AMAS0_ELFLR12_GLVWA8_GLVWB8_NLCB1_PLR5_SVW1_SKFT1_SKXCCM1_TT1_16_VW1_VWB1_WGM8
    SolutionIndex: 135
    SolutionNameMin: Cijk_Alik_Bjlk_HHS_BH_MT64x128x64_MI16x16x16x1_SN_1LDSB0_AMAS3_ELFLR12_GLVWA8_GLVWB8_NLCB1_PLR5_SVW2_SKFT0_SKXCCM0_TT2_64_VW2_VWB2_WGM0
    SolutionIndex: 136
    SolutionNameMin: Cijk_Alik_Bjlk_HHS_BH_MT64x128x64_MI16x16x16x1_SN_1LDSB0_AMAS3_ELFLR12_GLVWA8_GLVWB8_NLCB1_PLR5_SVW2_SKFT0_SKXCCM1_TT2_64_VW2_VWB2_WGM0
    SolutionIndex: 137
    SolutionNameMin: Cijk_Alik_Bjlk_HHS_BH_MT64x128x64_MI16x16x16x1_SN_1LDSB0_AMAS3_ELFLR0_GLVWA8_GLVWB8_NLCB1_PLR5_SVW2_SKFT1_SKXCCM1_TT2_64_VW2_VWB2_WGM0
    SolutionIndex: 138
    SolutionNameMin: Cijk_Alik_Bjlk_HHS_BH_MT64x128x64_MI16x16x16x1_SN_1LDSB0_AMAS3_ELFLR12_GLVWA8_GLVWB8_NLCB1_PLR5_SVW2_SKFT1_SKXCCM1_TT2_64_VW2_VWB2_WGM0
    SolutionIndex: 139
    SolutionNameMin: Cijk_Alik_Bjlk_HHS_BH_MT64x128x64_MI16x16x16x1_SN_1LDSB0_AMAS3_ELFLR12_GLVWA8_GLVWB8_NLCB2_PLR5_SVW2_SKFT1_SKXCCM1_TT2_64_VW2_VWB2_WGM0
    SolutionIndex: 140
    SolutionNameMin: Cijk_Alik_Bjlk_HHS_BH_MT64x128x64_MI16x16x16x1_SN_1LDSB0_AMAS3_ELFLR0_GLVWA8_GLVWB8_NLCB1_PLR5_SVW2_SKFT0_SKXCCM0_TT2_64_VW2_VWB2_WGM8
    SolutionIndex: 141
    SolutionNameMin: Cijk_Alik_Bjlk_HHS_BH_MT64x128x64_MI16x16x16x1_SN_1LDSB0_AMAS3_ELFLR0_GLVWA8_GLVWB8_NLCB1_PLR5_SVW2_SKFT0_SKXCCM1_TT2_64_VW2_VWB2_WGM8
    SolutionIndex: 142
    SolutionNameMin: Cijk_Alik_Bjlk_HHS_BH_MT64x128x64_MI16x16x16x1_SN_1LDSB0_AMAS3_ELFLR12_GLVWA8_GLVWB8_NLCB1_PLR5_SVW2_SKFT1_SKXCCM1_TT2_64_VW2_VWB2_WGM8
    SolutionIndex: 143
    SolutionNameMin: Cijk_Alik_Bjlk_HHS_BH_MT64x128x64_MI16x16x16x1_SN_1LDSB0_AMAS3_ELFLR0_GLVWA8_GLVWB8_NLCB2_PLR5_SVW2_SKFT0_SKXCCM1_TT2_64_VW2_VWB2_WGM8
    SolutionIndex: 144
    SolutionNameMin: Cijk_Alik_Bjlk_HHS_BH_MT64x128x64_MI16x16x16x1_SN_1LDSB0_AMAS3_ELFLR12_GLVWA8_GLVWB8_NLCB2_PLR5_SVW2_SKFT0_SKXCCM1_TT2_64_VW2_VWB2_WGM8
    SolutionIndex: 145
    SolutionNameMin: Cijk_Alik_Bjlk_HHS_BH_MT64x128x64_MI16x16x16x1_SN_1LDSB0_AMAS3_ELFLR0_GLVWA8_GLVWB8_NLCB2_PLR5_SVW2_SKFT1_SKXCCM1_TT2_64_VW2_VWB2_WGM8
    SolutionIndex: 146
    SolutionNameMin: Cijk_Alik_Bjlk_HHS_BH_MT64x64x64_MI16x16x16x1_SN_1LDSB0_AMAS3_ELFLR0_GLVWA8_GLVWB8_NLCB1_PLR5_SVW2_SKFT0_SKXCCM0_TT2_32_VW2_VWB2_WGM0
    SolutionIndex: 147
    SolutionNameMin: Cijk_Alik_Bjlk_HHS_BH_MT64x64x64_MI16x16x16x1_SN_1LDSB0_AMAS3_ELFLR12_GLVWA8_GLVWB8_NLCB1_PLR5_SVW2_SKFT0_SKXCCM0_TT2_32_VW2_VWB2_WGM0
    SolutionIndex: 148
    SolutionNameMin: Cijk_Alik_Bjlk_HHS_BH_MT64x64x64_MI16x16x16x1_SN_1LDSB0_AMAS3_ELFLR0_GLVWA8_GLVWB8_NLCB1_PLR5_SVW2_SKFT0_SKXCCM1_TT2_32_VW2_VWB2_WGM0
    SolutionIndex: 149
    SolutionNameMin: Cijk_Alik_Bjlk_HHS_BH_MT64x64x64_MI16x16x16x1_SN_1LDSB0_AMAS3_ELFLR12_GLVWA8_GLVWB8_NLCB1_PLR5_SVW2_SKFT0_SKXCCM1_TT2_32_VW2_VWB2_WGM0
    SolutionIndex: 150
    SolutionNameMin: Cijk_Alik_Bjlk_HHS_BH_MT64x64x64_MI16x16x16x1_SN_1LDSB0_AMAS3_ELFLR12_GLVWA8_GLVWB8_NLCB1_PLR5_SVW2_SKFT1_SKXCCM0_TT2_32_VW2_VWB2_WGM0
    SolutionIndex: 151
    SolutionNameMin: Cijk_Alik_Bjlk_HHS_BH_MT64x64x64_MI16x16x16x1_SN_1LDSB0_AMAS3_ELFLR12_GLVWA8_GLVWB8_NLCB1_PLR5_SVW2_SKFT1_SKXCCM1_TT2_32_VW2_VWB2_WGM0
    SolutionIndex: 152
    SolutionNameMin: Cijk_Alik_Bjlk_HHS_BH_MT64x64x64_MI16x16x16x1_SN_1LDSB0_AMAS3_ELFLR12_GLVWA8_GLVWB8_NLCB1_PLR5_SVW2_SKFT0_SKXCCM0_TT2_32_VW2_VWB2_WGM8
    SolutionIndex: 153
    SolutionNameMin: Cijk_Alik_Bjlk_HHS_BH_MT64x64x64_MI16x16x16x1_SN_1LDSB0_AMAS3_ELFLR0_GLVWA8_GLVWB8_NLCB1_PLR5_SVW2_SKFT0_SKXCCM1_TT2_32_VW2_VWB2_WGM8
    SolutionIndex: 154
    SolutionNameMin: Cijk_Alik_Bjlk_HHS_BH_MT64x64x64_MI16x16x16x1_SN_1LDSB0_AMAS3_ELFLR0_GLVWA8_GLVWB8_NLCB1_PLR5_SVW2_SKFT1_SKXCCM1_TT2_32_VW2_VWB2_WGM8
    SolutionIndex: 155
    SolutionNameMin: Cijk_Alik_Bjlk_HHS_BH_MT64x64x64_MI16x16x16x1_SN_1LDSB0_AMAS3_ELFLR12_GLVWA8_GLVWB8_NLCB1_PLR5_SVW2_SKFT1_SKXCCM1_TT2_32_VW2_VWB2_WGM8
    SolutionIndex: 156
    SolutionNameMin: Cijk_Alik_Bjlk_HHS_BH_MT64x64x64_MI16x16x16x1_SN_1LDSB0_AMAS3_ELFLR12_GLVWA8_GLVWB8_NLCB2_PLR5_SVW2_SKFT1_SKXCCM0_TT2_32_VW2_VWB2_WGM8
    SolutionIndex: 157
    SolutionNameMin: Cijk_Alik_Bjlk_HHS_BH_MT64x32x64_MI16x16x16x1_SN_1LDSB0_AMAS3_ELFLR12_GLVWA8_GLVWB8_NLCB1_PLR5_SVW2_SKFT0_SKXCCM0_TT2_16_VW2_VWB1_WGM0
    SolutionIndex: 158
    SolutionNameMin: Cijk_Alik_Bjlk_HHS_BH_MT64x32x64_MI16x16x16x1_SN_1LDSB0_AMAS3_ELFLR12_GLVWA8_GLVWB8_NLCB1_PLR5_SVW2_SKFT1_SKXCCM0_TT2_16_VW2_VWB1_WGM0
    SolutionIndex: 159
    SolutionNameMin: Cijk_Alik_Bjlk_HHS_BH_MT128x128x64_MI16x16x16x1_SN_1LDSB0_AMAS3_ELFLR12_GLVWA8_GLVWB8_NLCB1_PLR5_SVW4_SKFT0_SKXCCM0_TT4_64_VW4_VWB4_WGM0
    SolutionIndex: 160
    SolutionNameMin: Cijk_Alik_Bjlk_HHS_BH_MT128x128x64_MI16x16x16x1_SN_1LDSB0_AMAS3_ELFLR12_GLVWA8_GLVWB8_NLCB2_PLR5_SVW4_SKFT1_SKXCCM0_TT4_64_VW4_VWB4_WGM0
    SolutionIndex: 161
    SolutionNameMin: Cijk_Alik_Bjlk_HHS_BH_MT128x128x64_MI16x16x16x1_SN_1LDSB0_AMAS3_ELFLR0_GLVWA8_GLVWB8_NLCB1_PLR5_SVW4_SKFT0_SKXCCM0_TT4_64_VW4_VWB4_WGM8
    SolutionIndex: 162
    SolutionNameMin: Cijk_Alik_Bjlk_HHS_BH_MT128x128x64_MI16x16x16x1_SN_1LDSB0_AMAS3_ELFLR12_GLVWA8_GLVWB8_NLCB1_PLR5_SVW4_SKFT0_SKXCCM0_TT4_64_VW4_VWB4_WGM8
    SolutionIndex: 163
    SolutionNameMin: Cijk_Alik_Bjlk_HHS_BH_MT128x128x64_MI16x16x16x1_SN_1LDSB0_AMAS3_ELFLR0_GLVWA8_GLVWB8_NLCB2_PLR5_SVW4_SKFT0_SKXCCM0_TT4_64_VW4_VWB4_WGM8
    SolutionIndex: 164
    SolutionNameMin: Cijk_Alik_Bjlk_HHS_BH_MT128x128x64_MI16x16x16x1_SN_1LDSB0_AMAS3_ELFLR12_GLVWA8_GLVWB8_NLCB2_PLR5_SVW4_SKFT0_SKXCCM0_TT4_64_VW4_VWB4_WGM8
    SolutionIndex: 165
    SolutionNameMin: Cijk_Alik_Bjlk_HHS_BH_MT128x128x64_MI16x16x16x1_SN_1LDSB0_AMAS3_ELFLR12_GLVWA8_GLVWB8_NLCB2_PLR5_SVW4_SKFT0_SKXCCM1_TT4_64_VW4_VWB4_WGM8
    SolutionIndex: 166
    SolutionNameMin: Cijk_Alik_Bjlk_HHS_BH_MT128x128x64_MI16x16x16x1_SN_1LDSB0_AMAS3_ELFLR0_GLVWA8_GLVWB8_NLCB2_PLR5_SVW4_SKFT1_SKXCCM0_TT4_64_VW4_VWB4_WGM8
    SolutionIndex: 167
    SolutionNameMin: Cijk_Alik_Bjlk_HHS_BH_MT128x64x64_MI16x16x16x1_SN_1LDSB0_AMAS3_ELFLR12_GLVWA8_GLVWB8_NLCB1_PLR5_SVW4_SKFT0_SKXCCM1_TT4_32_VW4_VWB1_WGM0
    SolutionIndex: 168
    SolutionNameMin: Cijk_Alik_Bjlk_HHS_BH_MT128x64x64_MI16x16x16x1_SN_1LDSB0_AMAS3_ELFLR0_GLVWA8_GLVWB8_NLCB1_PLR5_SVW4_SKFT0_SKXCCM0_TT4_32_VW4_VWB1_WGM8
    SolutionIndex: 169
    SolutionNameMin: Cijk_Alik_Bjlk_HHS_BH_MT128x64x64_MI16x16x16x1_SN_1LDSB0_AMAS3_ELFLR12_GLVWA8_GLVWB8_NLCB1_PLR5_SVW4_SKFT1_SKXCCM0_TT4_32_VW4_VWB1_WGM8
    SolutionIndex: 170
    SolutionNameMin: Cijk_Alik_Bjlk_HHS_BH_MT128x64x64_MI16x16x16x1_SN_1LDSB0_AMAS3_ELFLR12_GLVWA8_GLVWB8_NLCB2_PLR5_SVW4_SKFT1_SKXCCM0_TT4_32_VW4_VWB1_WGM8
    SolutionIndex: 171
    SolutionNameMin: Cijk_Alik_Bjlk_HHS_BH_MT128x64x64_MI16x16x16x1_SN_1LDSB0_AMAS3_ELFLR12_GLVWA8_GLVWB8_NLCB2_PLR5_SVW4_SKFT1_SKXCCM1_TT4_32_VW4_VWB1_WGM8
    SolutionIndex: 172
    SolutionNameMin: Cijk_Alik_Bjlk_HHS_BH_MT128x256x64_MI16x16x16x1_SN_1LDSB1_AMAS3_ELFLR0_GLVWA8_GLVWB8_NLCB1_PLR5_SVW4_SKFT1_SKXCCM0_TT4_128_VW4_VWB4_WGM0
    SolutionIndex: 173
    SolutionNameMin: Cijk_Alik_Bjlk_HHS_BH_MT128x256x64_MI16x16x16x1_SN_1LDSB1_AMAS3_ELFLR12_GLVWA8_GLVWB8_NLCB1_PLR5_SVW4_SKFT1_SKXCCM0_TT4_128_VW4_VWB4_WGM0
    SolutionIndex: 174
    SolutionNameMin: Cijk_Alik_Bjlk_HHS_BH_MT128x256x64_MI16x16x16x1_SN_1LDSB1_AMAS3_ELFLR0_GLVWA8_GLVWB8_NLCB2_PLR5_SVW4_SKFT1_SKXCCM0_TT4_128_VW4_VWB4_WGM0
    SolutionIndex: 175
    SolutionNameMin: Cijk_Alik_Bjlk_HHS_BH_MT128x256x64_MI16x16x16x1_SN_1LDSB1_AMAS3_ELFLR12_GLVWA8_GLVWB8_NLCB2_PLR5_SVW4_SKFT1_SKXCCM0_TT4_128_VW4_VWB4_WGM0
    SolutionIndex: 176
    SolutionNameMin: Cijk_Alik_Bjlk_HHS_BH_MT128x256x64_MI16x16x16x1_SN_1LDSB1_AMAS3_ELFLR12_GLVWA8_GLVWB8_NLCB1_PLR5_SVW4_SKFT1_SKXCCM0_TT4_128_VW4_VWB4_WGM8
    SolutionIndex: 177
    SolutionNameMin: Cijk_Alik_Bjlk_HHS_BH_MT128x128x64_MI16x16x16x1_SN_1LDSB1_AMAS3_ELFLR12_GLVWA8_GLVWB8_NLCB1_PLR5_SVW4_SKFT0_SKXCCM0_TT4_64_VW4_VWB4_WGM0
    SolutionIndex: 178
    SolutionNameMin: Cijk_Alik_Bjlk_HHS_BH_MT128x128x64_MI16x16x16x1_SN_1LDSB1_AMAS3_ELFLR0_GLVWA8_GLVWB8_NLCB1_PLR5_SVW4_SKFT0_SKXCCM1_TT4_64_VW4_VWB4_WGM0
    SolutionIndex: 179
    SolutionNameMin: Cijk_Alik_Bjlk_HHS_BH_MT128x128x64_MI16x16x16x1_SN_1LDSB1_AMAS3_ELFLR12_GLVWA8_GLVWB8_NLCB1_PLR5_SVW4_SKFT1_SKXCCM0_TT4_64_VW4_VWB4_WGM0
    SolutionIndex: 180
    SolutionNameMin: Cijk_Alik_Bjlk_HHS_BH_MT128x128x64_MI16x16x16x1_SN_1LDSB1_AMAS3_ELFLR12_GLVWA8_GLVWB8_NLCB2_PLR5_SVW4_SKFT1_SKXCCM0_TT4_64_VW4_VWB4_WGM0
    SolutionIndex: 181
    SolutionNameMin: Cijk_Alik_Bjlk_HHS_BH_MT128x128x64_MI16x16x16x1_SN_1LDSB1_AMAS3_ELFLR12_GLVWA8_GLVWB8_NLCB1_PLR5_SVW4_SKFT0_SKXCCM0_TT4_64_VW4_VWB4_WGM8
    SolutionIndex: 182
    SolutionNameMin: Cijk_Alik_Bjlk_HHS_BH_MT128x128x64_MI16x16x16x1_SN_1LDSB1_AMAS3_ELFLR12_GLVWA8_GLVWB8_NLCB1_PLR5_SVW4_SKFT1_SKXCCM0_TT4_64_VW4_VWB4_WGM8
    SolutionIndex: 183
    SolutionNameMin: Cijk_Alik_Bjlk_HHS_BH_MT128x128x64_MI16x16x16x1_SN_1LDSB1_AMAS3_ELFLR12_GLVWA8_GLVWB8_NLCB2_PLR5_SVW4_SKFT1_SKXCCM0_TT4_64_VW4_VWB4_WGM8
- - - [128, 128, 1, 128, 128, 128, 128, 128]
    - [149, 530.118]
  - - [128, 128, 1, 256, 128, 128, 256, 128]
    - [124, 882.621]
  - - [128, 128, 1, 512, 128, 128, 512, 128]
    - [130, 1364.23]
  - - [128, 128, 1, 1024, 128, 128, 1024, 128]
    - [134, 1828.4]
  - - [128, 128, 1, 2048, 128, 128, 2048, 128]
    - [4, 3052.73]
  - - [128, 128, 1, 4096, 128, 128, 4096, 128]
    - [0, 5841.77]
  - - [128, 128, 1, 8192, 128, 128, 8192, 128]
    - [130, 10889.5]
  - - [128, 256, 1, 128, 128, 128, 128, 256]
    - [124, 1026.56]
  - - [128, 256, 1, 256, 128, 128, 256, 256]
    - [130, 1743.02]
  - - [128, 256, 1, 512, 128, 128, 512, 256]
    - [125, 2669.11]
  - - [128, 256, 1, 1024, 128, 128, 1024, 256]
    - [4, 4516.68]
  - - [128, 256, 1, 2048, 128, 128, 2048, 256]
    - [3, 8563.4]
  - - [128, 256, 1, 4096, 128, 128, 4096, 256]
    - [130, 15255.9]
  - - [128, 256, 1, 8192, 128, 128, 8192, 256]
    - [132, 24565.1]
  - - [128, 512, 1, 128, 128, 128, 128, 512]
    - [124, 1989.47]
  - - [128, 512, 1, 256, 128, 128, 256, 512]
    - [125, 3439.44]
  - - [128, 512, 1, 512, 128, 128, 512, 512]
    - [7, 6011.99]
  - - [128, 512, 1, 1024, 128, 128, 1024, 512]
    - [126, 11093.2]
  - - [128, 512, 1, 2048, 128, 128, 2048, 512]
    - [124, 18853.3]
  - - [128, 512, 1, 4096, 128, 128, 4096, 512]
    - [126, 29483.8]
  - - [128, 512, 1, 8192, 128, 128, 8192, 512]
    - [36, 44773.5]
  - - [128, 1024, 1, 128, 128, 128, 128, 1024]
    - [127, 3865.56]
  - - [128, 1024, 1, 256, 128, 128, 256, 1024]
    - [130, 6898.43]
  - - [128, 1024, 1, 512, 128, 128, 512, 1024]
    - [126, 12530.1]
  - - [128, 1024, 1, 1024, 128, 128, 1024, 1024]
    - [124, 21028.2]
  - - [128, 1024, 1, 2048, 128, 128, 2048, 1024]
    - [45, 33383.3]
  - - [128, 1024, 1, 4096, 128, 128, 4096, 1024]
    - [39, 52443.1]
  - - [128, 1024, 1, 8192, 128, 128, 8192, 1024]
    - [150, 74080.5]
  - - [128, 2048, 1, 128, 128, 128, 128, 2048]
    - [127, 8050.43]
  - - [128, 2048, 1, 256, 128, 128, 256, 2048]
    - [126, 14123.4]
  - - [128, 2048, 1, 512, 128, 128, 512, 2048]
    - [40, 22889.0]
  - - [128, 2048, 1, 1024, 128, 128, 1024, 2048]
    - [37, 38182.0]
  - - [128, 2048, 1, 2048, 128, 128, 2048, 2048]
    - [29, 58872.4]
  - - [128, 2048, 1, 4096, 128, 128, 4096, 2048]
    - [146, 84387.7]
  - - [128, 2048, 1, 8192, 128, 128, 8192, 2048]
    - [28, 117509.0]
  - - [128, 4096, 1, 128, 128, 128, 128, 4096]
    - [122, 15289.3]
  - - [128, 4096, 1, 256, 128, 128, 256, 4096]
    - [120, 25937.1]
  - - [128, 4096, 1, 512, 128, 128, 512, 4096]
    - [42, 40400.1]
  - - [128, 4096, 1, 1024, 128, 128, 1024, 4096]
    - [31, 66365.7]
  - - [128, 4096, 1, 2048, 128, 128, 2048, 4096]
    - [30, 102190.0]
  - - [128, 4096, 1, 4096, 128, 128, 4096, 4096]
    - [34, 133081.0]
  - - [128, 4096, 1, 8192, 128, 128, 8192, 4096]
    - [10, 168312.0]
  - - [128, 8192, 1, 128, 128, 128, 128, 8192]
    - [147, 27735.9]
  - - [128, 8192, 1, 256, 128, 128, 256, 8192]
    - [148, 46349.5]
  - - [128, 8192, 1, 512, 128, 128, 512, 8192]
    - [27, 72717.9]
  - - [128, 8192, 1, 1024, 128, 128, 1024, 8192]
    - [34, 105762.0]
  - - [128, 8192, 1, 2048, 128, 128, 2048, 8192]
    - [12, 136590.0]
  - - [128, 8192, 1, 4096, 128, 128, 4096, 8192]
    - [70, 189363.0]
  - - [128, 8192, 1, 8192, 128, 128, 8192, 8192]
    - [74, 243905.0]
  - - [256, 128, 1, 128, 256, 256, 128, 128]
    - [124, 1020.18]
  - - [256, 128, 1, 256, 256, 256, 256, 128]
    - [124, 1733.57]
  - - [256, 128, 1, 512, 256, 256, 512, 128]
    - [130, 2657.01]
  - - [256, 128, 1, 1024, 256, 256, 1024, 128]
    - [1, 4468.78]
  - - [256, 128, 1, 2048, 256, 256, 2048, 128]
    - [1, 8523.97]
  - - [256, 128, 1, 4096, 256, 256, 4096, 128]
    - [130, 15198.0]
  - - [256, 128, 1, 8192, 256, 256, 8192, 128]
    - [129, 25010.7]
  - - [256, 256, 1, 128, 256, 256, 128, 256]
    - [124, 1997.92]
  - - [256, 256, 1, 256, 256, 256, 256, 256]
    - [126, 3415.6]
  - - [256, 256, 1, 512, 256, 256, 512, 256]
    - [6, 5986.02]
  - - [256, 256, 1, 1024, 256, 256, 1024, 256]
    - [134, 11066.7]
  - - [256, 256, 1, 2048, 256, 256, 2048, 256]
    - [5, 18612.5]
  - - [256, 256, 1, 4096, 256, 256, 4096, 256]
    - [131, 29217.7]
  - - [256, 256, 1, 8192, 256, 256, 8192, 256]
    - [43, 44090.4]
  - - [256, 512, 1, 128, 256, 256, 128, 512]
    - [134, 3817.9]
  - - [256, 512, 1, 256, 256, 256, 256, 512]
    - [130, 6891.75]
  - - [256, 512, 1, 512, 256, 256, 512, 512]
    - [125, 12304.9]
  - - [256, 512, 1, 1024, 256, 256, 1024, 512]
    - [5, 20913.1]
  - - [256, 512, 1, 2048, 256, 256, 2048, 512]
    - [35, 34471.6]
  - - [256, 512, 1, 4096, 256, 256, 4096, 512]
    - [40, 53243.2]
  - - [256, 512, 1, 8192, 256, 256, 8192, 512]
    - [155, 72503.4]
  - - [256, 1024, 1, 128, 256, 256, 128, 1024]
    - [128, 8072.16]
  - - [256, 1024, 1, 256, 256, 256, 256, 1024]
    - [124, 14112.4]
  - - [256, 1024, 1, 512, 256, 256, 512, 1024]
    - [37, 22782.0]
  - - [256, 1024, 1, 1024, 256, 256, 1024, 1024]
    - [38, 38766.3]
  - - [256, 1024, 1, 2048, 256, 256, 2048, 1024]
    - [30, 60364.0]
  - - [256, 1024, 1, 4096, 256, 256, 4096, 1024]
    - [152, 84543.4]
  - - [256, 1024, 1, 8192, 256, 256, 8192, 1024]
    - [30, 116033.0]
  - - [256, 2048, 1, 128, 256, 256, 128, 2048]
    - [157, 14909.7]
  - - [256, 2048, 1, 256, 256, 256, 256, 2048]
    - [121, 25448.5]
  - - [256, 2048, 1, 512, 256, 256, 512, 2048]
    - [35, 40840.8]
  - - [256, 2048, 1, 1024, 256, 256, 1024, 2048]
    - [20, 66430.6]
  - - [256, 2048, 1, 2048, 256, 256, 2048, 2048]
    - [30, 100887.0]
  - - [256, 2048, 1, 4096, 256, 256, 4096, 2048]
    - [29, 131825.0]
  - - [256, 2048, 1, 8192, 256, 256, 8192, 2048]
    - [15, 163610.0]
  - - [256, 4096, 1, 128, 256, 256, 128, 4096]
    - [150, 26408.9]
  - - [256, 4096, 1, 256, 256, 256, 256, 4096]
    - [155, 45583.3]
  - - [256, 4096, 1, 512, 256, 256, 512, 4096]
    - [23, 70893.6]
  - - [256, 4096, 1, 1024, 256, 256, 1024, 4096]
    - [22, 104542.0]
  - - [256, 4096, 1, 2048, 256, 256, 2048, 4096]
    - [82, 136740.0]
  - - [256, 4096, 1, 4096, 256, 256, 4096, 4096]
    - [86, 181848.0]
  - - [256, 4096, 1, 8192, 256, 256, 8192, 4096]
    - [80, 234595.0]
  - - [256, 8192, 1, 128, 256, 256, 128, 8192]
    - [168, 46638.2]
  - - [256, 8192, 1, 256, 256, 256, 256, 8192]
    - [135, 68328.2]
  - - [256, 8192, 1, 512, 256, 256, 512, 8192]
    - [27, 102655.0]
  - - [256, 8192, 1, 1024, 256, 256, 1024, 8192]
    - [10, 140687.0]
  - - [256, 8192, 1, 2048, 256, 256, 2048, 8192]
    - [75, 196156.0]
  - - [256, 8192, 1, 4096, 256, 256, 4096, 8192]
    - [79, 253320.0]
  - - [256, 8192, 1, 8192, 256, 256, 8192, 8192]
    - [102, 298308.0]
  - - [512, 128, 1, 128, 512, 512, 128, 128]
    - [124, 2000.02]
  - - [512, 128, 1, 256, 512, 512, 256, 128]
    - [130, 3426.7]
  - - [512, 128, 1, 512, 512, 512, 512, 128]
    - [8, 5945.12]
  - - [512, 128, 1, 1024, 512, 512, 1024, 128]
    - [126, 11122.5]
  - - [512, 128, 1, 2048, 512, 512, 2048, 128]
    - [124, 18581.0]
  - - [512, 128, 1, 4096, 512, 512, 4096, 128]
    - [123, 29193.2]
  - - [512, 128, 1, 8192, 512, 512, 8192, 128]
    - [44, 43935.0]
  - - [512, 256, 1, 128, 512, 512, 128, 256]
    - [124, 3829.07]
  - - [512, 256, 1, 256, 512, 512, 256, 256]
    - [126, 6980.94]
  - - [512, 256, 1, 512, 512, 512, 512, 256]
    - [130, 12403.7]
  - - [512, 256, 1, 1024, 512, 512, 1024, 256]
    - [2, 20532.4]
  - - [512, 256, 1, 2048, 512, 512, 2048, 256]
    - [39, 34537.0]
  - - [512, 256, 1, 4096, 512, 512, 4096, 256]
    - [44, 52435.5]
  - - [512, 256, 1, 8192, 512, 512, 8192, 256]
    - [155, 73658.6]
  - - [512, 512, 1, 128, 512, 512, 128, 512]
    - [130, 7943.93]
  - - [512, 512, 1, 256, 512, 512, 256, 512]
    - [124, 14165.8]
  - - [512, 512, 1, 512, 512, 512, 512, 512]
    - [40, 22814.5]
  - - [512, 512, 1, 1024, 512, 512, 1024, 512]
    - [35, 38852.9]
  - - [512, 512, 1, 2048, 512, 512, 2048, 512]
    - [31, 59412.6]
  - - [512, 512, 1, 4096, 512, 512, 4096, 512]
    - [154, 84142.7]
  - - [512, 512, 1, 8192, 512, 512, 8192, 512]
    - [33, 114395.0]
  - - [512, 1024, 1, 128, 512, 512, 128, 1024]
    - [158, 14955.3]
  - - [512, 1024, 1, 256, 512, 512, 256, 1024]
    - [118, 25697.9]
  - - [512, 1024, 1, 512, 512, 512, 512, 1024]
    - [39, 41219.6]
  - - [512, 1024, 1, 1024, 512, 512, 1024, 1024]
    - [25, 68394.4]
  - - [512, 1024, 1, 2048, 512, 512, 2048, 1024]
    - [29, 101070.0]
  - - [512, 1024, 1, 4096, 512, 512, 4096, 1024]
    - [85, 126438.0]
  - - [512, 1024, 1, 8192, 512, 512, 8192, 1024]
    - [19, 163869.0]
  - - [512, 2048, 1, 128, 512, 512, 128, 2048]
    - [152, 27329.8]
  - - [512, 2048, 1, 256, 512, 512, 256, 2048]
    - [151, 45747.4]
  - - [512, 2048, 1, 512, 512, 512, 512, 2048]
    - [33, 71318.9]
  - - [512, 2048, 1, 1024, 512, 512, 1024, 2048]
    - [23, 104035.0]
  - - [512, 2048, 1, 2048, 512, 512, 2048, 2048]
    - [84, 135096.0]
  - - [512, 2048, 1, 4096, 512, 512, 4096, 2048]
    - [71, 180767.0]
  - - [512, 2048, 1, 8192, 512, 512, 8192, 2048]
    - [77, 245677.0]
  - - [512, 4096, 1, 128, 512, 512, 128, 4096]
    - [169, 46962.6]
  - - [512, 4096, 1, 256, 512, 512, 256, 4096]
    - [145, 69250.6]
  - - [512, 4096, 1, 512, 512, 512, 512, 4096]
    - [26, 103397.0]
  - - [512, 4096, 1, 1024, 512, 512, 1024, 4096]
    - [136, 144054.0]
  - - [512, 4096, 1, 2048, 512, 512, 2048, 4096]
    - [79, 196335.0]
  - - [512, 4096, 1, 4096, 512, 512, 4096, 4096]
    - [81, 261609.0]
  - - [512, 4096, 1, 8192, 512, 512, 8192, 4096]
    - [68, 306315.0]
  - - [512, 8192, 1, 128, 512, 512, 128, 8192]
    - [164, 73143.5]
  - - [512, 8192, 1, 256, 512, 512, 256, 8192]
    - [183, 95569.5]
  - - [512, 8192, 1, 512, 512, 512, 512, 8192]
    - [18, 137547.0]
  - - [512, 8192, 1, 1024, 512, 512, 1024, 8192]
    - [75, 196366.0]
  - - [512, 8192, 1, 2048, 512, 512, 2048, 8192]
    - [79, 254383.0]
  - - [512, 8192, 1, 4096, 512, 512, 4096, 8192]
    - [63, 321105.0]
  - - [512, 8192, 1, 8192, 512, 512, 8192, 8192]
    - [107, 352304.0]
  - - [1024, 128, 1, 128, 1024, 1024, 128, 128]
    - [128, 3800.82]
  - - [1024, 128, 1, 256, 1024, 1024, 256, 128]
    - [133, 6893.89]
  - - [1024, 128, 1, 512, 1024, 1024, 512, 128]
    - [130, 12440.3]
  - - [1024, 128, 1, 1024, 1024, 1024, 1024, 128]
    - [123, 20769.8]
  - - [1024, 128, 1, 2048, 1024, 1024, 2048, 128]
    - [39, 34021.8]
  - - [1024, 128, 1, 4096, 1024, 1024, 4096, 128]
    - [47, 51605.6]
  - - [1024, 128, 1, 8192, 1024, 1024, 8192, 128]
    - [24, 74905.0]
  - - [1024, 256, 1, 128, 1024, 1024, 128, 256]
    - [128, 7991.68]
  - - [1024, 256, 1, 256, 1024, 1024, 256, 256]
    - [125, 14124.6]
  - - [1024, 256, 1, 512, 1024, 1024, 512, 256]
    - [36, 22775.8]
  - - [1024, 256, 1, 1024, 1024, 1024, 1024, 256]
    - [39, 38623.4]
  - - [1024, 256, 1, 2048, 1024, 1024, 2048, 256]
    - [31, 59777.1]
  - - [1024, 256, 1, 4096, 1024, 1024, 4096, 256]
    - [34, 86465.5]
  - - [1024, 256, 1, 8192, 1024, 1024, 8192, 256]
    - [34, 122767.0]
  - - [1024, 512, 1, 128, 1024, 1024, 128, 512]
    - [158, 15042.2]
  - - [1024, 512, 1, 256, 1024, 1024, 256, 512]
    - [119, 25530.0]
  - - [1024, 512, 1, 512, 1024, 1024, 512, 512]
    - [35, 41071.8]
  - - [1024, 512, 1, 1024, 1024, 1024, 1024, 512]
    - [32, 69121.2]
  - - [1024, 512, 1, 2048, 1024, 1024, 2048, 512]
    - [21, 97467.1]
  - - [1024, 512, 1, 4096, 1024, 1024, 4096, 512]
    - [34, 133274.0]
  - - [1024, 512, 1, 8192, 1024, 1024, 8192, 512]
    - [18, 169600.0]
  - - [1024, 1024, 1, 128, 1024, 1024, 128, 1024]
    - [146, 27582.4]
  - - [1024, 1024, 1, 256, 1024, 1024, 256, 1024]
    - [149, 46635.8]
  - - [1024, 1024, 1, 512, 1024, 1024, 512, 1024]
    - [26, 72373.2]
  - - [1024, 1024, 1, 1024, 1024, 1024, 1024, 1024]
    - [21, 107893.0]
  - - [1024, 1024, 1, 2048, 1024, 1024, 2048, 1024]
    - [83, 135930.0]
  - - [1024, 1024, 1, 4096, 1024, 1024, 4096, 1024]
    - [78, 184048.0]
  - - [1024, 1024, 1, 8192, 1024, 1024, 8192, 1024]
    - [115, 238920.0]
  - - [1024, 2048, 1, 128, 1024, 1024, 128, 2048]
    - [150, 47095.4]
  - - [1024, 2048, 1, 256, 1024, 1024, 256, 2048]
    - [171, 71402.6]
  - - [1024, 2048, 1, 512, 1024, 1024, 512, 2048]
    - [138, 104951.0]
  - - [1024, 2048, 1, 1024, 1024, 1024, 1024, 2048]
    - [137, 144516.0]
  - - [1024, 2048, 1, 2048, 1024, 1024, 2048, 2048]
    - [75, 194463.0]
  - - [1024, 2048, 1, 4096, 1024, 1024, 4096, 2048]
    - [77, 257046.0]
  - - [1024, 2048, 1, 8192, 1024, 1024, 8192, 2048]
    - [99, 300777.0]
  - - [1024, 4096, 1, 128, 1024, 1024, 128, 4096]
    - [166, 74976.7]
  - - [1024, 4096, 1, 256, 1024, 1024, 256, 4096]
    - [180, 97701.5]
  - - [1024, 4096, 1, 512, 1024, 1024, 512, 4096]
    - [11, 139441.0]
  - - [1024, 4096, 1, 1024, 1024, 1024, 1024, 4096]
    - [78, 196763.0]
  - - [1024, 4096, 1, 2048, 1024, 1024, 2048, 4096]
    - [69, 257495.0]
  - - [1024, 4096, 1, 4096, 1024, 1024, 4096, 4096]
    - [67, 320040.0]
  - - [1024, 4096, 1, 8192, 1024, 1024, 8192, 4096]
    - [109, 355264.0]
  - - [1024, 8192, 1, 128, 1024, 1024, 128, 8192]
    - [177, 90197.9]
  - - [1024, 8192, 1, 256, 1024, 1024, 256, 8192]
    - [178, 127263.0]
  - - [1024, 8192, 1, 512, 1024, 1024, 512, 8192]
    - [110, 189392.0]
  - - [1024, 8192, 1, 1024, 1024, 1024, 1024, 8192]
    - [113, 250028.0]
  - - [1024, 8192, 1, 2048, 1024, 1024, 2048, 8192]
    - [105, 319026.0]
  - - [1024, 8192, 1, 4096, 1024, 1024, 4096, 8192]
    - [97, 351659.0]
  - - [1024, 8192, 1, 8192, 1024, 1024, 8192, 8192]
    - [87, 418425.0]
  - - [2048, 128, 1, 128, 2048, 2048, 128, 128]
    - [124, 7987.86]
  - - [2048, 128, 1, 256, 2048, 2048, 256, 128]
    - [123, 14140.7]
  - - [2048, 128, 1, 512, 2048, 2048, 512, 128]
    - [41, 22609.0]
  - - [2048, 128, 1, 1024, 2048, 2048, 1024, 128]
    - [43, 38271.5]
  - - [2048, 128, 1, 2048, 2048, 2048, 2048, 128]
    - [46, 56423.5]
  - - [2048, 128, 1, 4096, 2048, 2048, 4096, 128]
    - [21, 91998.2]
  - - [2048, 128, 1, 8192, 2048, 2048, 8192, 128]
    - [22, 113266.0]
  - - [2048, 256, 1, 128, 2048, 2048, 128, 256]
    - [158, 14943.6]
  - - [2048, 256, 1, 256, 2048, 2048, 256, 256]
    - [121, 25517.9]
  - - [2048, 256, 1, 512, 2048, 2048, 512, 256]
    - [39, 41293.2]
  - - [2048, 256, 1, 1024, 2048, 2048, 1024, 256]
    - [24, 67395.2]
  - - [2048, 256, 1, 2048, 2048, 2048, 2048, 256]
    - [21, 100262.0]
  - - [2048, 256, 1, 4096, 2048, 2048, 4096, 256]
    - [30, 133868.0]
  - - [2048, 256, 1, 8192, 2048, 2048, 8192, 256]
    - [14, 170055.0]
  - - [2048, 512, 1, 128, 2048, 2048, 128, 512]
    - [156, 27228.7]
  - - [2048, 512, 1, 256, 2048, 2048, 256, 512]
    - [155, 46018.5]
  - - [2048, 512, 1, 512, 2048, 2048, 512, 512]
    - [21, 72092.9]
  - - [2048, 512, 1, 1024, 2048, 2048, 1024, 512]
    - [21, 105355.0]
  - - [2048, 512, 1, 2048, 2048, 2048, 2048, 512]
    - [33, 138274.0]
  - - [2048, 512, 1, 4096, 2048, 2048, 4096, 512]
    - [116, 185487.0]
  - - [2048, 512, 1, 8192, 2048, 2048, 8192, 512]
    - [114, 241826.0]
  - - [2048, 1024, 1, 128, 2048, 2048, 128, 1024]
    - [170, 47306.6]
  - - [2048, 1024, 1, 256, 2048, 2048, 256, 1024]
    - [34, 69142.5]
  - - [2048, 1024, 1, 512, 2048, 2048, 512, 1024]
    - [141, 106504.0]
  - - [2048, 1024, 1, 1024, 2048, 2048, 1024, 1024]
    - [142, 145645.0]
  - - [2048, 1024, 1, 2048, 2048, 2048, 2048, 1024]
    - [75, 194615.0]
  - - [2048, 1024, 1, 4096, 2048, 2048, 4096, 1024]
    - [79, 255099.0]
  - - [2048, 1024, 1, 8192, 2048, 2048, 8192, 1024]
    - [108, 313859.0]
  - - [2048, 2048, 1, 128, 2048, 2048, 128, 2048]
    - [164, 75120.7]
  - - [2048, 2048, 1, 256, 2048, 2048, 256, 2048]
    - [159, 98286.4]
  - - [2048, 2048, 1, 512, 2048, 2048, 512, 2048]
    - [140, 136890.0]
  - - [2048, 2048, 1, 1024, 2048, 2048, 1024, 2048]
    - [116, 192741.0]
  - - [2048, 2048, 1, 2048, 2048, 2048, 2048, 2048]
    - [112, 252669.0]
  - - [2048, 2048, 1, 4096, 2048, 2048, 4096, 2048]
    - [106, 318343.0]
  - - [2048, 2048, 1, 8192, 2048, 2048, 8192, 2048]
    - [98, 349358.0]
  - - [2048, 4096, 1, 128, 2048, 2048, 128, 4096]
    - [183, 91189.9]
  - - [2048, 4096, 1, 256, 2048, 2048, 256, 4096]
    - [178, 128287.0]
  - - [2048, 4096, 1, 512, 2048, 2048, 512, 4096]
    - [113, 190924.0]
  - - [2048, 4096, 1, 1024, 2048, 2048, 1024, 4096]
    - [111, 254938.0]
  - - [2048, 4096, 1, 2048, 2048, 2048, 2048, 4096]
    - [100, 317323.0]
  - - [2048, 4096, 1, 4096, 2048, 2048, 4096, 4096]
    - [61, 353737.0]
  - - [2048, 4096, 1, 8192, 2048, 2048, 8192, 4096]
    - [92, 417847.0]
  - - [2048, 8192, 1, 128, 2048, 2048, 128, 8192]
    - [175, 115284.0]
  - - [2048, 8192, 1, 256, 2048, 2048, 256, 8192]
    - [73, 165295.0]
  - - [2048, 8192, 1, 512, 2048, 2048, 512, 8192]
    - [58, 239790.0]
  - - [2048, 8192, 1, 1024, 2048, 2048, 1024, 8192]
    - [58, 328234.0]
  - - [2048, 8192, 1, 2048, 2048, 2048, 2048, 8192]
    - [61, 358402.0]
  - - [2048, 8192, 1, 4096, 2048, 2048, 4096, 8192]
    - [89, 412431.0]
  - - [2048, 8192, 1, 8192, 2048, 2048, 8192, 8192]
    - [88, 449365.0]
  - - [4096, 128, 1, 128, 4096, 4096, 128, 128]
    - [158, 15052.4]
  - - [4096, 128, 1, 256, 4096, 4096, 256, 128]
    - [119, 25929.6]
  - - [4096, 128, 1, 512, 4096, 4096, 512, 128]
    - [36, 40312.0]
  - - [4096, 128, 1, 1024, 4096, 4096, 1024, 128]
    - [28, 65810.8]
  - - [4096, 128, 1, 2048, 4096, 4096, 2048, 128]
    - [24, 100346.0]
  - - [4096, 128, 1, 4096, 4096, 4096, 4096, 128]
    - [24, 129905.0]
  - - [4096, 128, 1, 8192, 4096, 4096, 8192, 128]
    - [16, 174733.0]
  - - [4096, 256, 1, 128, 4096, 4096, 128, 256]
    - [146, 27834.5]
  - - [4096, 256, 1, 256, 4096, 4096, 256, 256]
    - [153, 46052.4]
  - - [4096, 256, 1, 512, 4096, 4096, 512, 256]
    - [27, 72497.6]
  - - [4096, 256, 1, 1024, 4096, 4096, 1024, 256]
    - [29, 102967.0]
  - - [4096, 256, 1, 2048, 4096, 4096, 2048, 256]
    - [144, 139149.0]
  - - [4096, 256, 1, 4096, 4096, 4096, 4096, 256]
    - [10, 189198.0]
  - - [4096, 256, 1, 8192, 4096, 4096, 8192, 256]
    - [79, 237147.0]
  - - [4096, 512, 1, 128, 4096, 4096, 128, 512]
    - [168, 46869.8]
  - - [4096, 512, 1, 256, 4096, 4096, 256, 512]
    - [139, 69290.9]
  - - [4096, 512, 1, 512, 4096, 4096, 512, 512]
    - [143, 104447.0]
  - - [4096, 512, 1, 1024, 4096, 4096, 1024, 512]
    - [13, 142075.0]
  - - [4096, 512, 1, 2048, 4096, 4096, 2048, 512]
    - [76, 195315.0]
  - - [4096, 512, 1, 4096, 4096, 4096, 4096, 512]
    - [112, 245855.0]
  - - [4096, 512, 1, 8192, 4096, 4096, 8192, 512]
    - [104, 317808.0]
  - - [4096, 1024, 1, 128, 4096, 4096, 128, 1024]
    - [162, 74229.2]
  - - [4096, 1024, 1, 256, 4096, 4096, 256, 1024]
    - [182, 95873.8]
  - - [4096, 1024, 1, 512, 4096, 4096, 512, 1024]
    - [144, 135899.0]
  - - [4096, 1024, 1, 1024, 4096, 4096, 1024, 1024]
    - [76, 196836.0]
  - - [4096, 1024, 1, 2048, 4096, 4096, 2048, 1024]
    - [117, 254130.0]
  - - [4096, 1024, 1, 4096, 4096, 4096, 4096, 1024]
    - [66, 307640.0]
  - - [4096, 1024, 1, 8192, 4096, 4096, 8192, 1024]
    - [63, 347553.0]
  - - [4096, 2048, 1, 128, 4096, 4096, 128, 2048]
    - [181, 89903.7]
  - - [4096, 2048, 1, 256, 4096, 4096, 256, 2048]
    - [72, 126955.0]
  - - [4096, 2048, 1, 512, 4096, 4096, 512, 2048]
    - [78, 189120.0]
  - - [4096, 2048, 1, 1024, 4096, 4096, 1024, 2048]
    - [114, 255162.0]
  - - [4096, 2048, 1, 2048, 4096, 4096, 2048, 2048]
    - [55, 324504.0]
  - - [4096, 2048, 1, 4096, 4096, 4096, 4096, 2048]
    - [50, 352455.0]
  - - [4096, 2048, 1, 8192, 4096, 4096, 8192, 2048]
    - [52, 414301.0]
  - - [4096, 4096, 1, 128, 4096, 4096, 128, 4096]
    - [176, 114719.0]
  - - [4096, 4096, 1, 256, 4096, 4096, 256, 4096]
    - [73, 163186.0]
  - - [4096, 4096, 1, 512, 4096, 4096, 512, 4096]
    - [65, 239574.0]
  - - [4096, 4096, 1, 1024, 4096, 4096, 1024, 4096]
    - [103, 316868.0]
  - - [4096, 4096, 1, 2048, 4096, 4096, 2048, 4096]
    - [104, 354356.0]
  - - [4096, 4096, 1, 4096, 4096, 4096, 4096, 4096]
    - [48, 412706.0]
  - - [4096, 4096, 1, 8192, 4096, 4096, 8192, 4096]
    - [52, 449918.0]
  - - [4096, 8192, 1, 128, 4096, 4096, 128, 8192]
    - [173, 130167.0]
  - - [4096, 8192, 1, 256, 4096, 4096, 256, 8192]
    - [61, 191947.0]
  - - [4096, 8192, 1, 512, 4096, 4096, 512, 8192]
    - [58, 271906.0]
  - - [4096, 8192, 1, 1024, 4096, 4096, 1024, 8192]
    - [53, 341418.0]
  - - [4096, 8192, 1, 2048, 4096, 4096, 2048, 8192]
    - [93, 410578.0]
  - - [4096, 8192, 1, 4096, 4096, 4096, 4096, 8192]
    - [96, 461801.0]
  - - [4096, 8192, 1, 8192, 4096, 4096, 8192, 8192]
    - [51, 489070.0]
  - - [8192, 128, 1, 128, 8192, 8192, 128, 128]
    - [150, 27386.8]
  - - [8192, 128, 1, 256, 8192, 8192, 256, 128]
    - [149, 45613.6]
  - - [8192, 128, 1, 512, 8192, 8192, 512, 128]
    - [30, 70301.3]
  - - [8192, 128, 1, 1024, 8192, 8192, 1024, 128]
    - [29, 103092.0]
  - - [8192, 128, 1, 2048, 8192, 8192, 2048, 128]
    - [17, 133158.0]
  - - [8192, 128, 1, 4096, 8192, 8192, 4096, 128]
    - [79, 184229.0]
  - - [8192, 128, 1, 8192, 8192, 8192, 8192, 128]
    - [74, 239087.0]
  - - [8192, 256, 1, 128, 8192, 8192, 128, 256]
    - [169, 47069.8]
  - - [8192, 256, 1, 256, 8192, 8192, 256, 256]
    - [167, 69794.2]
  - - [8192, 256, 1, 512, 8192, 8192, 512, 256]
    - [142, 101833.0]
  - - [8192, 256, 1, 1024, 8192, 8192, 1024, 256]
    - [141, 143085.0]
  - - [8192, 256, 1, 2048, 8192, 8192, 2048, 256]
    - [75, 193740.0]
  - - [8192, 256, 1, 4096, 8192, 8192, 4096, 256]
    - [9, 251128.0]
  - - [8192, 256, 1, 8192, 8192, 8192, 8192, 256]
    - [101, 319426.0]
  - - [8192, 512, 1, 128, 8192, 8192, 128, 512]
    - [163, 74237.4]
  - - [8192, 512, 1, 256, 8192, 8192, 256, 512]
    - [179, 96161.9]
  - - [8192, 512, 1, 512, 8192, 8192, 512, 512]
    - [19, 139868.0]
  - - [8192, 512, 1, 1024, 8192, 8192, 1024, 512]
    - [75, 197404.0]
  - - [8192, 512, 1, 2048, 8192, 8192, 2048, 512]
    - [109, 250347.0]
  - - [8192, 512, 1, 4096, 8192, 8192, 4096, 512]
    - [104, 323154.0]
  - - [8192, 512, 1, 8192, 8192, 8192, 8192, 512]
    - [56, 362179.0]
  - - [8192, 1024, 1, 128, 8192, 8192, 128, 1024]
    - [161, 91313.4]
  - - [8192, 1024, 1, 256, 8192, 8192, 256, 1024]
    - [165, 127057.0]
  - - [8192, 1024, 1, 512, 8192, 8192, 512, 1024]
    - [113, 188483.0]
  - - [8192, 1024, 1, 1024, 8192, 8192, 1024, 1024]
    - [81, 249977.0]
  - - [8192, 1024, 1, 2048, 8192, 8192, 2048, 1024]
    - [59, 329072.0]
  - - [8192, 1024, 1, 4096, 8192, 8192, 4096, 1024]
    - [60, 352372.0]
  - - [8192, 1024, 1, 8192, 8192, 8192, 8192, 1024]
    - [95, 412945.0]
  - - [8192, 2048, 1, 128, 8192, 8192, 128, 2048]
    - [174, 112638.0]
  - - [8192, 2048, 1, 256, 8192, 8192, 256, 2048]
    - [77, 162323.0]
  - - [8192, 2048, 1, 512, 8192, 8192, 512, 2048]
    - [108, 238702.0]
  - - [8192, 2048, 1, 1024, 8192, 8192, 1024, 2048]
    - [62, 308977.0]
  - - [8192, 2048, 1, 2048, 8192, 8192, 2048, 2048]
    - [58, 363063.0]
  - - [8192, 2048, 1, 4096, 8192, 8192, 4096, 2048]
    - [51, 414459.0]
  - - [8192, 2048, 1, 8192, 8192, 8192, 8192, 2048]
    - [87, 454836.0]
  - - [8192, 4096, 1, 128, 8192, 8192, 128, 4096]
    - [160, 129799.0]
  - - [8192, 4096, 1, 256, 8192, 8192, 256, 4096]
    - [57, 188591.0]
  - - [8192, 4096, 1, 512, 8192, 8192, 512, 4096]
    - [64, 269438.0]
  - - [8192, 4096, 1, 1024, 8192, 8192, 1024, 4096]
    - [91, 342507.0]
  - - [8192, 4096, 1, 2048, 8192, 8192, 2048, 4096]
    - [93, 415945.0]
  - - [8192, 4096, 1, 4096, 8192, 8192, 4096, 4096]
    - [90, 462127.0]
  - - [8192, 4096, 1, 8192, 8192, 8192, 8192, 4096]
    - [53, 491054.0]
  - - [8192, 8192, 1, 128, 8192, 8192, 128, 8192]
    - [172, 152427.0]
  - - [8192, 8192, 1, 256, 8192, 8192, 256, 8192]
    - [54, 222385.0]
  - - [8192, 8192, 1, 512, 8192, 8192, 512, 8192]
    - [59, 304907.0]
  - - [8192, 8192, 1, 1024, 8192, 8192, 1024, 8192]
    - [51, 380406.0]
  - - [8192, 8192, 1, 2048, 8192, 8192, 2048, 8192]
    - [94, 452379.0]
  - - [8192, 8192, 1, 4096, 8192, 8192, 4096, 8192]
    - [93, 504837.0]
  - - [8192, 8192, 1, 8192, 8192, 8192, 8192, 8192]
    - [49, 527466.0]
- null
- null
- DeviceEfficiency
