experiments/sk3rx8_transposes/yaml_outputs/hgemm_tn_2024-06-05_12_37_15/aquavanjaram942_Cijk_Alik_Bljk_HHS_BH.yaml
- {MinimumRequiredVersion: 4.41.0}
- aquavanjaram942
- gfx942
- [Device 0049, Device 0050]
    SolutionIndex: 0
    SolutionNameMin: Cijk_Alik_Bljk_HHS_BH_MT32x32x16_MI16x16x16x1_SN_1LDSB0_AMAS0_ELFLR0_GLVWA2_GLVWB2_NLCB1_PLR1_SVW1_SKFT0_SKXCCM1_TT1_16_VW1_VWB1_WGM0
    SolutionIndex: 1
    SolutionNameMin: Cijk_Alik_Bljk_HHS_BH_MT32x32x16_MI16x16x16x1_SN_1LDSB0_AMAS0_ELFLR12_GLVWA2_GLVWB2_NLCB1_PLR1_SVW1_SKFT0_SKXCCM1_TT1_16_VW1_VWB1_WGM0
    SolutionIndex: 2
    SolutionNameMin: Cijk_Alik_Bljk_HHS_BH_MT32x32x16_MI16x16x16x1_SN_1LDSB0_AMAS0_ELFLR0_GLVWA2_GLVWB2_NLCB1_PLR1_SVW1_SKFT1_SKXCCM0_TT1_16_VW1_VWB1_WGM0
    SolutionIndex: 3
    SolutionNameMin: Cijk_Alik_Bljk_HHS_BH_MT32x32x16_MI16x16x16x1_SN_1LDSB0_AMAS0_ELFLR0_GLVWA2_GLVWB2_NLCB1_PLR1_SVW1_SKFT1_SKXCCM1_TT1_16_VW1_VWB1_WGM0
    SolutionIndex: 4
    SolutionNameMin: Cijk_Alik_Bljk_HHS_BH_MT32x32x32_MI16x16x16x1_SN_1LDSB0_AMAS0_ELFLR0_GLVWA4_GLVWB4_NLCB1_PLR3_SVW1_SKFT1_SKXCCM1_TT1_16_VW1_VWB1_WGM0
    SolutionIndex: 5
    SolutionNameMin: Cijk_Alik_Bljk_HHS_BH_MT32x32x32_MI16x16x16x1_SN_1LDSB0_AMAS0_ELFLR12_GLVWA4_GLVWB4_NLCB1_PLR3_SVW1_SKFT1_SKXCCM1_TT1_16_VW1_VWB1_WGM0
    SolutionIndex: 6
    SolutionNameMin: Cijk_Alik_Bljk_HHS_BH_MT128x64x32_MI16x16x16x1_SN_1LDSB0_AMAS3_ELFLR0_GLVWA8_GLVWB8_NLCB1_PLR3_SVW2_SKFT1_SKXCCM1_TT4_32_VW2_VWB2_WGM0
    SolutionIndex: 7
    SolutionNameMin: Cijk_Alik_Bljk_HHS_BH_MT64x64x32_MI16x16x16x1_SN_1LDSB0_AMAS3_ELFLR0_GLVWA8_GLVWB8_NLCB1_PLR3_SVW2_SKFT0_SKXCCM0_TT2_32_VW2_VWB2_WGM0
    SolutionIndex: 8
    SolutionNameMin: Cijk_Alik_Bljk_HHS_BH_MT64x64x32_MI16x16x16x1_SN_1LDSB0_AMAS3_ELFLR12_GLVWA8_GLVWB8_NLCB1_PLR3_SVW2_SKFT0_SKXCCM0_TT2_32_VW2_VWB2_WGM0
    SolutionIndex: 9
    SolutionNameMin: Cijk_Alik_Bljk_HHS_BH_MT64x64x32_MI16x16x16x1_SN_1LDSB0_AMAS3_ELFLR0_GLVWA8_GLVWB8_NLCB1_PLR3_SVW2_SKFT0_SKXCCM1_TT2_32_VW2_VWB2_WGM0
    SolutionIndex: 10
    SolutionNameMin: Cijk_Alik_Bljk_HHS_BH_MT64x64x32_MI16x16x16x1_SN_1LDSB0_AMAS3_ELFLR12_GLVWA8_GLVWB8_NLCB1_PLR3_SVW2_SKFT0_SKXCCM1_TT2_32_VW2_VWB2_WGM0
    SolutionIndex: 11
    SolutionNameMin: Cijk_Alik_Bljk_HHS_BH_MT64x64x32_MI16x16x16x1_SN_1LDSB0_AMAS3_ELFLR0_GLVWA8_GLVWB8_NLCB1_PLR3_SVW2_SKFT1_SKXCCM0_TT2_32_VW2_VWB2_WGM0
    SolutionIndex: 12
    SolutionNameMin: Cijk_Alik_Bljk_HHS_BH_MT64x64x32_MI16x16x16x1_SN_1LDSB0_AMAS3_ELFLR12_GLVWA8_GLVWB8_NLCB1_PLR3_SVW2_SKFT1_SKXCCM0_TT2_32_VW2_VWB2_WGM0
    SolutionIndex: 13
    SolutionNameMin: Cijk_Alik_Bljk_HHS_BH_MT64x64x32_MI16x16x16x1_SN_1LDSB0_AMAS3_ELFLR0_GLVWA8_GLVWB8_NLCB1_PLR3_SVW2_SKFT1_SKXCCM1_TT2_32_VW2_VWB2_WGM0
    SolutionIndex: 14
    SolutionNameMin: Cijk_Alik_Bljk_HHS_BH_MT64x64x32_MI16x16x16x1_SN_1LDSB0_AMAS3_ELFLR0_GLVWA8_GLVWB8_NLCB1_PLR3_SVW2_SKFT0_SKXCCM0_TT2_32_VW2_VWB2_WGM8
    SolutionIndex: 15
    SolutionNameMin: Cijk_Alik_Bljk_HHS_BH_MT64x64x32_MI16x16x16x1_SN_1LDSB0_AMAS3_ELFLR12_GLVWA8_GLVWB8_NLCB1_PLR3_SVW2_SKFT0_SKXCCM0_TT2_32_VW2_VWB2_WGM8
    SolutionIndex: 16
    SolutionNameMin: Cijk_Alik_Bljk_HHS_BH_MT64x64x32_MI16x16x16x1_SN_1LDSB0_AMAS3_ELFLR0_GLVWA8_GLVWB8_NLCB1_PLR3_SVW2_SKFT0_SKXCCM1_TT2_32_VW2_VWB2_WGM8
    SolutionIndex: 17
    SolutionNameMin: Cijk_Alik_Bljk_HHS_BH_MT64x64x32_MI16x16x16x1_SN_1LDSB0_AMAS3_ELFLR12_GLVWA8_GLVWB8_NLCB1_PLR3_SVW2_SKFT0_SKXCCM1_TT2_32_VW2_VWB2_WGM8
    SolutionIndex: 18
    SolutionNameMin: Cijk_Alik_Bljk_HHS_BH_MT64x64x32_MI16x16x16x1_SN_1LDSB0_AMAS3_ELFLR0_GLVWA8_GLVWB8_NLCB1_PLR3_SVW2_SKFT1_SKXCCM0_TT2_32_VW2_VWB2_WGM8
    SolutionIndex: 19
    SolutionNameMin: Cijk_Alik_Bljk_HHS_BH_MT64x64x32_MI16x16x16x1_SN_1LDSB0_AMAS3_ELFLR12_GLVWA8_GLVWB8_NLCB1_PLR3_SVW2_SKFT1_SKXCCM0_TT2_32_VW2_VWB2_WGM8
    SolutionIndex: 20
    SolutionNameMin: Cijk_Alik_Bljk_HHS_BH_MT64x64x32_MI16x16x16x1_SN_1LDSB0_AMAS3_ELFLR0_GLVWA8_GLVWB8_NLCB1_PLR3_SVW2_SKFT1_SKXCCM1_TT2_32_VW2_VWB2_WGM8
    SolutionIndex: 21
    SolutionNameMin: Cijk_Alik_Bljk_HHS_BH_MT64x64x32_MI16x16x16x1_SN_1LDSB0_AMAS3_ELFLR12_GLVWA8_GLVWB8_NLCB1_PLR3_SVW2_SKFT1_SKXCCM1_TT2_32_VW2_VWB2_WGM8
    SolutionIndex: 22
    SolutionNameMin: Cijk_Alik_Bljk_HHS_BH_MT64x32x32_MI16x16x16x1_SN_1LDSB0_AMAS3_ELFLR0_GLVWA8_GLVWB4_NLCB1_PLR3_SVW2_SKFT0_SKXCCM0_TT2_16_VW2_VWB1_WGM0
    SolutionIndex: 23
    SolutionNameMin: Cijk_Alik_Bljk_HHS_BH_MT64x32x32_MI16x16x16x1_SN_1LDSB0_AMAS3_ELFLR12_GLVWA8_GLVWB4_NLCB1_PLR3_SVW2_SKFT0_SKXCCM0_TT2_16_VW2_VWB1_WGM0
    SolutionIndex: 24
    SolutionNameMin: Cijk_Alik_Bljk_HHS_BH_MT64x32x32_MI16x16x16x1_SN_1LDSB0_AMAS3_ELFLR0_GLVWA8_GLVWB4_NLCB1_PLR3_SVW2_SKFT0_SKXCCM1_TT2_16_VW2_VWB1_WGM0
    SolutionIndex: 25
    SolutionNameMin: Cijk_Alik_Bljk_HHS_BH_MT64x32x32_MI16x16x16x1_SN_1LDSB0_AMAS3_ELFLR12_GLVWA8_GLVWB4_NLCB1_PLR3_SVW2_SKFT0_SKXCCM1_TT2_16_VW2_VWB1_WGM0
    SolutionIndex: 26
    SolutionNameMin: Cijk_Alik_Bljk_HHS_BH_MT64x32x32_MI16x16x16x1_SN_1LDSB0_AMAS3_ELFLR0_GLVWA8_GLVWB4_NLCB1_PLR3_SVW2_SKFT1_SKXCCM0_TT2_16_VW2_VWB1_WGM0
    SolutionIndex: 27
    SolutionNameMin: Cijk_Alik_Bljk_HHS_BH_MT64x32x32_MI16x16x16x1_SN_1LDSB0_AMAS3_ELFLR12_GLVWA8_GLVWB4_NLCB1_PLR3_SVW2_SKFT1_SKXCCM0_TT2_16_VW2_VWB1_WGM0
    SolutionIndex: 28
    SolutionNameMin: Cijk_Alik_Bljk_HHS_BH_MT64x32x32_MI16x16x16x1_SN_1LDSB0_AMAS3_ELFLR0_GLVWA8_GLVWB4_NLCB1_PLR3_SVW2_SKFT1_SKXCCM1_TT2_16_VW2_VWB1_WGM0
    SolutionIndex: 29
    SolutionNameMin: Cijk_Alik_Bljk_HHS_BH_MT64x32x32_MI16x16x16x1_SN_1LDSB0_AMAS3_ELFLR0_GLVWA8_GLVWB4_NLCB1_PLR3_SVW2_SKFT0_SKXCCM0_TT2_16_VW2_VWB1_WGM8
    SolutionIndex: 30
    SolutionNameMin: Cijk_Alik_Bljk_HHS_BH_MT64x32x32_MI16x16x16x1_SN_1LDSB0_AMAS3_ELFLR12_GLVWA8_GLVWB4_NLCB1_PLR3_SVW2_SKFT1_SKXCCM0_TT2_16_VW2_VWB1_WGM8
    SolutionIndex: 31
    SolutionNameMin: Cijk_Alik_Bljk_HHS_BH_MT64x32x32_MI16x16x16x1_SN_1LDSB0_AMAS3_ELFLR0_GLVWA8_GLVWB4_NLCB1_PLR3_SVW2_SKFT1_SKXCCM1_TT2_16_VW2_VWB1_WGM8
    SolutionIndex: 32
    SolutionNameMin: Cijk_Alik_Bljk_HHS_BH_MT256x256x32_MI16x16x16x1_SN_1LDSB0_AMAS3_ELFLR0_GLVWA8_GLVWB8_NLCB1_PLR3_SVW4_SKFT0_SKXCCM0_TT8_128_VW4_VWB4_WGM0
    SolutionIndex: 33
    SolutionNameMin: Cijk_Alik_Bljk_HHS_BH_MT256x256x32_MI16x16x16x1_SN_1LDSB0_AMAS3_ELFLR0_GLVWA8_GLVWB8_NLCB1_PLR3_SVW4_SKFT0_SKXCCM1_TT8_128_VW4_VWB4_WGM0
    SolutionIndex: 34
    SolutionNameMin: Cijk_Alik_Bljk_HHS_BH_MT256x256x32_MI16x16x16x1_SN_1LDSB0_AMAS3_ELFLR0_GLVWA8_GLVWB8_NLCB1_PLR3_SVW4_SKFT1_SKXCCM1_TT8_128_VW4_VWB4_WGM0
    SolutionIndex: 35
    SolutionNameMin: Cijk_Alik_Bljk_HHS_BH_MT256x256x32_MI16x16x16x1_SN_1LDSB0_AMAS3_ELFLR12_GLVWA8_GLVWB8_NLCB1_PLR3_SVW4_SKFT1_SKXCCM1_TT8_128_VW4_VWB4_WGM0
    SolutionIndex: 36
    SolutionNameMin: Cijk_Alik_Bljk_HHS_BH_MT256x256x32_MI16x16x16x1_SN_1LDSB0_AMAS3_ELFLR12_GLVWA8_GLVWB8_NLCB2_PLR3_SVW4_SKFT1_SKXCCM1_TT8_128_VW4_VWB4_WGM0
    SolutionIndex: 37
    SolutionNameMin: Cijk_Alik_Bljk_HHS_BH_MT256x256x32_MI16x16x16x1_SN_1LDSB0_AMAS3_ELFLR0_GLVWA8_GLVWB8_NLCB1_PLR3_SVW4_SKFT0_SKXCCM1_TT8_128_VW4_VWB4_WGM8
    SolutionIndex: 38
    SolutionNameMin: Cijk_Alik_Bljk_HHS_BH_MT256x256x32_MI16x16x16x1_SN_1LDSB0_AMAS3_ELFLR0_GLVWA8_GLVWB8_NLCB1_PLR3_SVW4_SKFT1_SKXCCM1_TT8_128_VW4_VWB4_WGM8
    SolutionIndex: 39
    SolutionNameMin: Cijk_Alik_Bljk_HHS_BH_MT256x256x32_MI16x16x16x1_SN_1LDSB0_AMAS3_ELFLR12_GLVWA8_GLVWB8_NLCB2_PLR3_SVW4_SKFT0_SKXCCM1_TT8_128_VW4_VWB4_WGM8
    SolutionIndex: 40
    SolutionNameMin: Cijk_Alik_Bljk_HHS_BH_MT256x256x32_MI16x16x16x1_SN_1LDSB0_AMAS3_ELFLR0_GLVWA8_GLVWB8_NLCB2_PLR3_SVW4_SKFT1_SKXCCM1_TT8_128_VW4_VWB4_WGM8
    SolutionIndex: 41
    SolutionNameMin: Cijk_Alik_Bljk_HHS_BH_MT128x256x32_MI16x16x16x1_SN_1LDSB0_AMAS3_ELFLR0_GLVWA8_GLVWB8_NLCB1_PLR3_SVW4_SKFT0_SKXCCM1_TT4_128_VW4_VWB4_WGM0
    SolutionIndex: 42
    SolutionNameMin: Cijk_Alik_Bljk_HHS_BH_MT128x256x32_MI16x16x16x1_SN_1LDSB0_AMAS3_ELFLR0_GLVWA8_GLVWB8_NLCB2_PLR3_SVW4_SKFT0_SKXCCM1_TT4_128_VW4_VWB4_WGM0
    SolutionIndex: 43
    SolutionNameMin: Cijk_Alik_Bljk_HHS_BH_MT128x256x32_MI16x16x16x1_SN_1LDSB0_AMAS3_ELFLR12_GLVWA8_GLVWB8_NLCB2_PLR3_SVW4_SKFT0_SKXCCM1_TT4_128_VW4_VWB4_WGM0
    SolutionIndex: 44
    SolutionNameMin: Cijk_Alik_Bljk_HHS_BH_MT128x256x32_MI16x16x16x1_SN_1LDSB0_AMAS3_ELFLR0_GLVWA8_GLVWB8_NLCB2_PLR3_SVW4_SKFT1_SKXCCM1_TT4_128_VW4_VWB4_WGM0
    SolutionIndex: 45
    SolutionNameMin: Cijk_Alik_Bljk_HHS_BH_MT128x256x32_MI16x16x16x1_SN_1LDSB0_AMAS3_ELFLR12_GLVWA8_GLVWB8_NLCB2_PLR3_SVW4_SKFT1_SKXCCM1_TT4_128_VW4_VWB4_WGM0
    SolutionIndex: 46
    SolutionNameMin: Cijk_Alik_Bljk_HHS_BH_MT128x256x32_MI16x16x16x1_SN_1LDSB0_AMAS3_ELFLR0_GLVWA8_GLVWB8_NLCB1_PLR3_SVW4_SKFT0_SKXCCM1_TT4_128_VW4_VWB4_WGM8
    SolutionIndex: 47
    SolutionNameMin: Cijk_Alik_Bljk_HHS_BH_MT128x256x32_MI16x16x16x1_SN_1LDSB0_AMAS3_ELFLR0_GLVWA8_GLVWB8_NLCB1_PLR3_SVW4_SKFT1_SKXCCM1_TT4_128_VW4_VWB4_WGM8
    SolutionIndex: 48
    SolutionNameMin: Cijk_Alik_Bljk_HHS_BH_MT256x128x32_MI16x16x16x1_SN_1LDSB0_AMAS3_ELFLR0_GLVWA8_GLVWB8_NLCB2_PLR3_SVW4_SKFT0_SKXCCM1_TT8_64_VW4_VWB4_WGM8
    SolutionIndex: 49
    SolutionNameMin: Cijk_Alik_Bljk_HHS_BH_MT256x128x32_MI16x16x16x1_SN_1LDSB0_AMAS3_ELFLR0_GLVWA8_GLVWB8_NLCB2_PLR3_SVW4_SKFT1_SKXCCM1_TT8_64_VW4_VWB4_WGM8
    SolutionIndex: 50
    SolutionNameMin: Cijk_Alik_Bljk_HHS_BH_MT256x128x32_MI16x16x16x1_SN_1LDSB0_AMAS3_ELFLR12_GLVWA8_GLVWB8_NLCB2_PLR3_SVW4_SKFT1_SKXCCM1_TT8_64_VW4_VWB4_WGM8
    SolutionIndex: 51
    SolutionNameMin: Cijk_Alik_Bljk_HHS_BH_MT128x128x32_MI16x16x16x1_SN_1LDSB0_AMAS3_ELFLR0_GLVWA8_GLVWB8_NLCB1_PLR3_SVW4_SKFT0_SKXCCM0_TT4_64_VW4_VWB4_WGM0
    SolutionIndex: 52
    SolutionNameMin: Cijk_Alik_Bljk_HHS_BH_MT128x128x32_MI16x16x16x1_SN_1LDSB0_AMAS3_ELFLR0_GLVWA8_GLVWB8_NLCB1_PLR3_SVW4_SKFT0_SKXCCM1_TT4_64_VW4_VWB4_WGM0
    SolutionIndex: 53
    SolutionNameMin: Cijk_Alik_Bljk_HHS_BH_MT128x128x32_MI16x16x16x1_SN_1LDSB0_AMAS3_ELFLR12_GLVWA8_GLVWB8_NLCB1_PLR3_SVW4_SKFT0_SKXCCM1_TT4_64_VW4_VWB4_WGM0
    SolutionIndex: 54
    SolutionNameMin: Cijk_Alik_Bljk_HHS_BH_MT128x128x32_MI16x16x16x1_SN_1LDSB0_AMAS3_ELFLR0_GLVWA8_GLVWB8_NLCB1_PLR3_SVW4_SKFT1_SKXCCM1_TT4_64_VW4_VWB4_WGM0
    SolutionIndex: 55
    SolutionNameMin: Cijk_Alik_Bljk_HHS_BH_MT128x128x32_MI16x16x16x1_SN_1LDSB0_AMAS3_ELFLR12_GLVWA8_GLVWB8_NLCB1_PLR3_SVW4_SKFT1_SKXCCM1_TT4_64_VW4_VWB4_WGM0
    SolutionIndex: 56
    SolutionNameMin: Cijk_Alik_Bljk_HHS_BH_MT128x128x32_MI16x16x16x1_SN_1LDSB0_AMAS3_ELFLR0_GLVWA8_GLVWB8_NLCB2_PLR3_SVW4_SKFT0_SKXCCM0_TT4_64_VW4_VWB4_WGM0
    SolutionIndex: 57
    SolutionNameMin: Cijk_Alik_Bljk_HHS_BH_MT128x128x32_MI16x16x16x1_SN_1LDSB0_AMAS3_ELFLR0_GLVWA8_GLVWB8_NLCB2_PLR3_SVW4_SKFT0_SKXCCM1_TT4_64_VW4_VWB4_WGM0
    SolutionIndex: 58
    SolutionNameMin: Cijk_Alik_Bljk_HHS_BH_MT128x128x32_MI16x16x16x1_SN_1LDSB0_AMAS3_ELFLR12_GLVWA8_GLVWB8_NLCB2_PLR3_SVW4_SKFT0_SKXCCM1_TT4_64_VW4_VWB4_WGM0
    SolutionIndex: 59
    SolutionNameMin: Cijk_Alik_Bljk_HHS_BH_MT128x128x32_MI16x16x16x1_SN_1LDSB0_AMAS3_ELFLR12_GLVWA8_GLVWB8_NLCB2_PLR3_SVW4_SKFT1_SKXCCM0_TT4_64_VW4_VWB4_WGM0
    SolutionIndex: 60
    SolutionNameMin: Cijk_Alik_Bljk_HHS_BH_MT128x128x32_MI16x16x16x1_SN_1LDSB0_AMAS3_ELFLR0_GLVWA8_GLVWB8_NLCB2_PLR3_SVW4_SKFT1_SKXCCM1_TT4_64_VW4_VWB4_WGM0
    SolutionIndex: 61
    SolutionNameMin: Cijk_Alik_Bljk_HHS_BH_MT128x128x32_MI16x16x16x1_SN_1LDSB0_AMAS3_ELFLR12_GLVWA8_GLVWB8_NLCB2_PLR3_SVW4_SKFT1_SKXCCM1_TT4_64_VW4_VWB4_WGM0
    SolutionIndex: 62
    SolutionNameMin: Cijk_Alik_Bljk_HHS_BH_MT128x128x32_MI16x16x16x1_SN_1LDSB0_AMAS3_ELFLR0_GLVWA8_GLVWB8_NLCB1_PLR3_SVW4_SKFT0_SKXCCM1_TT4_64_VW4_VWB4_WGM8
    SolutionIndex: 63
    SolutionNameMin: Cijk_Alik_Bljk_HHS_BH_MT128x128x32_MI16x16x16x1_SN_1LDSB0_AMAS3_ELFLR12_GLVWA8_GLVWB8_NLCB1_PLR3_SVW4_SKFT0_SKXCCM1_TT4_64_VW4_VWB4_WGM8
    SolutionIndex: 64
    SolutionNameMin: Cijk_Alik_Bljk_HHS_BH_MT128x128x32_MI16x16x16x1_SN_1LDSB0_AMAS3_ELFLR0_GLVWA8_GLVWB8_NLCB1_PLR3_SVW4_SKFT1_SKXCCM0_TT4_64_VW4_VWB4_WGM8
    SolutionIndex: 65
    SolutionNameMin: Cijk_Alik_Bljk_HHS_BH_MT128x128x32_MI16x16x16x1_SN_1LDSB0_AMAS3_ELFLR0_GLVWA8_GLVWB8_NLCB1_PLR3_SVW4_SKFT1_SKXCCM1_TT4_64_VW4_VWB4_WGM8
    SolutionIndex: 66
    SolutionNameMin: Cijk_Alik_Bljk_HHS_BH_MT128x128x32_MI16x16x16x1_SN_1LDSB0_AMAS3_ELFLR12_GLVWA8_GLVWB8_NLCB1_PLR3_SVW4_SKFT1_SKXCCM1_TT4_64_VW4_VWB4_WGM8
    SolutionIndex: 67
    SolutionNameMin: Cijk_Alik_Bljk_HHS_BH_MT128x128x32_MI16x16x16x1_SN_1LDSB0_AMAS3_ELFLR0_GLVWA8_GLVWB8_NLCB2_PLR3_SVW4_SKFT0_SKXCCM1_TT4_64_VW4_VWB4_WGM8
    SolutionIndex: 68
    SolutionNameMin: Cijk_Alik_Bljk_HHS_BH_MT128x128x32_MI16x16x16x1_SN_1LDSB0_AMAS3_ELFLR12_GLVWA8_GLVWB8_NLCB2_PLR3_SVW4_SKFT0_SKXCCM1_TT4_64_VW4_VWB4_WGM8
    SolutionIndex: 69
    SolutionNameMin: Cijk_Alik_Bljk_HHS_BH_MT128x128x32_MI16x16x16x1_SN_1LDSB0_AMAS3_ELFLR12_GLVWA8_GLVWB8_NLCB2_PLR3_SVW4_SKFT1_SKXCCM0_TT4_64_VW4_VWB4_WGM8
    SolutionIndex: 70
    SolutionNameMin: Cijk_Alik_Bljk_HHS_BH_MT128x128x32_MI16x16x16x1_SN_1LDSB0_AMAS3_ELFLR0_GLVWA8_GLVWB8_NLCB2_PLR3_SVW4_SKFT1_SKXCCM1_TT4_64_VW4_VWB4_WGM8
    SolutionIndex: 71
    SolutionNameMin: Cijk_Alik_Bljk_HHS_BH_MT128x128x32_MI16x16x16x1_SN_1LDSB0_AMAS3_ELFLR12_GLVWA8_GLVWB8_NLCB2_PLR3_SVW4_SKFT1_SKXCCM1_TT4_64_VW4_VWB4_WGM8
    SolutionIndex: 72
    SolutionNameMin: Cijk_Alik_Bljk_HHS_BH_MT128x64x32_MI16x16x16x1_SN_1LDSB0_AMAS3_ELFLR0_GLVWA8_GLVWB8_NLCB1_PLR3_SVW4_SKFT0_SKXCCM0_TT4_32_VW4_VWB1_WGM0
    SolutionIndex: 73
    SolutionNameMin: Cijk_Alik_Bljk_HHS_BH_MT128x64x32_MI16x16x16x1_SN_1LDSB0_AMAS3_ELFLR12_GLVWA8_GLVWB8_NLCB1_PLR3_SVW4_SKFT0_SKXCCM0_TT4_32_VW4_VWB1_WGM0
    SolutionIndex: 74
    SolutionNameMin: Cijk_Alik_Bljk_HHS_BH_MT128x64x32_MI16x16x16x1_SN_1LDSB0_AMAS3_ELFLR0_GLVWA8_GLVWB8_NLCB1_PLR3_SVW4_SKFT0_SKXCCM1_TT4_32_VW4_VWB1_WGM0
    SolutionIndex: 75
    SolutionNameMin: Cijk_Alik_Bljk_HHS_BH_MT128x64x32_MI16x16x16x1_SN_1LDSB0_AMAS3_ELFLR12_GLVWA8_GLVWB8_NLCB1_PLR3_SVW4_SKFT0_SKXCCM1_TT4_32_VW4_VWB1_WGM0
    SolutionIndex: 76
    SolutionNameMin: Cijk_Alik_Bljk_HHS_BH_MT128x64x32_MI16x16x16x1_SN_1LDSB0_AMAS3_ELFLR12_GLVWA8_GLVWB8_NLCB1_PLR3_SVW4_SKFT1_SKXCCM0_TT4_32_VW4_VWB1_WGM0
    SolutionIndex: 77
    SolutionNameMin: Cijk_Alik_Bljk_HHS_BH_MT128x64x32_MI16x16x16x1_SN_1LDSB0_AMAS3_ELFLR0_GLVWA8_GLVWB8_NLCB1_PLR3_SVW4_SKFT1_SKXCCM1_TT4_32_VW4_VWB1_WGM0
    SolutionIndex: 78
    SolutionNameMin: Cijk_Alik_Bljk_HHS_BH_MT128x64x32_MI16x16x16x1_SN_1LDSB0_AMAS3_ELFLR12_GLVWA8_GLVWB8_NLCB1_PLR3_SVW4_SKFT1_SKXCCM1_TT4_32_VW4_VWB1_WGM0
    SolutionIndex: 79
    SolutionNameMin: Cijk_Alik_Bljk_HHS_BH_MT128x64x32_MI16x16x16x1_SN_1LDSB0_AMAS3_ELFLR12_GLVWA8_GLVWB8_NLCB1_PLR3_SVW4_SKFT0_SKXCCM0_TT4_32_VW4_VWB1_WGM8
    SolutionIndex: 80
    SolutionNameMin: Cijk_Alik_Bljk_HHS_BH_MT128x64x32_MI16x16x16x1_SN_1LDSB0_AMAS3_ELFLR0_GLVWA8_GLVWB8_NLCB1_PLR3_SVW4_SKFT0_SKXCCM1_TT4_32_VW4_VWB1_WGM8
    SolutionIndex: 81
    SolutionNameMin: Cijk_Alik_Bljk_HHS_BH_MT128x64x32_MI16x16x16x1_SN_1LDSB0_AMAS3_ELFLR12_GLVWA8_GLVWB8_NLCB1_PLR3_SVW4_SKFT0_SKXCCM1_TT4_32_VW4_VWB1_WGM8
    SolutionIndex: 82
    SolutionNameMin: Cijk_Alik_Bljk_HHS_BH_MT128x64x32_MI16x16x16x1_SN_1LDSB0_AMAS3_ELFLR0_GLVWA8_GLVWB8_NLCB1_PLR3_SVW4_SKFT1_SKXCCM1_TT4_32_VW4_VWB1_WGM8
    SolutionIndex: 83
    SolutionNameMin: Cijk_Alik_Bljk_HHS_BH_MT128x64x32_MI16x16x16x1_SN_1LDSB0_AMAS3_ELFLR12_GLVWA8_GLVWB8_NLCB1_PLR3_SVW4_SKFT1_SKXCCM1_TT4_32_VW4_VWB1_WGM8
    SolutionIndex: 84
    SolutionNameMin: Cijk_Alik_Bljk_HHS_BH_MT256x256x32_MI16x16x16x1_SN_1LDSB1_AMAS3_ELFLR0_GLVWA8_GLVWB8_NLCB1_PLR3_SVW4_SKFT0_SKXCCM1_TT8_128_VW4_VWB4_WGM0
    SolutionIndex: 85
    SolutionNameMin: Cijk_Alik_Bljk_HHS_BH_MT256x256x32_MI16x16x16x1_SN_1LDSB1_AMAS3_ELFLR12_GLVWA8_GLVWB8_NLCB1_PLR3_SVW4_SKFT0_SKXCCM1_TT8_128_VW4_VWB4_WGM0
    SolutionIndex: 86
    SolutionNameMin: Cijk_Alik_Bljk_HHS_BH_MT256x256x32_MI16x16x16x1_SN_1LDSB1_AMAS3_ELFLR0_GLVWA8_GLVWB8_NLCB1_PLR3_SVW4_SKFT1_SKXCCM1_TT8_128_VW4_VWB4_WGM0
    SolutionIndex: 87
    SolutionNameMin: Cijk_Alik_Bljk_HHS_BH_MT256x256x32_MI16x16x16x1_SN_1LDSB1_AMAS3_ELFLR12_GLVWA8_GLVWB8_NLCB1_PLR3_SVW4_SKFT1_SKXCCM1_TT8_128_VW4_VWB4_WGM0
    SolutionIndex: 88
    SolutionNameMin: Cijk_Alik_Bljk_HHS_BH_MT256x256x32_MI16x16x16x1_SN_1LDSB1_AMAS3_ELFLR0_GLVWA8_GLVWB8_NLCB2_PLR3_SVW4_SKFT0_SKXCCM1_TT8_128_VW4_VWB4_WGM0
    SolutionIndex: 89
    SolutionNameMin: Cijk_Alik_Bljk_HHS_BH_MT256x256x32_MI16x16x16x1_SN_1LDSB1_AMAS3_ELFLR12_GLVWA8_GLVWB8_NLCB2_PLR3_SVW4_SKFT0_SKXCCM1_TT8_128_VW4_VWB4_WGM0
    SolutionIndex: 90
    SolutionNameMin: Cijk_Alik_Bljk_HHS_BH_MT256x256x32_MI16x16x16x1_SN_1LDSB1_AMAS3_ELFLR0_GLVWA8_GLVWB8_NLCB2_PLR3_SVW4_SKFT1_SKXCCM1_TT8_128_VW4_VWB4_WGM0
    SolutionIndex: 91
    SolutionNameMin: Cijk_Alik_Bljk_HHS_BH_MT256x256x32_MI16x16x16x1_SN_1LDSB1_AMAS3_ELFLR12_GLVWA8_GLVWB8_NLCB2_PLR3_SVW4_SKFT1_SKXCCM1_TT8_128_VW4_VWB4_WGM0
    SolutionIndex: 92
    SolutionNameMin: Cijk_Alik_Bljk_HHS_BH_MT256x256x32_MI16x16x16x1_SN_1LDSB1_AMAS3_ELFLR0_GLVWA8_GLVWB8_NLCB1_PLR3_SVW4_SKFT0_SKXCCM1_TT8_128_VW4_VWB4_WGM8
    SolutionIndex: 93
    SolutionNameMin: Cijk_Alik_Bljk_HHS_BH_MT256x256x32_MI16x16x16x1_SN_1LDSB1_AMAS3_ELFLR0_GLVWA8_GLVWB8_NLCB1_PLR3_SVW4_SKFT1_SKXCCM1_TT8_128_VW4_VWB4_WGM8
    SolutionIndex: 94
    SolutionNameMin: Cijk_Alik_Bljk_HHS_BH_MT256x256x32_MI16x16x16x1_SN_1LDSB1_AMAS3_ELFLR0_GLVWA8_GLVWB8_NLCB2_PLR3_SVW4_SKFT1_SKXCCM1_TT8_128_VW4_VWB4_WGM8
    SolutionIndex: 95
    SolutionNameMin: Cijk_Alik_Bljk_HHS_BH_MT128x256x32_MI16x16x16x1_SN_1LDSB1_AMAS3_ELFLR0_GLVWA8_GLVWB8_NLCB2_PLR3_SVW4_SKFT0_SKXCCM1_TT4_128_VW4_VWB4_WGM0
    SolutionIndex: 96
    SolutionNameMin: Cijk_Alik_Bljk_HHS_BH_MT128x256x32_MI16x16x16x1_SN_1LDSB1_AMAS3_ELFLR0_GLVWA8_GLVWB8_NLCB2_PLR3_SVW4_SKFT1_SKXCCM1_TT4_128_VW4_VWB4_WGM0
    SolutionIndex: 97
    SolutionNameMin: Cijk_Alik_Bljk_HHS_BH_MT128x256x32_MI16x16x16x1_SN_1LDSB1_AMAS3_ELFLR0_GLVWA8_GLVWB8_NLCB2_PLR3_SVW4_SKFT1_SKXCCM1_TT4_128_VW4_VWB4_WGM8
    SolutionIndex: 98
    SolutionNameMin: Cijk_Alik_Bljk_HHS_BH_MT128x256x32_MI16x16x16x1_SN_1LDSB1_AMAS3_ELFLR12_GLVWA8_GLVWB8_NLCB2_PLR3_SVW4_SKFT1_SKXCCM1_TT4_128_VW4_VWB4_WGM8
    SolutionIndex: 99
    SolutionNameMin: Cijk_Alik_Bljk_HHS_BH_MT256x128x32_MI16x16x16x1_SN_1LDSB1_AMAS3_ELFLR0_GLVWA8_GLVWB8_NLCB2_PLR3_SVW4_SKFT0_SKXCCM1_TT8_64_VW4_VWB4_WGM0
    SolutionIndex: 100
    SolutionNameMin: Cijk_Alik_Bljk_HHS_BH_MT256x128x32_MI16x16x16x1_SN_1LDSB1_AMAS3_ELFLR0_GLVWA8_GLVWB8_NLCB2_PLR3_SVW4_SKFT1_SKXCCM1_TT8_64_VW4_VWB4_WGM0
    SolutionIndex: 101
    SolutionNameMin: Cijk_Alik_Bljk_HHS_BH_MT256x128x32_MI16x16x16x1_SN_1LDSB1_AMAS3_ELFLR0_GLVWA8_GLVWB8_NLCB2_PLR3_SVW4_SKFT1_SKXCCM1_TT8_64_VW4_VWB4_WGM8
    SolutionIndex: 102
    SolutionNameMin: Cijk_Alik_Bljk_HHS_BH_MT128x128x32_MI16x16x16x1_SN_1LDSB1_AMAS3_ELFLR12_GLVWA8_GLVWB8_NLCB1_PLR3_SVW4_SKFT0_SKXCCM0_TT4_64_VW4_VWB4_WGM0
    SolutionIndex: 103
    SolutionNameMin: Cijk_Alik_Bljk_HHS_BH_MT128x128x32_MI16x16x16x1_SN_1LDSB1_AMAS3_ELFLR0_GLVWA8_GLVWB8_NLCB1_PLR3_SVW4_SKFT1_SKXCCM0_TT4_64_VW4_VWB4_WGM0
    SolutionIndex: 104
    SolutionNameMin: Cijk_Alik_Bljk_HHS_BH_MT128x128x32_MI16x16x16x1_SN_1LDSB1_AMAS3_ELFLR0_GLVWA8_GLVWB8_NLCB2_PLR3_SVW4_SKFT0_SKXCCM1_TT4_64_VW4_VWB4_WGM8
    SolutionIndex: 105
    SolutionNameMin: Cijk_Alik_Bljk_HHS_BH_MT128x128x32_MI16x16x16x1_SN_1LDSB1_AMAS3_ELFLR12_GLVWA8_GLVWB8_NLCB2_PLR3_SVW4_SKFT1_SKXCCM1_TT4_64_VW4_VWB4_WGM8
    SolutionIndex: 106
    SolutionNameMin: Cijk_Alik_Bljk_HHS_BH_MT32x64x64_MI16x16x16x1_SN_1LDSB0_AMAS0_ELFLR0_GLVWA8_GLVWB8_NLCB2_PLR5_SVW1_SKFT0_SKXCCM0_TT1_32_VW1_VWB1_WGM0
    SolutionIndex: 107
    SolutionNameMin: Cijk_Alik_Bljk_HHS_BH_MT32x64x64_MI16x16x16x1_SN_1LDSB0_AMAS0_ELFLR0_GLVWA8_GLVWB8_NLCB2_PLR5_SVW1_SKFT0_SKXCCM1_TT1_32_VW1_VWB1_WGM0
    SolutionIndex: 108
    SolutionNameMin: Cijk_Alik_Bljk_HHS_BH_MT32x64x64_MI16x16x16x1_SN_1LDSB0_AMAS0_ELFLR12_GLVWA8_GLVWB8_NLCB2_PLR5_SVW1_SKFT0_SKXCCM1_TT1_32_VW1_VWB1_WGM0
    SolutionIndex: 109
    SolutionNameMin: Cijk_Alik_Bljk_HHS_BH_MT32x64x64_MI16x16x16x1_SN_1LDSB0_AMAS0_ELFLR0_GLVWA8_GLVWB8_NLCB2_PLR5_SVW1_SKFT1_SKXCCM1_TT1_32_VW1_VWB1_WGM0
    SolutionIndex: 110
    SolutionNameMin: Cijk_Alik_Bljk_HHS_BH_MT32x32x64_MI16x16x16x1_SN_1LDSB0_AMAS0_ELFLR0_GLVWA8_GLVWB8_NLCB1_PLR5_SVW1_SKFT0_SKXCCM0_TT1_16_VW1_VWB1_WGM0
    SolutionIndex: 111
    SolutionNameMin: Cijk_Alik_Bljk_HHS_BH_MT32x32x64_MI16x16x16x1_SN_1LDSB0_AMAS0_ELFLR12_GLVWA8_GLVWB8_NLCB1_PLR5_SVW1_SKFT0_SKXCCM0_TT1_16_VW1_VWB1_WGM0
    SolutionIndex: 112
    SolutionNameMin: Cijk_Alik_Bljk_HHS_BH_MT32x32x64_MI16x16x16x1_SN_1LDSB0_AMAS0_ELFLR0_GLVWA8_GLVWB8_NLCB1_PLR5_SVW1_SKFT0_SKXCCM1_TT1_16_VW1_VWB1_WGM0
    SolutionIndex: 113
    SolutionNameMin: Cijk_Alik_Bljk_HHS_BH_MT32x32x64_MI16x16x16x1_SN_1LDSB0_AMAS0_ELFLR12_GLVWA8_GLVWB8_NLCB1_PLR5_SVW1_SKFT0_SKXCCM1_TT1_16_VW1_VWB1_WGM0
    SolutionIndex: 114
    SolutionNameMin: Cijk_Alik_Bljk_HHS_BH_MT32x32x64_MI16x16x16x1_SN_1LDSB0_AMAS0_ELFLR0_GLVWA8_GLVWB8_NLCB1_PLR5_SVW1_SKFT1_SKXCCM0_TT1_16_VW1_VWB1_WGM0
    SolutionIndex: 115
    SolutionNameMin: Cijk_Alik_Bljk_HHS_BH_MT32x32x64_MI16x16x16x1_SN_1LDSB0_AMAS0_ELFLR12_GLVWA8_GLVWB8_NLCB1_PLR5_SVW1_SKFT1_SKXCCM0_TT1_16_VW1_VWB1_WGM0
    SolutionIndex: 116
    SolutionNameMin: Cijk_Alik_Bljk_HHS_BH_MT32x32x64_MI16x16x16x1_SN_1LDSB0_AMAS0_ELFLR0_GLVWA8_GLVWB8_NLCB1_PLR5_SVW1_SKFT1_SKXCCM1_TT1_16_VW1_VWB1_WGM0
    SolutionIndex: 117
    SolutionNameMin: Cijk_Alik_Bljk_HHS_BH_MT32x32x64_MI16x16x16x1_SN_1LDSB0_AMAS0_ELFLR12_GLVWA8_GLVWB8_NLCB1_PLR5_SVW1_SKFT1_SKXCCM1_TT1_16_VW1_VWB1_WGM0
    SolutionIndex: 118
    SolutionNameMin: Cijk_Alik_Bljk_HHS_BH_MT32x32x64_MI16x16x16x1_SN_1LDSB0_AMAS0_ELFLR0_GLVWA8_GLVWB8_NLCB1_PLR5_SVW1_SKFT0_SKXCCM1_TT1_16_VW1_VWB1_WGM8
    SolutionIndex: 119
    SolutionNameMin: Cijk_Alik_Bljk_HHS_BH_MT64x64x64_MI16x16x16x1_SN_1LDSB0_AMAS3_ELFLR0_GLVWA8_GLVWB8_NLCB2_PLR5_SVW2_SKFT0_SKXCCM0_TT2_32_VW2_VWB2_WGM0
    SolutionIndex: 120
    SolutionNameMin: Cijk_Alik_Bljk_HHS_BH_MT64x64x64_MI16x16x16x1_SN_1LDSB0_AMAS3_ELFLR12_GLVWA8_GLVWB8_NLCB2_PLR5_SVW2_SKFT0_SKXCCM0_TT2_32_VW2_VWB2_WGM0
    SolutionIndex: 121
    SolutionNameMin: Cijk_Alik_Bljk_HHS_BH_MT64x64x64_MI16x16x16x1_SN_1LDSB0_AMAS3_ELFLR0_GLVWA8_GLVWB8_NLCB2_PLR5_SVW2_SKFT0_SKXCCM1_TT2_32_VW2_VWB2_WGM0
    SolutionIndex: 122
    SolutionNameMin: Cijk_Alik_Bljk_HHS_BH_MT64x64x64_MI16x16x16x1_SN_1LDSB0_AMAS3_ELFLR0_GLVWA8_GLVWB8_NLCB2_PLR5_SVW2_SKFT1_SKXCCM0_TT2_32_VW2_VWB2_WGM0
    SolutionIndex: 123
    SolutionNameMin: Cijk_Alik_Bljk_HHS_BH_MT64x64x64_MI16x16x16x1_SN_1LDSB0_AMAS3_ELFLR0_GLVWA8_GLVWB8_NLCB2_PLR5_SVW2_SKFT1_SKXCCM1_TT2_32_VW2_VWB2_WGM0
    SolutionIndex: 124
    SolutionNameMin: Cijk_Alik_Bljk_HHS_BH_MT64x64x64_MI16x16x16x1_SN_1LDSB0_AMAS3_ELFLR12_GLVWA8_GLVWB8_NLCB2_PLR5_SVW2_SKFT1_SKXCCM1_TT2_32_VW2_VWB2_WGM0
    SolutionIndex: 125
    SolutionNameMin: Cijk_Alik_Bljk_HHS_BH_MT64x64x64_MI16x16x16x1_SN_1LDSB0_AMAS3_ELFLR0_GLVWA8_GLVWB8_NLCB2_PLR5_SVW2_SKFT0_SKXCCM0_TT2_32_VW2_VWB2_WGM8
    SolutionIndex: 126
    SolutionNameMin: Cijk_Alik_Bljk_HHS_BH_MT64x64x64_MI16x16x16x1_SN_1LDSB0_AMAS3_ELFLR0_GLVWA8_GLVWB8_NLCB2_PLR5_SVW2_SKFT0_SKXCCM1_TT2_32_VW2_VWB2_WGM8
    SolutionIndex: 127
    SolutionNameMin: Cijk_Alik_Bljk_HHS_BH_MT64x64x64_MI16x16x16x1_SN_1LDSB0_AMAS3_ELFLR12_GLVWA8_GLVWB8_NLCB2_PLR5_SVW2_SKFT0_SKXCCM1_TT2_32_VW2_VWB2_WGM8
    SolutionIndex: 128
    SolutionNameMin: Cijk_Alik_Bljk_HHS_BH_MT64x64x64_MI16x16x16x1_SN_1LDSB0_AMAS3_ELFLR12_GLVWA8_GLVWB8_NLCB2_PLR5_SVW2_SKFT1_SKXCCM1_TT2_32_VW2_VWB2_WGM8
    SolutionIndex: 129
    SolutionNameMin: Cijk_Alik_Bljk_HHS_BH_MT64x32x64_MI16x16x16x1_SN_1LDSB0_AMAS3_ELFLR0_GLVWA8_GLVWB8_NLCB1_PLR5_SVW2_SKFT0_SKXCCM0_TT2_16_VW2_VWB1_WGM0
    SolutionIndex: 130
    SolutionNameMin: Cijk_Alik_Bljk_HHS_BH_MT64x32x64_MI16x16x16x1_SN_1LDSB0_AMAS3_ELFLR0_GLVWA8_GLVWB8_NLCB1_PLR5_SVW2_SKFT1_SKXCCM0_TT2_16_VW2_VWB1_WGM0
    SolutionIndex: 131
    SolutionNameMin: Cijk_Alik_Bljk_HHS_BH_MT64x32x64_MI16x16x16x1_SN_1LDSB0_AMAS3_ELFLR12_GLVWA8_GLVWB8_NLCB1_PLR5_SVW2_SKFT1_SKXCCM0_TT2_16_VW2_VWB1_WGM0
    SolutionIndex: 132
    SolutionNameMin: Cijk_Alik_Bljk_HHS_BH_MT128x128x64_MI16x16x16x1_SN_1LDSB0_AMAS3_ELFLR12_GLVWA8_GLVWB8_NLCB1_PLR5_SVW4_SKFT1_SKXCCM1_TT4_64_VW4_VWB4_WGM0
    SolutionIndex: 133
    SolutionNameMin: Cijk_Alik_Bljk_HHS_BH_MT128x128x64_MI16x16x16x1_SN_1LDSB0_AMAS3_ELFLR12_GLVWA8_GLVWB8_NLCB2_PLR5_SVW4_SKFT0_SKXCCM1_TT4_64_VW4_VWB4_WGM0
    SolutionIndex: 134
    SolutionNameMin: Cijk_Alik_Bljk_HHS_BH_MT128x128x64_MI16x16x16x1_SN_1LDSB0_AMAS3_ELFLR12_GLVWA8_GLVWB8_NLCB2_PLR5_SVW4_SKFT1_SKXCCM0_TT4_64_VW4_VWB4_WGM0
    SolutionIndex: 135
    SolutionNameMin: Cijk_Alik_Bljk_HHS_BH_MT128x128x64_MI16x16x16x1_SN_1LDSB0_AMAS3_ELFLR0_GLVWA8_GLVWB8_NLCB2_PLR5_SVW4_SKFT1_SKXCCM1_TT4_64_VW4_VWB4_WGM0
    SolutionIndex: 136
    SolutionNameMin: Cijk_Alik_Bljk_HHS_BH_MT128x128x64_MI16x16x16x1_SN_1LDSB0_AMAS3_ELFLR0_GLVWA8_GLVWB8_NLCB1_PLR5_SVW4_SKFT0_SKXCCM0_TT4_64_VW4_VWB4_WGM8
    SolutionIndex: 137
    SolutionNameMin: Cijk_Alik_Bljk_HHS_BH_MT128x128x64_MI16x16x16x1_SN_1LDSB0_AMAS3_ELFLR12_GLVWA8_GLVWB8_NLCB1_PLR5_SVW4_SKFT1_SKXCCM0_TT4_64_VW4_VWB4_WGM8
    SolutionIndex: 138
    SolutionNameMin: Cijk_Alik_Bljk_HHS_BH_MT128x128x64_MI16x16x16x1_SN_1LDSB0_AMAS3_ELFLR12_GLVWA8_GLVWB8_NLCB2_PLR5_SVW4_SKFT0_SKXCCM0_TT4_64_VW4_VWB4_WGM8
    SolutionIndex: 139
    SolutionNameMin: Cijk_Alik_Bljk_HHS_BH_MT128x128x64_MI16x16x16x1_SN_1LDSB0_AMAS3_ELFLR12_GLVWA8_GLVWB8_NLCB2_PLR5_SVW4_SKFT1_SKXCCM0_TT4_64_VW4_VWB4_WGM8
    SolutionIndex: 140
    SolutionNameMin: Cijk_Alik_Bljk_HHS_BH_MT128x64x64_MI16x16x16x1_SN_1LDSB0_AMAS3_ELFLR12_GLVWA8_GLVWB8_NLCB2_PLR5_SVW4_SKFT0_SKXCCM0_TT4_32_VW4_VWB1_WGM0
    SolutionIndex: 141
    SolutionNameMin: Cijk_Alik_Bljk_HHS_BH_MT128x64x64_MI16x16x16x1_SN_1LDSB0_AMAS3_ELFLR12_GLVWA8_GLVWB8_NLCB2_PLR5_SVW4_SKFT1_SKXCCM1_TT4_32_VW4_VWB1_WGM0
    SolutionIndex: 142
    SolutionNameMin: Cijk_Alik_Bljk_HHS_BH_MT128x64x64_MI16x16x16x1_SN_1LDSB0_AMAS3_ELFLR0_GLVWA8_GLVWB8_NLCB2_PLR5_SVW4_SKFT0_SKXCCM0_TT4_32_VW4_VWB1_WGM8
    SolutionIndex: 143
    SolutionNameMin: Cijk_Alik_Bljk_HHS_BH_MT128x64x64_MI16x16x16x1_SN_1LDSB0_AMAS3_ELFLR0_GLVWA8_GLVWB8_NLCB2_PLR5_SVW4_SKFT1_SKXCCM0_TT4_32_VW4_VWB1_WGM8
    SolutionIndex: 144
    SolutionNameMin: Cijk_Alik_Bljk_HHS_BH_MT256x256x64_MI16x16x16x1_SN_1LDSB1_AMAS3_ELFLR12_GLVWA8_GLVWB8_NLCB2_PLR5_SVW4_SKFT0_SKXCCM0_TT8_128_VW4_VWB4_WGM0
    SolutionIndex: 145
    SolutionNameMin: Cijk_Alik_Bljk_HHS_BH_MT128x256x64_MI16x16x16x1_SN_1LDSB1_AMAS3_ELFLR0_GLVWA8_GLVWB8_NLCB2_PLR5_SVW4_SKFT1_SKXCCM0_TT4_128_VW4_VWB4_WGM8
    SolutionIndex: 146
    SolutionNameMin: Cijk_Alik_Bljk_HHS_BH_MT128x256x64_MI16x16x16x1_SN_1LDSB1_AMAS3_ELFLR12_GLVWA8_GLVWB8_NLCB2_PLR5_SVW4_SKFT1_SKXCCM1_TT4_128_VW4_VWB4_WGM8
    SolutionIndex: 147
    SolutionNameMin: Cijk_Alik_Bljk_HHS_BH_MT128x128x64_MI16x16x16x1_SN_1LDSB1_AMAS3_ELFLR0_GLVWA8_GLVWB8_NLCB1_PLR5_SVW4_SKFT0_SKXCCM0_TT4_64_VW4_VWB4_WGM0
    SolutionIndex: 148
    SolutionNameMin: Cijk_Alik_Bljk_HHS_BH_MT128x128x64_MI16x16x16x1_SN_1LDSB1_AMAS3_ELFLR0_GLVWA8_GLVWB8_NLCB2_PLR5_SVW4_SKFT1_SKXCCM0_TT4_64_VW4_VWB4_WGM0
    SolutionIndex: 149
    SolutionNameMin: Cijk_Alik_Bljk_HHS_BH_MT128x128x64_MI16x16x16x1_SN_1LDSB1_AMAS3_ELFLR12_GLVWA8_GLVWB8_NLCB2_PLR5_SVW4_SKFT0_SKXCCM0_TT4_64_VW4_VWB4_WGM8
    SolutionIndex: 150
    SolutionNameMin: Cijk_Alik_Bljk_HHS_BH_MT128x128x64_MI16x16x16x1_SN_1LDSB1_AMAS3_ELFLR0_GLVWA8_GLVWB8_NLCB2_PLR5_SVW4_SKFT0_SKXCCM1_TT4_64_VW4_VWB4_WGM8
- - - [128, 128, 1, 128, 128, 128, 128, 128]
    - [114, 520.901]
  - - [128, 128, 1, 256, 128, 128, 256, 256]
    - [117, 886.509]
  - - [128, 128, 1, 512, 128, 128, 512, 512]
    - [117, 1376.56]
  - - [128, 128, 1, 1024, 128, 128, 1024, 1024]
    - [112, 1889.68]
  - - [128, 128, 1, 2048, 128, 128, 2048, 2048]
    - [0, 3124.73]
  - - [128, 128, 1, 4096, 128, 128, 4096, 4096]
    - [3, 5879.19]
  - - [128, 128, 1, 8192, 128, 128, 8192, 8192]
    - [112, 10671.0]
  - - [128, 256, 1, 128, 128, 128, 128, 128]
    - [113, 1002.55]
  - - [128, 256, 1, 256, 128, 128, 256, 256]
    - [112, 1760.57]
  - - [128, 256, 1, 512, 128, 128, 512, 512]
    - [116, 2733.35]
  - - [128, 256, 1, 1024, 128, 128, 1024, 1024]
    - [3, 4511.7]
  - - [128, 256, 1, 2048, 128, 128, 2048, 2048]
    - [1, 8378.9]
  - - [128, 256, 1, 4096, 128, 128, 4096, 4096]
    - [117, 14494.9]
  - - [128, 256, 1, 8192, 128, 128, 8192, 8192]
    - [116, 22467.8]
  - - [128, 512, 1, 128, 128, 128, 128, 128]
    - [112, 1993.35]
  - - [128, 512, 1, 256, 128, 128, 256, 256]
    - [112, 3462.26]
  - - [128, 512, 1, 512, 128, 128, 512, 512]
    - [5, 5978.43]
  - - [128, 512, 1, 1024, 128, 128, 1024, 1024]
    - [117, 10924.1]
  - - [128, 512, 1, 2048, 128, 128, 2048, 2048]
    - [117, 17484.1]
  - - [128, 512, 1, 4096, 128, 128, 4096, 4096]
    - [26, 26468.9]
  - - [128, 512, 1, 8192, 128, 128, 8192, 8192]
    - [27, 40430.9]
  - - [128, 1024, 1, 128, 128, 128, 128, 128]
    - [116, 3921.84]
  - - [128, 1024, 1, 256, 128, 128, 256, 256]
    - [116, 6981.81]
  - - [128, 1024, 1, 512, 128, 128, 512, 512]
    - [116, 12241.3]
  - - [128, 1024, 1, 1024, 128, 128, 1024, 1024]
    - [114, 19308.3]
  - - [128, 1024, 1, 2048, 128, 128, 2048, 2048]
    - [22, 31985.0]
  - - [128, 1024, 1, 4096, 128, 128, 4096, 4096]
    - [23, 46974.2]
  - - [128, 1024, 1, 8192, 128, 128, 8192, 8192]
    - [9, 73624.3]
  - - [128, 2048, 1, 128, 128, 128, 128, 128]
    - [111, 8145.17]
  - - [128, 2048, 1, 256, 128, 128, 256, 256]
    - [112, 14098.8]
  - - [128, 2048, 1, 512, 128, 128, 512, 512]
    - [28, 22018.0]
  - - [128, 2048, 1, 1024, 128, 128, 1024, 1024]
    - [22, 35563.9]
  - - [128, 2048, 1, 2048, 128, 128, 2048, 2048]
    - [11, 53685.3]
  - - [128, 2048, 1, 4096, 128, 128, 4096, 4096]
    - [11, 86213.9]
  - - [128, 2048, 1, 8192, 128, 128, 8192, 8192]
    - [76, 110447.0]
  - - [128, 4096, 1, 128, 128, 128, 128, 128]
    - [106, 15164.1]
  - - [128, 4096, 1, 256, 128, 128, 256, 256]
    - [107, 25407.1]
  - - [128, 4096, 1, 512, 128, 128, 512, 512]
    - [28, 37341.7]
  - - [128, 4096, 1, 1024, 128, 128, 1024, 1024]
    - [12, 61518.2]
  - - [128, 4096, 1, 2048, 128, 128, 2048, 2048]
    - [11, 91345.4]
  - - [128, 4096, 1, 4096, 128, 128, 4096, 4096]
    - [77, 126210.0]
  - - [128, 4096, 1, 8192, 128, 128, 8192, 8192]
    - [80, 157753.0]
  - - [128, 8192, 1, 128, 128, 128, 128, 128]
    - [120, 27816.6]
  - - [128, 8192, 1, 256, 128, 128, 256, 256]
    - [121, 46162.7]
  - - [128, 8192, 1, 512, 128, 128, 512, 512]
    - [7, 67132.9]
  - - [128, 8192, 1, 1024, 128, 128, 1024, 1024]
    - [8, 94835.0]
  - - [128, 8192, 1, 2048, 128, 128, 2048, 2048]
    - [6, 127004.0]
  - - [128, 8192, 1, 4096, 128, 128, 4096, 4096]
    - [51, 173043.0]
  - - [128, 8192, 1, 8192, 128, 128, 8192, 8192]
    - [56, 221070.0]
  - - [256, 128, 1, 128, 256, 256, 128, 128]
    - [110, 1024.45]
  - - [256, 128, 1, 256, 256, 256, 256, 256]
    - [116, 1751.88]
  - - [256, 128, 1, 512, 256, 256, 512, 512]
    - [113, 2708.74]
  - - [256, 128, 1, 1024, 256, 256, 1024, 1024]
    - [3, 4502.0]
  - - [256, 128, 1, 2048, 256, 256, 2048, 2048]
    - [2, 8317.76]
  - - [256, 128, 1, 4096, 256, 256, 4096, 4096]
    - [117, 14460.5]
  - - [256, 128, 1, 8192, 256, 256, 8192, 8192]
    - [116, 22504.4]
  - - [256, 256, 1, 128, 256, 256, 128, 128]
    - [117, 1992.12]
  - - [256, 256, 1, 256, 256, 256, 256, 256]
    - [116, 3437.89]
  - - [256, 256, 1, 512, 256, 256, 512, 512]
    - [4, 5947.65]
  - - [256, 256, 1, 1024, 256, 256, 1024, 1024]
    - [116, 10870.6]
  - - [256, 256, 1, 2048, 256, 256, 2048, 2048]
    - [114, 17395.6]
  - - [256, 256, 1, 4096, 256, 256, 4096, 4096]
    - [22, 26493.7]
  - - [256, 256, 1, 8192, 256, 256, 8192, 8192]
    - [25, 39786.6]
  - - [256, 512, 1, 128, 256, 256, 128, 128]
    - [116, 3911.96]
  - - [256, 512, 1, 256, 256, 256, 256, 256]
    - [118, 6873.95]
  - - [256, 512, 1, 512, 256, 256, 512, 512]
    - [113, 12144.8]
  - - [256, 512, 1, 1024, 256, 256, 1024, 1024]
    - [114, 19260.6]
  - - [256, 512, 1, 2048, 256, 256, 2048, 2048]
    - [23, 32260.7]
  - - [256, 512, 1, 4096, 256, 256, 4096, 4096]
    - [7, 47206.2]
  - - [256, 512, 1, 8192, 256, 256, 8192, 8192]
    - [13, 71928.1]
  - - [256, 1024, 1, 128, 256, 256, 128, 128]
    - [115, 8178.78]
  - - [256, 1024, 1, 256, 256, 256, 256, 256]
    - [115, 14095.8]
  - - [256, 1024, 1, 512, 256, 256, 512, 512]
    - [28, 22035.8]
  - - [256, 1024, 1, 1024, 256, 256, 1024, 1024]
    - [26, 35673.2]
  - - [256, 1024, 1, 2048, 256, 256, 2048, 2048]
    - [12, 57448.5]
  - - [256, 1024, 1, 4096, 256, 256, 4096, 4096]
    - [17, 83768.1]
  - - [256, 1024, 1, 8192, 256, 256, 8192, 8192]
    - [21, 107711.0]
  - - [256, 2048, 1, 128, 256, 256, 128, 128]
    - [130, 15090.3]
  - - [256, 2048, 1, 256, 256, 256, 256, 256]
    - [108, 25016.3]
  - - [256, 2048, 1, 512, 256, 256, 512, 512]
    - [26, 37751.4]
  - - [256, 2048, 1, 1024, 256, 256, 1024, 1024]
    - [7, 62630.0]
  - - [256, 2048, 1, 2048, 256, 256, 2048, 2048]
    - [7, 90722.4]
  - - [256, 2048, 1, 4096, 256, 256, 4096, 4096]
    - [78, 126047.0]
  - - [256, 2048, 1, 8192, 256, 256, 8192, 8192]
    - [83, 151021.0]
  - - [256, 4096, 1, 128, 256, 256, 128, 128]
    - [119, 27524.6]
  - - [256, 4096, 1, 256, 256, 256, 256, 256]
    - [121, 45557.8]
  - - [256, 4096, 1, 512, 256, 256, 512, 512]
    - [18, 67109.4]
  - - [256, 4096, 1, 1024, 256, 256, 1024, 1024]
    - [8, 94155.5]
  - - [256, 4096, 1, 2048, 256, 256, 2048, 2048]
    - [75, 135370.0]
  - - [256, 4096, 1, 4096, 256, 256, 4096, 4096]
    - [63, 170704.0]
  - - [256, 4096, 1, 8192, 256, 256, 8192, 8192]
    - [54, 211215.0]
  - - [256, 8192, 1, 128, 256, 256, 128, 128]
    - [123, 46112.7]
  - - [256, 8192, 1, 256, 256, 256, 256, 256]
    - [75, 69752.6]
  - - [256, 8192, 1, 512, 256, 256, 512, 512]
    - [77, 100649.0]
  - - [256, 8192, 1, 1024, 256, 256, 1024, 1024]
    - [83, 134739.0]
  - - [256, 8192, 1, 2048, 256, 256, 2048, 2048]
    - [68, 182046.0]
  - - [256, 8192, 1, 4096, 256, 256, 4096, 4096]
    - [70, 228705.0]
  - - [256, 8192, 1, 8192, 256, 256, 8192, 8192]
    - [101, 272832.0]
  - - [512, 128, 1, 128, 512, 512, 128, 128]
    - [114, 1976.89]
  - - [512, 128, 1, 256, 512, 512, 256, 256]
    - [113, 3435.08]
  - - [512, 128, 1, 512, 512, 512, 512, 512]
    - [4, 5933.23]
  - - [512, 128, 1, 1024, 512, 512, 1024, 1024]
    - [112, 10827.1]
  - - [512, 128, 1, 2048, 512, 512, 2048, 2048]
    - [116, 17384.3]
  - - [512, 128, 1, 4096, 512, 512, 4096, 4096]
    - [30, 26554.9]
  - - [512, 128, 1, 8192, 512, 512, 8192, 8192]
    - [29, 39794.3]
  - - [512, 256, 1, 128, 512, 512, 128, 128]
    - [113, 3881.59]
  - - [512, 256, 1, 256, 512, 512, 256, 256]
    - [112, 6894.46]
  - - [512, 256, 1, 512, 512, 512, 512, 512]
    - [116, 12166.4]
  - - [512, 256, 1, 1024, 512, 512, 1024, 1024]
    - [112, 19113.9]
  - - [512, 256, 1, 2048, 512, 512, 2048, 2048]
    - [26, 32121.9]
  - - [512, 256, 1, 4096, 512, 512, 4096, 4096]
    - [15, 47131.9]
  - - [512, 256, 1, 8192, 512, 512, 8192, 8192]
    - [20, 71975.5]
  - - [512, 512, 1, 128, 512, 512, 128, 128]
    - [110, 8048.9]
  - - [512, 512, 1, 256, 512, 512, 256, 256]
    - [115, 13989.9]
  - - [512, 512, 1, 512, 512, 512, 512, 512]
    - [28, 21913.3]
  - - [512, 512, 1, 1024, 512, 512, 1024, 1024]
    - [23, 35718.9]
  - - [512, 512, 1, 2048, 512, 512, 2048, 2048]
    - [12, 57507.7]
  - - [512, 512, 1, 4096, 512, 512, 4096, 4096]
    - [13, 84326.8]
  - - [512, 512, 1, 8192, 512, 512, 8192, 8192]
    - [9, 107892.0]
  - - [512, 1024, 1, 128, 512, 512, 128, 128]
    - [129, 15032.5]
  - - [512, 1024, 1, 256, 512, 512, 256, 256]
    - [107, 25006.5]
  - - [512, 1024, 1, 512, 512, 512, 512, 512]
    - [26, 37584.1]
  - - [512, 1024, 1, 1024, 512, 512, 1024, 1024]
    - [11, 63709.3]
  - - [512, 1024, 1, 2048, 512, 512, 2048, 2048]
    - [19, 87813.3]
  - - [512, 1024, 1, 4096, 512, 512, 4096, 4096]
    - [74, 122695.0]
  - - [512, 1024, 1, 8192, 512, 512, 8192, 8192]
    - [55, 151404.0]
  - - [512, 2048, 1, 128, 512, 512, 128, 128]
    - [122, 27670.1]
  - - [512, 2048, 1, 256, 512, 512, 256, 256]
    - [124, 45476.6]
  - - [512, 2048, 1, 512, 512, 512, 512, 512]
    - [14, 67156.5]
  - - [512, 2048, 1, 1024, 512, 512, 1024, 1024]
    - [11, 94511.5]
  - - [512, 2048, 1, 2048, 512, 512, 2048, 2048]
    - [74, 132051.0]
  - - [512, 2048, 1, 4096, 512, 512, 4096, 4096]
    - [54, 176314.0]
  - - [512, 2048, 1, 8192, 512, 512, 8192, 8192]
    - [57, 210550.0]
  - - [512, 4096, 1, 128, 512, 512, 128, 128]
    - [124, 46354.3]
  - - [512, 4096, 1, 256, 512, 512, 256, 256]
    - [141, 69745.3]
  - - [512, 4096, 1, 512, 512, 512, 512, 512]
    - [75, 101601.0]
  - - [512, 4096, 1, 1024, 512, 512, 1024, 1024]
    - [83, 139826.0]
  - - [512, 4096, 1, 2048, 512, 512, 2048, 2048]
    - [54, 182200.0]
  - - [512, 4096, 1, 4096, 512, 512, 4096, 4096]
    - [67, 224882.0]
  - - [512, 4096, 1, 8192, 512, 512, 8192, 8192]
    - [100, 274125.0]
  - - [512, 8192, 1, 128, 512, 512, 128, 128]
    - [143, 67972.2]
  - - [512, 8192, 1, 256, 512, 512, 256, 256]
    - [147, 96177.5]
  - - [512, 8192, 1, 512, 512, 512, 512, 512]
    - [78, 132846.0]
  - - [512, 8192, 1, 1024, 512, 512, 1024, 1024]
    - [57, 187298.0]
  - - [512, 8192, 1, 2048, 512, 512, 2048, 2048]
    - [50, 232285.0]
  - - [512, 8192, 1, 4096, 512, 512, 4096, 4096]
    - [97, 280115.0]
  - - [512, 8192, 1, 8192, 512, 512, 8192, 8192]
    - [89, 336577.0]
  - - [1024, 128, 1, 128, 1024, 1024, 128, 128]
    - [112, 3887.54]
  - - [1024, 128, 1, 256, 1024, 1024, 256, 256]
    - [112, 6919.67]
  - - [1024, 128, 1, 512, 1024, 1024, 512, 512]
    - [117, 12165.1]
  - - [1024, 128, 1, 1024, 1024, 1024, 1024, 1024]
    - [110, 19172.7]
  - - [1024, 128, 1, 2048, 1024, 1024, 2048, 2048]
    - [26, 31788.5]
  - - [1024, 128, 1, 4096, 1024, 1024, 4096, 4096]
    - [28, 46322.3]
  - - [1024, 128, 1, 8192, 1024, 1024, 8192, 8192]
    - [11, 73329.7]
  - - [1024, 256, 1, 128, 1024, 1024, 128, 128]
    - [117, 7976.27]
  - - [1024, 256, 1, 256, 1024, 1024, 256, 256]
    - [110, 13968.9]
  - - [1024, 256, 1, 512, 1024, 1024, 512, 512]
    - [28, 21984.8]
  - - [1024, 256, 1, 1024, 1024, 1024, 1024, 1024]
    - [23, 35715.1]
  - - [1024, 256, 1, 2048, 1024, 1024, 2048, 2048]
    - [14, 57285.8]
  - - [1024, 256, 1, 4096, 1024, 1024, 4096, 4096]
    - [12, 85590.3]
  - - [1024, 256, 1, 8192, 1024, 1024, 8192, 8192]
    - [16, 108992.0]
  - - [1024, 512, 1, 128, 1024, 1024, 128, 128]
    - [129, 15056.4]
  - - [1024, 512, 1, 256, 1024, 1024, 256, 256]
    - [107, 24938.6]
  - - [1024, 512, 1, 512, 1024, 1024, 512, 512]
    - [27, 37639.5]
  - - [1024, 512, 1, 1024, 1024, 1024, 1024, 1024]
    - [14, 63722.3]
  - - [1024, 512, 1, 2048, 1024, 1024, 2048, 2048]
    - [7, 90205.7]
  - - [1024, 512, 1, 4096, 1024, 1024, 4096, 4096]
    - [83, 120100.0]
  - - [1024, 512, 1, 8192, 1024, 1024, 8192, 8192]
    - [62, 151616.0]
  - - [1024, 1024, 1, 128, 1024, 1024, 128, 128]
    - [125, 27467.6]
  - - [1024, 1024, 1, 256, 1024, 1024, 256, 256]
    - [123, 45588.8]
  - - [1024, 1024, 1, 512, 1024, 1024, 512, 512]
    - [11, 67159.0]
  - - [1024, 1024, 1, 1024, 1024, 1024, 1024, 1024]
    - [12, 95226.8]
  - - [1024, 1024, 1, 2048, 1024, 1024, 2048, 2048]
    - [80, 128603.0]
  - - [1024, 1024, 1, 4096, 1024, 1024, 4096, 4096]
    - [54, 170631.0]
  - - [1024, 1024, 1, 8192, 1024, 1024, 8192, 8192]
    - [52, 211012.0]
  - - [1024, 2048, 1, 128, 1024, 1024, 128, 128]
    - [124, 46502.3]
  - - [1024, 2048, 1, 256, 1024, 1024, 256, 256]
    - [82, 70250.7]
  - - [1024, 2048, 1, 512, 1024, 1024, 512, 512]
    - [74, 101272.0]
  - - [1024, 2048, 1, 1024, 1024, 1024, 1024, 1024]
    - [80, 137596.0]
  - - [1024, 2048, 1, 2048, 1024, 1024, 2048, 2048]
    - [61, 179764.0]
  - - [1024, 2048, 1, 4096, 1024, 1024, 4096, 4096]
    - [57, 227466.0]
  - - [1024, 2048, 1, 8192, 1024, 1024, 8192, 8192]
    - [99, 271921.0]
  - - [1024, 4096, 1, 128, 1024, 1024, 128, 128]
    - [139, 66174.8]
  - - [1024, 4096, 1, 256, 1024, 1024, 256, 256]
    - [147, 95167.5]
  - - [1024, 4096, 1, 512, 1024, 1024, 512, 512]
    - [133, 131662.0]
  - - [1024, 4096, 1, 1024, 1024, 1024, 1024, 1024]
    - [65, 184551.0]
  - - [1024, 4096, 1, 2048, 1024, 1024, 2048, 2048]
    - [96, 236901.0]
  - - [1024, 4096, 1, 4096, 1024, 1024, 4096, 4096]
    - [50, 273259.0]
  - - [1024, 4096, 1, 8192, 1024, 1024, 8192, 8192]
    - [38, 329941.0]
  - - [1024, 8192, 1, 128, 1024, 1024, 128, 128]
    - [148, 85805.4]
  - - [1024, 8192, 1, 256, 1024, 1024, 256, 256]
    - [103, 119901.0]
  - - [1024, 8192, 1, 512, 1024, 1024, 512, 512]
    - [71, 177222.0]
  - - [1024, 8192, 1, 1024, 1024, 1024, 1024, 1024]
    - [95, 229208.0]
  - - [1024, 8192, 1, 2048, 1024, 1024, 2048, 2048]
    - [39, 278441.0]
  - - [1024, 8192, 1, 4096, 1024, 1024, 4096, 4096]
    - [34, 338064.0]
  - - [1024, 8192, 1, 8192, 1024, 1024, 8192, 8192]
    - [86, 394766.0]
  - - [2048, 128, 1, 128, 2048, 2048, 128, 128]
    - [115, 8103.8]
  - - [2048, 128, 1, 256, 2048, 2048, 256, 256]
    - [111, 14068.9]
  - - [2048, 128, 1, 512, 2048, 2048, 512, 512]
    - [29, 22051.0]
  - - [2048, 128, 1, 1024, 2048, 2048, 1024, 1024]
    - [31, 35280.3]
  - - [2048, 128, 1, 2048, 2048, 2048, 2048, 2048]
    - [11, 53944.7]
  - - [2048, 128, 1, 4096, 2048, 2048, 4096, 4096]
    - [7, 85488.0]
  - - [2048, 128, 1, 8192, 2048, 2048, 8192, 8192]
    - [10, 108519.0]
  - - [2048, 256, 1, 128, 2048, 2048, 128, 128]
    - [130, 14913.3]
  - - [2048, 256, 1, 256, 2048, 2048, 256, 256]
    - [107, 25138.3]
  - - [2048, 256, 1, 512, 2048, 2048, 512, 512]
    - [22, 37686.0]
  - - [2048, 256, 1, 1024, 2048, 2048, 1024, 1024]
    - [12, 63752.5]
  - - [2048, 256, 1, 2048, 2048, 2048, 2048, 2048]
    - [8, 91026.6]
  - - [2048, 256, 1, 4096, 2048, 2048, 4096, 4096]
    - [83, 124178.0]
  - - [2048, 256, 1, 8192, 2048, 2048, 8192, 8192]
    - [52, 153796.0]
  - - [2048, 512, 1, 128, 2048, 2048, 128, 128]
    - [120, 27581.8]
  - - [2048, 512, 1, 256, 2048, 2048, 256, 256]
    - [121, 45321.3]
  - - [2048, 512, 1, 512, 2048, 2048, 512, 512]
    - [7, 67093.4]
  - - [2048, 512, 1, 1024, 2048, 2048, 1024, 1024]
    - [8, 94479.0]
  - - [2048, 512, 1, 2048, 2048, 2048, 2048, 2048]
    - [82, 126738.0]
  - - [2048, 512, 1, 4096, 2048, 2048, 4096, 4096]
    - [62, 173695.0]
  - - [2048, 512, 1, 8192, 2048, 2048, 8192, 8192]
    - [60, 215134.0]
  - - [2048, 1024, 1, 128, 2048, 2048, 128, 128]
    - [140, 46787.3]
  - - [2048, 1024, 1, 256, 2048, 2048, 256, 256]
    - [80, 69337.5]
  - - [2048, 1024, 1, 512, 2048, 2048, 512, 512]
    - [79, 102400.0]
  - - [2048, 1024, 1, 1024, 2048, 2048, 1024, 1024]
    - [80, 134365.0]
  - - [2048, 1024, 1, 2048, 2048, 2048, 2048, 2048]
    - [105, 179628.0]
  - - [2048, 1024, 1, 4096, 2048, 2048, 4096, 4096]
    - [70, 229440.0]
  - - [2048, 1024, 1, 8192, 2048, 2048, 8192, 8192]
    - [48, 273669.0]
  - - [2048, 2048, 1, 128, 2048, 2048, 128, 128]
    - [139, 66687.7]
  - - [2048, 2048, 1, 256, 2048, 2048, 256, 256]
    - [136, 94966.9]
  - - [2048, 2048, 1, 512, 2048, 2048, 512, 512]
    - [135, 130702.0]
  - - [2048, 2048, 1, 1024, 2048, 2048, 1024, 1024]
    - [53, 182328.0]
  - - [2048, 2048, 1, 2048, 2048, 2048, 2048, 2048]
    - [61, 230517.0]
  - - [2048, 2048, 1, 4096, 2048, 2048, 4096, 4096]
    - [42, 281932.0]
  - - [2048, 2048, 1, 8192, 2048, 2048, 8192, 8192]
    - [34, 332255.0]
  - - [2048, 4096, 1, 128, 2048, 2048, 128, 128]
    - [134, 86755.2]
  - - [2048, 4096, 1, 256, 2048, 2048, 256, 256]
    - [64, 121506.0]
  - - [2048, 4096, 1, 512, 2048, 2048, 512, 512]
    - [65, 176434.0]
  - - [2048, 4096, 1, 1024, 2048, 2048, 1024, 1024]
    - [101, 225782.0]
  - - [2048, 4096, 1, 2048, 2048, 2048, 2048, 2048]
    - [96, 281648.0]
  - - [2048, 4096, 1, 4096, 2048, 2048, 4096, 4096]
    - [86, 334451.0]
  - - [2048, 4096, 1, 8192, 2048, 2048, 8192, 8192]
    - [33, 396707.0]
  - - [2048, 8192, 1, 128, 2048, 2048, 128, 128]
    - [146, 108814.0]
  - - [2048, 8192, 1, 256, 2048, 2048, 256, 256]
    - [100, 154637.0]
  - - [2048, 8192, 1, 512, 2048, 2048, 512, 512]
    - [45, 220794.0]
  - - [2048, 8192, 1, 1024, 2048, 2048, 1024, 1024]
    - [96, 270758.0]
  - - [2048, 8192, 1, 2048, 2048, 2048, 2048, 2048]
    - [92, 331603.0]
  - - [2048, 8192, 1, 4096, 2048, 2048, 4096, 4096]
    - [84, 393374.0]
  - - [2048, 8192, 1, 8192, 2048, 2048, 8192, 8192]
    - [33, 415070.0]
  - - [4096, 128, 1, 128, 4096, 4096, 128, 128]
    - [131, 14907.4]
  - - [4096, 128, 1, 256, 4096, 4096, 256, 256]
    - [109, 25150.6]
  - - [4096, 128, 1, 512, 4096, 4096, 512, 512]
    - [24, 37109.0]
  - - [4096, 128, 1, 1024, 4096, 4096, 1024, 1024]
    - [11, 61511.9]
  - - [4096, 128, 1, 2048, 4096, 4096, 2048, 2048]
    - [8, 91485.7]
  - - [4096, 128, 1, 4096, 4096, 4096, 4096, 4096]
    - [73, 120434.0]
  - - [4096, 128, 1, 8192, 4096, 4096, 8192, 8192]
    - [57, 153324.0]
  - - [4096, 256, 1, 128, 4096, 4096, 128, 128]
    - [120, 27706.1]
  - - [4096, 256, 1, 256, 4096, 4096, 256, 256]
    - [127, 45449.7]
  - - [4096, 256, 1, 512, 4096, 4096, 512, 512]
    - [13, 67072.4]
  - - [4096, 256, 1, 1024, 4096, 4096, 1024, 1024]
    - [18, 94164.6]
  - - [4096, 256, 1, 2048, 4096, 4096, 2048, 2048]
    - [82, 129065.0]
  - - [4096, 256, 1, 4096, 4096, 4096, 4096, 4096]
    - [65, 168881.0]
  - - [4096, 256, 1, 8192, 4096, 4096, 8192, 8192]
    - [58, 214177.0]
  - - [4096, 512, 1, 128, 4096, 4096, 128, 128]
    - [142, 45478.2]
  - - [4096, 512, 1, 256, 4096, 4096, 256, 256]
    - [83, 69552.6]
  - - [4096, 512, 1, 512, 4096, 4096, 512, 512]
    - [80, 98750.0]
  - - [4096, 512, 1, 1024, 4096, 4096, 1024, 1024]
    - [81, 137915.0]
  - - [4096, 512, 1, 2048, 4096, 4096, 2048, 2048]
    - [104, 180979.0]
  - - [4096, 512, 1, 4096, 4096, 4096, 4096, 4096]
    - [57, 227427.0]
  - - [4096, 512, 1, 8192, 4096, 4096, 8192, 8192]
    - [46, 268275.0]
  - - [4096, 1024, 1, 128, 4096, 4096, 128, 128]
    - [149, 64115.5]
  - - [4096, 1024, 1, 256, 4096, 4096, 256, 256]
    - [137, 96073.2]
  - - [4096, 1024, 1, 512, 4096, 4096, 512, 512]
    - [102, 129842.0]
  - - [4096, 1024, 1, 1024, 4096, 4096, 1024, 1024]
    - [105, 178969.0]
  - - [4096, 1024, 1, 2048, 4096, 4096, 2048, 2048]
    - [49, 231114.0]
  - - [4096, 1024, 1, 4096, 4096, 4096, 4096, 4096]
    - [41, 279706.0]
  - - [4096, 1024, 1, 8192, 4096, 4096, 8192, 8192]
    - [85, 333649.0]
  - - [4096, 2048, 1, 128, 4096, 4096, 128, 128]
    - [138, 86725.1]
  - - [4096, 2048, 1, 256, 4096, 4096, 256, 256]
    - [57, 121645.0]
  - - [4096, 2048, 1, 512, 4096, 4096, 512, 512]
    - [66, 175746.0]
  - - [4096, 2048, 1, 1024, 4096, 4096, 1024, 1024]
    - [45, 223747.0]
  - - [4096, 2048, 1, 2048, 4096, 4096, 2048, 2048]
    - [95, 284512.0]
  - - [4096, 2048, 1, 4096, 4096, 4096, 4096, 4096]
    - [33, 336074.0]
  - - [4096, 2048, 1, 8192, 4096, 4096, 8192, 8192]
    - [37, 394296.0]
  - - [4096, 4096, 1, 128, 4096, 4096, 128, 128]
    - [145, 110030.0]
  - - [4096, 4096, 1, 256, 4096, 4096, 256, 256]
    - [61, 154801.0]
  - - [4096, 4096, 1, 512, 4096, 4096, 512, 512]
    - [45, 221668.0]
  - - [4096, 4096, 1, 1024, 4096, 4096, 1024, 1024]
    - [96, 276306.0]
  - - [4096, 4096, 1, 2048, 4096, 4096, 2048, 2048]
    - [36, 338043.0]
  - - [4096, 4096, 1, 4096, 4096, 4096, 4096, 4096]
    - [84, 392102.0]
  - - [4096, 4096, 1, 8192, 4096, 4096, 8192, 8192]
    - [33, 416527.0]
  - - [4096, 8192, 1, 128, 4096, 4096, 128, 128]
    - [44, 127946.0]
  - - [4096, 8192, 1, 256, 4096, 4096, 256, 256]
    - [90, 179061.0]
  - - [4096, 8192, 1, 512, 4096, 4096, 512, 512]
    - [94, 255581.0]
  - - [4096, 8192, 1, 1024, 4096, 4096, 1024, 1024]
    - [35, 327208.0]
  - - [4096, 8192, 1, 2048, 4096, 4096, 2048, 2048]
    - [34, 384925.0]
  - - [4096, 8192, 1, 4096, 4096, 4096, 4096, 4096]
    - [33, 418227.0]
  - - [4096, 8192, 1, 8192, 4096, 4096, 8192, 8192]
    - [37, 442992.0]
  - - [8192, 128, 1, 128, 8192, 8192, 128, 128]
    - [120, 27377.9]
  - - [8192, 128, 1, 256, 8192, 8192, 256, 256]
    - [126, 45784.2]
  - - [8192, 128, 1, 512, 8192, 8192, 512, 512]
    - [18, 67011.2]
  - - [8192, 128, 1, 1024, 8192, 8192, 1024, 1024]
    - [14, 93925.4]
  - - [8192, 128, 1, 2048, 8192, 8192, 2048, 2048]
    - [72, 127839.0]
  - - [8192, 128, 1, 4096, 8192, 8192, 4096, 4096]
    - [52, 174077.0]
  - - [8192, 128, 1, 8192, 8192, 8192, 8192, 8192]
    - [69, 215043.0]
  - - [8192, 256, 1, 128, 8192, 8192, 128, 128]
    - [128, 46327.9]
  - - [8192, 256, 1, 256, 8192, 8192, 256, 256]
    - [82, 69656.6]
  - - [8192, 256, 1, 512, 8192, 8192, 512, 512]
    - [82, 98853.8]
  - - [8192, 256, 1, 1024, 8192, 8192, 1024, 1024]
    - [81, 135634.0]
  - - [8192, 256, 1, 2048, 8192, 8192, 2048, 2048]
    - [59, 179626.0]
  - - [8192, 256, 1, 4096, 8192, 8192, 4096, 4096]
    - [57, 224182.0]
  - - [8192, 256, 1, 8192, 8192, 8192, 8192, 8192]
    - [46, 268929.0]
  - - [8192, 512, 1, 128, 8192, 8192, 128, 128]
    - [138, 65576.7]
  - - [8192, 512, 1, 256, 8192, 8192, 256, 256]
    - [132, 94155.4]
  - - [8192, 512, 1, 512, 8192, 8192, 512, 512]
    - [150, 129324.0]
  - - [8192, 512, 1, 1024, 8192, 8192, 1024, 1024]
    - [70, 183152.0]
  - - [8192, 512, 1, 2048, 8192, 8192, 2048, 2048]
    - [44, 225165.0]
  - - [8192, 512, 1, 4096, 8192, 8192, 4096, 4096]
    - [43, 281189.0]
  - - [8192, 512, 1, 8192, 8192, 8192, 8192, 8192]
    - [93, 331712.0]
  - - [8192, 1024, 1, 128, 8192, 8192, 128, 128]
    - [138, 89125.1]
  - - [8192, 1024, 1, 256, 8192, 8192, 256, 256]
    - [62, 121588.0]
  - - [8192, 1024, 1, 512, 8192, 8192, 512, 512]
    - [71, 175996.0]
  - - [8192, 1024, 1, 1024, 8192, 8192, 1024, 1024]
    - [98, 225282.0]
  - - [8192, 1024, 1, 2048, 8192, 8192, 2048, 2048]
    - [44, 285062.0]
  - - [8192, 1024, 1, 4096, 8192, 8192, 4096, 4096]
    - [37, 334353.0]
  - - [8192, 1024, 1, 8192, 8192, 8192, 8192, 8192]
    - [84, 394834.0]
  - - [8192, 2048, 1, 128, 8192, 8192, 128, 128]
    - [145, 108156.0]
  - - [8192, 2048, 1, 256, 8192, 8192, 256, 256]
    - [70, 155138.0]
  - - [8192, 2048, 1, 512, 8192, 8192, 512, 512]
    - [47, 217789.0]
  - - [8192, 2048, 1, 1024, 8192, 8192, 1024, 1024]
    - [96, 273626.0]
  - - [8192, 2048, 1, 2048, 8192, 8192, 2048, 2048]
    - [88, 338389.0]
  - - [8192, 2048, 1, 4096, 8192, 8192, 4096, 4096]
    - [38, 388018.0]
  - - [8192, 2048, 1, 8192, 8192, 8192, 8192, 8192]
    - [90, 412425.0]
  - - [8192, 4096, 1, 128, 8192, 8192, 128, 128]
    - [139, 124938.0]
  - - [8192, 4096, 1, 256, 8192, 8192, 256, 256]
    - [49, 175351.0]
  - - [8192, 4096, 1, 512, 8192, 8192, 512, 512]
    - [34, 247528.0]
  - - [8192, 4096, 1, 1024, 8192, 8192, 1024, 1024]
    - [91, 322277.0]
  - - [8192, 4096, 1, 2048, 8192, 8192, 2048, 2048]
    - [87, 390704.0]
  - - [8192, 4096, 1, 4096, 8192, 8192, 4096, 4096]
    - [86, 412281.0]
  - - [8192, 4096, 1, 8192, 8192, 8192, 8192, 8192]
    - [32, 442421.0]
  - - [8192, 8192, 1, 128, 8192, 8192, 128, 128]
    - [44, 144316.0]
  - - [8192, 8192, 1, 256, 8192, 8192, 256, 256]
    - [48, 204516.0]
  - - [8192, 8192, 1, 512, 8192, 8192, 512, 512]
    - [40, 277886.0]
  - - [8192, 8192, 1, 1024, 8192, 8192, 1024, 1024]
    - [92, 360726.0]
  - - [8192, 8192, 1, 2048, 8192, 8192, 2048, 2048]
    - [92, 396478.0]
  - - [8192, 8192, 1, 4096, 8192, 8192, 4096, 4096]
    - [37, 437142.0]
  - - [8192, 8192, 1, 8192, 8192, 8192, 8192, 8192]
    - [144, 450653.0]
- null
- null
- DeviceEfficiency
