experiments/sk3rx8_transposes/yaml_outputs/hgemm_nt_2024-06-03_13_36_46/aquavanjaram942_Cijk_Ailk_Bjlk_HHS_BH.yaml
- {MinimumRequiredVersion: 4.41.0}
- aquavanjaram942
- gfx942
- [Device 0049, Device 0050]
    SolutionIndex: 0
    SolutionNameMin: Cijk_Ailk_Bjlk_HHS_BH_MT32x32x16_MI16x16x16x1_SN_1LDSB0_AMAS0_ELFLR0_GLVWA2_GLVWB2_NLCB1_PLR1_SVW1_SKFT0_SKXCCM1_TT1_16_VW1_VWB1_WG32_8_1_WGM0
    SolutionIndex: 1
    SolutionNameMin: Cijk_Ailk_Bjlk_HHS_BH_MT32x32x16_MI16x16x16x1_SN_1LDSB0_AMAS0_ELFLR0_GLVWA2_GLVWB2_NLCB1_PLR1_SVW1_SKFT1_SKXCCM1_TT1_16_VW1_VWB1_WG32_8_1_WGM8
    SolutionIndex: 2
    SolutionNameMin: Cijk_Ailk_Bjlk_HHS_BH_MT64x64x32_MI16x16x16x1_SN_1LDSB0_AMAS0_ELFLR12_GLVWA8_GLVWB8_NLCB1_PLR3_SVW1_SKFT1_SKXCCM1_TT2_32_VW1_VWB1_WG32_8_1_WGM8
    SolutionIndex: 3
    SolutionNameMin: Cijk_Ailk_Bjlk_HHS_BH_MT32x32x32_MI16x16x16x1_SN_1LDSB0_AMAS0_ELFLR0_GLVWA4_GLVWB4_NLCB1_PLR3_SVW1_SKFT0_SKXCCM1_TT1_16_VW1_VWB1_WG32_8_1_WGM0
    SolutionIndex: 4
    SolutionNameMin: Cijk_Ailk_Bjlk_HHS_BH_MT32x32x32_MI16x16x16x1_SN_1LDSB0_AMAS0_ELFLR12_GLVWA4_GLVWB4_NLCB1_PLR3_SVW1_SKFT1_SKXCCM0_TT1_16_VW1_VWB1_WG32_8_1_WGM0
    SolutionIndex: 5
    SolutionNameMin: Cijk_Ailk_Bjlk_HHS_BH_MT32x32x32_MI16x16x16x1_SN_1LDSB0_AMAS0_ELFLR0_GLVWA4_GLVWB4_NLCB1_PLR3_SVW1_SKFT1_SKXCCM1_TT1_16_VW1_VWB1_WG32_8_1_WGM0
    SolutionIndex: 6
    SolutionNameMin: Cijk_Ailk_Bjlk_HHS_BH_MT32x32x32_MI16x16x16x1_SN_1LDSB0_AMAS0_ELFLR12_GLVWA4_GLVWB4_NLCB1_PLR3_SVW1_SKFT1_SKXCCM1_TT1_16_VW1_VWB1_WG32_8_1_WGM0
    SolutionIndex: 7
    SolutionNameMin: Cijk_Ailk_Bjlk_HHS_BH_MT32x32x32_MI16x16x16x1_SN_1LDSB0_AMAS0_ELFLR12_GLVWA4_GLVWB4_NLCB1_PLR3_SVW1_SKFT0_SKXCCM1_TT1_16_VW1_VWB1_WG32_8_1_WGM8
    SolutionIndex: 8
    SolutionNameMin: Cijk_Ailk_Bjlk_HHS_BH_MT64x64x32_MI16x16x16x1_SN_1LDSB0_AMAS3_ELFLR12_GLVWA8_GLVWB8_NLCB1_PLR3_SVW2_SKFT1_SKXCCM0_TT2_32_VW2_VWB2_WG32_8_1_WGM0
    SolutionIndex: 9
    SolutionNameMin: Cijk_Ailk_Bjlk_HHS_BH_MT128x128x32_MI16x16x16x1_SN_1LDSB0_AMAS3_ELFLR0_GLVWA8_GLVWB8_NLCB1_PLR3_SVW4_SKFT1_SKXCCM0_TT4_64_VW4_VWB4_WG32_8_1_WGM0
    SolutionIndex: 10
    SolutionNameMin: Cijk_Ailk_Bjlk_HHS_BH_MT128x64x32_MI16x16x16x1_SN_1LDSB0_AMAS3_ELFLR12_GLVWA8_GLVWB8_NLCB1_PLR3_SVW4_SKFT0_SKXCCM1_TT4_32_VW4_VWB1_WG32_8_1_WGM8
    SolutionIndex: 11
    SolutionNameMin: Cijk_Ailk_Bjlk_HHS_BH_MT32x32x64_MI16x16x16x1_SN_1LDSB0_AMAS0_ELFLR0_GLVWA8_GLVWB8_NLCB1_PLR5_SVW1_SKFT0_SKXCCM1_TT1_16_VW1_VWB1_WG32_8_1_WGM0
    SolutionIndex: 12
    SolutionNameMin: Cijk_Ailk_Bjlk_HHS_BH_MT32x32x64_MI16x16x16x1_SN_1LDSB0_AMAS0_ELFLR12_GLVWA8_GLVWB8_NLCB1_PLR5_SVW1_SKFT0_SKXCCM1_TT1_16_VW1_VWB1_WG32_8_1_WGM0
    SolutionIndex: 13
    SolutionNameMin: Cijk_Ailk_Bjlk_HHS_BH_MT32x32x64_MI16x16x16x1_SN_1LDSB0_AMAS0_ELFLR0_GLVWA8_GLVWB8_NLCB1_PLR5_SVW1_SKFT1_SKXCCM0_TT1_16_VW1_VWB1_WG32_8_1_WGM0
    SolutionIndex: 14
    SolutionNameMin: Cijk_Ailk_Bjlk_HHS_BH_MT32x32x64_MI16x16x16x1_SN_1LDSB0_AMAS0_ELFLR12_GLVWA8_GLVWB8_NLCB1_PLR5_SVW1_SKFT1_SKXCCM0_TT1_16_VW1_VWB1_WG32_8_1_WGM0
    SolutionIndex: 15
    SolutionNameMin: Cijk_Ailk_Bjlk_HHS_BH_MT32x32x64_MI16x16x16x1_SN_1LDSB0_AMAS0_ELFLR0_GLVWA8_GLVWB8_NLCB1_PLR5_SVW1_SKFT1_SKXCCM1_TT1_16_VW1_VWB1_WG32_8_1_WGM0
    SolutionIndex: 16
    SolutionNameMin: Cijk_Ailk_Bjlk_HHS_BH_MT32x32x64_MI16x16x16x1_SN_1LDSB0_AMAS0_ELFLR12_GLVWA8_GLVWB8_NLCB1_PLR5_SVW1_SKFT1_SKXCCM1_TT1_16_VW1_VWB1_WG32_8_1_WGM0
    SolutionIndex: 17
    SolutionNameMin: Cijk_Ailk_Bjlk_HHS_BH_MT32x32x64_MI16x16x16x1_SN_1LDSB0_AMAS0_ELFLR12_GLVWA8_GLVWB8_NLCB1_PLR5_SVW1_SKFT0_SKXCCM0_TT1_16_VW1_VWB1_WG32_8_1_WGM8
    SolutionIndex: 18
    SolutionNameMin: Cijk_Ailk_Bjlk_HHS_BH_MT32x32x64_MI16x16x16x1_SN_1LDSB0_AMAS0_ELFLR12_GLVWA8_GLVWB8_NLCB1_PLR5_SVW1_SKFT0_SKXCCM1_TT1_16_VW1_VWB1_WG32_8_1_WGM8
    SolutionIndex: 19
    SolutionNameMin: Cijk_Ailk_Bjlk_HHS_BH_MT32x32x64_MI16x16x16x1_SN_1LDSB0_AMAS0_ELFLR0_GLVWA8_GLVWB8_NLCB1_PLR5_SVW1_SKFT1_SKXCCM0_TT1_16_VW1_VWB1_WG32_8_1_WGM8
    SolutionIndex: 20
    SolutionNameMin: Cijk_Ailk_Bjlk_HHS_BH_MT32x32x64_MI16x16x16x1_SN_1LDSB0_AMAS0_ELFLR12_GLVWA8_GLVWB8_NLCB1_PLR5_SVW1_SKFT1_SKXCCM1_TT1_16_VW1_VWB1_WG32_8_1_WGM8
    SolutionIndex: 21
    SolutionNameMin: Cijk_Ailk_Bjlk_HHS_BH_MT64x64x64_MI16x16x16x1_SN_1LDSB0_AMAS3_ELFLR0_GLVWA8_GLVWB8_NLCB1_PLR5_SVW2_SKFT0_SKXCCM1_TT2_32_VW2_VWB2_WG32_8_1_WGM0
    SolutionIndex: 22
    SolutionNameMin: Cijk_Ailk_Bjlk_HHS_BH_MT64x64x64_MI16x16x16x1_SN_1LDSB0_AMAS3_ELFLR12_GLVWA8_GLVWB8_NLCB1_PLR5_SVW2_SKFT0_SKXCCM1_TT2_32_VW2_VWB2_WG32_8_1_WGM0
    SolutionIndex: 23
    SolutionNameMin: Cijk_Ailk_Bjlk_HHS_BH_MT64x64x64_MI16x16x16x1_SN_1LDSB0_AMAS3_ELFLR12_GLVWA8_GLVWB8_NLCB2_PLR5_SVW2_SKFT0_SKXCCM1_TT2_32_VW2_VWB2_WG32_8_1_WGM0
    SolutionIndex: 24
    SolutionNameMin: Cijk_Ailk_Bjlk_HHS_BH_MT64x64x64_MI16x16x16x1_SN_1LDSB0_AMAS3_ELFLR12_GLVWA8_GLVWB8_NLCB2_PLR5_SVW2_SKFT1_SKXCCM0_TT2_32_VW2_VWB2_WG32_8_1_WGM8
    SolutionIndex: 25
    SolutionNameMin: Cijk_Ailk_Bjlk_HHS_BH_MT64x32x64_MI16x16x16x1_SN_1LDSB0_AMAS3_ELFLR12_GLVWA8_GLVWB8_NLCB1_PLR5_SVW2_SKFT0_SKXCCM1_TT2_16_VW2_VWB1_WG32_8_1_WGM0
    SolutionIndex: 26
    SolutionNameMin: Cijk_Ailk_Bjlk_HHS_BH_MT64x32x64_MI16x16x16x1_SN_1LDSB0_AMAS3_ELFLR0_GLVWA8_GLVWB8_NLCB1_PLR5_SVW2_SKFT1_SKXCCM1_TT2_16_VW2_VWB1_WG32_8_1_WGM0
    SolutionIndex: 27
    SolutionNameMin: Cijk_Ailk_Bjlk_HHS_BH_MT64x32x64_MI16x16x16x1_SN_1LDSB0_AMAS3_ELFLR12_GLVWA8_GLVWB8_NLCB1_PLR5_SVW2_SKFT1_SKXCCM1_TT2_16_VW2_VWB1_WG32_8_1_WGM0
    SolutionIndex: 28
    SolutionNameMin: Cijk_Ailk_Bjlk_HHS_BH_MT64x32x64_MI16x16x16x1_SN_1LDSB0_AMAS3_ELFLR12_GLVWA8_GLVWB8_NLCB1_PLR5_SVW2_SKFT0_SKXCCM1_TT2_16_VW2_VWB1_WG32_8_1_WGM8
    SolutionIndex: 29
    SolutionNameMin: Cijk_Ailk_Bjlk_HHS_BH_MT128x64x64_MI16x16x16x1_SN_1LDSB0_AMAS3_ELFLR12_GLVWA8_GLVWB8_NLCB2_PLR5_SVW4_SKFT0_SKXCCM1_TT4_32_VW4_VWB1_WG32_8_1_WGM0
    SolutionIndex: 30
    SolutionNameMin: Cijk_Ailk_Bjlk_HHS_BH_MT128x64x64_MI16x16x16x1_SN_1LDSB0_AMAS3_ELFLR12_GLVWA8_GLVWB8_NLCB1_PLR5_SVW4_SKFT0_SKXCCM0_TT4_32_VW4_VWB1_WG32_8_1_WGM8
    SolutionIndex: 31
    SolutionNameMin: Cijk_Ailk_Bjlk_HHS_BH_MT128x64x64_MI16x16x16x1_SN_1LDSB0_AMAS3_ELFLR12_GLVWA8_GLVWB8_NLCB1_PLR5_SVW4_SKFT1_SKXCCM1_TT4_32_VW4_VWB1_WG32_8_1_WGM8
    SolutionIndex: 32
    SolutionNameMin: Cijk_Ailk_Bjlk_HHS_BH_MT128x32x64_MI16x16x16x1_SN_1LDSB0_AMAS3_ELFLR12_GLVWA8_GLVWB8_NLCB1_PLR5_SVW4_SKFT1_SKXCCM0_TT4_16_VW4_VWB1_WG32_8_1_WGM0
    SolutionIndex: 33
    SolutionNameMin: Cijk_Ailk_Bjlk_HHS_BH_MT128x32x64_MI16x16x16x1_SN_1LDSB0_AMAS3_ELFLR12_GLVWA8_GLVWB8_NLCB1_PLR5_SVW4_SKFT1_SKXCCM1_TT4_16_VW4_VWB1_WG32_8_1_WGM0
- - - [128, 128, 1, 128, 128, 128, 128, 128]
    - [32, 553.578]
  - - [128, 128, 1, 256, 128, 128, 128, 128]
    - [13, 898.548]
  - - [128, 128, 1, 512, 128, 128, 128, 128]
    - [16, 1392.48]
  - - [128, 128, 1, 1024, 128, 128, 128, 128]
    - [11, 1883.32]
  - - [128, 128, 1, 2048, 128, 128, 128, 128]
    - [0, 3146.09]
  - - [128, 128, 1, 4096, 128, 128, 128, 128]
    - [5, 6183.32]
  - - [128, 128, 1, 8192, 128, 128, 128, 128]
    - [15, 11701.0]
  - - [128, 256, 1, 128, 128, 128, 128, 256]
    - [17, 1022.1]
  - - [128, 256, 1, 256, 128, 128, 128, 256]
    - [12, 1770.88]
  - - [128, 256, 1, 512, 128, 128, 128, 256]
    - [15, 2749.5]
  - - [128, 256, 1, 1024, 128, 128, 128, 256]
    - [1, 4582.86]
  - - [128, 256, 1, 2048, 128, 128, 128, 256]
    - [3, 9007.02]
  - - [128, 256, 1, 4096, 128, 128, 128, 256]
    - [5, 16808.0]
  - - [128, 256, 1, 8192, 128, 128, 128, 256]
    - [20, 27547.5]
  - - [128, 512, 1, 128, 128, 128, 128, 512]
    - [12, 2023.94]
  - - [128, 512, 1, 256, 128, 128, 128, 512]
    - [15, 3400.42]
  - - [128, 512, 1, 512, 128, 128, 128, 512]
    - [7, 6077.11]
  - - [128, 512, 1, 1024, 128, 128, 128, 512]
    - [16, 11706.4]
  - - [128, 512, 1, 2048, 128, 128, 128, 512]
    - [4, 21095.4]
  - - [128, 512, 1, 4096, 128, 128, 128, 512]
    - [6, 34421.2]
  - - [128, 512, 1, 8192, 128, 128, 128, 512]
    - [25, 47858.6]
  - - [128, 1024, 1, 128, 128, 128, 128, 1024]
    - [12, 3912.95]
  - - [128, 1024, 1, 256, 128, 128, 128, 1024]
    - [18, 7099.72]
  - - [128, 1024, 1, 512, 128, 128, 128, 1024]
    - [6, 12938.8]
  - - [128, 1024, 1, 1024, 128, 128, 128, 1024]
    - [15, 22996.2]
  - - [128, 1024, 1, 2048, 128, 128, 128, 1024]
    - [19, 37367.1]
  - - [128, 1024, 1, 4096, 128, 128, 128, 1024]
    - [26, 57309.6]
  - - [128, 1024, 1, 8192, 128, 128, 128, 1024]
    - [24, 75899.3]
  - - [128, 2048, 1, 128, 128, 128, 128, 2048]
    - [14, 8156.67]
  - - [128, 2048, 1, 256, 128, 128, 128, 2048]
    - [16, 14506.9]
  - - [128, 2048, 1, 512, 128, 128, 128, 2048]
    - [16, 25070.1]
  - - [128, 2048, 1, 1024, 128, 128, 128, 2048]
    - [25, 41334.0]
  - - [128, 2048, 1, 2048, 128, 128, 128, 2048]
    - [28, 65581.4]
  - - [128, 2048, 1, 4096, 128, 128, 128, 2048]
    - [8, 87916.2]
  - - [128, 2048, 1, 8192, 128, 128, 128, 2048]
    - [23, 126277.0]
  - - [128, 4096, 1, 128, 128, 128, 128, 4096]
    - [13, 15576.9]
  - - [128, 4096, 1, 256, 128, 128, 128, 4096]
    - [27, 27518.4]
  - - [128, 4096, 1, 512, 128, 128, 128, 4096]
    - [25, 45007.0]
  - - [128, 4096, 1, 1024, 128, 128, 128, 4096]
    - [22, 71087.3]
  - - [128, 4096, 1, 2048, 128, 128, 128, 4096]
    - [2, 99484.8]
  - - [128, 4096, 1, 4096, 128, 128, 128, 4096]
    - [30, 140817.0]
  - - [128, 4096, 1, 8192, 128, 128, 128, 4096]
    - [10, 187732.0]
  - - [128, 8192, 1, 128, 128, 128, 128, 8192]
    - [27, 28811.7]
  - - [128, 8192, 1, 256, 128, 128, 128, 8192]
    - [33, 50034.5]
  - - [128, 8192, 1, 512, 128, 128, 128, 8192]
    - [22, 80315.9]
  - - [128, 8192, 1, 1024, 128, 128, 128, 8192]
    - [21, 106004.0]
  - - [128, 8192, 1, 2048, 128, 128, 128, 8192]
    - [29, 148288.0]
  - - [128, 8192, 1, 4096, 128, 128, 128, 8192]
    - [31, 200611.0]
  - - [128, 8192, 1, 8192, 128, 128, 128, 8192]
    - [9, 269344.0]
- null
- null
- DeviceEfficiency
