experiments/sk3rx8_transposes/yaml_outputs/hgemm_tn_2024-06-03_13_36_46/aquavanjaram942_Cijk_Alik_Bljk_HHS_BH.yaml
- {MinimumRequiredVersion: 4.41.0}
- aquavanjaram942
- gfx942
- [Device 0049, Device 0050]
    SolutionIndex: 0
    SolutionNameMin: Cijk_Alik_Bljk_HHS_BH_MT32x32x16_MI16x16x16x1_SN_1LDSB0_AMAS0_ELFLR0_GLVWA2_GLVWB2_NLCB1_PLR1_SVW1_SKFT1_SKXCCM1_TT1_16_VW1_VWB1_WG32_8_1_WGM0
    SolutionIndex: 1
    SolutionNameMin: Cijk_Alik_Bljk_HHS_BH_MT32x32x16_MI16x16x16x1_SN_1LDSB0_AMAS0_ELFLR12_GLVWA2_GLVWB2_NLCB1_PLR1_SVW1_SKFT1_SKXCCM1_TT1_16_VW1_VWB1_WG32_8_1_WGM0
    SolutionIndex: 2
    SolutionNameMin: Cijk_Alik_Bljk_HHS_BH_MT32x32x32_MI16x16x16x1_SN_1LDSB0_AMAS0_ELFLR0_GLVWA4_GLVWB4_NLCB1_PLR3_SVW1_SKFT1_SKXCCM0_TT1_16_VW1_VWB1_WG32_8_1_WGM0
    SolutionIndex: 3
    SolutionNameMin: Cijk_Alik_Bljk_HHS_BH_MT32x32x32_MI16x16x16x1_SN_1LDSB0_AMAS0_ELFLR12_GLVWA4_GLVWB4_NLCB1_PLR3_SVW1_SKFT1_SKXCCM1_TT1_16_VW1_VWB1_WG32_8_1_WGM8
    SolutionIndex: 4
    SolutionNameMin: Cijk_Alik_Bljk_HHS_BH_MT64x64x32_MI16x16x16x1_SN_1LDSB0_AMAS3_ELFLR0_GLVWA8_GLVWB8_NLCB1_PLR3_SVW2_SKFT0_SKXCCM0_TT2_32_VW2_VWB2_WG32_8_1_WGM0
    SolutionIndex: 5
    SolutionNameMin: Cijk_Alik_Bljk_HHS_BH_MT64x64x32_MI16x16x16x1_SN_1LDSB0_AMAS3_ELFLR0_GLVWA8_GLVWB8_NLCB1_PLR3_SVW2_SKFT1_SKXCCM0_TT2_32_VW2_VWB2_WG32_8_1_WGM0
    SolutionIndex: 6
    SolutionNameMin: Cijk_Alik_Bljk_HHS_BH_MT64x64x32_MI16x16x16x1_SN_1LDSB0_AMAS3_ELFLR12_GLVWA8_GLVWB8_NLCB1_PLR3_SVW2_SKFT1_SKXCCM0_TT2_32_VW2_VWB2_WG32_8_1_WGM0
    SolutionIndex: 7
    SolutionNameMin: Cijk_Alik_Bljk_HHS_BH_MT64x64x32_MI16x16x16x1_SN_1LDSB0_AMAS3_ELFLR12_GLVWA8_GLVWB8_NLCB1_PLR3_SVW2_SKFT1_SKXCCM1_TT2_32_VW2_VWB2_WG32_8_1_WGM0
    SolutionIndex: 8
    SolutionNameMin: Cijk_Alik_Bljk_HHS_BH_MT64x64x32_MI16x16x16x1_SN_1LDSB0_AMAS3_ELFLR12_GLVWA8_GLVWB8_NLCB1_PLR3_SVW2_SKFT1_SKXCCM0_TT2_32_VW2_VWB2_WG32_8_1_WGM8
    SolutionIndex: 9
    SolutionNameMin: Cijk_Alik_Bljk_HHS_BH_MT64x64x32_MI16x16x16x1_SN_1LDSB0_AMAS3_ELFLR0_GLVWA8_GLVWB8_NLCB1_PLR3_SVW2_SKFT1_SKXCCM1_TT2_32_VW2_VWB2_WG32_8_1_WGM8
    SolutionIndex: 10
    SolutionNameMin: Cijk_Alik_Bljk_HHS_BH_MT64x32x32_MI16x16x16x1_SN_1LDSB0_AMAS3_ELFLR0_GLVWA8_GLVWB4_NLCB1_PLR3_SVW2_SKFT0_SKXCCM0_TT2_16_VW2_VWB1_WG32_8_1_WGM0
    SolutionIndex: 11
    SolutionNameMin: Cijk_Alik_Bljk_HHS_BH_MT64x32x32_MI16x16x16x1_SN_1LDSB0_AMAS3_ELFLR12_GLVWA8_GLVWB4_NLCB1_PLR3_SVW2_SKFT0_SKXCCM0_TT2_16_VW2_VWB1_WG32_8_1_WGM0
    SolutionIndex: 12
    SolutionNameMin: Cijk_Alik_Bljk_HHS_BH_MT64x32x32_MI16x16x16x1_SN_1LDSB0_AMAS3_ELFLR0_GLVWA8_GLVWB4_NLCB1_PLR3_SVW2_SKFT1_SKXCCM0_TT2_16_VW2_VWB1_WG32_8_1_WGM0
    SolutionIndex: 13
    SolutionNameMin: Cijk_Alik_Bljk_HHS_BH_MT64x32x32_MI16x16x16x1_SN_1LDSB0_AMAS3_ELFLR12_GLVWA8_GLVWB4_NLCB1_PLR3_SVW2_SKFT1_SKXCCM0_TT2_16_VW2_VWB1_WG32_8_1_WGM0
    SolutionIndex: 14
    SolutionNameMin: Cijk_Alik_Bljk_HHS_BH_MT64x32x32_MI16x16x16x1_SN_1LDSB0_AMAS3_ELFLR0_GLVWA8_GLVWB4_NLCB1_PLR3_SVW2_SKFT1_SKXCCM1_TT2_16_VW2_VWB1_WG32_8_1_WGM0
    SolutionIndex: 15
    SolutionNameMin: Cijk_Alik_Bljk_HHS_BH_MT64x32x32_MI16x16x16x1_SN_1LDSB0_AMAS3_ELFLR12_GLVWA8_GLVWB4_NLCB1_PLR3_SVW2_SKFT0_SKXCCM0_TT2_16_VW2_VWB1_WG32_8_1_WGM8
    SolutionIndex: 16
    SolutionNameMin: Cijk_Alik_Bljk_HHS_BH_MT128x128x32_MI16x16x16x1_SN_1LDSB0_AMAS3_ELFLR0_GLVWA8_GLVWB8_NLCB1_PLR3_SVW4_SKFT0_SKXCCM0_TT4_64_VW4_VWB4_WG32_8_1_WGM0
    SolutionIndex: 17
    SolutionNameMin: Cijk_Alik_Bljk_HHS_BH_MT128x128x32_MI16x16x16x1_SN_1LDSB0_AMAS3_ELFLR12_GLVWA8_GLVWB8_NLCB1_PLR3_SVW4_SKFT1_SKXCCM1_TT4_64_VW4_VWB4_WG32_8_1_WGM8
    SolutionIndex: 18
    SolutionNameMin: Cijk_Alik_Bljk_HHS_BH_MT128x64x32_MI16x16x16x1_SN_1LDSB0_AMAS3_ELFLR0_GLVWA8_GLVWB8_NLCB1_PLR3_SVW4_SKFT0_SKXCCM0_TT4_32_VW4_VWB1_WG32_8_1_WGM0
    SolutionIndex: 19
    SolutionNameMin: Cijk_Alik_Bljk_HHS_BH_MT128x64x32_MI16x16x16x1_SN_1LDSB0_AMAS3_ELFLR12_GLVWA8_GLVWB8_NLCB1_PLR3_SVW4_SKFT1_SKXCCM0_TT4_32_VW4_VWB1_WG32_8_1_WGM0
    SolutionIndex: 20
    SolutionNameMin: Cijk_Alik_Bljk_HHS_BH_MT128x64x32_MI16x16x16x1_SN_1LDSB0_AMAS3_ELFLR12_GLVWA8_GLVWB8_NLCB1_PLR3_SVW4_SKFT1_SKXCCM1_TT4_32_VW4_VWB1_WG32_8_1_WGM0
    SolutionIndex: 21
    SolutionNameMin: Cijk_Alik_Bljk_HHS_BH_MT128x128x32_MI16x16x16x1_SN_1LDSB1_AMAS3_ELFLR0_GLVWA8_GLVWB8_NLCB2_PLR3_SVW4_SKFT0_SKXCCM0_TT4_64_VW4_VWB4_WG32_8_1_WGM8
    SolutionIndex: 22
    SolutionNameMin: Cijk_Alik_Bljk_HHS_BH_MT32x64x64_MI16x16x16x1_SN_1LDSB0_AMAS0_ELFLR0_GLVWA8_GLVWB8_NLCB2_PLR5_SVW1_SKFT0_SKXCCM0_TT1_32_VW1_VWB1_WG32_8_1_WGM0
    SolutionIndex: 23
    SolutionNameMin: Cijk_Alik_Bljk_HHS_BH_MT32x64x64_MI16x16x16x1_SN_1LDSB0_AMAS0_ELFLR0_GLVWA8_GLVWB8_NLCB2_PLR5_SVW1_SKFT0_SKXCCM1_TT1_32_VW1_VWB1_WG32_8_1_WGM0
    SolutionIndex: 24
    SolutionNameMin: Cijk_Alik_Bljk_HHS_BH_MT32x32x64_MI16x16x16x1_SN_1LDSB0_AMAS0_ELFLR0_GLVWA8_GLVWB8_NLCB1_PLR5_SVW1_SKFT0_SKXCCM0_TT1_16_VW1_VWB1_WG32_8_1_WGM0
    SolutionIndex: 25
    SolutionNameMin: Cijk_Alik_Bljk_HHS_BH_MT32x32x64_MI16x16x16x1_SN_1LDSB0_AMAS0_ELFLR0_GLVWA8_GLVWB8_NLCB1_PLR5_SVW1_SKFT0_SKXCCM1_TT1_16_VW1_VWB1_WG32_8_1_WGM0
    SolutionIndex: 26
    SolutionNameMin: Cijk_Alik_Bljk_HHS_BH_MT32x32x64_MI16x16x16x1_SN_1LDSB0_AMAS0_ELFLR12_GLVWA8_GLVWB8_NLCB1_PLR5_SVW1_SKFT0_SKXCCM1_TT1_16_VW1_VWB1_WG32_8_1_WGM0
    SolutionIndex: 27
    SolutionNameMin: Cijk_Alik_Bljk_HHS_BH_MT32x32x64_MI16x16x16x1_SN_1LDSB0_AMAS0_ELFLR0_GLVWA8_GLVWB8_NLCB1_PLR5_SVW1_SKFT1_SKXCCM0_TT1_16_VW1_VWB1_WG32_8_1_WGM0
    SolutionIndex: 28
    SolutionNameMin: Cijk_Alik_Bljk_HHS_BH_MT32x32x64_MI16x16x16x1_SN_1LDSB0_AMAS0_ELFLR12_GLVWA8_GLVWB8_NLCB1_PLR5_SVW1_SKFT1_SKXCCM0_TT1_16_VW1_VWB1_WG32_8_1_WGM0
    SolutionIndex: 29
    SolutionNameMin: Cijk_Alik_Bljk_HHS_BH_MT32x32x64_MI16x16x16x1_SN_1LDSB0_AMAS0_ELFLR0_GLVWA8_GLVWB8_NLCB1_PLR5_SVW1_SKFT1_SKXCCM1_TT1_16_VW1_VWB1_WG32_8_1_WGM0
    SolutionIndex: 30
    SolutionNameMin: Cijk_Alik_Bljk_HHS_BH_MT32x32x64_MI16x16x16x1_SN_1LDSB0_AMAS0_ELFLR12_GLVWA8_GLVWB8_NLCB1_PLR5_SVW1_SKFT1_SKXCCM1_TT1_16_VW1_VWB1_WG32_8_1_WGM0
    SolutionIndex: 31
    SolutionNameMin: Cijk_Alik_Bljk_HHS_BH_MT64x64x64_MI16x16x16x1_SN_1LDSB0_AMAS3_ELFLR12_GLVWA8_GLVWB8_NLCB2_PLR5_SVW2_SKFT1_SKXCCM0_TT2_32_VW2_VWB2_WG32_8_1_WGM0
    SolutionIndex: 32
    SolutionNameMin: Cijk_Alik_Bljk_HHS_BH_MT64x64x64_MI16x16x16x1_SN_1LDSB0_AMAS3_ELFLR12_GLVWA8_GLVWB8_NLCB2_PLR5_SVW2_SKFT1_SKXCCM1_TT2_32_VW2_VWB2_WG32_8_1_WGM0
- - - [128, 128, 1, 128, 128, 128, 128, 128]
    - [31, 522.225]
  - - [128, 128, 1, 256, 128, 128, 256, 256]
    - [26, 887.824]
  - - [128, 128, 1, 512, 128, 128, 512, 512]
    - [24, 1367.28]
  - - [128, 128, 1, 1024, 128, 128, 1024, 1024]
    - [29, 1841.51]
  - - [128, 128, 1, 2048, 128, 128, 2048, 2048]
    - [0, 3026.8]
  - - [128, 128, 1, 4096, 128, 128, 4096, 4096]
    - [0, 5724.11]
  - - [128, 128, 1, 8192, 128, 128, 8192, 8192]
    - [1, 10311.4]
  - - [128, 256, 1, 128, 128, 128, 128, 128]
    - [26, 996.75]
  - - [128, 256, 1, 256, 128, 128, 256, 256]
    - [25, 1756.32]
  - - [128, 256, 1, 512, 128, 128, 512, 512]
    - [25, 2693.79]
  - - [128, 256, 1, 1024, 128, 128, 1024, 1024]
    - [2, 4390.5]
  - - [128, 256, 1, 2048, 128, 128, 2048, 2048]
    - [2, 8230.41]
  - - [128, 256, 1, 4096, 128, 128, 4096, 4096]
    - [26, 14262.0]
  - - [128, 256, 1, 8192, 128, 128, 8192, 8192]
    - [30, 22092.1]
  - - [128, 512, 1, 128, 128, 128, 128, 128]
    - [24, 1989.9]
  - - [128, 512, 1, 256, 128, 128, 256, 256]
    - [26, 3442.91]
  - - [128, 512, 1, 512, 128, 128, 512, 512]
    - [3, 5907.91]
  - - [128, 512, 1, 1024, 128, 128, 1024, 1024]
    - [26, 10733.7]
  - - [128, 512, 1, 2048, 128, 128, 2048, 2048]
    - [25, 17220.1]
  - - [128, 512, 1, 4096, 128, 128, 4096, 4096]
    - [11, 26236.0]
  - - [128, 512, 1, 8192, 128, 128, 8192, 8192]
    - [12, 40139.1]
  - - [128, 1024, 1, 128, 128, 128, 128, 128]
    - [26, 3849.12]
  - - [128, 1024, 1, 256, 128, 128, 256, 256]
    - [29, 6918.24]
  - - [128, 1024, 1, 512, 128, 128, 512, 512]
    - [26, 12215.4]
  - - [128, 1024, 1, 1024, 128, 128, 1024, 1024]
    - [29, 19172.4]
  - - [128, 1024, 1, 2048, 128, 128, 2048, 2048]
    - [10, 31681.5]
  - - [128, 1024, 1, 4096, 128, 128, 4096, 4096]
    - [13, 46882.1]
  - - [128, 1024, 1, 8192, 128, 128, 8192, 8192]
    - [7, 72876.6]
  - - [128, 2048, 1, 128, 128, 128, 128, 128]
    - [27, 8201.39]
  - - [128, 2048, 1, 256, 128, 128, 256, 256]
    - [28, 14079.8]
  - - [128, 2048, 1, 512, 128, 128, 512, 512]
    - [14, 21893.6]
  - - [128, 2048, 1, 1024, 128, 128, 1024, 1024]
    - [15, 35317.4]
  - - [128, 2048, 1, 2048, 128, 128, 2048, 2048]
    - [4, 54113.5]
  - - [128, 2048, 1, 4096, 128, 128, 4096, 4096]
    - [4, 83052.9]
  - - [128, 2048, 1, 8192, 128, 128, 8192, 8192]
    - [18, 107686.0]
  - - [128, 4096, 1, 128, 128, 128, 128, 128]
    - [22, 15050.0]
  - - [128, 4096, 1, 256, 128, 128, 256, 256]
    - [23, 25187.4]
  - - [128, 4096, 1, 512, 128, 128, 512, 512]
    - [13, 37057.2]
  - - [128, 4096, 1, 1024, 128, 128, 1024, 1024]
    - [6, 61251.8]
  - - [128, 4096, 1, 2048, 128, 128, 2048, 2048]
    - [8, 87658.9]
  - - [128, 4096, 1, 4096, 128, 128, 4096, 4096]
    - [19, 121752.0]
  - - [128, 4096, 1, 8192, 128, 128, 8192, 8192]
    - [17, 153386.0]
  - - [128, 8192, 1, 128, 128, 128, 128, 128]
    - [31, 27619.9]
  - - [128, 8192, 1, 256, 128, 128, 256, 256]
    - [32, 45697.6]
  - - [128, 8192, 1, 512, 128, 128, 512, 512]
    - [5, 67179.9]
  - - [128, 8192, 1, 1024, 128, 128, 1024, 1024]
    - [9, 93646.4]
  - - [128, 8192, 1, 2048, 128, 128, 2048, 2048]
    - [20, 127861.0]
  - - [128, 8192, 1, 4096, 128, 128, 4096, 4096]
    - [16, 169376.0]
  - - [128, 8192, 1, 8192, 128, 128, 8192, 8192]
    - [21, 213211.0]
- null
- null
- DeviceEfficiency
